[INFO] Scanning for projects...
[INFO]                                                                         
[INFO] ------------------------------------------------------------------------
[INFO] Building Apache Commons Text 1.6-SNAPSHOT
[INFO] ------------------------------------------------------------------------
[INFO] 
[INFO] --- maven-enforcer-plugin:3.0.0-M2:enforce (enforce-maven-version) @ commons-text ---
[INFO] Skipping Rule Enforcement.
[INFO] 
[INFO] --- maven-enforcer-plugin:3.0.0-M2:enforce (enforce-maven-3) @ commons-text ---
[INFO] Skipping Rule Enforcement.
[INFO] 
[INFO] --- build-helper-maven-plugin:3.0.0:parse-version (parse-version) @ commons-text ---
[INFO] 
[INFO] --- maven-antrun-plugin:1.8:run (javadoc.resources) @ commons-text ---
[INFO] Executing tasks

main:
[INFO] Executed tasks
[INFO] 
[INFO] --- maven-remote-resources-plugin:1.5:process (process-resource-bundles) @ commons-text ---
[INFO] 
[INFO] --- buildnumber-maven-plugin:1.4:create (default) @ commons-text ---
[INFO] Executing: /bin/sh -c cd '/root/workspace/apache/commons-text/437690280' && 'git' 'rev-parse' '--verify' 'HEAD'
[INFO] Working directory: /root/workspace/apache/commons-text/437690280
[INFO] Storing buildNumber: d9cda575a21d2258a6750936d82d19ca3e12f4eb at timestamp: 1538755028995
[WARNING] Cannot get the branch information from the git repository: 
Detecting the current branch failed: fatal: ref HEAD is not a symbolic ref

[INFO] Executing: /bin/sh -c cd '/root/workspace/apache/commons-text/437690280' && 'git' 'rev-parse' '--verify' 'HEAD'
[INFO] Working directory: /root/workspace/apache/commons-text/437690280
[INFO] Storing buildScmBranch: UNKNOWN
[INFO] 
[INFO] --- maven-resources-plugin:3.0.2:resources (default-resources) @ commons-text ---
[INFO] Using 'ISO-8859-1' encoding to copy filtered resources.
[INFO] skip non existing resourceDirectory /root/workspace/apache/commons-text/437690280/src/main/resources
[INFO] Copying 2 resources to META-INF
[INFO] 
[INFO] --- maven-compiler-plugin:3.7.0:compile (default-compile) @ commons-text ---
[INFO] Changes detected - recompiling the module!
[INFO] Compiling 95 source files to /root/workspace/apache/commons-text/437690280/target/classes
[INFO] /root/workspace/apache/commons-text/437690280/src/main/java/org/apache/commons/text/TextStringBuilder.java: Some input files use unchecked or unsafe operations.
[INFO] /root/workspace/apache/commons-text/437690280/src/main/java/org/apache/commons/text/TextStringBuilder.java: Recompile with -Xlint:unchecked for details.
[INFO] 
[INFO] --- maven-bundle-plugin:3.5.0:manifest (bundle-manifest) @ commons-text ---
[INFO] 
[INFO] --- animal-sniffer-maven-plugin:1.16:check (checkAPIcompatibility) @ commons-text ---
[INFO] Checking unresolved references to org.codehaus.mojo.signature:java18:1.0
[INFO] 
[INFO] --- maven-resources-plugin:3.0.2:testResources (default-testResources) @ commons-text ---
[INFO] Using 'ISO-8859-1' encoding to copy filtered resources.
[INFO] Copying 4 resources
[INFO] Copying 2 resources to META-INF
[INFO] 
[INFO] --- maven-compiler-plugin:3.7.0:testCompile (default-testCompile) @ commons-text ---
[INFO] Nothing to compile - all classes are up to date
[INFO] 
[INFO] --- jacoco-maven-plugin:0.8.1:prepare-agent (prepare-agent) @ commons-text ---
[INFO] argLine set to -javaagent:/root/./workspace/apache/commons-text/437690280/.m2/org/jacoco/org.jacoco.agent/0.8.1/org.jacoco.agent-0.8.1-runtime.jar=destfile=/root/workspace/apache/commons-text/437690280/target/jacoco.exec
[INFO] 
[INFO] --- maven-surefire-plugin:2.22.0:test (default-test) @ commons-text ---
[INFO] Downloading: https://repo.maven.apache.org/maven2/org/apache/maven/surefire/surefire-junit-platform/2.22.0/surefire-junit-platform-2.22.0.pom
[INFO] Downloaded: https://repo.maven.apache.org/maven2/org/apache/maven/surefire/surefire-junit-platform/2.22.0/surefire-junit-platform-2.22.0.pom (7 KB at 19.2 KB/sec)
[INFO] Downloading: https://repo.maven.apache.org/maven2/org/apache/maven/surefire/surefire-providers/2.22.0/surefire-providers-2.22.0.pom
[INFO] Downloaded: https://repo.maven.apache.org/maven2/org/apache/maven/surefire/surefire-providers/2.22.0/surefire-providers-2.22.0.pom (3 KB at 67.5 KB/sec)
[INFO] Downloading: https://repo.maven.apache.org/maven2/org/junit/platform/junit-platform-launcher/1.2.0/junit-platform-launcher-1.2.0.pom
[INFO] Downloaded: https://repo.maven.apache.org/maven2/org/junit/platform/junit-platform-launcher/1.2.0/junit-platform-launcher-1.2.0.pom (3 KB at 61.9 KB/sec)
[INFO] Downloading: https://repo.maven.apache.org/maven2/org/junit/platform/junit-platform-engine/1.2.0/junit-platform-engine-1.2.0.pom
[INFO] Downloaded: https://repo.maven.apache.org/maven2/org/junit/platform/junit-platform-engine/1.2.0/junit-platform-engine-1.2.0.pom (3 KB at 63.2 KB/sec)
[INFO] Downloading: https://repo.maven.apache.org/maven2/org/junit/platform/junit-platform-commons/1.2.0/junit-platform-commons-1.2.0.pom
[INFO] Downloaded: https://repo.maven.apache.org/maven2/org/junit/platform/junit-platform-commons/1.2.0/junit-platform-commons-1.2.0.pom (2 KB at 56.4 KB/sec)
[INFO] Downloading: https://repo.maven.apache.org/maven2/org/opentest4j/opentest4j/1.1.0/opentest4j-1.1.0.pom
[INFO] Downloaded: https://repo.maven.apache.org/maven2/org/opentest4j/opentest4j/1.1.0/opentest4j-1.1.0.pom (2 KB at 42.1 KB/sec)
[INFO] Downloading: https://repo.maven.apache.org/maven2/org/apache/maven/surefire/surefire-junit-platform/2.22.0/surefire-junit-platform-2.22.0.jar
[INFO] Downloading: https://repo.maven.apache.org/maven2/org/junit/platform/junit-platform-commons/1.2.0/junit-platform-commons-1.2.0.jar
[INFO] Downloading: https://repo.maven.apache.org/maven2/org/junit/platform/junit-platform-engine/1.2.0/junit-platform-engine-1.2.0.jar
[INFO] Downloading: https://repo.maven.apache.org/maven2/org/junit/platform/junit-platform-launcher/1.2.0/junit-platform-launcher-1.2.0.jar
[INFO] Downloading: https://repo.maven.apache.org/maven2/org/opentest4j/opentest4j/1.1.0/opentest4j-1.1.0.jar
[INFO] Downloaded: https://repo.maven.apache.org/maven2/org/opentest4j/opentest4j/1.1.0/opentest4j-1.1.0.jar (7 KB at 84.3 KB/sec)
[INFO] Downloaded: https://repo.maven.apache.org/maven2/org/junit/platform/junit-platform-engine/1.2.0/junit-platform-engine-1.2.0.jar (88 KB at 924.6 KB/sec)
[INFO] Downloaded: https://repo.maven.apache.org/maven2/org/apache/maven/surefire/surefire-junit-platform/2.22.0/surefire-junit-platform-2.22.0.jar (65 KB at 550.1 KB/sec)
[INFO] Downloaded: https://repo.maven.apache.org/maven2/org/junit/platform/junit-platform-launcher/1.2.0/junit-platform-launcher-1.2.0.jar (79 KB at 631.4 KB/sec)
[INFO] Downloaded: https://repo.maven.apache.org/maven2/org/junit/platform/junit-platform-commons/1.2.0/junit-platform-commons-1.2.0.jar (77 KB at 626.7 KB/sec)
[INFO] 
[INFO] -------------------------------------------------------
[INFO]  T E S T S
[INFO] -------------------------------------------------------
[INFO] Running org.apache.commons.text.lookup.FileStringLookupTest
[INFO] Tests run: 1, Failures: 0, Errors: 0, Skipped: 0, Time elapsed: 0.027 s - in org.apache.commons.text.lookup.FileStringLookupTest
[INFO] Running org.apache.commons.text.lookup.PropertiesStringLookupTest
[INFO] Tests run: 5, Failures: 0, Errors: 0, Skipped: 0, Time elapsed: 0.015 s - in org.apache.commons.text.lookup.PropertiesStringLookupTest
[INFO] Running org.apache.commons.text.lookup.JavaPlatformStringLookupTest
[INFO] Tests run: 1, Failures: 0, Errors: 0, Skipped: 0, Time elapsed: 0 s - in org.apache.commons.text.lookup.JavaPlatformStringLookupTest
[INFO] Running org.apache.commons.text.lookup.MapStringLookupTest
[INFO] Tests run: 1, Failures: 0, Errors: 0, Skipped: 0, Time elapsed: 0.001 s - in org.apache.commons.text.lookup.MapStringLookupTest
[INFO] Running org.apache.commons.text.lookup.NullStringLookupTest
[INFO] Tests run: 1, Failures: 0, Errors: 0, Skipped: 0, Time elapsed: 0.001 s - in org.apache.commons.text.lookup.NullStringLookupTest
[INFO] Running org.apache.commons.text.lookup.InterpolatorStringLookupTest
java:version = Java version 1.8.0_121
java:runtime = OpenJDK Runtime Environment (build 1.8.0_121-8u121-b13-1~bpo8+1-b13) from Oracle Corporation
java:vm = OpenJDK 64-Bit Server VM (build 25.121-b13, mixed mode)
java:os = Linux 3.10.0-862.3.2.el7.x86_64 unknown, architecture: amd64-64
java:locale = default locale: en, platform encoding: UTF-8
java:hardware = processors: 8, architecture: amd64-64
[INFO] Tests run: 2, Failures: 0, Errors: 0, Skipped: 0, Time elapsed: 0.081 s - in org.apache.commons.text.lookup.InterpolatorStringLookupTest
[INFO] Running org.apache.commons.text.lookup.StringLookupFactoryTest
[ERROR] Tests run: 1, Failures: 1, Errors: 0, Skipped: 0, Time elapsed: 0.024 s <<< FAILURE! - in org.apache.commons.text.lookup.StringLookupFactoryTest
[ERROR] testSingletons  Time elapsed: 0.024 s  <<< FAILURE!
org.opentest4j.AssertionFailedError: expected: <org.apache.commons.text.lookup.Base64EncoderStringLookup@448ade1> but was: <org.apache.commons.text.lookup.Base64DecoderStringLookup@21f9c6ea>
	at org.apache.commons.text.lookup.StringLookupFactoryTest.testSingletons(StringLookupFactoryTest.java:34)

[INFO] Running org.apache.commons.text.lookup.UrlEncoderStringLookupTest
[INFO] Tests run: 1, Failures: 0, Errors: 0, Skipped: 0, Time elapsed: 0.001 s - in org.apache.commons.text.lookup.UrlEncoderStringLookupTest
[INFO] Running org.apache.commons.text.lookup.DateStringLookupTest
[INFO] Tests run: 2, Failures: 0, Errors: 0, Skipped: 0, Time elapsed: 0.01 s - in org.apache.commons.text.lookup.DateStringLookupTest
[INFO] Running org.apache.commons.text.lookup.ScriptStringLookupTest
[INFO] Tests run: 1, Failures: 0, Errors: 0, Skipped: 0, Time elapsed: 1.289 s - in org.apache.commons.text.lookup.ScriptStringLookupTest
[INFO] Running org.apache.commons.text.lookup.Base64DecoderStringLookupTest
[ERROR] Tests run: 1, Failures: 0, Errors: 1, Skipped: 0, Time elapsed: 0.005 s <<< FAILURE! - in org.apache.commons.text.lookup.Base64DecoderStringLookupTest
[ERROR] test  Time elapsed: 0.005 s  <<< ERROR!
java.lang.IllegalArgumentException: Illegal base64 character 21
	at org.apache.commons.text.lookup.Base64DecoderStringLookupTest.test(Base64DecoderStringLookupTest.java:30)

[INFO] Running org.apache.commons.text.lookup.ResourceBundleStringLookupTest
[INFO] Tests run: 2, Failures: 0, Errors: 0, Skipped: 0, Time elapsed: 0.01 s - in org.apache.commons.text.lookup.ResourceBundleStringLookupTest
[INFO] Running org.apache.commons.text.lookup.SystemPropertyStringLookupTest
[INFO] Tests run: 1, Failures: 0, Errors: 0, Skipped: 0, Time elapsed: 0.005 s - in org.apache.commons.text.lookup.SystemPropertyStringLookupTest
[INFO] Running org.apache.commons.text.lookup.XmlStringLookupTest
[INFO] Tests run: 1, Failures: 0, Errors: 0, Skipped: 0, Time elapsed: 0.099 s - in org.apache.commons.text.lookup.XmlStringLookupTest
[INFO] Running org.apache.commons.text.lookup.LocalHostStringLookupTest
[INFO] Tests run: 3, Failures: 0, Errors: 0, Skipped: 0, Time elapsed: 0.01 s - in org.apache.commons.text.lookup.LocalHostStringLookupTest
[INFO] Running org.apache.commons.text.lookup.ConstantStringLookupTest
[INFO] Tests run: 8, Failures: 0, Errors: 0, Skipped: 0, Time elapsed: 0.064 s - in org.apache.commons.text.lookup.ConstantStringLookupTest
[INFO] Running org.apache.commons.text.lookup.UrlStringLookupTest
file:///root/workspace/apache/commons-text/437690280/src/test/resources/document.properties
[INFO] Tests run: 2, Failures: 0, Errors: 0, Skipped: 0, Time elapsed: 0.21 s - in org.apache.commons.text.lookup.UrlStringLookupTest
[INFO] Running org.apache.commons.text.lookup.UrlDecoderStringLookupTest
[INFO] Tests run: 3, Failures: 0, Errors: 0, Skipped: 0, Time elapsed: 0.007 s - in org.apache.commons.text.lookup.UrlDecoderStringLookupTest
[INFO] Running org.apache.commons.text.lookup.ConstantStringLookupBasicTest
[INFO] Tests run: 1, Failures: 0, Errors: 0, Skipped: 0, Time elapsed: 0 s - in org.apache.commons.text.lookup.ConstantStringLookupBasicTest
[INFO] Running org.apache.commons.text.lookup.Base64EncoderStringLookupTest
[ERROR] Tests run: 1, Failures: 1, Errors: 0, Skipped: 0, Time elapsed: 0 s <<< FAILURE! - in org.apache.commons.text.lookup.Base64EncoderStringLookupTest
[ERROR] test  Time elapsed: 0 s  <<< FAILURE!
org.opentest4j.AssertionFailedError: expected: <HelloWorld!> but was: <U0dWc2JHOVhiM0pzWkNFPQ==>
	at org.apache.commons.text.lookup.Base64EncoderStringLookupTest.test(Base64EncoderStringLookupTest.java:30)

[INFO] Running org.apache.commons.text.lookup.EnvironmentVariableStringLookupTest
[INFO] Tests run: 1, Failures: 0, Errors: 0, Skipped: 0, Time elapsed: 0.007 s - in org.apache.commons.text.lookup.EnvironmentVariableStringLookupTest
[INFO] Running org.apache.commons.text.FormattableUtilsTest
[INFO] Tests run: 8, Failures: 0, Errors: 0, Skipped: 0, Time elapsed: 0.174 s - in org.apache.commons.text.FormattableUtilsTest
[INFO] Running org.apache.commons.text.similarity.LevenshteinDetailedDistanceTest
[INFO] Tests run: 16, Failures: 0, Errors: 0, Skipped: 0, Time elapsed: 0.033 s - in org.apache.commons.text.similarity.LevenshteinDetailedDistanceTest
[INFO] Running org.apache.commons.text.similarity.JaroWinklerDistanceTest
[INFO] Tests run: 4, Failures: 0, Errors: 0, Skipped: 0, Time elapsed: 0.008 s - in org.apache.commons.text.similarity.JaroWinklerDistanceTest
[INFO] Running org.apache.commons.text.similarity.ParameterizedLevenshteinDistanceTest
[INFO] Tests run: 38, Failures: 0, Errors: 0, Skipped: 0, Time elapsed: 0.175 s - in org.apache.commons.text.similarity.ParameterizedLevenshteinDistanceTest
[INFO] Running org.apache.commons.text.similarity.LongestCommonSubsequenceTest
[INFO] Tests run: 12, Failures: 0, Errors: 0, Skipped: 0, Time elapsed: 0.023 s - in org.apache.commons.text.similarity.LongestCommonSubsequenceTest
[INFO] Running org.apache.commons.text.similarity.CosineSimilarityTest
[INFO] Tests run: 4, Failures: 0, Errors: 0, Skipped: 0, Time elapsed: 0.011 s - in org.apache.commons.text.similarity.CosineSimilarityTest
[INFO] Running org.apache.commons.text.similarity.JaccardDistanceTest
[INFO] Tests run: 4, Failures: 0, Errors: 0, Skipped: 0, Time elapsed: 0.008 s - in org.apache.commons.text.similarity.JaccardDistanceTest
[INFO] Running org.apache.commons.text.similarity.LevenshteinDistanceTest
[INFO] Tests run: 9, Failures: 0, Errors: 0, Skipped: 0, Time elapsed: 0.014 s - in org.apache.commons.text.similarity.LevenshteinDistanceTest
[INFO] Running org.apache.commons.text.similarity.HammingDistanceTest
[INFO] Tests run: 3, Failures: 0, Errors: 0, Skipped: 0, Time elapsed: 0.004 s - in org.apache.commons.text.similarity.HammingDistanceTest
[INFO] Running org.apache.commons.text.similarity.LevenshteinResultsTest
[INFO] Tests run: 5, Failures: 0, Errors: 0, Skipped: 0, Time elapsed: 0.004 s - in org.apache.commons.text.similarity.LevenshteinResultsTest
[INFO] Running org.apache.commons.text.similarity.StringMetricFromTest
[INFO] Tests run: 3, Failures: 0, Errors: 0, Skipped: 0, Time elapsed: 0.003 s - in org.apache.commons.text.similarity.StringMetricFromTest
[INFO] Running org.apache.commons.text.similarity.CosineDistanceTest
[INFO] Tests run: 1, Failures: 0, Errors: 0, Skipped: 0, Time elapsed: 0.008 s - in org.apache.commons.text.similarity.CosineDistanceTest
[INFO] Running org.apache.commons.text.similarity.SimilarityScoreFromTest
[INFO] Tests run: 2, Failures: 0, Errors: 0, Skipped: 0, Time elapsed: 0.004 s - in org.apache.commons.text.similarity.SimilarityScoreFromTest
[INFO] Running org.apache.commons.text.similarity.JaccardSimilarityTest
[INFO] Tests run: 4, Failures: 0, Errors: 0, Skipped: 0, Time elapsed: 0.006 s - in org.apache.commons.text.similarity.JaccardSimilarityTest
[INFO] Running org.apache.commons.text.similarity.LongestCommonSubsequenceDistanceTest
[INFO] Tests run: 4, Failures: 0, Errors: 0, Skipped: 0, Time elapsed: 0.003 s - in org.apache.commons.text.similarity.LongestCommonSubsequenceDistanceTest
[INFO] Running org.apache.commons.text.similarity.ParameterizedSimilarityScoreFromTest
[INFO] Tests run: 4, Failures: 0, Errors: 0, Skipped: 0, Time elapsed: 0.01 s - in org.apache.commons.text.similarity.ParameterizedSimilarityScoreFromTest
[INFO] Running org.apache.commons.text.similarity.FuzzyScoreTest
[INFO] Tests run: 6, Failures: 0, Errors: 0, Skipped: 0, Time elapsed: 0.007 s - in org.apache.commons.text.similarity.FuzzyScoreTest
[INFO] Running org.apache.commons.text.similarity.ParameterizedEditDistanceFromTest
[INFO] Tests run: 10, Failures: 0, Errors: 0, Skipped: 0, Time elapsed: 0.024 s - in org.apache.commons.text.similarity.ParameterizedEditDistanceFromTest
[INFO] Running org.apache.commons.text.translate.CsvTranslatorsTest
[INFO] Tests run: 10, Failures: 0, Errors: 0, Skipped: 0, Time elapsed: 0.034 s - in org.apache.commons.text.translate.CsvTranslatorsTest
[INFO] Running org.apache.commons.text.translate.LookupTranslatorTest
[INFO] Tests run: 3, Failures: 0, Errors: 0, Skipped: 0, Time elapsed: 0.004 s - in org.apache.commons.text.translate.LookupTranslatorTest
[INFO] Running org.apache.commons.text.translate.AggregateTranslatorTest
[INFO] Tests run: 3, Failures: 0, Errors: 0, Skipped: 0, Time elapsed: 0.003 s - in org.apache.commons.text.translate.AggregateTranslatorTest
[INFO] Running org.apache.commons.text.translate.UnicodeUnpairedSurrogateRemoverTest
[INFO] Tests run: 2, Failures: 0, Errors: 0, Skipped: 0, Time elapsed: 0.003 s - in org.apache.commons.text.translate.UnicodeUnpairedSurrogateRemoverTest
[INFO] Running org.apache.commons.text.translate.CodePointTranslatorTest
[INFO] Tests run: 1, Failures: 0, Errors: 0, Skipped: 0, Time elapsed: 0.006 s - in org.apache.commons.text.translate.CodePointTranslatorTest
[INFO] Running org.apache.commons.text.translate.EntityArraysTest
[INFO] Tests run: 12, Failures: 0, Errors: 0, Skipped: 0, Time elapsed: 0.05 s - in org.apache.commons.text.translate.EntityArraysTest
[INFO] Running org.apache.commons.text.translate.SinglePassTranslatorTest
[INFO] Tests run: 3, Failures: 0, Errors: 0, Skipped: 0, Time elapsed: 0.005 s - in org.apache.commons.text.translate.SinglePassTranslatorTest
[INFO] Running org.apache.commons.text.translate.JavaUnicodeEscaperTest
[INFO] Tests run: 4, Failures: 0, Errors: 0, Skipped: 0, Time elapsed: 0 s - in org.apache.commons.text.translate.JavaUnicodeEscaperTest
[INFO] Running org.apache.commons.text.translate.NumericEntityEscaperTest
[INFO] Tests run: 4, Failures: 0, Errors: 0, Skipped: 0, Time elapsed: 0 s - in org.apache.commons.text.translate.NumericEntityEscaperTest
[INFO] Running org.apache.commons.text.translate.OctalUnescaperTest
[INFO] Tests run: 1, Failures: 0, Errors: 0, Skipped: 0, Time elapsed: 0.006 s - in org.apache.commons.text.translate.OctalUnescaperTest
[INFO] Running org.apache.commons.text.translate.NumericEntityUnescaperTest
[INFO] Tests run: 5, Failures: 0, Errors: 0, Skipped: 0, Time elapsed: 0.007 s - in org.apache.commons.text.translate.NumericEntityUnescaperTest
[INFO] Running org.apache.commons.text.translate.UnicodeUnescaperTest
[INFO] Tests run: 3, Failures: 0, Errors: 0, Skipped: 0, Time elapsed: 0.001 s - in org.apache.commons.text.translate.UnicodeUnescaperTest
[INFO] Running org.apache.commons.text.translate.UnicodeEscaperTest
[INFO] Tests run: 3, Failures: 0, Errors: 0, Skipped: 0, Time elapsed: 0 s - in org.apache.commons.text.translate.UnicodeEscaperTest
[INFO] Running org.apache.commons.text.StrSubstitutorTest
[INFO] Tests run: 49, Failures: 0, Errors: 0, Skipped: 0, Time elapsed: 0.065 s - in org.apache.commons.text.StrSubstitutorTest
[INFO] Running org.apache.commons.text.TextStringBuilderTest
[INFO] Tests run: 99, Failures: 0, Errors: 0, Skipped: 0, Time elapsed: 0.082 s - in org.apache.commons.text.TextStringBuilderTest
[INFO] Running org.apache.commons.text.StrMatcherTest
[INFO] Tests run: 14, Failures: 0, Errors: 0, Skipped: 0, Time elapsed: 0.007 s - in org.apache.commons.text.StrMatcherTest
[INFO] Running org.apache.commons.text.WordUtilsTest
[INFO] Tests run: 28, Failures: 0, Errors: 0, Skipped: 0, Time elapsed: 0.033 s - in org.apache.commons.text.WordUtilsTest
[INFO] Running org.apache.commons.text.matcher.StringMatcherTest
[INFO] Tests run: 14, Failures: 0, Errors: 0, Skipped: 0, Time elapsed: 0.008 s - in org.apache.commons.text.matcher.StringMatcherTest
[INFO] Running org.apache.commons.text.matcher.StringSubstitutorGetSetTest
[INFO] Tests run: 3, Failures: 0, Errors: 0, Skipped: 0, Time elapsed: 0.001 s - in org.apache.commons.text.matcher.StringSubstitutorGetSetTest
[INFO] Running org.apache.commons.text.StrTokenizerTest
[INFO] Tests run: 62, Failures: 0, Errors: 0, Skipped: 0, Time elapsed: 0.048 s - in org.apache.commons.text.StrTokenizerTest
[INFO] Running org.apache.commons.text.CaseUtilsTest
[INFO] Tests run: 2, Failures: 0, Errors: 0, Skipped: 0, Time elapsed: 0 s - in org.apache.commons.text.CaseUtilsTest
[INFO] Running org.apache.commons.text.StringSubstitutorTest
[INFO] Tests run: 39, Failures: 0, Errors: 0, Skipped: 0, Time elapsed: 0.042 s - in org.apache.commons.text.StringSubstitutorTest
[INFO] Running org.apache.commons.text.CharacterPredicatesTest
[INFO] Tests run: 7, Failures: 0, Errors: 0, Skipped: 0, Time elapsed: 0.011 s - in org.apache.commons.text.CharacterPredicatesTest
[INFO] Running org.apache.commons.text.diff.StringsComparatorTest
[INFO] Tests run: 3, Failures: 0, Errors: 0, Skipped: 0, Time elapsed: 0.022 s - in org.apache.commons.text.diff.StringsComparatorTest
[INFO] Running org.apache.commons.text.diff.ReplacementsFinderTest
[INFO] Tests run: 2, Failures: 0, Errors: 0, Skipped: 0, Time elapsed: 0.007 s - in org.apache.commons.text.diff.ReplacementsFinderTest
[INFO] Running org.apache.commons.text.AlphabetConverterTest
[INFO] Tests run: 20, Failures: 0, Errors: 0, Skipped: 0, Time elapsed: 0.027 s - in org.apache.commons.text.AlphabetConverterTest
[INFO] Running org.apache.commons.text.StrLookupTest
[INFO] Tests run: 8, Failures: 0, Errors: 0, Skipped: 0, Time elapsed: 0.003 s - in org.apache.commons.text.StrLookupTest
[INFO] Running org.apache.commons.text.RandomStringGeneratorTest
[INFO] Tests run: 20, Failures: 0, Errors: 0, Skipped: 0, Time elapsed: 0.069 s - in org.apache.commons.text.RandomStringGeneratorTest
[INFO] Running org.apache.commons.text.StringEscapeUtilsTest
[INFO] Tests run: 34, Failures: 0, Errors: 0, Skipped: 0, Time elapsed: 0.462 s - in org.apache.commons.text.StringEscapeUtilsTest
[INFO] Running org.apache.commons.text.StrBuilderTest
[INFO] Tests run: 99, Failures: 0, Errors: 0, Skipped: 0, Time elapsed: 0.049 s - in org.apache.commons.text.StrBuilderTest
[INFO] Running org.apache.commons.text.StringSubstitutorWithInterpolatorStringLookupTest
[INFO] Tests run: 7, Failures: 0, Errors: 0, Skipped: 0, Time elapsed: 0.001 s - in org.apache.commons.text.StringSubstitutorWithInterpolatorStringLookupTest
[INFO] Running org.apache.commons.text.TextStringBuilderAppendInsertTest
[INFO] Tests run: 51, Failures: 0, Errors: 0, Skipped: 0, Time elapsed: 0.027 s - in org.apache.commons.text.TextStringBuilderAppendInsertTest
[INFO] Running org.apache.commons.text.ExtendedMessageFormatTest
[INFO] Tests run: 21, Failures: 0, Errors: 0, Skipped: 0, Time elapsed: 1.716 s - in org.apache.commons.text.ExtendedMessageFormatTest
[INFO] Running org.apache.commons.text.CompositeFormatTest
[INFO] Tests run: 2, Failures: 0, Errors: 0, Skipped: 0, Time elapsed: 0.002 s - in org.apache.commons.text.CompositeFormatTest
[INFO] Running org.apache.commons.text.StringTokenizerTest
[INFO] Tests run: 62, Failures: 0, Errors: 0, Skipped: 0, Time elapsed: 0.029 s - in org.apache.commons.text.StringTokenizerTest
[INFO] Running org.apache.commons.text.StrBuilderAppendInsertTest
[INFO] Tests run: 51, Failures: 0, Errors: 0, Skipped: 0, Time elapsed: 0.028 s - in org.apache.commons.text.StrBuilderAppendInsertTest
[INFO] 
[INFO] Results:
[INFO] 
[ERROR] Failures: 
[ERROR]   Base64EncoderStringLookupTest.test:30 expected: <HelloWorld!> but was: <U0dWc2JHOVhiM0pzWkNFPQ==>
[ERROR]   StringLookupFactoryTest.testSingletons:34 expected: <org.apache.commons.text.lookup.Base64EncoderStringLookup@448ade1> but was: <org.apache.commons.text.lookup.Base64DecoderStringLookup@21f9c6ea>
[ERROR] Errors: 
[ERROR]   Base64DecoderStringLookupTest.test:30 » IllegalArgument Illegal base64 charact...
[INFO] 
[ERROR] Tests run: 928, Failures: 2, Errors: 1, Skipped: 0
[INFO] 
[INFO] ------------------------------------------------------------------------
[INFO] BUILD FAILURE
[INFO] ------------------------------------------------------------------------
[INFO] Total time: 22.676 s
[INFO] Finished at: 2018-10-05T17:57:29+02:00
[INFO] Final Memory: 33M/557M
[INFO] ------------------------------------------------------------------------
[ERROR] Failed to execute goal org.apache.maven.plugins:maven-surefire-plugin:2.22.0:test (default-test) on project commons-text: There are test failures.
[ERROR] 
[ERROR] Please refer to /root/workspace/apache/commons-text/437690280/target/surefire-reports for the individual test results.
[ERROR] Please refer to dump files (if any exist) [date]-jvmRun[N].dump, [date].dumpstream and [date]-jvmRun[N].dumpstream.
[ERROR] -> [Help 1]
[ERROR] 
[ERROR] To see the full stack trace of the errors, re-run Maven with the -e switch.
[ERROR] Re-run Maven using the -X switch to enable full debug logging.
[ERROR] 
[ERROR] For more information about the errors and possible solutions, please read the following articles:
[ERROR] [Help 1] http://cwiki.apache.org/confluence/display/MAVEN/MojoFailureException
