[INFO] Scanning for projects...
[INFO] ------------------------------------------------------------------------
[INFO] Reactor Build Order:
[INFO] 
[INFO] net.oneandone:ejb-cdi-unit-parent
[INFO] net.oneandone:ejb-cdi-unit
[INFO] net.oneandone:ejb-cdi-unit5
[INFO] net.oneandone:ejb-cdi-unit-test-war
[INFO] net.oneandone:ejb-cdi-unit-tests
[INFO] net.oneandone:purecdi-tests
[INFO] net.oneandone:ejb-cdi-unit-tests5
[INFO] net.oneandone:ejb-cdi-unit-simulators
[INFO] net.oneandone:ejb-cdi-unit-camunda
[INFO] net.oneandone:ejb-cdi-unit arquillian tests
[INFO] net.oneandone:ejb-cdi-unit-examples
[INFO] example1 service with one entity
[INFO] service with one entity in Junit5 nested classes
[INFO] service syncconsumed
[INFO] service asyncconsumed with polling
[INFO] service asyncconsumed with callback
[INFO] service asyncconsumed with callback use jms
[INFO] service asyncconsumed with callback use jms
[INFO] service as simple rest
[INFO] mockito-example
[INFO]                                                                         
[INFO] ------------------------------------------------------------------------
[INFO] Building net.oneandone:ejb-cdi-unit-parent 1.1.17-SNAPSHOT
[INFO] ------------------------------------------------------------------------
[INFO]                                                                         
[INFO] ------------------------------------------------------------------------
[INFO] Building net.oneandone:ejb-cdi-unit 1.1.17-SNAPSHOT
[INFO] ------------------------------------------------------------------------
[INFO] 
[INFO] --- maven-resources-plugin:2.6:resources (default-resources) @ ejb-cdi-unit ---
[INFO] Using 'UTF-8' encoding to copy filtered resources.
[INFO] Copying 1 resource
[INFO] 
[INFO] --- maven-compiler-plugin:3.7.0:compile (default-compile) @ ejb-cdi-unit ---
[INFO] Changes detected - recompiling the module!
[INFO] Compiling 112 source files to /root/workspace/1and1/ejb-cdi-unit/436756933/ejb-cdi-unit/target/classes
[INFO] /root/workspace/1and1/ejb-cdi-unit/436756933/ejb-cdi-unit/src/main/java/com/oneandone/ejbcdiunit/resourcesimulators/EjbContextSimulation.java: Some input files use or override a deprecated API.
[INFO] /root/workspace/1and1/ejb-cdi-unit/436756933/ejb-cdi-unit/src/main/java/com/oneandone/ejbcdiunit/resourcesimulators/EjbContextSimulation.java: Recompile with -Xlint:deprecation for details.
[INFO] /root/workspace/1and1/ejb-cdi-unit/436756933/ejb-cdi-unit/src/main/java/com/oneandone/ejbcdiunit/AsynchronousManager.java: Some input files use unchecked or unsafe operations.
[INFO] /root/workspace/1and1/ejb-cdi-unit/436756933/ejb-cdi-unit/src/main/java/com/oneandone/ejbcdiunit/AsynchronousManager.java: Recompile with -Xlint:unchecked for details.
[INFO] 
[INFO] --- maven-resources-plugin:2.6:testResources (default-testResources) @ ejb-cdi-unit ---
[INFO] Using 'UTF-8' encoding to copy filtered resources.
[INFO] skip non existing resourceDirectory /root/workspace/1and1/ejb-cdi-unit/436756933/ejb-cdi-unit/src/test/resources
[INFO] 
[INFO] --- maven-compiler-plugin:3.7.0:testCompile (default-testCompile) @ ejb-cdi-unit ---
[INFO] Nothing to compile - all classes are up to date
[INFO] 
[INFO] --- maven-surefire-plugin:2.22.0:test (default-test) @ ejb-cdi-unit ---
[INFO] Downloading: https://repo.maven.apache.org/maven2/org/apache/maven/surefire/surefire-junit4/2.22.0/surefire-junit4-2.22.0.pom
[INFO] Downloaded: https://repo.maven.apache.org/maven2/org/apache/maven/surefire/surefire-junit4/2.22.0/surefire-junit4-2.22.0.pom (4 KB at 9.0 KB/sec)
[INFO] Downloading: https://repo.maven.apache.org/maven2/org/apache/maven/surefire/surefire-junit4/2.22.0/surefire-junit4-2.22.0.jar
[INFO] Downloaded: https://repo.maven.apache.org/maven2/org/apache/maven/surefire/surefire-junit4/2.22.0/surefire-junit4-2.22.0.jar (83 KB at 1045.0 KB/sec)
[INFO] 
[INFO] -------------------------------------------------------
[INFO]  T E S T S
[INFO] -------------------------------------------------------
[INFO] Listening for transport dt_socket at address: 5005
[INFO] Running cdiunittests.alternatives.NonAlternativeTest
[INFO] Tests run: 1, Failures: 0, Errors: 0, Skipped: 0, Time elapsed: 1.463 s - in cdiunittests.alternatives.NonAlternativeTest
[INFO] test(cdiunittests.alternatives.NonAlternativeTest)  Time elapsed: 0.026 s
[INFO] Listening for transport dt_socket at address: 5005
[INFO] Running cdiunittests.alternatives.ProducesAltTest
[INFO] Tests run: 2, Failures: 0, Errors: 0, Skipped: 0, Time elapsed: 1.954 s - in cdiunittests.alternatives.ProducesAltTest
[INFO] test(cdiunittests.alternatives.ProducesAltTest)  Time elapsed: 0.362 s
[INFO] test2(cdiunittests.alternatives.ProducesAltTest)  Time elapsed: 0.009 s
[INFO] Listening for transport dt_socket at address: 5005
[INFO] Running cdiunittests.alternatives.AlternativeTest
[INFO] Tests run: 1, Failures: 0, Errors: 0, Skipped: 0, Time elapsed: 1.376 s - in cdiunittests.alternatives.AlternativeTest
[INFO] test(cdiunittests.alternatives.AlternativeTest)  Time elapsed: 0.026 s
[INFO] Listening for transport dt_socket at address: 5005
[INFO] Running cdiunittests.TestCircularInject
[INFO] Tests run: 1, Failures: 0, Errors: 0, Skipped: 0, Time elapsed: 1.139 s - in cdiunittests.TestCircularInject
[INFO] testCircularDependency(cdiunittests.TestCircularInject)  Time elapsed: 0.001 s
[INFO] 
[INFO] Results:
[INFO] 
[INFO] Tests run: 5, Failures: 0, Errors: 0, Skipped: 0
[INFO] 
[INFO]                                                                         
[INFO] ------------------------------------------------------------------------
[INFO] Building net.oneandone:ejb-cdi-unit5 1.1.17-SNAPSHOT
[INFO] ------------------------------------------------------------------------
[INFO] 
[INFO] --- maven-resources-plugin:2.6:resources (default-resources) @ ejb-cdi-unit5 ---
[INFO] Using 'UTF-8' encoding to copy filtered resources.
[INFO] skip non existing resourceDirectory /root/workspace/1and1/ejb-cdi-unit/436756933/ejb-cdi-unit5/src/main/resources
[INFO] 
[INFO] --- maven-compiler-plugin:3.7.0:compile (default-compile) @ ejb-cdi-unit5 ---
[INFO] Nothing to compile - all classes are up to date
[INFO] 
[INFO] --- maven-resources-plugin:2.6:testResources (default-testResources) @ ejb-cdi-unit5 ---
[INFO] Using 'UTF-8' encoding to copy filtered resources.
[INFO] skip non existing resourceDirectory /root/workspace/1and1/ejb-cdi-unit/436756933/ejb-cdi-unit5/src/test/resources
[INFO] 
[INFO] --- maven-compiler-plugin:3.7.0:testCompile (default-testCompile) @ ejb-cdi-unit5 ---
[INFO] Nothing to compile - all classes are up to date
[INFO] 
[INFO] --- maven-surefire-plugin:2.22.0:test (default-test) @ ejb-cdi-unit5 ---
[INFO] Downloading: https://repo.maven.apache.org/maven2/org/apache/maven/wagon/wagon-provider-api/1.0-beta-6/wagon-provider-api-1.0-beta-6.pom
[INFO] Downloaded: https://repo.maven.apache.org/maven2/org/apache/maven/wagon/wagon-provider-api/1.0-beta-6/wagon-provider-api-1.0-beta-6.pom (2 KB at 35.1 KB/sec)
[INFO] Downloading: https://repo.maven.apache.org/maven2/org/apache/maven/wagon/wagon/1.0-beta-6/wagon-1.0-beta-6.pom
[INFO] Downloaded: https://repo.maven.apache.org/maven2/org/apache/maven/wagon/wagon/1.0-beta-6/wagon-1.0-beta-6.pom (13 KB at 345.6 KB/sec)
[INFO] Downloading: https://repo.maven.apache.org/maven2/org/codehaus/plexus/plexus-utils/1.4.2/plexus-utils-1.4.2.pom
[INFO] Downloaded: https://repo.maven.apache.org/maven2/org/codehaus/plexus/plexus-utils/1.4.2/plexus-utils-1.4.2.pom (2 KB at 56.3 KB/sec)
[INFO] Downloading: https://repo.maven.apache.org/maven2/org/apache/maven/wagon/wagon-http/1.0-beta-6/wagon-http-1.0-beta-6.pom
[INFO] Downloaded: https://repo.maven.apache.org/maven2/org/apache/maven/wagon/wagon-http/1.0-beta-6/wagon-http-1.0-beta-6.pom (4 KB at 90.6 KB/sec)
[INFO] Downloading: https://repo.maven.apache.org/maven2/org/apache/maven/wagon/wagon-providers/1.0-beta-6/wagon-providers-1.0-beta-6.pom
[INFO] Downloaded: https://repo.maven.apache.org/maven2/org/apache/maven/wagon/wagon-providers/1.0-beta-6/wagon-providers-1.0-beta-6.pom (3 KB at 42.1 KB/sec)
[INFO] Downloading: https://repo.maven.apache.org/maven2/org/apache/maven/wagon/wagon-http-shared/1.0-beta-6/wagon-http-shared-1.0-beta-6.pom
[INFO] Downloaded: https://repo.maven.apache.org/maven2/org/apache/maven/wagon/wagon-http-shared/1.0-beta-6/wagon-http-shared-1.0-beta-6.pom (3 KB at 60.5 KB/sec)
[INFO] Downloading: https://repo.maven.apache.org/maven2/nekohtml/xercesMinimal/1.9.6.2/xercesMinimal-1.9.6.2.pom
[INFO] Downloaded: https://repo.maven.apache.org/maven2/nekohtml/xercesMinimal/1.9.6.2/xercesMinimal-1.9.6.2.pom (390 B at 10.6 KB/sec)
[INFO] Downloading: https://repo.maven.apache.org/maven2/nekohtml/nekohtml/1.9.6.2/nekohtml-1.9.6.2.pom
[INFO] Downloaded: https://repo.maven.apache.org/maven2/nekohtml/nekohtml/1.9.6.2/nekohtml-1.9.6.2.pom (704 B at 20.8 KB/sec)
[INFO] Downloading: https://repo.maven.apache.org/maven2/commons-httpclient/commons-httpclient/3.1/commons-httpclient-3.1.pom
[INFO] Downloaded: https://repo.maven.apache.org/maven2/commons-httpclient/commons-httpclient/3.1/commons-httpclient-3.1.pom (8 KB at 216.6 KB/sec)
[INFO] Downloading: https://repo.maven.apache.org/maven2/commons-codec/commons-codec/1.2/commons-codec-1.2.pom
[INFO] Downloaded: https://repo.maven.apache.org/maven2/commons-codec/commons-codec/1.2/commons-codec-1.2.pom (4 KB at 109.9 KB/sec)
[INFO] Downloading: https://repo.maven.apache.org/maven2/org/apache/maven/wagon/wagon-webdav-jackrabbit/1.0-beta-6/wagon-webdav-jackrabbit-1.0-beta-6.pom
[INFO] Downloaded: https://repo.maven.apache.org/maven2/org/apache/maven/wagon/wagon-webdav-jackrabbit/1.0-beta-6/wagon-webdav-jackrabbit-1.0-beta-6.pom (4 KB at 74.5 KB/sec)
[INFO] Downloading: https://repo.maven.apache.org/maven2/org/apache/jackrabbit/jackrabbit-webdav/1.5.0/jackrabbit-webdav-1.5.0.pom
[INFO] Downloaded: https://repo.maven.apache.org/maven2/org/apache/jackrabbit/jackrabbit-webdav/1.5.0/jackrabbit-webdav-1.5.0.pom (4 KB at 95.7 KB/sec)
[INFO] Downloading: https://repo.maven.apache.org/maven2/org/apache/jackrabbit/jackrabbit-parent/1.5.0/jackrabbit-parent-1.5.0.pom
[INFO] Downloaded: https://repo.maven.apache.org/maven2/org/apache/jackrabbit/jackrabbit-parent/1.5.0/jackrabbit-parent-1.5.0.pom (25 KB at 589.8 KB/sec)
[INFO] Downloading: https://repo.maven.apache.org/maven2/org/apache/jackrabbit/jackrabbit-jcr-commons/1.5.0/jackrabbit-jcr-commons-1.5.0.pom
[INFO] Downloaded: https://repo.maven.apache.org/maven2/org/apache/jackrabbit/jackrabbit-jcr-commons/1.5.0/jackrabbit-jcr-commons-1.5.0.pom (3 KB at 85.7 KB/sec)
[INFO] Downloading: https://repo.maven.apache.org/maven2/org/slf4j/slf4j-api/1.5.3/slf4j-api-1.5.3.pom
[INFO] Downloaded: https://repo.maven.apache.org/maven2/org/slf4j/slf4j-api/1.5.3/slf4j-api-1.5.3.pom (3 KB at 85.7 KB/sec)
[INFO] Downloading: https://repo.maven.apache.org/maven2/org/slf4j/slf4j-parent/1.5.3/slf4j-parent-1.5.3.pom
[INFO] Downloaded: https://repo.maven.apache.org/maven2/org/slf4j/slf4j-parent/1.5.3/slf4j-parent-1.5.3.pom (8 KB at 215.9 KB/sec)
[INFO] Downloading: https://repo.maven.apache.org/maven2/commons-httpclient/commons-httpclient/3.0/commons-httpclient-3.0.pom
[INFO] Downloaded: https://repo.maven.apache.org/maven2/commons-httpclient/commons-httpclient/3.0/commons-httpclient-3.0.pom (8 KB at 211.9 KB/sec)
[INFO] Downloading: https://repo.maven.apache.org/maven2/org/slf4j/slf4j-nop/1.5.3/slf4j-nop-1.5.3.pom
[INFO] Downloaded: https://repo.maven.apache.org/maven2/org/slf4j/slf4j-nop/1.5.3/slf4j-nop-1.5.3.pom (2 KB at 42.0 KB/sec)
[INFO] Downloading: https://repo.maven.apache.org/maven2/org/apache/maven/wagon/wagon-http/1.0-beta-6/wagon-http-1.0-beta-6.jar
[INFO] Downloading: https://repo.maven.apache.org/maven2/org/apache/maven/wagon/wagon-http-shared/1.0-beta-6/wagon-http-shared-1.0-beta-6.jar
[INFO] Downloading: https://repo.maven.apache.org/maven2/org/apache/maven/wagon/wagon-provider-api/1.0-beta-6/wagon-provider-api-1.0-beta-6.jar
[INFO] Downloading: https://repo.maven.apache.org/maven2/nekohtml/xercesMinimal/1.9.6.2/xercesMinimal-1.9.6.2.jar
[INFO] Downloading: https://repo.maven.apache.org/maven2/nekohtml/nekohtml/1.9.6.2/nekohtml-1.9.6.2.jar
[INFO] Downloaded: https://repo.maven.apache.org/maven2/org/apache/maven/wagon/wagon-http-shared/1.0-beta-6/wagon-http-shared-1.0-beta-6.jar (25 KB at 515.3 KB/sec)
[INFO] Downloading: https://repo.maven.apache.org/maven2/commons-httpclient/commons-httpclient/3.1/commons-httpclient-3.1.jar
[INFO] Downloaded: https://repo.maven.apache.org/maven2/org/apache/maven/wagon/wagon-http/1.0-beta-6/wagon-http-1.0-beta-6.jar (11 KB at 123.7 KB/sec)
[INFO] Downloading: https://repo.maven.apache.org/maven2/commons-codec/commons-codec/1.2/commons-codec-1.2.jar
[INFO] Downloaded: https://repo.maven.apache.org/maven2/nekohtml/xercesMinimal/1.9.6.2/xercesMinimal-1.9.6.2.jar (39 KB at 388.7 KB/sec)
[INFO] Downloading: https://repo.maven.apache.org/maven2/org/apache/maven/wagon/wagon-webdav-jackrabbit/1.0-beta-6/wagon-webdav-jackrabbit-1.0-beta-6.jar
[INFO] Downloaded: https://repo.maven.apache.org/maven2/org/apache/maven/wagon/wagon-provider-api/1.0-beta-6/wagon-provider-api-1.0-beta-6.jar (52 KB at 455.6 KB/sec)
[INFO] Downloading: https://repo.maven.apache.org/maven2/org/apache/jackrabbit/jackrabbit-webdav/1.5.0/jackrabbit-webdav-1.5.0.jar
[INFO] Downloaded: https://repo.maven.apache.org/maven2/nekohtml/nekohtml/1.9.6.2/nekohtml-1.9.6.2.jar (110 KB at 902.9 KB/sec)
[INFO] Downloading: https://repo.maven.apache.org/maven2/org/apache/jackrabbit/jackrabbit-jcr-commons/1.5.0/jackrabbit-jcr-commons-1.5.0.jar
[INFO] Downloaded: https://repo.maven.apache.org/maven2/commons-codec/commons-codec/1.2/commons-codec-1.2.jar (30 KB at 612.1 KB/sec)
[INFO] Downloading: https://repo.maven.apache.org/maven2/org/slf4j/slf4j-nop/1.5.3/slf4j-nop-1.5.3.jar
[INFO] Downloaded: https://repo.maven.apache.org/maven2/org/apache/maven/wagon/wagon-webdav-jackrabbit/1.0-beta-6/wagon-webdav-jackrabbit-1.0-beta-6.jar (18 KB at 446.6 KB/sec)
[INFO] Downloading: https://repo.maven.apache.org/maven2/org/apache/maven/reporting/maven-reporting-api/2.2.1/maven-reporting-api-2.2.1.jar
[INFO] Downloaded: https://repo.maven.apache.org/maven2/commons-httpclient/commons-httpclient/3.1/commons-httpclient-3.1.jar (298 KB at 2612.7 KB/sec)
[INFO] Downloading: https://repo.maven.apache.org/maven2/org/apache/maven/doxia/doxia-logging-api/1.1/doxia-logging-api-1.1.jar
[INFO] Downloaded: https://repo.maven.apache.org/maven2/org/slf4j/slf4j-nop/1.5.3/slf4j-nop-1.5.3.jar (6 KB at 145.1 KB/sec)
[INFO] Downloaded: https://repo.maven.apache.org/maven2/org/apache/maven/reporting/maven-reporting-api/2.2.1/maven-reporting-api-2.2.1.jar (10 KB at 273.1 KB/sec)
[INFO] Downloaded: https://repo.maven.apache.org/maven2/org/apache/maven/doxia/doxia-logging-api/1.1/doxia-logging-api-1.1.jar (12 KB at 316.3 KB/sec)
[INFO] Downloaded: https://repo.maven.apache.org/maven2/org/apache/jackrabbit/jackrabbit-jcr-commons/1.5.0/jackrabbit-jcr-commons-1.5.0.jar (199 KB at 2129.1 KB/sec)
[INFO] Downloaded: https://repo.maven.apache.org/maven2/org/apache/jackrabbit/jackrabbit-webdav/1.5.0/jackrabbit-webdav-1.5.0.jar (296 KB at 2508.3 KB/sec)
[INFO] 
[INFO] -------------------------------------------------------
[INFO]  T E S T S
[INFO] -------------------------------------------------------

 +-------------------------------------------------------------------------------+
 | WARNING:                                                                      |
 | The junit-platform-surefire-provider has been deprecated and is scheduled to  |
 | be removed in JUnit Platform 1.4. Please use the built-in support in Maven    |
 | Surefire >= 2.22.0 instead.                                                   |
 | » https://junit.org/junit5/docs/current/user-guide/#running-tests-build-maven |
 +-------------------------------------------------------------------------------+


[INFO] Listening for transport dt_socket at address: 5005
[INFO] Running net.oneandone.ejbcdiunit.relbuilder.RelBuilderTest
[INFO] Tests run: 3, Failures: 0, Errors: 0, Skipped: 0, Time elapsed: 0.035 s - in net.oneandone.ejbcdiunit.relbuilder.RelBuilderTest
[INFO] canInjectOneProducerParameter  Time elapsed: 0.021 s
[INFO] canInjectOneField  Time elapsed: 0.003 s
[INFO] canInjectViaConstructor  Time elapsed: 0.001 s
[INFO] Listening for transport dt_socket at address: 5005
[INFO] Running com.oneandone.ejbcdiunit5.junit5.FirstJunit5Test
[INFO] Tests run: 11, Failures: 0, Errors: 0, Skipped: 0, Time elapsed: 2.501 s - in com.oneandone.ejbcdiunit5.junit5.FirstJunit5Test
[INFO] myFirstRepeatedTest[1]  Time elapsed: 0.009 s
[INFO] myFirstRepeatedTest[2]  Time elapsed: 0.001 s
[INFO] myFirstRepeatedTest[3]  Time elapsed: 0 s
[INFO] myFirstRepeatedTest[4]  Time elapsed: 0.001 s
[INFO] myFirstRepeatedTest[5]  Time elapsed: 0 s
[INFO] myFirstRepeatedTestWithRepetitionInfo{RepetitionInfo, TestInfo}[1]  Time elapsed: 0.004 s
[INFO] myFirstRepeatedTestWithRepetitionInfo{RepetitionInfo, TestInfo}[2]  Time elapsed: 0 s
[INFO] myFirstRepeatedTestWithRepetitionInfo{RepetitionInfo, TestInfo}[3]  Time elapsed: 0 s
[INFO] myFirstRepeatedTestWithRepetitionInfo{RepetitionInfo, TestInfo}[4]  Time elapsed: 0 s
[INFO] myFirstRepeatedTestWithRepetitionInfo{RepetitionInfo, TestInfo}[5]  Time elapsed: 0.001 s
[INFO] myFirstTest  Time elapsed: 0.001 s
[INFO] 
[INFO] Results:
[INFO] 
[INFO] Tests run: 14, Failures: 0, Errors: 0, Skipped: 0
[INFO] 
[INFO]                                                                         
[INFO] ------------------------------------------------------------------------
[INFO] Building net.oneandone:ejb-cdi-unit-test-war 1.1.17-SNAPSHOT
[INFO] ------------------------------------------------------------------------
[INFO] 
[INFO] --- maven-resources-plugin:2.6:resources (default-resources) @ ejb-cdi-unit-test-war ---
[INFO] Using 'UTF-8' encoding to copy filtered resources.
[INFO] Copying 3 resources
[INFO] 
[INFO] --- maven-compiler-plugin:3.7.0:compile (default-compile) @ ejb-cdi-unit-test-war ---
[INFO] Nothing to compile - all classes are up to date
[INFO] 
[INFO] --- maven-resources-plugin:2.6:testResources (default-testResources) @ ejb-cdi-unit-test-war ---
[INFO] Using 'UTF-8' encoding to copy filtered resources.
[INFO] skip non existing resourceDirectory /root/workspace/1and1/ejb-cdi-unit/436756933/ejb-cdi-unit-test-war/src/test/resources
[INFO] 
[INFO] --- maven-compiler-plugin:3.7.0:testCompile (default-testCompile) @ ejb-cdi-unit-test-war ---
[INFO] No sources to compile
[INFO] 
[INFO] --- maven-surefire-plugin:2.22.0:test (default-test) @ ejb-cdi-unit-test-war ---
[INFO] No tests to run.
[INFO]                                                                         
[INFO] ------------------------------------------------------------------------
[INFO] Building net.oneandone:ejb-cdi-unit-tests 1.1.17-SNAPSHOT
[INFO] ------------------------------------------------------------------------
[INFO] 
[INFO] --- maven-resources-plugin:2.6:resources (default-resources) @ ejb-cdi-unit-tests ---
[INFO] Using 'UTF-8' encoding to copy filtered resources.
[INFO] skip non existing resourceDirectory /root/workspace/1and1/ejb-cdi-unit/436756933/ejb-cdi-unit-tests/src/main/resources
[INFO] 
[INFO] --- maven-compiler-plugin:3.7.0:compile (default-compile) @ ejb-cdi-unit-tests ---
[INFO] No sources to compile
[INFO] 
[INFO] --- maven-resources-plugin:2.6:testResources (default-testResources) @ ejb-cdi-unit-tests ---
[INFO] Using 'UTF-8' encoding to copy filtered resources.
[INFO] Copying 2 resources
[INFO] 
[INFO] --- maven-compiler-plugin:3.7.0:testCompile (default-testCompile) @ ejb-cdi-unit-tests ---
[INFO] Nothing to compile - all classes are up to date
[INFO] 
[INFO] --- maven-surefire-plugin:2.22.0:test (default-test) @ ejb-cdi-unit-tests ---
[INFO] 
[INFO] -------------------------------------------------------
[INFO]  T E S T S
[INFO] -------------------------------------------------------
[INFO] Listening for transport dt_socket at address: 5005
[INFO] Running cdiunit.decoratortest.NoDecoratorTest
[INFO] Tests run: 1, Failures: 0, Errors: 0, Skipped: 0, Time elapsed: 1.736 s - in cdiunit.decoratortest.NoDecoratorTest
[INFO] testZero(cdiunit.decoratortest.NoDecoratorTest)  Time elapsed: 0.018 s
[INFO] Listening for transport dt_socket at address: 5005
[INFO] Running cdiunit.decoratortest.AddOneDecoratorTest
[INFO] Tests run: 1, Failures: 0, Errors: 0, Skipped: 0, Time elapsed: 1.748 s - in cdiunit.decoratortest.AddOneDecoratorTest
[INFO] testAddOne(cdiunit.decoratortest.AddOneDecoratorTest)  Time elapsed: 0.028 s
[INFO] Listening for transport dt_socket at address: 5005
[INFO] Running cdiunit.TestServletProducers
[INFO] Tests run: 1, Failures: 0, Errors: 0, Skipped: 0, Time elapsed: 1.793 s - in cdiunit.TestServletProducers
[INFO] testServletException(cdiunit.TestServletProducers)  Time elapsed: 0.093 s
[INFO] Listening for transport dt_socket at address: 5005
[INFO] Running cdiunit.TestViewScope
[INFO] Tests run: 3, Failures: 0, Errors: 0, Skipped: 0, Time elapsed: 1.745 s - in cdiunit.TestViewScope
[INFO] testSameBeanEachTime(cdiunit.TestViewScope)  Time elapsed: 0.019 s
[INFO] testTransitiveViewScoped1(cdiunit.TestViewScope)  Time elapsed: 0.003 s
[INFO] testTransitiveViewScoped2(cdiunit.TestViewScope)  Time elapsed: 0.003 s
[INFO] Listening for transport dt_socket at address: 5005
[INFO] Running cdiunit.TestProducerConfig
[INFO] Tests run: 4, Failures: 0, Errors: 0, Skipped: 0, Time elapsed: 2.13 s - in cdiunit.TestProducerConfig
[INFO] testA1(cdiunit.TestProducerConfig)  Time elapsed: 0.016 s
[INFO] testA2(cdiunit.TestProducerConfig)  Time elapsed: 0.003 s
[INFO] testArrayList(cdiunit.TestProducerConfig)  Time elapsed: 0.003 s
[INFO] testHashSet(cdiunit.TestProducerConfig)  Time elapsed: 0.003 s
[INFO] Listening for transport dt_socket at address: 5005
[INFO] Running cdiunit.TestCdiUnitRunner
[INFO] Tests run: 18, Failures: 0, Errors: 0, Skipped: 0, Time elapsed: 3.807 s - in cdiunit.TestCdiUnitRunner
[INFO] testRequestScope(cdiunit.TestCdiUnitRunner)  Time elapsed: 0.363 s
[INFO] testProducedViaMethod(cdiunit.TestCdiUnitRunner)  Time elapsed: 0.012 s
[INFO] testBeanManager(cdiunit.TestCdiUnitRunner)  Time elapsed: 0.009 s
[INFO] testConversationScope(cdiunit.TestCdiUnitRunner)  Time elapsed: 0.017 s
[INFO] testSuper(cdiunit.TestCdiUnitRunner)  Time elapsed: 0.009 s
[INFO] testContextControllerSessionScoped(cdiunit.TestCdiUnitRunner)  Time elapsed: 0.017 s
[INFO] testTestAlternative(cdiunit.TestCdiUnitRunner)  Time elapsed: 0.014 s
[INFO] testSessionScopeFail(cdiunit.TestCdiUnitRunner)  Time elapsed: 0.008 s
[INFO] testRequestScopeFail(cdiunit.TestCdiUnitRunner)  Time elapsed: 0.006 s
[INFO] testPostConstruct(cdiunit.TestCdiUnitRunner)  Time elapsed: 0.006 s
[INFO] testSessionScope(cdiunit.TestCdiUnitRunner)  Time elapsed: 0.008 s
[INFO] testContextControllerRequestScoped(cdiunit.TestCdiUnitRunner)  Time elapsed: 0.008 s
[INFO] testContextControllerSessionScopedWithRequest(cdiunit.TestCdiUnitRunner)  Time elapsed: 0.009 s
[INFO] testProducedViaField(cdiunit.TestCdiUnitRunner)  Time elapsed: 0.006 s
[INFO] testContextController(cdiunit.TestCdiUnitRunner)  Time elapsed: 0.03 s
[INFO] testConversationScopeFail(cdiunit.TestCdiUnitRunner)  Time elapsed: 0.009 s
[INFO] testContextControllerConversationScoped(cdiunit.TestCdiUnitRunner)  Time elapsed: 0.009 s
[INFO] testApplicationScoped(cdiunit.TestCdiUnitRunner)  Time elapsed: 0.008 s
[INFO] Listening for transport dt_socket at address: 5005
[INFO] Running cdiunit.TestNonCDIClasses
[INFO] Tests run: 1, Failures: 0, Errors: 0, Skipped: 0, Time elapsed: 1.29 s - in cdiunit.TestNonCDIClasses
[INFO] testNonCDIClassDiscovery(cdiunit.TestNonCDIClasses)  Time elapsed: 0 s
[INFO] Listening for transport dt_socket at address: 5005
[INFO] Running cdiunit.TestContextController
[INFO] Tests run: 2, Failures: 0, Errors: 0, Skipped: 0, Time elapsed: 1.901 s - in cdiunit.TestContextController
[INFO] testSynchronousExecution(cdiunit.TestContextController)  Time elapsed: 0.102 s
[INFO] testAsynchronousExecution(cdiunit.TestContextController)  Time elapsed: 0.016 s
[INFO] Listening for transport dt_socket at address: 5005
[INFO] Running cdiunit.TestAlternativeStereotype
[INFO] Tests run: 1, Failures: 0, Errors: 0, Skipped: 0, Time elapsed: 1.619 s - in cdiunit.TestAlternativeStereotype
[INFO] testAlternativeSelected(cdiunit.TestAlternativeStereotype)  Time elapsed: 0.019 s
[INFO] Listening for transport dt_socket at address: 5005
[INFO] Running cdiunit.TestCircularInject
[INFO] Tests run: 1, Failures: 0, Errors: 0, Skipped: 0, Time elapsed: 1.403 s - in cdiunit.TestCircularInject
[INFO] testCircularDependency(cdiunit.TestCircularInject)  Time elapsed: 0.001 s
[INFO] Listening for transport dt_socket at address: 5005
[INFO] Running cdiunit.TestAlternativeAnnotations
[INFO] Tests run: 1, Failures: 0, Errors: 0, Skipped: 0, Time elapsed: 1.73 s - in cdiunit.TestAlternativeAnnotations
[INFO] testAlternativeSelected(cdiunit.TestAlternativeAnnotations)  Time elapsed: 0.021 s
[INFO] Listening for transport dt_socket at address: 5005
[INFO] Running cdiunit.TestAdditionalPackages
[INFO] Tests run: 1, Failures: 0, Errors: 0, Skipped: 0, Time elapsed: 1.68 s - in cdiunit.TestAdditionalPackages
[INFO] testResolvedPackage(cdiunit.TestAdditionalPackages)  Time elapsed: 0.015 s
[INFO] Listening for transport dt_socket at address: 5005
[INFO] Running cdiunit.TestJaxRs
[INFO] Tests run: 1, Failures: 0, Errors: 0, Skipped: 0, Time elapsed: 2.11 s - in cdiunit.TestJaxRs
[INFO] testJaxRs(cdiunit.TestJaxRs)  Time elapsed: 0.386 s
[INFO] Listening for transport dt_socket at address: 5005
[INFO] Running cdiunit.ExtensionInheritanceTest
[INFO] Tests run: 1, Failures: 0, Errors: 0, Skipped: 0, Time elapsed: 1.559 s - in cdiunit.ExtensionInheritanceTest
[INFO] test(cdiunit.ExtensionInheritanceTest)  Time elapsed: 0.016 s
[INFO] Listening for transport dt_socket at address: 5005
[INFO] Running cdiunit.TestAdditionalClasspaths
[INFO] Tests run: 1, Failures: 0, Errors: 0, Skipped: 0, Time elapsed: 1.666 s - in cdiunit.TestAdditionalClasspaths
[INFO] testResolvedExternal(cdiunit.TestAdditionalClasspaths)  Time elapsed: 0.016 s
[INFO] Listening for transport dt_socket at address: 5005
[INFO] Running com.oneandone.ejbcdiunit.asynchmdb.TestTimerExclusion
[INFO] Tests run: 1, Failures: 0, Errors: 0, Skipped: 0, Time elapsed: 1.544 s - in com.oneandone.ejbcdiunit.asynchmdb.TestTimerExclusion
[INFO] testTimer(com.oneandone.ejbcdiunit.asynchmdb.TestTimerExclusion)  Time elapsed: 1.047 s
[INFO] Listening for transport dt_socket at address: 5005
[INFO] Running com.oneandone.ejbcdiunit.asynchmdb.TestMdb
[INFO] Tests run: 2, Failures: 0, Errors: 0, Skipped: 0, Time elapsed: 62.128 s - in com.oneandone.ejbcdiunit.asynchmdb.TestMdb
[INFO] testTopic(com.oneandone.ejbcdiunit.asynchmdb.TestMdb)  Time elapsed: 56.242 s
[INFO] testQueues(com.oneandone.ejbcdiunit.asynchmdb.TestMdb)  Time elapsed: 4.028 s
[INFO] Listening for transport dt_socket at address: 5005
[INFO] Running com.oneandone.ejbcdiunit.asynchmdb.TestCompletelyAsynch
[INFO] Tests run: 1, Failures: 0, Errors: 0, Skipped: 0, Time elapsed: 1.762 s - in com.oneandone.ejbcdiunit.asynchmdb.TestCompletelyAsynch
[INFO] test(com.oneandone.ejbcdiunit.asynchmdb.TestCompletelyAsynch)  Time elapsed: 0.038 s
[INFO] Listening for transport dt_socket at address: 5005
[INFO] Running com.oneandone.ejbcdiunit.asynchmdb.TestAsynch
[INFO] Tests run: 5, Failures: 0, Errors: 0, Skipped: 0, Time elapsed: 6.302 s - in com.oneandone.ejbcdiunit.asynchmdb.TestAsynch
[INFO] testTimer(com.oneandone.ejbcdiunit.asynchmdb.TestAsynch)  Time elapsed: 0.049 s
[INFO] testTimerSecondTest(com.oneandone.ejbcdiunit.asynchmdb.TestAsynch)  Time elapsed: 0.009 s
[INFO] testNotAsyncMethod(com.oneandone.ejbcdiunit.asynchmdb.TestAsynch)  Time elapsed: 0.006 s
[INFO] test(com.oneandone.ejbcdiunit.asynchmdb.TestAsynch)  Time elapsed: 0.007 s
[INFO] testTimerWithThread(com.oneandone.ejbcdiunit.asynchmdb.TestAsynch)  Time elapsed: 4.214 s
[INFO] Listening for transport dt_socket at address: 5005
[INFO] Running com.oneandone.ejbcdiunit.ejb.AppExceptionTest
[INFO] Tests run: 12, Failures: 0, Errors: 0, Skipped: 0, Time elapsed: 5.877 s - in com.oneandone.ejbcdiunit.ejb.AppExceptionTest
[INFO] testAppExcInNotSupported(com.oneandone.ejbcdiunit.ejb.AppExceptionTest)  Time elapsed: 1.828 s
[INFO] testAppRTExcInRequiresNew(com.oneandone.ejbcdiunit.ejb.AppExceptionTest)  Time elapsed: 0.14 s
[INFO] testAppRTExcInRequired(com.oneandone.ejbcdiunit.ejb.AppExceptionTest)  Time elapsed: 0.108 s
[INFO] testAppExcInCurrentTra(com.oneandone.ejbcdiunit.ejb.AppExceptionTest)  Time elapsed: 0.119 s
[INFO] testAppExcInSupports(com.oneandone.ejbcdiunit.ejb.AppExceptionTest)  Time elapsed: 0.106 s
[INFO] testAppExcInRequiresNew(com.oneandone.ejbcdiunit.ejb.AppExceptionTest)  Time elapsed: 0.081 s
[INFO] testAppRTExcInCurrentTra(com.oneandone.ejbcdiunit.ejb.AppExceptionTest)  Time elapsed: 0.093 s
[INFO] testDeclaredAppExcInCurrentTra(com.oneandone.ejbcdiunit.ejb.AppExceptionTest)  Time elapsed: 0.08 s
[INFO] testDeclaredAppRtExcInCurrentTra(com.oneandone.ejbcdiunit.ejb.AppExceptionTest)  Time elapsed: 0.095 s
[INFO] testAppExcInRequired(com.oneandone.ejbcdiunit.ejb.AppExceptionTest)  Time elapsed: 0.075 s
[INFO] testAppRTExcInNotSupported(com.oneandone.ejbcdiunit.ejb.AppExceptionTest)  Time elapsed: 0.078 s
[INFO] testAppRTExcInSupports(com.oneandone.ejbcdiunit.ejb.AppExceptionTest)  Time elapsed: 0.09 s
[INFO] Listening for transport dt_socket at address: 5005
[INFO] Running com.oneandone.ejbcdiunit.ejb.TestEjbInjection
[INFO] Tests run: 1, Failures: 0, Errors: 0, Skipped: 0, Time elapsed: 3.056 s - in com.oneandone.ejbcdiunit.ejb.TestEjbInjection
[INFO] testEjbName(com.oneandone.ejbcdiunit.ejb.TestEjbInjection)  Time elapsed: 1.449 s
[INFO] Listening for transport dt_socket at address: 5005
[INFO] Running com.oneandone.ejbcdiunit.ejb.TestStringResourceInjection
[INFO] Tests run: 2, Failures: 0, Errors: 0, Skipped: 0, Time elapsed: 1.893 s - in com.oneandone.ejbcdiunit.ejb.TestStringResourceInjection
[INFO] canInjectFullSpecified(com.oneandone.ejbcdiunit.ejb.TestStringResourceInjection)  Time elapsed: 0.043 s
[INFO] canInjectPartlySpecified(com.oneandone.ejbcdiunit.ejb.TestStringResourceInjection)  Time elapsed: 0.007 s
[INFO] Listening for transport dt_socket at address: 5005
[INFO] Running com.oneandone.ejbcdiunit.ejb.TestEjbNotSupported
[INFO] Tests run: 10, Failures: 0, Errors: 0, Skipped: 0, Time elapsed: 4.752 s - in com.oneandone.ejbcdiunit.ejb.TestEjbNotSupported
[INFO] testRequiredTraPlusIOException(com.oneandone.ejbcdiunit.ejb.TestEjbNotSupported)  Time elapsed: 1.45 s
[INFO] testRequiredTraPlusRTException(com.oneandone.ejbcdiunit.ejb.TestEjbNotSupported)  Time elapsed: 0.089 s
[INFO] persistRequiresNewSetRollbackOnlyBySessionContext(com.oneandone.ejbcdiunit.ejb.TestEjbNotSupported)  Time elapsed: 0.191 s
[INFO] persistRequiresNewGetRollbackOnlyBySessionContext(com.oneandone.ejbcdiunit.ejb.TestEjbNotSupported)  Time elapsed: 0.068 s
[INFO] testRequiredIndirectTraPlusIOException(com.oneandone.ejbcdiunit.ejb.TestEjbNotSupported)  Time elapsed: 0.073 s
[INFO] testRequiredIndirectTraPlusRTException(com.oneandone.ejbcdiunit.ejb.TestEjbNotSupported)  Time elapsed: 0.058 s
[INFO] testRequiresNewTraPlusIOException(com.oneandone.ejbcdiunit.ejb.TestEjbNotSupported)  Time elapsed: 0.058 s
[INFO] testRequiresNewTraPlusRTException(com.oneandone.ejbcdiunit.ejb.TestEjbNotSupported)  Time elapsed: 0.065 s
[INFO] testRequiredIndirectTraPlusIOExceptionIndirect(com.oneandone.ejbcdiunit.ejb.TestEjbNotSupported)  Time elapsed: 0.076 s
[INFO] testRequiredIndirectTraPlusRTExceptionIndirect(com.oneandone.ejbcdiunit.ejb.TestEjbNotSupported)  Time elapsed: 0.072 s
[INFO] Listening for transport dt_socket at address: 5005
[INFO] Running com.oneandone.ejbcdiunit.ejb.TestEjb
[INFO] Tests run: 34, Failures: 0, Errors: 0, Skipped: 0, Time elapsed: 8.767 s - in com.oneandone.ejbcdiunit.ejb.TestEjb
[INFO] testBeanManagedTransactionsInTra(com.oneandone.ejbcdiunit.ejb.TestEjb)  Time elapsed: 2.754 s
[INFO] testBeanManagedTransactionsWOTra(com.oneandone.ejbcdiunit.ejb.TestEjb)  Time elapsed: 0.318 s
[INFO] testSessionContextInjection(com.oneandone.ejbcdiunit.ejb.TestEjb)  Time elapsed: 0.278 s
[INFO] canInterpretTransactionAttributeInParentClass(com.oneandone.ejbcdiunit.ejb.TestEjb)  Time elapsed: 0.244 s
[INFO] requiredMethodWorks(com.oneandone.ejbcdiunit.ejb.TestEjb)  Time elapsed: 0.41 s
[INFO] indirectSaveNewInRequired(com.oneandone.ejbcdiunit.ejb.TestEjb)  Time elapsed: 0.218 s
[INFO] indirectSaveNewInRequiredThrowException(com.oneandone.ejbcdiunit.ejb.TestEjb)  Time elapsed: 0.241 s
[INFO] requiresNewMethodWorks(com.oneandone.ejbcdiunit.ejb.TestEjb)  Time elapsed: 0.215 s
[INFO] indirectSaveRequiredInRequired(com.oneandone.ejbcdiunit.ejb.TestEjb)  Time elapsed: 0.204 s
[INFO] testBeanManagedTransactionsWOTraButOuter(com.oneandone.ejbcdiunit.ejb.TestEjb)  Time elapsed: 0.147 s
[INFO] indirectSaveRequiredPlusNewInNewTraButDirectCallAndThrow(com.oneandone.ejbcdiunit.ejb.TestEjb)  Time elapsed: 0.139 s
[INFO] indirectSaveRequiredInRequiredThrowException(com.oneandone.ejbcdiunit.ejb.TestEjb)  Time elapsed: 0.138 s
[INFO] indirectSaveRequiresNewLocalUsingSelfAndThrow(com.oneandone.ejbcdiunit.ejb.TestEjb)  Time elapsed: 0.135 s
[INFO] canInterpretTransactionAttributeInParentMethodRequired(com.oneandone.ejbcdiunit.ejb.TestEjb)  Time elapsed: 0.248 s
[INFO] testBeanManagedWOTraInTestCode(com.oneandone.ejbcdiunit.ejb.TestEjb)  Time elapsed: 0.14 s
[INFO] indirectSaveNewInNewTra(com.oneandone.ejbcdiunit.ejb.TestEjb)  Time elapsed: 0.143 s
[INFO] tryTestBeanManagedWOTraInTestCodeInSupported(com.oneandone.ejbcdiunit.ejb.TestEjb)  Time elapsed: 0.114 s
[INFO] testBeanManagedTransactionsInTraEncapsulatedPlusPreAndPostTras(com.oneandone.ejbcdiunit.ejb.TestEjb)  Time elapsed: 0.115 s
[INFO] indirectSaveRequiresNewLocalAsBusinessObjectAndThrow(com.oneandone.ejbcdiunit.ejb.TestEjb)  Time elapsed: 0.128 s
[INFO] defaultMethodWorks(com.oneandone.ejbcdiunit.ejb.TestEjb)  Time elapsed: 0.118 s
[INFO] indirectSaveRequiredInNewTra(com.oneandone.ejbcdiunit.ejb.TestEjb)  Time elapsed: 0.16 s
[INFO] saveToSetRollbackOnlyAndTryAdditionalSave(com.oneandone.ejbcdiunit.ejb.TestEjb)  Time elapsed: 0.186 s
[INFO] canInterpretTransactionAttributeInParentMethodNever(com.oneandone.ejbcdiunit.ejb.TestEjb)  Time elapsed: 0.173 s
[INFO] everythingNotNull(com.oneandone.ejbcdiunit.ejb.TestEjb)  Time elapsed: 0.188 s
[INFO] indirectSaveRequiredInNewTraThrow(com.oneandone.ejbcdiunit.ejb.TestEjb)  Time elapsed: 0.108 s
[INFO] testBeanManagedWOTraInTestCodeTryInNotSupported(com.oneandone.ejbcdiunit.ejb.TestEjb)  Time elapsed: 0.102 s
[INFO] indirectSaveRequiresNewLocalAsBusinessObject(com.oneandone.ejbcdiunit.ejb.TestEjb)  Time elapsed: 0.11 s
[INFO] indirectSaveRequiredPlusNewInNewTra(com.oneandone.ejbcdiunit.ejb.TestEjb)  Time elapsed: 0.109 s
[INFO] testSelfInjection(com.oneandone.ejbcdiunit.ejb.TestEjb)  Time elapsed: 0.097 s
[INFO] testCacheWOTransaction(com.oneandone.ejbcdiunit.ejb.TestEjb)  Time elapsed: 0.114 s
[INFO] testBeanManagedWithTraInTestCodeTryInNotSupported(com.oneandone.ejbcdiunit.ejb.TestEjb)  Time elapsed: 0.096 s
[INFO] testBeanManagedWithTraInTestCodeInSupported(com.oneandone.ejbcdiunit.ejb.TestEjb)  Time elapsed: 0.101 s
[INFO] testSelfInjectionByEjb(com.oneandone.ejbcdiunit.ejb.TestEjb)  Time elapsed: 0.097 s
[INFO] indirectSaveNewInNewTraThrow(com.oneandone.ejbcdiunit.ejb.TestEjb)  Time elapsed: 0.108 s
[INFO] Listening for transport dt_socket at address: 5005
[INFO] Running com.oneandone.ejbcdiunit.ejb.TestEjbSpecialContext
[INFO] Tests run: 1, Failures: 0, Errors: 0, Skipped: 0, Time elapsed: 1.693 s - in com.oneandone.ejbcdiunit.ejb.TestEjbSpecialContext
[INFO] checkContextAlternative(com.oneandone.ejbcdiunit.ejb.TestEjbSpecialContext)  Time elapsed: 0.132 s
[INFO] Listening for transport dt_socket at address: 5005
[INFO] Running com.oneandone.ejbcdiunit.ejb.NonEjbTransactionTest
[INFO] Tests run: 3, Failures: 0, Errors: 0, Skipped: 0, Time elapsed: 3.84 s - in com.oneandone.ejbcdiunit.ejb.NonEjbTransactionTest
[INFO] testRequired(com.oneandone.ejbcdiunit.ejb.NonEjbTransactionTest)  Time elapsed: 1.635 s
[INFO] testRequired2(com.oneandone.ejbcdiunit.ejb.NonEjbTransactionTest)  Time elapsed: 0.088 s
[INFO] testRequired3(com.oneandone.ejbcdiunit.ejb.NonEjbTransactionTest)  Time elapsed: 0.085 s
[INFO] Listening for transport dt_socket at address: 5005
[INFO] Running com.oneandone.ejbcdiunit.persistencefactory.Jpa2PUTest
[INFO] Tests run: 3, Failures: 0, Errors: 0, Skipped: 0, Time elapsed: 5.936 s - in com.oneandone.ejbcdiunit.persistencefactory.Jpa2PUTest
[INFO] checkForUpdate(com.oneandone.ejbcdiunit.persistencefactory.Jpa2PUTest)  Time elapsed: 3.733 s
[INFO] canWorkIn2Transactions(com.oneandone.ejbcdiunit.persistencefactory.Jpa2PUTest)  Time elapsed: 0.153 s
[INFO] testEmsAreCorrectInjected(com.oneandone.ejbcdiunit.persistencefactory.Jpa2PUTest)  Time elapsed: 0.123 s
[INFO] Listening for transport dt_socket at address: 5005
[INFO] Running com.oneandone.ejbcdiunit.persistencefactory.MySqlTest
[ERROR] Tests run: 2, Failures: 0, Errors: 1, Skipped: 0, Time elapsed: 21.786 s <<< FAILURE! - in com.oneandone.ejbcdiunit.persistencefactory.MySqlTest
[ERROR] test(com.oneandone.ejbcdiunit.persistencefactory.MySqlTest)  Time elapsed: 19.724 s  <<< ERROR!
org.jboss.weld.exceptions.WeldException: WELD-000049 Unable to invoke [method] @PostConstruct public com.oneandone.ejbcdiunit.helpers.MySqlStarter.create() on com.oneandone.ejbcdiunit.helpers.MySqlStarter@7a388990
Caused by: java.lang.reflect.InvocationTargetException
Caused by: ch.vorburger.exec.ManagedProcessException: An error occurred while starting the database
Caused by: ch.vorburger.exec.ManagedProcessException: 
Asked to wait for "mysqld: ready for connections." from Program [/tmp/MariaDB4j/base/bin/mysqld, --no-defaults, --console, --skip-grant-tables, --max_allowed_packet=64M, --basedir=/tmp/MariaDB4j/base, --datadir=/tmp/MariaDB4j/data/3406, --port=3406, --socket=/tmp/MariaDB4j.3406.sock] (in working directory /tmp/MariaDB4j/base), but it already exited! (without that message in console), last 100 lines of console:
2018-10-03 18:29:40 139833021507456 [Note] /tmp/MariaDB4j/base/bin/mysqld (mysqld 10.1.13-MariaDB) starting as process 1728 ...
2018-10-03 18:29:40 139833021507456 [ERROR] Fatal error: Please consult the Knowledge Base to find out how to run mysqld as root!

2018-10-03 18:29:40 139833021507456 [ERROR] Aborting


[ERROR] test2(com.oneandone.ejbcdiunit.persistencefactory.MySqlTest)  Time elapsed: 0.228 s
[INFO] Listening for transport dt_socket at address: 5005
[INFO] Running com.oneandone.ejbcdiunit.persistencefactory.TestProperty1
[INFO] Tests run: 19, Failures: 0, Errors: 0, Skipped: 0, Time elapsed: 7.356 s - in com.oneandone.ejbcdiunit.persistencefactory.TestProperty1
[INFO] doesFlushBeforeNativeQuery(com.oneandone.ejbcdiunit.persistencefactory.TestProperty1)  Time elapsed: 1.56 s
[INFO] test(com.oneandone.ejbcdiunit.persistencefactory.TestProperty1)  Time elapsed: 0.083 s
[INFO] checkUserTransactionAndDataSource(com.oneandone.ejbcdiunit.persistencefactory.TestProperty1)  Time elapsed: 0.186 s
[INFO] canQueryPersistedChangedEntityInTransaction(com.oneandone.ejbcdiunit.persistencefactory.TestProperty1)  Time elapsed: 0.078 s
[INFO] doesFlushBeforeQuery(com.oneandone.ejbcdiunit.persistencefactory.TestProperty1)  Time elapsed: 0.071 s
[INFO] checkForUpdate(com.oneandone.ejbcdiunit.persistencefactory.TestProperty1)  Time elapsed: 0.109 s
[INFO] testTraRolledBack(com.oneandone.ejbcdiunit.persistencefactory.TestProperty1)  Time elapsed: 0.062 s
[INFO] canInsertInEmbeddedTransaction(com.oneandone.ejbcdiunit.persistencefactory.TestProperty1)  Time elapsed: 0.172 s
[INFO] checkForUpdateMultiThreaded(com.oneandone.ejbcdiunit.persistencefactory.TestProperty1)  Time elapsed: 1.069 s
[INFO] canInsertInMandatoryTransactionByClosure(com.oneandone.ejbcdiunit.persistencefactory.TestProperty1)  Time elapsed: 0.09 s
[INFO] canNotInsertInMandatoyTransaction(com.oneandone.ejbcdiunit.persistencefactory.TestProperty1)  Time elapsed: 0.077 s
[INFO] requiresNewDoesInsertInOtherEm(com.oneandone.ejbcdiunit.persistencefactory.TestProperty1)  Time elapsed: 0.081 s
[INFO] requiresNewDoesInsertInSameEm(com.oneandone.ejbcdiunit.persistencefactory.TestProperty1)  Time elapsed: 0.08 s
[INFO] canQueryPersistedEntityInTransaction(com.oneandone.ejbcdiunit.persistencefactory.TestProperty1)  Time elapsed: 0.091 s
[INFO] canInsertInTransaction(com.oneandone.ejbcdiunit.persistencefactory.TestProperty1)  Time elapsed: 0.1 s
[INFO] canQueryCreatedEntityInEmbeddedTransaction(com.oneandone.ejbcdiunit.persistencefactory.TestProperty1)  Time elapsed: 0.106 s
[INFO] canInsertInMandatoryTransaction(com.oneandone.ejbcdiunit.persistencefactory.TestProperty1)  Time elapsed: 0.093 s
[INFO] doesCommitChangeEvenWhenAlreadyFlushed(com.oneandone.ejbcdiunit.persistencefactory.TestProperty1)  Time elapsed: 0.057 s
[INFO] doesCommitChangeEvenWhenASecondTimeFlushed(com.oneandone.ejbcdiunit.persistencefactory.TestProperty1)  Time elapsed: 0.059 s
[INFO] Listening for transport dt_socket at address: 5005
[INFO] Running com.oneandone.ejbcdiunit.persistencefactory.TestPersistenceFactoryAlternativeH2Test
[INFO] Tests run: 19, Failures: 0, Errors: 0, Skipped: 0, Time elapsed: 7.07 s - in com.oneandone.ejbcdiunit.persistencefactory.TestPersistenceFactoryAlternativeH2Test
[INFO] canExecuteStatementsUsingDataSource(com.oneandone.ejbcdiunit.persistencefactory.TestPersistenceFactoryAlternativeH2Test)  Time elapsed: 1.385 s
[INFO] doesFlushBeforeNativeQuery(com.oneandone.ejbcdiunit.persistencefactory.TestPersistenceFactoryAlternativeH2Test)  Time elapsed: 0.108 s
[INFO] canQueryPersistedChangedEntityInTransaction(com.oneandone.ejbcdiunit.persistencefactory.TestPersistenceFactoryAlternativeH2Test)  Time elapsed: 0.292 s
[INFO] doesFlushBeforeQuery(com.oneandone.ejbcdiunit.persistencefactory.TestPersistenceFactoryAlternativeH2Test)  Time elapsed: 0.101 s
[INFO] checkForUpdate(com.oneandone.ejbcdiunit.persistencefactory.TestPersistenceFactoryAlternativeH2Test)  Time elapsed: 0.102 s
[INFO] testTraRolledBack(com.oneandone.ejbcdiunit.persistencefactory.TestPersistenceFactoryAlternativeH2Test)  Time elapsed: 0.075 s
[INFO] canInsertInEmbeddedTransaction(com.oneandone.ejbcdiunit.persistencefactory.TestPersistenceFactoryAlternativeH2Test)  Time elapsed: 0.075 s
[INFO] checkForUpdateMultiThreaded(com.oneandone.ejbcdiunit.persistencefactory.TestPersistenceFactoryAlternativeH2Test)  Time elapsed: 1.066 s
[INFO] canInsertInMandatoryTransactionByClosure(com.oneandone.ejbcdiunit.persistencefactory.TestPersistenceFactoryAlternativeH2Test)  Time elapsed: 0.086 s
[INFO] canNotInsertInMandatoyTransaction(com.oneandone.ejbcdiunit.persistencefactory.TestPersistenceFactoryAlternativeH2Test)  Time elapsed: 0.113 s
[INFO] requiresNewDoesInsertInOtherEm(com.oneandone.ejbcdiunit.persistencefactory.TestPersistenceFactoryAlternativeH2Test)  Time elapsed: 0.06 s
[INFO] checkUserTransactionAndDataSource(com.oneandone.ejbcdiunit.persistencefactory.TestPersistenceFactoryAlternativeH2Test)  Time elapsed: 0.082 s
[INFO] requiresNewDoesInsertInSameEm(com.oneandone.ejbcdiunit.persistencefactory.TestPersistenceFactoryAlternativeH2Test)  Time elapsed: 0.065 s
[INFO] canQueryPersistedEntityInTransaction(com.oneandone.ejbcdiunit.persistencefactory.TestPersistenceFactoryAlternativeH2Test)  Time elapsed: 0.069 s
[INFO] canInsertInTransaction(com.oneandone.ejbcdiunit.persistencefactory.TestPersistenceFactoryAlternativeH2Test)  Time elapsed: 0.051 s
[INFO] canQueryCreatedEntityInEmbeddedTransaction(com.oneandone.ejbcdiunit.persistencefactory.TestPersistenceFactoryAlternativeH2Test)  Time elapsed: 0.057 s
[INFO] canInsertInMandatoryTransaction(com.oneandone.ejbcdiunit.persistencefactory.TestPersistenceFactoryAlternativeH2Test)  Time elapsed: 0.049 s
[INFO] doesCommitChangeEvenWhenAlreadyFlushed(com.oneandone.ejbcdiunit.persistencefactory.TestPersistenceFactoryAlternativeH2Test)  Time elapsed: 0.079 s
[INFO] doesCommitChangeEvenWhenASecondTimeFlushed(com.oneandone.ejbcdiunit.persistencefactory.TestPersistenceFactoryAlternativeH2Test)  Time elapsed: 0.054 s
[INFO] Listening for transport dt_socket at address: 5005
[INFO] Running com.oneandone.ejbcdiunit.persistencefactory.TestPersistenceFactoryH2Test
[INFO] Tests run: 18, Failures: 0, Errors: 0, Skipped: 0, Time elapsed: 7.248 s - in com.oneandone.ejbcdiunit.persistencefactory.TestPersistenceFactoryH2Test
[INFO] doesFlushBeforeNativeQuery(com.oneandone.ejbcdiunit.persistencefactory.TestPersistenceFactoryH2Test)  Time elapsed: 1.46 s
[INFO] canQueryPersistedChangedEntityInTransaction(com.oneandone.ejbcdiunit.persistencefactory.TestPersistenceFactoryH2Test)  Time elapsed: 0.33 s
[INFO] doesFlushBeforeQuery(com.oneandone.ejbcdiunit.persistencefactory.TestPersistenceFactoryH2Test)  Time elapsed: 0.095 s
[INFO] checkForUpdate(com.oneandone.ejbcdiunit.persistencefactory.TestPersistenceFactoryH2Test)  Time elapsed: 0.106 s
[INFO] testTraRolledBack(com.oneandone.ejbcdiunit.persistencefactory.TestPersistenceFactoryH2Test)  Time elapsed: 0.081 s
[INFO] canInsertInEmbeddedTransaction(com.oneandone.ejbcdiunit.persistencefactory.TestPersistenceFactoryH2Test)  Time elapsed: 0.098 s
[INFO] checkForUpdateMultiThreaded(com.oneandone.ejbcdiunit.persistencefactory.TestPersistenceFactoryH2Test)  Time elapsed: 1.069 s
[INFO] canInsertInMandatoryTransactionByClosure(com.oneandone.ejbcdiunit.persistencefactory.TestPersistenceFactoryH2Test)  Time elapsed: 0.066 s
[INFO] canNotInsertInMandatoyTransaction(com.oneandone.ejbcdiunit.persistencefactory.TestPersistenceFactoryH2Test)  Time elapsed: 0.052 s
[INFO] requiresNewDoesInsertInOtherEm(com.oneandone.ejbcdiunit.persistencefactory.TestPersistenceFactoryH2Test)  Time elapsed: 0.058 s
[INFO] checkUserTransactionAndDataSource(com.oneandone.ejbcdiunit.persistencefactory.TestPersistenceFactoryH2Test)  Time elapsed: 0.15 s
[INFO] requiresNewDoesInsertInSameEm(com.oneandone.ejbcdiunit.persistencefactory.TestPersistenceFactoryH2Test)  Time elapsed: 0.054 s
[INFO] canQueryPersistedEntityInTransaction(com.oneandone.ejbcdiunit.persistencefactory.TestPersistenceFactoryH2Test)  Time elapsed: 0.058 s
[INFO] canInsertInTransaction(com.oneandone.ejbcdiunit.persistencefactory.TestPersistenceFactoryH2Test)  Time elapsed: 0.058 s
[INFO] canQueryCreatedEntityInEmbeddedTransaction(com.oneandone.ejbcdiunit.persistencefactory.TestPersistenceFactoryH2Test)  Time elapsed: 0.058 s
[INFO] canInsertInMandatoryTransaction(com.oneandone.ejbcdiunit.persistencefactory.TestPersistenceFactoryH2Test)  Time elapsed: 0.065 s
[INFO] doesCommitChangeEvenWhenAlreadyFlushed(com.oneandone.ejbcdiunit.persistencefactory.TestPersistenceFactoryH2Test)  Time elapsed: 0.09 s
[INFO] doesCommitChangeEvenWhenASecondTimeFlushed(com.oneandone.ejbcdiunit.persistencefactory.TestPersistenceFactoryH2Test)  Time elapsed: 0.101 s
[INFO] Listening for transport dt_socket at address: 5005
[INFO] Running com.oneandone.ejbcdiunit.persistencefactory.PFH2Test
[INFO] Tests run: 18, Failures: 0, Errors: 0, Skipped: 0, Time elapsed: 6.908 s - in com.oneandone.ejbcdiunit.persistencefactory.PFH2Test
[INFO] doesFlushBeforeNativeQuery(com.oneandone.ejbcdiunit.persistencefactory.PFH2Test)  Time elapsed: 1.525 s
[INFO] canQueryPersistedChangedEntityInTransaction(com.oneandone.ejbcdiunit.persistencefactory.PFH2Test)  Time elapsed: 0.183 s
[INFO] doesFlushBeforeQuery(com.oneandone.ejbcdiunit.persistencefactory.PFH2Test)  Time elapsed: 0.092 s
[INFO] checkForUpdate(com.oneandone.ejbcdiunit.persistencefactory.PFH2Test)  Time elapsed: 0.117 s
[INFO] testTraRolledBack(com.oneandone.ejbcdiunit.persistencefactory.PFH2Test)  Time elapsed: 0.064 s
[INFO] canInsertInEmbeddedTransaction(com.oneandone.ejbcdiunit.persistencefactory.PFH2Test)  Time elapsed: 0.062 s
[INFO] checkForUpdateMultiThreaded(com.oneandone.ejbcdiunit.persistencefactory.PFH2Test)  Time elapsed: 1.069 s
[INFO] canInsertInMandatoryTransactionByClosure(com.oneandone.ejbcdiunit.persistencefactory.PFH2Test)  Time elapsed: 0.092 s
[INFO] canNotInsertInMandatoyTransaction(com.oneandone.ejbcdiunit.persistencefactory.PFH2Test)  Time elapsed: 0.074 s
[INFO] requiresNewDoesInsertInOtherEm(com.oneandone.ejbcdiunit.persistencefactory.PFH2Test)  Time elapsed: 0.103 s
[INFO] checkUserTransactionAndDataSource(com.oneandone.ejbcdiunit.persistencefactory.PFH2Test)  Time elapsed: 0.084 s
[INFO] requiresNewDoesInsertInSameEm(com.oneandone.ejbcdiunit.persistencefactory.PFH2Test)  Time elapsed: 0.066 s
[INFO] canQueryPersistedEntityInTransaction(com.oneandone.ejbcdiunit.persistencefactory.PFH2Test)  Time elapsed: 0.065 s
[INFO] canInsertInTransaction(com.oneandone.ejbcdiunit.persistencefactory.PFH2Test)  Time elapsed: 0.065 s
[INFO] canQueryCreatedEntityInEmbeddedTransaction(com.oneandone.ejbcdiunit.persistencefactory.PFH2Test)  Time elapsed: 0.062 s
[INFO] canInsertInMandatoryTransaction(com.oneandone.ejbcdiunit.persistencefactory.PFH2Test)  Time elapsed: 0.076 s
[INFO] doesCommitChangeEvenWhenAlreadyFlushed(com.oneandone.ejbcdiunit.persistencefactory.PFH2Test)  Time elapsed: 0.064 s
[INFO] doesCommitChangeEvenWhenASecondTimeFlushed(com.oneandone.ejbcdiunit.persistencefactory.PFH2Test)  Time elapsed: 0.095 s
[INFO] Listening for transport dt_socket at address: 5005
[INFO] Running com.oneandone.ejbcdiunit.persistencefactory.PFMySqlTest
[INFO] Tests run: 18, Failures: 0, Errors: 0, Skipped: 0, Time elapsed: 6.935 s - in com.oneandone.ejbcdiunit.persistencefactory.PFMySqlTest
[INFO] doesFlushBeforeNativeQuery(com.oneandone.ejbcdiunit.persistencefactory.PFMySqlTest)  Time elapsed: 1.567 s
[INFO] canQueryPersistedChangedEntityInTransaction(com.oneandone.ejbcdiunit.persistencefactory.PFMySqlTest)  Time elapsed: 0.249 s
[INFO] doesFlushBeforeQuery(com.oneandone.ejbcdiunit.persistencefactory.PFMySqlTest)  Time elapsed: 0.107 s
[INFO] checkForUpdate(com.oneandone.ejbcdiunit.persistencefactory.PFMySqlTest)  Time elapsed: 0.088 s
[INFO] testTraRolledBack(com.oneandone.ejbcdiunit.persistencefactory.PFMySqlTest)  Time elapsed: 0.064 s
[INFO] canInsertInEmbeddedTransaction(com.oneandone.ejbcdiunit.persistencefactory.PFMySqlTest)  Time elapsed: 0.062 s
[INFO] checkForUpdateMultiThreaded(com.oneandone.ejbcdiunit.persistencefactory.PFMySqlTest)  Time elapsed: 1.066 s
[INFO] canInsertInMandatoryTransactionByClosure(com.oneandone.ejbcdiunit.persistencefactory.PFMySqlTest)  Time elapsed: 0.061 s
[INFO] canNotInsertInMandatoyTransaction(com.oneandone.ejbcdiunit.persistencefactory.PFMySqlTest)  Time elapsed: 0.055 s
[INFO] requiresNewDoesInsertInOtherEm(com.oneandone.ejbcdiunit.persistencefactory.PFMySqlTest)  Time elapsed: 0.091 s
[INFO] checkUserTransactionAndDataSource(com.oneandone.ejbcdiunit.persistencefactory.PFMySqlTest)  Time elapsed: 0.064 s
[INFO] requiresNewDoesInsertInSameEm(com.oneandone.ejbcdiunit.persistencefactory.PFMySqlTest)  Time elapsed: 0.069 s
[INFO] canQueryPersistedEntityInTransaction(com.oneandone.ejbcdiunit.persistencefactory.PFMySqlTest)  Time elapsed: 0.069 s
[INFO] canInsertInTransaction(com.oneandone.ejbcdiunit.persistencefactory.PFMySqlTest)  Time elapsed: 0.074 s
[INFO] canQueryCreatedEntityInEmbeddedTransaction(com.oneandone.ejbcdiunit.persistencefactory.PFMySqlTest)  Time elapsed: 0.071 s
[INFO] canInsertInMandatoryTransaction(com.oneandone.ejbcdiunit.persistencefactory.PFMySqlTest)  Time elapsed: 0.06 s
[INFO] doesCommitChangeEvenWhenAlreadyFlushed(com.oneandone.ejbcdiunit.persistencefactory.PFMySqlTest)  Time elapsed: 0.052 s
[INFO] doesCommitChangeEvenWhenASecondTimeFlushed(com.oneandone.ejbcdiunit.persistencefactory.PFMySqlTest)  Time elapsed: 0.067 s
[INFO] Listening for transport dt_socket at address: 5005
[INFO] Running com.oneandone.ejbcdiunit.excludedclasses.ExcludeNegativeByRuleTest
[INFO] Tests run: 1, Failures: 0, Errors: 0, Skipped: 0, Time elapsed: 1.67 s - in com.oneandone.ejbcdiunit.excludedclasses.ExcludeNegativeByRuleTest
[INFO] test(com.oneandone.ejbcdiunit.excludedclasses.ExcludeNegativeByRuleTest)  Time elapsed: 1.177 s
[INFO] Listening for transport dt_socket at address: 5005
[INFO] Running com.oneandone.ejbcdiunit.excludedclasses.ExcludeByRuleTest
[INFO] Tests run: 1, Failures: 0, Errors: 0, Skipped: 0, Time elapsed: 1.609 s - in com.oneandone.ejbcdiunit.excludedclasses.ExcludeByRuleTest
[INFO] test(com.oneandone.ejbcdiunit.excludedclasses.ExcludeByRuleTest)  Time elapsed: 1.089 s
[INFO] Listening for transport dt_socket at address: 5005
[INFO] Running com.oneandone.ejbcdiunit.excludedclasses.IndirectExcludeByRuleTest
[INFO] Tests run: 1, Failures: 0, Errors: 0, Skipped: 0, Time elapsed: 0.722 s - in com.oneandone.ejbcdiunit.excludedclasses.IndirectExcludeByRuleTest
[INFO] test(com.oneandone.ejbcdiunit.excludedclasses.IndirectExcludeByRuleTest)  Time elapsed: 0.23 s
[INFO] Listening for transport dt_socket at address: 5005
[INFO] Running com.oneandone.ejbcdiunit.excludedclasses.ExcludeNegativeTest
[INFO] Tests run: 1, Failures: 0, Errors: 0, Skipped: 0, Time elapsed: 1.694 s - in com.oneandone.ejbcdiunit.excludedclasses.ExcludeNegativeTest
[INFO] test(com.oneandone.ejbcdiunit.excludedclasses.ExcludeNegativeTest)  Time elapsed: 0.023 s
[INFO] Listening for transport dt_socket at address: 5005
[INFO] Running com.oneandone.ejbcdiunit.excludedclasses.IndirectExcludeTest
[INFO] Tests run: 1, Failures: 0, Errors: 0, Skipped: 0, Time elapsed: 0.734 s - in com.oneandone.ejbcdiunit.excludedclasses.IndirectExcludeTest
[INFO] test(com.oneandone.ejbcdiunit.excludedclasses.IndirectExcludeTest)  Time elapsed: 0 s
[INFO] Listening for transport dt_socket at address: 5005
[INFO] Running com.oneandone.ejbcdiunit.excludedclasses.ExcludeTest
[INFO] Tests run: 1, Failures: 0, Errors: 0, Skipped: 0, Time elapsed: 1.598 s - in com.oneandone.ejbcdiunit.excludedclasses.ExcludeTest
[INFO] test(com.oneandone.ejbcdiunit.excludedclasses.ExcludeTest)  Time elapsed: 0.03 s
[INFO] Listening for transport dt_socket at address: 5005
[INFO] Running com.oneandone.ejbcdiunit.excludedclasses.SubExcludeTest
[INFO] Tests run: 1, Failures: 0, Errors: 0, Skipped: 0, Time elapsed: 1.582 s - in com.oneandone.ejbcdiunit.excludedclasses.SubExcludeTest
[INFO] test(com.oneandone.ejbcdiunit.excludedclasses.SubExcludeTest)  Time elapsed: 0.025 s
[INFO] Listening for transport dt_socket at address: 5005
[INFO] Running com.oneandone.ejbcdiunit.cdibeans.CdiBeansAliasTest
[INFO] Tests run: 1, Failures: 0, Errors: 0, Skipped: 0, Time elapsed: 1.667 s - in com.oneandone.ejbcdiunit.cdibeans.CdiBeansAliasTest
[INFO] test(com.oneandone.ejbcdiunit.cdibeans.CdiBeansAliasTest)  Time elapsed: 0.021 s
[INFO] Listening for transport dt_socket at address: 5005
[INFO] Running com.oneandone.ejbcdiunit.cdibeans.CdiBeansTest
[INFO] Tests run: 1, Failures: 0, Errors: 0, Skipped: 0, Time elapsed: 1.601 s - in com.oneandone.ejbcdiunit.cdibeans.CdiBeansTest
[INFO] test(com.oneandone.ejbcdiunit.cdibeans.CdiBeansTest)  Time elapsed: 0.021 s
[INFO] Listening for transport dt_socket at address: 5005
[INFO] Running com.oneandone.ejbcdiunit.SimpleTest
[INFO] Tests run: 1, Failures: 0, Errors: 0, Skipped: 0, Time elapsed: 1.57 s - in com.oneandone.ejbcdiunit.SimpleTest
[INFO] test(com.oneandone.ejbcdiunit.SimpleTest)  Time elapsed: 1.071 s
[INFO] Listening for transport dt_socket at address: 5005
[INFO] Running com.oneandone.ejbcdiunit.mvcc.MvccTest
[ERROR] Tests run: 2, Failures: 0, Errors: 1, Skipped: 0, Time elapsed: 20.338 s <<< FAILURE! - in com.oneandone.ejbcdiunit.mvcc.MvccTest
[ERROR] testH2(com.oneandone.ejbcdiunit.mvcc.MvccTest)  Time elapsed: 0.226 s
[ERROR] testMariaDb(com.oneandone.ejbcdiunit.mvcc.MvccTest)  Time elapsed: 20.018 s  <<< ERROR!
ch.vorburger.exec.ManagedProcessException: An error occurred while starting the database
	at com.oneandone.ejbcdiunit.mvcc.MvccTest.createConnection(MvccTest.java:62)
	at com.oneandone.ejbcdiunit.mvcc.MvccTest.initDb(MvccTest.java:77)
	at com.oneandone.ejbcdiunit.mvcc.MvccTest.testMariaDb(MvccTest.java:133)
Caused by: ch.vorburger.exec.ManagedProcessException: 
Asked to wait for "mysqld: ready for connections." from Program [/tmp/MariaDB4j/base/bin/mysqld, --no-defaults, --console, --skip-grant-tables, --max_allowed_packet=64M, --basedir=/tmp/MariaDB4j/base, --datadir=/tmp/MariaDB4j/data/3406, --port=3406, --socket=/tmp/MariaDB4j.3406.sock] (in working directory /tmp/MariaDB4j/base), but it already exited! (without that message in console), last 100 lines of console:
2018-10-03 18:31:01 140421444880256 [Note] /tmp/MariaDB4j/base/bin/mysqld (mysqld 10.1.13-MariaDB) starting as process 2357 ...
2018-10-03 18:31:01 140421444880256 [ERROR] Fatal error: Please consult the Knowledge Base to find out how to run mysqld as root!

2018-10-03 18:31:01 140421444880256 [ERROR] Aborting

	at com.oneandone.ejbcdiunit.mvcc.MvccTest.createConnection(MvccTest.java:62)
	at com.oneandone.ejbcdiunit.mvcc.MvccTest.initDb(MvccTest.java:77)
	at com.oneandone.ejbcdiunit.mvcc.MvccTest.testMariaDb(MvccTest.java:133)

[INFO] Listening for transport dt_socket at address: 5005
[INFO] Running cdiunittests.ProducesAltTest
[INFO] Tests run: 2, Failures: 0, Errors: 0, Skipped: 0, Time elapsed: 2.123 s - in cdiunittests.ProducesAltTest
[INFO] test(cdiunittests.ProducesAltTest)  Time elapsed: 0.337 s
[INFO] test2(cdiunittests.ProducesAltTest)  Time elapsed: 0.005 s
[INFO] Listening for transport dt_socket at address: 5005
[INFO] Running cdiunittests.TestCircularInject
[INFO] Tests run: 1, Failures: 0, Errors: 0, Skipped: 0, Time elapsed: 1.36 s - in cdiunittests.TestCircularInject
[INFO] testCircularDependency(cdiunittests.TestCircularInject)  Time elapsed: 0.001 s
[INFO] Listening for transport dt_socket at address: 5005
[INFO] Running alternatives.NonAlternativeTest
[INFO] Tests run: 1, Failures: 0, Errors: 0, Skipped: 0, Time elapsed: 1.717 s - in alternatives.NonAlternativeTest
[INFO] test(alternatives.NonAlternativeTest)  Time elapsed: 0.016 s
[INFO] Listening for transport dt_socket at address: 5005
[INFO] Running alternatives.AlternativeTest
[INFO] Tests run: 1, Failures: 0, Errors: 0, Skipped: 0, Time elapsed: 1.856 s - in alternatives.AlternativeTest
[INFO] test(alternatives.AlternativeTest)  Time elapsed: 0.015 s
[INFO] 
[INFO] Results:
[INFO] 
[ERROR] Errors: 
[ERROR]   MvccTest.testMariaDb:133->initDb:77->createConnection:62 » ManagedProcess An e...
[ERROR]   MySqlTest.test » Weld WELD-000049 Unable to invoke [method] @PostConstruct pub...
[INFO] 
[ERROR] Tests run: 224, Failures: 0, Errors: 2, Skipped: 0
[INFO] 
[INFO] ------------------------------------------------------------------------
[INFO] Reactor Summary:
[INFO] 
[INFO] net.oneandone:ejb-cdi-unit-parent .................. SUCCESS [  0.003 s]
[INFO] net.oneandone:ejb-cdi-unit ......................... SUCCESS [ 13.259 s]
[INFO] net.oneandone:ejb-cdi-unit5 ........................ SUCCESS [  6.738 s]
[INFO] net.oneandone:ejb-cdi-unit-test-war ................ SUCCESS [  0.055 s]
[INFO] net.oneandone:ejb-cdi-unit-tests ................... FAILURE [04:25 min]
[INFO] net.oneandone:purecdi-tests ........................ SKIPPED
[INFO] net.oneandone:ejb-cdi-unit-tests5 .................. SKIPPED
[INFO] net.oneandone:ejb-cdi-unit-simulators .............. SKIPPED
[INFO] net.oneandone:ejb-cdi-unit-camunda ................. SKIPPED
[INFO] net.oneandone:ejb-cdi-unit arquillian tests ........ SKIPPED
[INFO] net.oneandone:ejb-cdi-unit-examples ................ SKIPPED
[INFO] example1 service with one entity ................... SKIPPED
[INFO] service with one entity in Junit5 nested classes ... SKIPPED
[INFO] service syncconsumed ............................... SKIPPED
[INFO] service asyncconsumed with polling ................. SKIPPED
[INFO] service asyncconsumed with callback ................ SKIPPED
[INFO] service asyncconsumed with callback use jms ........ SKIPPED
[INFO] service asyncconsumed with callback use jms ........ SKIPPED
[INFO] service as simple rest ............................. SKIPPED
[INFO] mockito-example .................................... SKIPPED
[INFO] ------------------------------------------------------------------------
[INFO] BUILD FAILURE
[INFO] ------------------------------------------------------------------------
[INFO] Total time: 04:46 min
[INFO] Finished at: 2018-10-03T20:31:11+02:00
[INFO] Final Memory: 36M/688M
[INFO] ------------------------------------------------------------------------
[ERROR] Failed to execute goal org.apache.maven.plugins:maven-surefire-plugin:2.22.0:test (default-test) on project ejb-cdi-unit-tests: There are test failures.
[ERROR] 
[ERROR] Please refer to /root/workspace/1and1/ejb-cdi-unit/436756933/ejb-cdi-unit-tests/target/surefire-reports for the individual test results.
[ERROR] Please refer to dump files (if any exist) [date]-jvmRun[N].dump, [date].dumpstream and [date]-jvmRun[N].dumpstream.
[ERROR] -> [Help 1]
[ERROR] 
[ERROR] To see the full stack trace of the errors, re-run Maven with the -e switch.
[ERROR] Re-run Maven using the -X switch to enable full debug logging.
[ERROR] 
[ERROR] For more information about the errors and possible solutions, please read the following articles:
[ERROR] [Help 1] http://cwiki.apache.org/confluence/display/MAVEN/MojoFailureException
[ERROR] 
[ERROR] After correcting the problems, you can resume the build with the command
[ERROR]   mvn <goals> -rf :ejb-cdi-unit-tests
