[INFO] Scanning for projects...
[INFO]                                                                         
[INFO] ------------------------------------------------------------------------
[INFO] Building Vert.x Core 3.6.0-SNAPSHOT
[INFO] ------------------------------------------------------------------------
[INFO] 
[INFO] --- maven-enforcer-plugin:1.0:enforce (enforce-maven) @ vertx-core ---
[INFO] Skipping Rule Enforcement.
[INFO] 
[INFO] --- maven-processor-plugin:3.1.0:process (generate-sources) @ vertx-core ---
[WARNING] diagnostic: /root/workspace/eclipse-vertx/vert.x/437307181/src/main/java/io/vertx/core/http/ServerWebSocket.java:36: warning: Interface io.vertx.core.http.ServerWebSocket does not redeclare the @Fluent return type  of method writeTextMessage(java.lang.String) declared by io.vertx.core.http.WebSocketBase
public interface ServerWebSocket extends WebSocketBase {
       ^
[WARNING] diagnostic: /root/workspace/eclipse-vertx/vert.x/437307181/src/main/java/io/vertx/core/http/ServerWebSocket.java:36: warning: Interface io.vertx.core.http.ServerWebSocket does not redeclare the @Fluent return type  of method writePing(io.vertx.core.buffer.Buffer) declared by io.vertx.core.http.WebSocketBase
public interface ServerWebSocket extends WebSocketBase {
       ^
[WARNING] diagnostic: /root/workspace/eclipse-vertx/vert.x/437307181/src/main/java/io/vertx/core/http/ServerWebSocket.java:36: warning: Interface io.vertx.core.http.ServerWebSocket does not redeclare the @Fluent return type  of method writePong(io.vertx.core.buffer.Buffer) declared by io.vertx.core.http.WebSocketBase
public interface ServerWebSocket extends WebSocketBase {
       ^
[WARNING] diagnostic: /root/workspace/eclipse-vertx/vert.x/437307181/src/main/java/io/vertx/core/http/ServerWebSocket.java:36: warning: Interface io.vertx.core.http.ServerWebSocket does not redeclare the @Fluent return type  of method textMessageHandler((@io.vertx.codegen.annotations.Nullable :: io.vertx.core.Handler<java.lang.String>)) declared by io.vertx.core.http.WebSocketBase
public interface ServerWebSocket extends WebSocketBase {
       ^
[WARNING] diagnostic: /root/workspace/eclipse-vertx/vert.x/437307181/src/main/java/io/vertx/core/http/ServerWebSocket.java:36: warning: Interface io.vertx.core.http.ServerWebSocket does not redeclare the @Fluent return type  of method binaryMessageHandler((@io.vertx.codegen.annotations.Nullable :: io.vertx.core.Handler<io.vertx.core.buffer.Buffer>)) declared by io.vertx.core.http.WebSocketBase
public interface ServerWebSocket extends WebSocketBase {
       ^
[WARNING] diagnostic: /root/workspace/eclipse-vertx/vert.x/437307181/src/main/java/io/vertx/core/http/ServerWebSocket.java:36: warning: Interface io.vertx.core.http.ServerWebSocket does not redeclare the @Fluent return type  of method pongHandler((@io.vertx.codegen.annotations.Nullable :: io.vertx.core.Handler<io.vertx.core.buffer.Buffer>)) declared by io.vertx.core.http.WebSocketBase
public interface ServerWebSocket extends WebSocketBase {
       ^
[WARNING] diagnostic: /root/workspace/eclipse-vertx/vert.x/437307181/src/main/java/io/vertx/core/http/WebSocket.java:24: warning: Interface io.vertx.core.http.WebSocket does not redeclare the @Fluent return type  of method writePing(io.vertx.core.buffer.Buffer) declared by io.vertx.core.http.WebSocketBase
public interface WebSocket extends WebSocketBase {
       ^
[WARNING] diagnostic: /root/workspace/eclipse-vertx/vert.x/437307181/src/main/java/io/vertx/core/http/WebSocket.java:24: warning: Interface io.vertx.core.http.WebSocket does not redeclare the @Fluent return type  of method writePong(io.vertx.core.buffer.Buffer) declared by io.vertx.core.http.WebSocketBase
public interface WebSocket extends WebSocketBase {
       ^
[WARNING] diagnostic: /root/workspace/eclipse-vertx/vert.x/437307181/src/main/java/io/vertx/core/http/WebSocket.java:24: warning: Interface io.vertx.core.http.WebSocket does not redeclare the @Fluent return type  of method textMessageHandler((@io.vertx.codegen.annotations.Nullable :: io.vertx.core.Handler<java.lang.String>)) declared by io.vertx.core.http.WebSocketBase
public interface WebSocket extends WebSocketBase {
       ^
[WARNING] diagnostic: /root/workspace/eclipse-vertx/vert.x/437307181/src/main/java/io/vertx/core/http/WebSocket.java:24: warning: Interface io.vertx.core.http.WebSocket does not redeclare the @Fluent return type  of method binaryMessageHandler((@io.vertx.codegen.annotations.Nullable :: io.vertx.core.Handler<io.vertx.core.buffer.Buffer>)) declared by io.vertx.core.http.WebSocketBase
public interface WebSocket extends WebSocketBase {
       ^
[WARNING] diagnostic: /root/workspace/eclipse-vertx/vert.x/437307181/src/main/java/io/vertx/core/http/WebSocket.java:24: warning: Interface io.vertx.core.http.WebSocket does not redeclare the @Fluent return type  of method pongHandler((@io.vertx.codegen.annotations.Nullable :: io.vertx.core.Handler<io.vertx.core.buffer.Buffer>)) declared by io.vertx.core.http.WebSocketBase
public interface WebSocket extends WebSocketBase {
       ^
[WARNING] diagnostic: warning: The following options were not recognized by any processor: '[maven.artifactId, maven.version, codegen.output.data_object_converters, maven.groupId]'
[INFO] 
[INFO] --- build-helper-maven-plugin:3.0.0:add-source (add-source) @ vertx-core ---
[INFO] Source directory: /root/workspace/eclipse-vertx/vert.x/437307181/src/main/generated added.
[INFO] Source directory: /root/workspace/eclipse-vertx/vert.x/437307181/src/main/asciidoc added.
[INFO] 
[INFO] --- maven-resources-plugin:2.7:resources (default-resources) @ vertx-core ---
[INFO] Using 'UTF-8' encoding to copy filtered resources.
[INFO] Copying 1 resource
[INFO] Copying 6 resources
[INFO] 
[INFO] --- maven-compiler-plugin:3.7.0:compile (default-compile) @ vertx-core ---
[INFO] Changes detected - recompiling the module!
[INFO] Compiling 475 source files to /root/workspace/eclipse-vertx/vert.x/437307181/target/classes
[INFO] /root/workspace/eclipse-vertx/vert.x/437307181/src/main/java/io/vertx/core/impl/ContextImpl.java: Some input files use or override a deprecated API.
[INFO] /root/workspace/eclipse-vertx/vert.x/437307181/src/main/java/io/vertx/core/impl/ContextImpl.java: Recompile with -Xlint:deprecation for details.
[INFO] /root/workspace/eclipse-vertx/vert.x/437307181/src/main/java/io/vertx/core/Future.java: Some input files use unchecked or unsafe operations.
[INFO] /root/workspace/eclipse-vertx/vert.x/437307181/src/main/java/io/vertx/core/Future.java: Recompile with -Xlint:unchecked for details.
[INFO] 
[INFO] --- maven-bundle-plugin:2.5.3:manifest (bundle-manifest) @ vertx-core ---
[INFO] 
[INFO] --- build-helper-maven-plugin:3.0.0:add-test-source (add-test-source) @ vertx-core ---
[INFO] Test Source directory: /root/workspace/eclipse-vertx/vert.x/437307181/src/test/benchmarks added.
[INFO] 
[INFO] --- maven-resources-plugin:2.7:testResources (default-testResources) @ vertx-core ---
[INFO] Using 'UTF-8' encoding to copy filtered resources.
[INFO] Copying 140 resources
[INFO] 
[INFO] --- maven-compiler-plugin:3.7.0:testCompile (default-testCompile) @ vertx-core ---
[INFO] Nothing to compile - all classes are up to date
[INFO] 
[INFO] --- maven-surefire-plugin:2.18.1:test (default-test) @ vertx-core ---
[INFO] Surefire report directory: /root/workspace/eclipse-vertx/vert.x/437307181/target/surefire-reports
[INFO] Downloading: https://repo.maven.apache.org/maven2/org/apache/maven/surefire/surefire-junit4/2.18.1/surefire-junit4-2.18.1.pom
[INFO] Downloaded: https://repo.maven.apache.org/maven2/org/apache/maven/surefire/surefire-junit4/2.18.1/surefire-junit4-2.18.1.pom (3 KB at 9.3 KB/sec)
[INFO] Downloading: https://repo.maven.apache.org/maven2/org/apache/maven/surefire/surefire-providers/2.18.1/surefire-providers-2.18.1.pom
[INFO] Downloaded: https://repo.maven.apache.org/maven2/org/apache/maven/surefire/surefire-providers/2.18.1/surefire-providers-2.18.1.pom (3 KB at 69.0 KB/sec)
[INFO] Downloading: https://repo.maven.apache.org/maven2/org/apache/maven/surefire/surefire-junit4/2.18.1/surefire-junit4-2.18.1.jar
[INFO] Downloaded: https://repo.maven.apache.org/maven2/org/apache/maven/surefire/surefire-junit4/2.18.1/surefire-junit4-2.18.1.jar (67 KB at 935.1 KB/sec)

-------------------------------------------------------
 T E S T S
-------------------------------------------------------
Running io.vertx.core.cli.impl.TypedArgumentTest
Tests run: 8, Failures: 0, Errors: 0, Skipped: 0, Time elapsed: 0.065 sec - in io.vertx.core.cli.impl.TypedArgumentTest
Running io.vertx.core.cli.impl.DefaultParserTest
Tests run: 35, Failures: 0, Errors: 0, Skipped: 0, Time elapsed: 0.044 sec - in io.vertx.core.cli.impl.DefaultParserTest
Running io.vertx.core.cli.impl.IntensiveDefaultParserTest
Tests run: 39, Failures: 0, Errors: 0, Skipped: 0, Time elapsed: 0.023 sec - in io.vertx.core.cli.impl.IntensiveDefaultParserTest
Running io.vertx.core.cli.impl.CLIConfiguratorTest
Tests run: 13, Failures: 0, Errors: 0, Skipped: 0, Time elapsed: 0.037 sec - in io.vertx.core.cli.impl.CLIConfiguratorTest
Running io.vertx.core.cli.impl.DefaultCLITest
Tests run: 16, Failures: 0, Errors: 0, Skipped: 0, Time elapsed: 0.006 sec - in io.vertx.core.cli.impl.DefaultCLITest
Running io.vertx.core.cli.converters.CharacterConverterTest
Tests run: 4, Failures: 0, Errors: 0, Skipped: 0, Time elapsed: 0.001 sec - in io.vertx.core.cli.converters.CharacterConverterTest
Running io.vertx.core.cli.converters.BooleanConverterTest
Tests run: 6, Failures: 0, Errors: 0, Skipped: 0, Time elapsed: 0.002 sec - in io.vertx.core.cli.converters.BooleanConverterTest
Running io.vertx.core.cli.converters.ConvertersTest
Tests run: 8, Failures: 0, Errors: 0, Skipped: 0, Time elapsed: 0.01 sec - in io.vertx.core.cli.converters.ConvertersTest
Running io.vertx.core.cli.converters.ConstructorBasedConverterTest
Tests run: 2, Failures: 0, Errors: 0, Skipped: 0, Time elapsed: 0 sec - in io.vertx.core.cli.converters.ConstructorBasedConverterTest
Running io.vertx.core.cli.converters.StringConverterTest
Tests run: 1, Failures: 0, Errors: 0, Skipped: 0, Time elapsed: 0.001 sec - in io.vertx.core.cli.converters.StringConverterTest
Running io.vertx.core.cli.converters.CustomConverterTest
Tests run: 2, Failures: 0, Errors: 0, Skipped: 0, Time elapsed: 0 sec - in io.vertx.core.cli.converters.CustomConverterTest
Running io.vertx.core.cli.OptionTest
Tests run: 1, Failures: 0, Errors: 0, Skipped: 0, Time elapsed: 0.241 sec - in io.vertx.core.cli.OptionTest
Running io.vertx.core.cli.AmbiguousOptionExceptionTest
Tests run: 1, Failures: 0, Errors: 0, Skipped: 0, Time elapsed: 0 sec - in io.vertx.core.cli.AmbiguousOptionExceptionTest
Running io.vertx.core.http.Http2ServerTest
throwing from data
Tests run: 87, Failures: 0, Errors: 0, Skipped: 0, Time elapsed: 11.546 sec - in io.vertx.core.http.Http2ServerTest
Running io.vertx.core.http.Http2ClientTest
CONNECTED io.vertx.core.http.impl.Http2UpgradedClientConnection@70f501b0
CONNECTED io.vertx.core.http.impl.Http2ClientConnection@5b4e1815
Tests run: 58, Failures: 0, Errors: 0, Skipped: 0, Time elapsed: 17.3 sec - in io.vertx.core.http.Http2ClientTest
Running io.vertx.core.http.HttpConnectionEarlyResetTest
Tests run: 1, Failures: 0, Errors: 0, Skipped: 0, Time elapsed: 2.034 sec - in io.vertx.core.http.HttpConnectionEarlyResetTest
Running io.vertx.core.http.Http2CompressionTest
Tests run: 1, Failures: 0, Errors: 0, Skipped: 0, Time elapsed: 0.139 sec - in io.vertx.core.http.Http2CompressionTest
Running io.vertx.core.http.WebSocketTest
Tests run: 124, Failures: 0, Errors: 0, Skipped: 0, Time elapsed: 15.458 sec - in io.vertx.core.http.WebSocketTest
Running io.vertx.core.http.Http2SettingsTest
Tests run: 5, Failures: 0, Errors: 0, Skipped: 0, Time elapsed: 0.58 sec - in io.vertx.core.http.Http2SettingsTest
Running io.vertx.core.http.Http2TLSTest
Tests run: 113, Failures: 0, Errors: 0, Skipped: 0, Time elapsed: 19.808 sec - in io.vertx.core.http.Http2TLSTest
Running io.vertx.core.http.Http1xTLSTest
Tests run: 124, Failures: 0, Errors: 0, Skipped: 0, Time elapsed: 19.726 sec - in io.vertx.core.http.Http1xTLSTest
Running io.vertx.core.http.HttpRequestStreamTest
Tests run: 3, Failures: 0, Errors: 0, Skipped: 0, Time elapsed: 0.041 sec - in io.vertx.core.http.HttpRequestStreamTest
Running io.vertx.core.http.HttpUtilsTest
Tests run: 2, Failures: 0, Errors: 0, Skipped: 0, Time elapsed: 0.001 sec - in io.vertx.core.http.HttpUtilsTest
Running io.vertx.core.http.Http2MetricsTest
Tests run: 5, Failures: 0, Errors: 0, Skipped: 0, Time elapsed: 4.338 sec - in io.vertx.core.http.Http2MetricsTest
Running io.vertx.core.http.HttpCompressionTest
Tests run: 2, Failures: 0, Errors: 0, Skipped: 0, Time elapsed: 0.039 sec - in io.vertx.core.http.HttpCompressionTest
Running io.vertx.core.http.CaseInsensitiveHeadersTest
Tests run: 69, Failures: 0, Errors: 0, Skipped: 0, Time elapsed: 0.02 sec - in io.vertx.core.http.CaseInsensitiveHeadersTest
Running io.vertx.core.http.Http1xTest
*** Iteration 1/10 of test
*** Iteration 2/10 of test
*** Iteration 3/10 of test
*** Iteration 4/10 of test
*** Iteration 5/10 of test
*** Iteration 6/10 of test
*** Iteration 7/10 of test
*** Iteration 8/10 of test
*** Iteration 9/10 of test
*** Iteration 10/10 of test
Tests run: 361, Failures: 1, Errors: 0, Skipped: 1, Time elapsed: 66.236 sec <<< FAILURE! - in io.vertx.core.http.Http1xTest
testListenInvalidPort(io.vertx.core.http.Http1xTest)  Time elapsed: 0.016 sec  <<< FAILURE!
java.lang.AssertionError: null
	at org.junit.Assert.fail(Assert.java:86)
	at org.junit.Assert.assertTrue(Assert.java:41)
	at org.junit.Assert.assertFalse(Assert.java:64)
	at org.junit.Assert.assertFalse(Assert.java:74)
	at io.vertx.test.core.AsyncTestBase.assertFalse(AsyncTestBase.java:208)
	at io.vertx.test.core.AsyncTestBase.lambda$onFailure$0(AsyncTestBase.java:586)
	at io.vertx.core.http.impl.HttpServerImpl.lambda$null$4(HttpServerImpl.java:357)
	at io.vertx.core.impl.ContextImpl.executeTask(ContextImpl.java:333)
	at io.vertx.core.impl.EventLoopContext.lambda$executeAsync$0(EventLoopContext.java:39)
	at io.netty.util.concurrent.AbstractEventExecutor.safeExecute(AbstractEventExecutor.java:163)
	at io.netty.util.concurrent.SingleThreadEventExecutor.runAllTasks(SingleThreadEventExecutor.java:404)
	at io.netty.channel.nio.NioEventLoop.run(NioEventLoop.java:464)
	at io.netty.util.concurrent.SingleThreadEventExecutor$5.run(SingleThreadEventExecutor.java:884)
	at io.netty.util.concurrent.FastThreadLocalRunnable.run(FastThreadLocalRunnable.java:30)
	at java.lang.Thread.run(Thread.java:745)

Running io.vertx.core.http.Http1xMetricsTest
Tests run: 4, Failures: 0, Errors: 0, Skipped: 0, Time elapsed: 4.043 sec - in io.vertx.core.http.Http1xMetricsTest
Running io.vertx.core.http.Http2Test
starting
listening
Tests run: 250, Failures: 1, Errors: 0, Skipped: 1, Time elapsed: 30.23 sec <<< FAILURE! - in io.vertx.core.http.Http2Test
testListenInvalidPort(io.vertx.core.http.Http2Test)  Time elapsed: 0.036 sec  <<< FAILURE!
java.lang.AssertionError: null
	at org.junit.Assert.fail(Assert.java:86)
	at org.junit.Assert.assertTrue(Assert.java:41)
	at org.junit.Assert.assertFalse(Assert.java:64)
	at org.junit.Assert.assertFalse(Assert.java:74)
	at io.vertx.test.core.AsyncTestBase.assertFalse(AsyncTestBase.java:208)
	at io.vertx.test.core.AsyncTestBase.lambda$onFailure$0(AsyncTestBase.java:586)
	at io.vertx.core.http.impl.HttpServerImpl.lambda$null$4(HttpServerImpl.java:357)
	at io.vertx.core.impl.ContextImpl.executeTask(ContextImpl.java:333)
	at io.vertx.core.impl.EventLoopContext.lambda$executeAsync$0(EventLoopContext.java:39)
	at io.netty.util.concurrent.AbstractEventExecutor.safeExecute(AbstractEventExecutor.java:163)
	at io.netty.util.concurrent.SingleThreadEventExecutor.runAllTasks(SingleThreadEventExecutor.java:404)
	at io.netty.channel.nio.NioEventLoop.run(NioEventLoop.java:464)
	at io.netty.util.concurrent.SingleThreadEventExecutor$5.run(SingleThreadEventExecutor.java:884)
	at io.netty.util.concurrent.FastThreadLocalRunnable.run(FastThreadLocalRunnable.java:30)
	at java.lang.Thread.run(Thread.java:745)

Running io.vertx.core.http.VertxHttpHeadersTest
Tests run: 69, Failures: 0, Errors: 0, Skipped: 0, Time elapsed: 0.001 sec - in io.vertx.core.http.VertxHttpHeadersTest
Running io.vertx.core.http.Http2HeadersTest
Tests run: 7, Failures: 0, Errors: 0, Skipped: 0, Time elapsed: 0 sec - in io.vertx.core.http.Http2HeadersTest
Running io.vertx.core.eventbus.LocalEventBusTest
Tests run: 130, Failures: 0, Errors: 0, Skipped: 0, Time elapsed: 10.286 sec - in io.vertx.core.eventbus.LocalEventBusTest
Running io.vertx.core.eventbus.ClusteredEventBusWithSSLTest
Tests run: 385, Failures: 0, Errors: 0, Skipped: 7, Time elapsed: 78.164 sec - in io.vertx.core.eventbus.ClusteredEventBusWithSSLTest
Running io.vertx.core.eventbus.JsonEventBusTest
Tests run: 6, Failures: 0, Errors: 0, Skipped: 0, Time elapsed: 4.035 sec - in io.vertx.core.eventbus.JsonEventBusTest
Running io.vertx.core.eventbus.EventBusRegistrationRaceTest
Tests run: 1, Failures: 0, Errors: 0, Skipped: 0, Time elapsed: 4.336 sec - in io.vertx.core.eventbus.EventBusRegistrationRaceTest
Running io.vertx.core.eventbus.EventBusFlowControlTest
Tests run: 6, Failures: 0, Errors: 0, Skipped: 0, Time elapsed: 4.417 sec - in io.vertx.core.eventbus.EventBusFlowControlTest
Running io.vertx.core.eventbus.ClusteredEventBusStartFailureTest
Tests run: 1, Failures: 0, Errors: 0, Skipped: 0, Time elapsed: 0.046 sec - in io.vertx.core.eventbus.ClusteredEventBusStartFailureTest
Running io.vertx.core.eventbus.EventBusInterceptorTest
Tests run: 12, Failures: 0, Errors: 0, Skipped: 0, Time elapsed: 0.499 sec - in io.vertx.core.eventbus.EventBusInterceptorTest
Running io.vertx.core.eventbus.ClusteredEventBusTest
Tests run: 74, Failures: 0, Errors: 0, Skipped: 0, Time elapsed: 10.843 sec - in io.vertx.core.eventbus.ClusteredEventBusTest
Running io.vertx.core.eventbus.DeliveryOptionsTest
Tests run: 1, Failures: 0, Errors: 0, Skipped: 0, Time elapsed: 0 sec - in io.vertx.core.eventbus.DeliveryOptionsTest
Running io.vertx.core.parsetools.JsonParserTest
Tests run: 25, Failures: 0, Errors: 0, Skipped: 0, Time elapsed: 0.088 sec - in io.vertx.core.parsetools.JsonParserTest
Running io.vertx.core.parsetools.RecordParserTest
Tests run: 7, Failures: 0, Errors: 0, Skipped: 0, Time elapsed: 1.913 sec - in io.vertx.core.parsetools.RecordParserTest
Running io.vertx.core.impl.launcher.ServiceCommandLoaderTest
Tests run: 3, Failures: 0, Errors: 0, Skipped: 0, Time elapsed: 0.01 sec - in io.vertx.core.impl.launcher.ServiceCommandLoaderTest
Running io.vertx.core.impl.launcher.commands.WatcherTest
Environment setup
Update change applied in 1600 ms
Deletion change applied in 561 ms
Creation change applied in 522 ms
Tests run: 9, Failures: 0, Errors: 0, Skipped: 0, Time elapsed: 15.326 sec - in io.vertx.core.impl.launcher.commands.WatcherTest
Running io.vertx.core.impl.launcher.commands.WatcherAbsolutePathTest
Environment setup
Update change applied in 1679 ms
Deletion change applied in 518 ms
Creation change applied in 508 ms
Tests run: 9, Failures: 0, Errors: 0, Skipped: 0, Time elapsed: 15.518 sec - in io.vertx.core.impl.launcher.commands.WatcherAbsolutePathTest
Running io.vertx.core.impl.launcher.commands.FileSelectorTest
Tests run: 4, Failures: 0, Errors: 0, Skipped: 0, Time elapsed: 0 sec - in io.vertx.core.impl.launcher.commands.FileSelectorTest
Running io.vertx.core.impl.launcher.commands.BareCommandTest
Tests run: 4, Failures: 0, Errors: 0, Skipped: 0, Time elapsed: 0.207 sec - in io.vertx.core.impl.launcher.commands.BareCommandTest
Running io.vertx.core.impl.launcher.commands.StartStopListCommandsTest
Succeeded in deploying verticle 
Tests run: 9, Failures: 0, Errors: 0, Skipped: 0, Time elapsed: 8.396 sec - in io.vertx.core.impl.launcher.commands.StartStopListCommandsTest
Running io.vertx.core.impl.launcher.commands.RedeployTest
Starting vert.x application...
df493b02-deea-4db5-981a-74d4a5a36b09-redeploy
Succeeded in deploying verticle 
Stopping vert.x application 'df493b02-deea-4db5-981a-74d4a5a36b09-redeploy'
Application 'df493b02-deea-4db5-981a-74d4a5a36b09-redeploy' terminated with status 0
Stopping vert.x application 'df493b02-deea-4db5-981a-74d4a5a36b09-redeploy'
Application 'df493b02-deea-4db5-981a-74d4a5a36b09-redeploy' terminated with status 0
SUREFIRE-859: [vert.x-acceptor-thread-0] WARN io.netty.bootstrap.ServerBootstrap - Failed to register an accepted channel: [id: 0x466b29aa, L:0.0.0.0/0.0.0.0:8080]
java.lang.IllegalStateException
	at io.vertx.core.net.impl.VertxEventLoopGroup.next(VertxEventLoopGroup.java:37)
	at io.vertx.core.net.impl.VertxEventLoopGroup.register(VertxEventLoopGroup.java:53)
	at io.netty.bootstrap.ServerBootstrap$ServerBootstrapAcceptor.channelRead(ServerBootstrap.java:255)
	at io.netty.channel.AbstractChannelHandlerContext.invokeChannelRead(AbstractChannelHandlerContext.java:362)
	at io.netty.channel.AbstractChannelHandlerContext.invokeChannelRead(AbstractChannelHandlerContext.java:348)
	at io.netty.channel.AbstractChannelHandlerContext.fireChannelRead(AbstractChannelHandlerContext.java:340)
	at io.netty.channel.DefaultChannelPipeline$HeadContext.channelRead(DefaultChannelPipeline.java:1434)
	at io.netty.channel.AbstractChannelHandlerContext.invokeChannelRead(AbstractChannelHandlerContext.java:362)
	at io.netty.channel.AbstractChannelHandlerContext.invokeChannelRead(AbstractChannelHandlerContext.java:348)
	at io.netty.channel.DefaultChannelPipeline.fireChannelRead(DefaultChannelPipeline.java:965)
	at io.netty.channel.nio.AbstractNioMessageChannel$NioMessageUnsafe.read(AbstractNioMessageChannel.java:93)
	at io.netty.channel.nio.NioEventLoop.processSelectedKey(NioEventLoop.java:646)
	at io.netty.channel.nio.NioEventLoop.processSelectedKeysOptimized(NioEventLoop.java:581)
	at io.netty.channel.nio.NioEventLoop.processSelectedKeys(NioEventLoop.java:498)
	at io.netty.channel.nio.NioEventLoop.run(NioEventLoop.java:452)
	at io.netty.util.concurrent.SingleThreadEventExecutor$5.run(SingleThreadEventExecutor.java:884)
	at io.netty.util.concurrent.FastThreadLocalRunnable.run(FastThreadLocalRunnable.java:30)
	at java.lang.Thread.run(Thread.java:745)
Starting vert.x application...
ac964784-3f99-4e9b-9aed-4ea9ba37a5ca-redeploy
Succeeded in deploying verticle 
Stopping vert.x application 'ac964784-3f99-4e9b-9aed-4ea9ba37a5ca-redeploy'
Application 'ac964784-3f99-4e9b-9aed-4ea9ba37a5ca-redeploy' terminated with status 0
Starting vert.x application...
ac964784-3f99-4e9b-9aed-4ea9ba37a5ca-redeploy
SUREFIRE-859: [vert.x-acceptor-thread-0] WARN io.netty.bootstrap.ServerBootstrap - Failed to register an accepted channel: [id: 0xec3e57fd, L:0.0.0.0/0.0.0.0:8080]
java.lang.IllegalStateException
	at io.vertx.core.net.impl.VertxEventLoopGroup.next(VertxEventLoopGroup.java:37)
	at io.vertx.core.net.impl.VertxEventLoopGroup.register(VertxEventLoopGroup.java:53)
	at io.netty.bootstrap.ServerBootstrap$ServerBootstrapAcceptor.channelRead(ServerBootstrap.java:255)
	at io.netty.channel.AbstractChannelHandlerContext.invokeChannelRead(AbstractChannelHandlerContext.java:362)
	at io.netty.channel.AbstractChannelHandlerContext.invokeChannelRead(AbstractChannelHandlerContext.java:348)
	at io.netty.channel.AbstractChannelHandlerContext.fireChannelRead(AbstractChannelHandlerContext.java:340)
	at io.netty.channel.DefaultChannelPipeline$HeadContext.channelRead(DefaultChannelPipeline.java:1434)
	at io.netty.channel.AbstractChannelHandlerContext.invokeChannelRead(AbstractChannelHandlerContext.java:362)
	at io.netty.channel.AbstractChannelHandlerContext.invokeChannelRead(AbstractChannelHandlerContext.java:348)
	at io.netty.channel.DefaultChannelPipeline.fireChannelRead(DefaultChannelPipeline.java:965)
	at io.netty.channel.nio.AbstractNioMessageChannel$NioMessageUnsafe.read(AbstractNioMessageChannel.java:93)
	at io.netty.channel.nio.NioEventLoop.processSelectedKey(NioEventLoop.java:646)
	at io.netty.channel.nio.NioEventLoop.processSelectedKeysOptimized(NioEventLoop.java:581)
	at io.netty.channel.nio.NioEventLoop.processSelectedKeys(NioEventLoop.java:498)
	at io.netty.channel.nio.NioEventLoop.run(NioEventLoop.java:452)
	at io.netty.util.concurrent.SingleThreadEventExecutor$5.run(SingleThreadEventExecutor.java:884)
	at io.netty.util.concurrent.FastThreadLocalRunnable.run(FastThreadLocalRunnable.java:30)
	at java.lang.Thread.run(Thread.java:745)
Succeeded in deploying verticle 
Stopping vert.x application 'ac964784-3f99-4e9b-9aed-4ea9ba37a5ca-redeploy'
Application 'ac964784-3f99-4e9b-9aed-4ea9ba37a5ca-redeploy' terminated with status 0
Stopping vert.x application 'ac964784-3f99-4e9b-9aed-4ea9ba37a5ca-redeploy'
Application 'ac964784-3f99-4e9b-9aed-4ea9ba37a5ca-redeploy' terminated with status 0
SUREFIRE-859: [vert.x-acceptor-thread-0] WARN io.netty.bootstrap.ServerBootstrap - Failed to register an accepted channel: [id: 0x1a55743e, L:0.0.0.0/0.0.0.0:8080]
java.lang.IllegalStateException
	at io.vertx.core.net.impl.VertxEventLoopGroup.next(VertxEventLoopGroup.java:37)
	at io.vertx.core.net.impl.VertxEventLoopGroup.register(VertxEventLoopGroup.java:53)
	at io.netty.bootstrap.ServerBootstrap$ServerBootstrapAcceptor.channelRead(ServerBootstrap.java:255)
	at io.netty.channel.AbstractChannelHandlerContext.invokeChannelRead(AbstractChannelHandlerContext.java:362)
	at io.netty.channel.AbstractChannelHandlerContext.invokeChannelRead(AbstractChannelHandlerContext.java:348)
	at io.netty.channel.AbstractChannelHandlerContext.fireChannelRead(AbstractChannelHandlerContext.java:340)
	at io.netty.channel.DefaultChannelPipeline$HeadContext.channelRead(DefaultChannelPipeline.java:1434)
	at io.netty.channel.AbstractChannelHandlerContext.invokeChannelRead(AbstractChannelHandlerContext.java:362)
	at io.netty.channel.AbstractChannelHandlerContext.invokeChannelRead(AbstractChannelHandlerContext.java:348)
	at io.netty.channel.DefaultChannelPipeline.fireChannelRead(DefaultChannelPipeline.java:965)
	at io.netty.channel.nio.AbstractNioMessageChannel$NioMessageUnsafe.read(AbstractNioMessageChannel.java:93)
	at io.netty.channel.nio.NioEventLoop.processSelectedKey(NioEventLoop.java:646)
	at io.netty.channel.nio.NioEventLoop.processSelectedKeysOptimized(NioEventLoop.java:581)
	at io.netty.channel.nio.NioEventLoop.processSelectedKeys(NioEventLoop.java:498)
	at io.netty.channel.nio.NioEventLoop.run(NioEventLoop.java:452)
	at io.netty.util.concurrent.SingleThreadEventExecutor$5.run(SingleThreadEventExecutor.java:884)
	at io.netty.util.concurrent.FastThreadLocalRunnable.run(FastThreadLocalRunnable.java:30)
	at java.lang.Thread.run(Thread.java:745)
Starting vert.x application...
935aeac2-ed74-44b4-a02d-579424aa87ad-redeploy
Succeeded in deploying verticle 
Stopping vert.x application '935aeac2-ed74-44b4-a02d-579424aa87ad-redeploy'
Application '935aeac2-ed74-44b4-a02d-579424aa87ad-redeploy' terminated with status 0
Stopping vert.x application '935aeac2-ed74-44b4-a02d-579424aa87ad-redeploy'
Application '935aeac2-ed74-44b4-a02d-579424aa87ad-redeploy' terminated with status 0
SUREFIRE-859: [vert.x-acceptor-thread-0] WARN io.netty.bootstrap.ServerBootstrap - Failed to register an accepted channel: [id: 0x388e0618, L:0.0.0.0/0.0.0.0:8080]
java.lang.IllegalStateException
	at io.vertx.core.net.impl.VertxEventLoopGroup.next(VertxEventLoopGroup.java:37)
	at io.vertx.core.net.impl.VertxEventLoopGroup.register(VertxEventLoopGroup.java:53)
	at io.netty.bootstrap.ServerBootstrap$ServerBootstrapAcceptor.channelRead(ServerBootstrap.java:255)
	at io.netty.channel.AbstractChannelHandlerContext.invokeChannelRead(AbstractChannelHandlerContext.java:362)
	at io.netty.channel.AbstractChannelHandlerContext.invokeChannelRead(AbstractChannelHandlerContext.java:348)
	at io.netty.channel.AbstractChannelHandlerContext.fireChannelRead(AbstractChannelHandlerContext.java:340)
	at io.netty.channel.DefaultChannelPipeline$HeadContext.channelRead(DefaultChannelPipeline.java:1434)
	at io.netty.channel.AbstractChannelHandlerContext.invokeChannelRead(AbstractChannelHandlerContext.java:362)
	at io.netty.channel.AbstractChannelHandlerContext.invokeChannelRead(AbstractChannelHandlerContext.java:348)
	at io.netty.channel.DefaultChannelPipeline.fireChannelRead(DefaultChannelPipeline.java:965)
	at io.netty.channel.nio.AbstractNioMessageChannel$NioMessageUnsafe.read(AbstractNioMessageChannel.java:93)
	at io.netty.channel.nio.NioEventLoop.processSelectedKey(NioEventLoop.java:646)
	at io.netty.channel.nio.NioEventLoop.processSelectedKeysOptimized(NioEventLoop.java:581)
	at io.netty.channel.nio.NioEventLoop.processSelectedKeys(NioEventLoop.java:498)
	at io.netty.channel.nio.NioEventLoop.run(NioEventLoop.java:452)
	at io.netty.util.concurrent.SingleThreadEventExecutor$5.run(SingleThreadEventExecutor.java:884)
	at io.netty.util.concurrent.FastThreadLocalRunnable.run(FastThreadLocalRunnable.java:30)
	at java.lang.Thread.run(Thread.java:745)
Starting vert.x application...
c99151a9-117c-4f78-97f7-9c150ea08dca-redeploy
Succeeded in deploying verticle 
Stopping vert.x application 'c99151a9-117c-4f78-97f7-9c150ea08dca-redeploy'
Application 'c99151a9-117c-4f78-97f7-9c150ea08dca-redeploy' terminated with status 0
Starting vert.x application...
c99151a9-117c-4f78-97f7-9c150ea08dca-redeploy
SUREFIRE-859: [vert.x-acceptor-thread-0] WARN io.netty.bootstrap.ServerBootstrap - Failed to register an accepted channel: [id: 0xb5410944, L:0.0.0.0/0.0.0.0:8080]
java.lang.IllegalStateException
	at io.vertx.core.net.impl.VertxEventLoopGroup.next(VertxEventLoopGroup.java:37)
	at io.vertx.core.net.impl.VertxEventLoopGroup.register(VertxEventLoopGroup.java:53)
	at io.netty.bootstrap.ServerBootstrap$ServerBootstrapAcceptor.channelRead(ServerBootstrap.java:255)
	at io.netty.channel.AbstractChannelHandlerContext.invokeChannelRead(AbstractChannelHandlerContext.java:362)
	at io.netty.channel.AbstractChannelHandlerContext.invokeChannelRead(AbstractChannelHandlerContext.java:348)
	at io.netty.channel.AbstractChannelHandlerContext.fireChannelRead(AbstractChannelHandlerContext.java:340)
	at io.netty.channel.DefaultChannelPipeline$HeadContext.channelRead(DefaultChannelPipeline.java:1434)
	at io.netty.channel.AbstractChannelHandlerContext.invokeChannelRead(AbstractChannelHandlerContext.java:362)
	at io.netty.channel.AbstractChannelHandlerContext.invokeChannelRead(AbstractChannelHandlerContext.java:348)
	at io.netty.channel.DefaultChannelPipeline.fireChannelRead(DefaultChannelPipeline.java:965)
	at io.netty.channel.nio.AbstractNioMessageChannel$NioMessageUnsafe.read(AbstractNioMessageChannel.java:93)
	at io.netty.channel.nio.NioEventLoop.processSelectedKey(NioEventLoop.java:646)
	at io.netty.channel.nio.NioEventLoop.processSelectedKeysOptimized(NioEventLoop.java:581)
	at io.netty.channel.nio.NioEventLoop.processSelectedKeys(NioEventLoop.java:498)
	at io.netty.channel.nio.NioEventLoop.run(NioEventLoop.java:452)
	at io.netty.util.concurrent.SingleThreadEventExecutor$5.run(SingleThreadEventExecutor.java:884)
	at io.netty.util.concurrent.FastThreadLocalRunnable.run(FastThreadLocalRunnable.java:30)
	at java.lang.Thread.run(Thread.java:745)
Succeeded in deploying verticle 
Stopping vert.x application 'c99151a9-117c-4f78-97f7-9c150ea08dca-redeploy'
Application 'c99151a9-117c-4f78-97f7-9c150ea08dca-redeploy' terminated with status 0
Stopping vert.x application 'c99151a9-117c-4f78-97f7-9c150ea08dca-redeploy'
Application 'c99151a9-117c-4f78-97f7-9c150ea08dca-redeploy' terminated with status 0
SUREFIRE-859: [vert.x-acceptor-thread-0] WARN io.netty.bootstrap.ServerBootstrap - Failed to register an accepted channel: [id: 0x29844744, L:0.0.0.0/0.0.0.0:8080]
java.lang.IllegalStateException
	at io.vertx.core.net.impl.VertxEventLoopGroup.next(VertxEventLoopGroup.java:37)
	at io.vertx.core.net.impl.VertxEventLoopGroup.register(VertxEventLoopGroup.java:53)
	at io.netty.bootstrap.ServerBootstrap$ServerBootstrapAcceptor.channelRead(ServerBootstrap.java:255)
	at io.netty.channel.AbstractChannelHandlerContext.invokeChannelRead(AbstractChannelHandlerContext.java:362)
	at io.netty.channel.AbstractChannelHandlerContext.invokeChannelRead(AbstractChannelHandlerContext.java:348)
	at io.netty.channel.AbstractChannelHandlerContext.fireChannelRead(AbstractChannelHandlerContext.java:340)
	at io.netty.channel.DefaultChannelPipeline$HeadContext.channelRead(DefaultChannelPipeline.java:1434)
	at io.netty.channel.AbstractChannelHandlerContext.invokeChannelRead(AbstractChannelHandlerContext.java:362)
	at io.netty.channel.AbstractChannelHandlerContext.invokeChannelRead(AbstractChannelHandlerContext.java:348)
	at io.netty.channel.DefaultChannelPipeline.fireChannelRead(DefaultChannelPipeline.java:965)
	at io.netty.channel.nio.AbstractNioMessageChannel$NioMessageUnsafe.read(AbstractNioMessageChannel.java:93)
	at io.netty.channel.nio.NioEventLoop.processSelectedKey(NioEventLoop.java:646)
	at io.netty.channel.nio.NioEventLoop.processSelectedKeysOptimized(NioEventLoop.java:581)
	at io.netty.channel.nio.NioEventLoop.processSelectedKeys(NioEventLoop.java:498)
	at io.netty.channel.nio.NioEventLoop.run(NioEventLoop.java:452)
	at io.netty.util.concurrent.SingleThreadEventExecutor$5.run(SingleThreadEventExecutor.java:884)
	at io.netty.util.concurrent.FastThreadLocalRunnable.run(FastThreadLocalRunnable.java:30)
	at java.lang.Thread.run(Thread.java:745)
Starting vert.x application...
66c412de-c456-42e3-b020-8a852ec5e9bf-redeploy
Succeeded in deploying verticle 
Stopping vert.x application '66c412de-c456-42e3-b020-8a852ec5e9bf-redeploy'
Application '66c412de-c456-42e3-b020-8a852ec5e9bf-redeploy' terminated with status 0
Stopping vert.x application '66c412de-c456-42e3-b020-8a852ec5e9bf-redeploy'
Application '66c412de-c456-42e3-b020-8a852ec5e9bf-redeploy' terminated with status 0
Starting vert.x application...
844d6cf0-b891-46e7-bfc7-731976f696be-redeploy
Succeeded in deploying verticle 
Stopping vert.x application '844d6cf0-b891-46e7-bfc7-731976f696be-redeploy'
Application '844d6cf0-b891-46e7-bfc7-731976f696be-redeploy' terminated with status 0
Stopping vert.x application '844d6cf0-b891-46e7-bfc7-731976f696be-redeploy'
Application '844d6cf0-b891-46e7-bfc7-731976f696be-redeploy' terminated with status 0
SUREFIRE-859: [vert.x-acceptor-thread-0] WARN io.netty.bootstrap.ServerBootstrap - Failed to register an accepted channel: [id: 0xdd76a6ec, L:0.0.0.0/0.0.0.0:8080]
java.lang.IllegalStateException
	at io.vertx.core.net.impl.VertxEventLoopGroup.next(VertxEventLoopGroup.java:37)
	at io.vertx.core.net.impl.VertxEventLoopGroup.register(VertxEventLoopGroup.java:53)
	at io.netty.bootstrap.ServerBootstrap$ServerBootstrapAcceptor.channelRead(ServerBootstrap.java:255)
	at io.netty.channel.AbstractChannelHandlerContext.invokeChannelRead(AbstractChannelHandlerContext.java:362)
	at io.netty.channel.AbstractChannelHandlerContext.invokeChannelRead(AbstractChannelHandlerContext.java:348)
	at io.netty.channel.AbstractChannelHandlerContext.fireChannelRead(AbstractChannelHandlerContext.java:340)
	at io.netty.channel.DefaultChannelPipeline$HeadContext.channelRead(DefaultChannelPipeline.java:1434)
	at io.netty.channel.AbstractChannelHandlerContext.invokeChannelRead(AbstractChannelHandlerContext.java:362)
	at io.netty.channel.AbstractChannelHandlerContext.invokeChannelRead(AbstractChannelHandlerContext.java:348)
	at io.netty.channel.DefaultChannelPipeline.fireChannelRead(DefaultChannelPipeline.java:965)
	at io.netty.channel.nio.AbstractNioMessageChannel$NioMessageUnsafe.read(AbstractNioMessageChannel.java:93)
	at io.netty.channel.nio.NioEventLoop.processSelectedKey(NioEventLoop.java:646)
	at io.netty.channel.nio.NioEventLoop.processSelectedKeysOptimized(NioEventLoop.java:581)
	at io.netty.channel.nio.NioEventLoop.processSelectedKeys(NioEventLoop.java:498)
	at io.netty.channel.nio.NioEventLoop.run(NioEventLoop.java:452)
	at io.netty.util.concurrent.SingleThreadEventExecutor$5.run(SingleThreadEventExecutor.java:884)
	at io.netty.util.concurrent.FastThreadLocalRunnable.run(FastThreadLocalRunnable.java:30)
	at java.lang.Thread.run(Thread.java:745)
Starting vert.x application...
43bbb3b3-6d21-4538-96ea-f4994ab151c6-redeploy
Starting clustering... 
No cluster-host specified so using address 172.17.0.2 
Succeeded in deploying verticle 
Stopping vert.x application '43bbb3b3-6d21-4538-96ea-f4994ab151c6-redeploy'
Application '43bbb3b3-6d21-4538-96ea-f4994ab151c6-redeploy' terminated with status 0
Stopping vert.x application '43bbb3b3-6d21-4538-96ea-f4994ab151c6-redeploy'
Application '43bbb3b3-6d21-4538-96ea-f4994ab151c6-redeploy' terminated with status 0
SUREFIRE-859: [vert.x-acceptor-thread-0] WARN io.netty.bootstrap.ServerBootstrap - Failed to register an accepted channel: [id: 0x3ac9b72b, L:0.0.0.0/0.0.0.0:8080]
java.lang.IllegalStateException
	at io.vertx.core.net.impl.VertxEventLoopGroup.next(VertxEventLoopGroup.java:37)
	at io.vertx.core.net.impl.VertxEventLoopGroup.register(VertxEventLoopGroup.java:53)
	at io.netty.bootstrap.ServerBootstrap$ServerBootstrapAcceptor.channelRead(ServerBootstrap.java:255)
	at io.netty.channel.AbstractChannelHandlerContext.invokeChannelRead(AbstractChannelHandlerContext.java:362)
	at io.netty.channel.AbstractChannelHandlerContext.invokeChannelRead(AbstractChannelHandlerContext.java:348)
	at io.netty.channel.AbstractChannelHandlerContext.fireChannelRead(AbstractChannelHandlerContext.java:340)
	at io.netty.channel.DefaultChannelPipeline$HeadContext.channelRead(DefaultChannelPipeline.java:1434)
	at io.netty.channel.AbstractChannelHandlerContext.invokeChannelRead(AbstractChannelHandlerContext.java:362)
	at io.netty.channel.AbstractChannelHandlerContext.invokeChannelRead(AbstractChannelHandlerContext.java:348)
	at io.netty.channel.DefaultChannelPipeline.fireChannelRead(DefaultChannelPipeline.java:965)
	at io.netty.channel.nio.AbstractNioMessageChannel$NioMessageUnsafe.read(AbstractNioMessageChannel.java:93)
	at io.netty.channel.nio.NioEventLoop.processSelectedKey(NioEventLoop.java:646)
	at io.netty.channel.nio.NioEventLoop.processSelectedKeysOptimized(NioEventLoop.java:581)
	at io.netty.channel.nio.NioEventLoop.processSelectedKeys(NioEventLoop.java:498)
	at io.netty.channel.nio.NioEventLoop.run(NioEventLoop.java:452)
	at io.netty.util.concurrent.SingleThreadEventExecutor$5.run(SingleThreadEventExecutor.java:884)
	at io.netty.util.concurrent.FastThreadLocalRunnable.run(FastThreadLocalRunnable.java:30)
	at java.lang.Thread.run(Thread.java:745)
Starting vert.x application...
42e92c27-5451-4c40-b017-f57e16b48d6a-redeploy
Succeeded in deploying verticle 
Stopping vert.x application '42e92c27-5451-4c40-b017-f57e16b48d6a-redeploy'
Application '42e92c27-5451-4c40-b017-f57e16b48d6a-redeploy' terminated with status 0
Stopping vert.x application '42e92c27-5451-4c40-b017-f57e16b48d6a-redeploy'
Application '42e92c27-5451-4c40-b017-f57e16b48d6a-redeploy' terminated with status 0
Tests run: 8, Failures: 0, Errors: 0, Skipped: 0, Time elapsed: 18.066 sec - in io.vertx.core.impl.launcher.commands.RedeployTest
Running io.vertx.core.impl.launcher.commands.ServiceCommandLookupTest
Tests run: 1, Failures: 0, Errors: 0, Skipped: 0, Time elapsed: 0.005 sec - in io.vertx.core.impl.launcher.commands.ServiceCommandLookupTest
Running io.vertx.core.impl.launcher.commands.ExecUtilsTest
Tests run: 3, Failures: 0, Errors: 0, Skipped: 0, Time elapsed: 0.001 sec - in io.vertx.core.impl.launcher.commands.ExecUtilsTest
Running io.vertx.core.impl.launcher.commands.ClasspathHandlerTest
SUREFIRE-859: [vert.x-acceptor-thread-0] WARN io.netty.bootstrap.ServerBootstrap - Failed to register an accepted channel: [id: 0x167febfc, L:0.0.0.0/0.0.0.0:8080]
java.lang.IllegalStateException
	at io.vertx.core.net.impl.VertxEventLoopGroup.next(VertxEventLoopGroup.java:37)
	at io.vertx.core.net.impl.VertxEventLoopGroup.register(VertxEventLoopGroup.java:53)
	at io.netty.bootstrap.ServerBootstrap$ServerBootstrapAcceptor.channelRead(ServerBootstrap.java:255)
	at io.netty.channel.AbstractChannelHandlerContext.invokeChannelRead(AbstractChannelHandlerContext.java:362)
	at io.netty.channel.AbstractChannelHandlerContext.invokeChannelRead(AbstractChannelHandlerContext.java:348)
	at io.netty.channel.AbstractChannelHandlerContext.fireChannelRead(AbstractChannelHandlerContext.java:340)
	at io.netty.channel.DefaultChannelPipeline$HeadContext.channelRead(DefaultChannelPipeline.java:1434)
	at io.netty.channel.AbstractChannelHandlerContext.invokeChannelRead(AbstractChannelHandlerContext.java:362)
	at io.netty.channel.AbstractChannelHandlerContext.invokeChannelRead(AbstractChannelHandlerContext.java:348)
	at io.netty.channel.DefaultChannelPipeline.fireChannelRead(DefaultChannelPipeline.java:965)
	at io.netty.channel.nio.AbstractNioMessageChannel$NioMessageUnsafe.read(AbstractNioMessageChannel.java:93)
	at io.netty.channel.nio.NioEventLoop.processSelectedKey(NioEventLoop.java:646)
	at io.netty.channel.nio.NioEventLoop.processSelectedKeysOptimized(NioEventLoop.java:581)
	at io.netty.channel.nio.NioEventLoop.processSelectedKeys(NioEventLoop.java:498)
	at io.netty.channel.nio.NioEventLoop.run(NioEventLoop.java:452)
	at io.netty.util.concurrent.SingleThreadEventExecutor$5.run(SingleThreadEventExecutor.java:884)
	at io.netty.util.concurrent.FastThreadLocalRunnable.run(FastThreadLocalRunnable.java:30)
	at java.lang.Thread.run(Thread.java:745)
Started...
Started...
Tests run: 2, Failures: 0, Errors: 0, Skipped: 0, Time elapsed: 0.975 sec - in io.vertx.core.impl.launcher.commands.ClasspathHandlerTest
Running io.vertx.core.impl.launcher.commands.RunCommandTest
Tests run: 12, Failures: 0, Errors: 0, Skipped: 0, Time elapsed: 0.595 sec - in io.vertx.core.impl.launcher.commands.RunCommandTest
Running io.vertx.core.impl.launcher.LauncherExtensibilityTest
Tests run: 6, Failures: 0, Errors: 0, Skipped: 0, Time elapsed: 0.221 sec - in io.vertx.core.impl.launcher.LauncherExtensibilityTest
Running io.vertx.core.impl.launcher.VertxCommandLineInterfaceTest
Tests run: 12, Failures: 0, Errors: 0, Skipped: 0, Time elapsed: 0.023 sec - in io.vertx.core.impl.launcher.VertxCommandLineInterfaceTest
Running io.vertx.core.impl.launcher.DefaultCommandTest
Tests run: 4, Failures: 0, Errors: 0, Skipped: 0, Time elapsed: 0.002 sec - in io.vertx.core.impl.launcher.DefaultCommandTest
Running io.vertx.core.impl.cpu.CpuCoreSensorTest
Tests run: 5, Failures: 0, Errors: 0, Skipped: 0, Time elapsed: 0.003 sec - in io.vertx.core.impl.cpu.CpuCoreSensorTest
Running io.vertx.core.impl.utils.ConcurrentCyclicSequenceTest
Tests run: 5, Failures: 0, Errors: 0, Skipped: 0, Time elapsed: 0.364 sec - in io.vertx.core.impl.utils.ConcurrentCyclicSequenceTest
Running io.vertx.core.logging.LoggerFactoryTest
Tests run: 1, Failures: 0, Errors: 0, Skipped: 0, Time elapsed: 0 sec - in io.vertx.core.logging.LoggerFactoryTest
Running io.vertx.core.net.NetClientOptionsTest
Tests run: 2, Failures: 0, Errors: 0, Skipped: 0, Time elapsed: 0 sec - in io.vertx.core.net.NetClientOptionsTest
Running io.vertx.core.net.SSLHelperTest
Tests run: 6, Failures: 0, Errors: 0, Skipped: 0, Time elapsed: 0.16 sec - in io.vertx.core.net.SSLHelperTest
Running io.vertx.core.net.ProxyOptionsTest
Tests run: 4, Failures: 0, Errors: 0, Skipped: 0, Time elapsed: 0.018 sec - in io.vertx.core.net.ProxyOptionsTest
Running io.vertx.core.net.NetTest
Tests run: 113, Failures: 1, Errors: 0, Skipped: 0, Time elapsed: 14.579 sec <<< FAILURE! - in io.vertx.core.net.NetTest
testListenInvalidPort(io.vertx.core.net.NetTest)  Time elapsed: 0.007 sec  <<< FAILURE!
java.lang.AssertionError: null
	at org.junit.Assert.fail(Assert.java:86)
	at org.junit.Assert.assertTrue(Assert.java:41)
	at org.junit.Assert.assertTrue(Assert.java:52)
	at io.vertx.test.core.AsyncTestBase.assertTrue(AsyncTestBase.java:372)
	at io.vertx.core.net.NetTest.lambda$testListenInvalidPort$46(NetTest.java:911)

Running io.vertx.core.net.impl.URIDecoderTest
Tests run: 9, Failures: 0, Errors: 0, Skipped: 0, Time elapsed: 0.001 sec - in io.vertx.core.net.impl.URIDecoderTest
Running io.vertx.core.net.ConnectionPoolTest
Tests run: 17, Failures: 0, Errors: 0, Skipped: 0, Time elapsed: 10.496 sec - in io.vertx.core.net.ConnectionPoolTest
Running io.vertx.core.net.ProxyErrorTest
Tests run: 6, Failures: 0, Errors: 0, Skipped: 0, Time elapsed: 0.21 sec - in io.vertx.core.net.ProxyErrorTest
Running io.vertx.core.net.SSLEngineTest
Tests run: 4, Failures: 0, Errors: 0, Skipped: 0, Time elapsed: 0.048 sec - in io.vertx.core.net.SSLEngineTest
Running io.vertx.core.net.KeyStoreTest
Tests run: 27, Failures: 0, Errors: 0, Skipped: 0, Time elapsed: 0.872 sec - in io.vertx.core.net.KeyStoreTest
Running io.vertx.core.streams.PumpTest
Tests run: 6, Failures: 0, Errors: 0, Skipped: 0, Time elapsed: 0.003 sec - in io.vertx.core.streams.PumpTest
Running io.vertx.core.file.NestedRootJarResolverTest
Tests run: 21, Failures: 0, Errors: 0, Skipped: 0, Time elapsed: 2.222 sec - in io.vertx.core.file.NestedRootJarResolverTest
Running io.vertx.core.file.FileSystemFileResolverTest
Tests run: 22, Failures: 0, Errors: 0, Skipped: 0, Time elapsed: 2.499 sec - in io.vertx.core.file.FileSystemFileResolverTest
Running io.vertx.core.file.impl.FileSystemImplTest
Tests run: 1, Failures: 0, Errors: 0, Skipped: 0, Time elapsed: 0 sec - in io.vertx.core.file.impl.FileSystemImplTest
Running io.vertx.core.file.JarFileResolverTest
Tests run: 21, Failures: 0, Errors: 0, Skipped: 0, Time elapsed: 2.371 sec - in io.vertx.core.file.JarFileResolverTest
Running io.vertx.core.file.NestedZipFileResolverTest
Tests run: 21, Failures: 0, Errors: 0, Skipped: 0, Time elapsed: 2.659 sec - in io.vertx.core.file.NestedZipFileResolverTest
Running io.vertx.core.file.FileSystemTest
Tests run: 94, Failures: 1, Errors: 0, Skipped: 0, Time elapsed: 2.049 sec <<< FAILURE! - in io.vertx.core.file.FileSystemTest
testChownToRootFails(io.vertx.core.file.FileSystemTest)  Time elapsed: 0.008 sec  <<< FAILURE!
java.lang.AssertionError: null
	at org.junit.Assert.fail(Assert.java:86)
	at org.junit.Assert.assertTrue(Assert.java:41)
	at org.junit.Assert.assertTrue(Assert.java:52)
	at io.vertx.test.core.AsyncTestBase.assertTrue(AsyncTestBase.java:372)
	at io.vertx.core.file.FileSystemTest.lambda$testChownFails$145(FileSystemTest.java:511)

Running io.vertx.core.file.JarFileResolverWithSpacesTest
Tests run: 21, Failures: 0, Errors: 0, Skipped: 0, Time elapsed: 4.258 sec - in io.vertx.core.file.JarFileResolverWithSpacesTest
Running io.vertx.core.file.NestedJarFileResolverTest
Tests run: 21, Failures: 0, Errors: 0, Skipped: 0, Time elapsed: 2.665 sec - in io.vertx.core.file.NestedJarFileResolverTest
Running io.vertx.core.file.FileSystemOptionsTest
Tests run: 4, Failures: 0, Errors: 0, Skipped: 0, Time elapsed: 0.015 sec - in io.vertx.core.file.FileSystemOptionsTest
Running io.vertx.core.file.ZipFileResolverTest
Tests run: 21, Failures: 0, Errors: 0, Skipped: 0, Time elapsed: 2.63 sec - in io.vertx.core.file.ZipFileResolverTest
Running io.vertx.core.EventLoopGroupTest
Tests run: 2, Failures: 0, Errors: 0, Skipped: 0, Time elapsed: 0.019 sec - in io.vertx.core.EventLoopGroupTest
Running io.vertx.core.shareddata.ClusteredAsynchronousLockTest
Tests run: 10, Failures: 0, Errors: 0, Skipped: 2, Time elapsed: 5.233 sec - in io.vertx.core.shareddata.ClusteredAsynchronousLockTest
Running io.vertx.core.shareddata.AsynchronousLockTest
Tests run: 8, Failures: 0, Errors: 0, Skipped: 0, Time elapsed: 5.062 sec - in io.vertx.core.shareddata.AsynchronousLockTest
Running io.vertx.core.shareddata.AsyncMultiMapTest
Tests run: 3, Failures: 0, Errors: 0, Skipped: 0, Time elapsed: 0.065 sec - in io.vertx.core.shareddata.AsyncMultiMapTest
Running io.vertx.core.shareddata.LocalSharedDataTest
Tests run: 11, Failures: 0, Errors: 0, Skipped: 0, Time elapsed: 0.08 sec - in io.vertx.core.shareddata.LocalSharedDataTest
Running io.vertx.core.shareddata.ClusteredSharedCounterTest
Tests run: 9, Failures: 0, Errors: 0, Skipped: 0, Time elapsed: 0.239 sec - in io.vertx.core.shareddata.ClusteredSharedCounterTest
Running io.vertx.core.shareddata.SharedCounterTest
Tests run: 9, Failures: 0, Errors: 0, Skipped: 0, Time elapsed: 0.057 sec - in io.vertx.core.shareddata.SharedCounterTest
Running io.vertx.core.shareddata.LocalAsyncMapTest
*** Iteration 1/100 of test
*** Iteration 2/100 of test
*** Iteration 3/100 of test
*** Iteration 4/100 of test
*** Iteration 5/100 of test
*** Iteration 6/100 of test
*** Iteration 7/100 of test
*** Iteration 8/100 of test
*** Iteration 9/100 of test
*** Iteration 10/100 of test
*** Iteration 11/100 of test
*** Iteration 12/100 of test
*** Iteration 13/100 of test
*** Iteration 14/100 of test
*** Iteration 15/100 of test
*** Iteration 16/100 of test
*** Iteration 17/100 of test
*** Iteration 18/100 of test
*** Iteration 19/100 of test
*** Iteration 20/100 of test
*** Iteration 21/100 of test
*** Iteration 22/100 of test
*** Iteration 23/100 of test
*** Iteration 24/100 of test
*** Iteration 25/100 of test
*** Iteration 26/100 of test
*** Iteration 27/100 of test
*** Iteration 28/100 of test
*** Iteration 29/100 of test
*** Iteration 30/100 of test
*** Iteration 31/100 of test
*** Iteration 32/100 of test
*** Iteration 33/100 of test
*** Iteration 34/100 of test
*** Iteration 35/100 of test
*** Iteration 36/100 of test
*** Iteration 37/100 of test
*** Iteration 38/100 of test
*** Iteration 39/100 of test
*** Iteration 40/100 of test
*** Iteration 41/100 of test
*** Iteration 42/100 of test
*** Iteration 43/100 of test
*** Iteration 44/100 of test
*** Iteration 45/100 of test
*** Iteration 46/100 of test
*** Iteration 47/100 of test
*** Iteration 48/100 of test
*** Iteration 49/100 of test
*** Iteration 50/100 of test
*** Iteration 51/100 of test
*** Iteration 52/100 of test
*** Iteration 53/100 of test
*** Iteration 54/100 of test
*** Iteration 55/100 of test
*** Iteration 56/100 of test
*** Iteration 57/100 of test
*** Iteration 58/100 of test
*** Iteration 59/100 of test
*** Iteration 60/100 of test
*** Iteration 61/100 of test
*** Iteration 62/100 of test
*** Iteration 63/100 of test
*** Iteration 64/100 of test
*** Iteration 65/100 of test
*** Iteration 66/100 of test
*** Iteration 67/100 of test
*** Iteration 68/100 of test
*** Iteration 69/100 of test
*** Iteration 70/100 of test
*** Iteration 71/100 of test
*** Iteration 72/100 of test
*** Iteration 73/100 of test
*** Iteration 74/100 of test
*** Iteration 75/100 of test
*** Iteration 76/100 of test
*** Iteration 77/100 of test
*** Iteration 78/100 of test
*** Iteration 79/100 of test
*** Iteration 80/100 of test
*** Iteration 81/100 of test
*** Iteration 82/100 of test
*** Iteration 83/100 of test
*** Iteration 84/100 of test
*** Iteration 85/100 of test
*** Iteration 86/100 of test
*** Iteration 87/100 of test
*** Iteration 88/100 of test
*** Iteration 89/100 of test
*** Iteration 90/100 of test
*** Iteration 91/100 of test
*** Iteration 92/100 of test
*** Iteration 93/100 of test
*** Iteration 94/100 of test
*** Iteration 95/100 of test
*** Iteration 96/100 of test
*** Iteration 97/100 of test
*** Iteration 98/100 of test
*** Iteration 99/100 of test
*** Iteration 100/100 of test
*** Iteration 1/100 of test
*** Iteration 2/100 of test
*** Iteration 3/100 of test
*** Iteration 4/100 of test
*** Iteration 5/100 of test
*** Iteration 6/100 of test
*** Iteration 7/100 of test
*** Iteration 8/100 of test
*** Iteration 9/100 of test
*** Iteration 10/100 of test
*** Iteration 11/100 of test
*** Iteration 12/100 of test
*** Iteration 13/100 of test
*** Iteration 14/100 of test
*** Iteration 15/100 of test
*** Iteration 16/100 of test
*** Iteration 17/100 of test
*** Iteration 18/100 of test
*** Iteration 19/100 of test
*** Iteration 20/100 of test
*** Iteration 21/100 of test
*** Iteration 22/100 of test
*** Iteration 23/100 of test
*** Iteration 24/100 of test
*** Iteration 25/100 of test
*** Iteration 26/100 of test
*** Iteration 27/100 of test
*** Iteration 28/100 of test
*** Iteration 29/100 of test
*** Iteration 30/100 of test
*** Iteration 31/100 of test
*** Iteration 32/100 of test
*** Iteration 33/100 of test
*** Iteration 34/100 of test
*** Iteration 35/100 of test
*** Iteration 36/100 of test
*** Iteration 37/100 of test
*** Iteration 38/100 of test
*** Iteration 39/100 of test
*** Iteration 40/100 of test
*** Iteration 41/100 of test
*** Iteration 42/100 of test
*** Iteration 43/100 of test
*** Iteration 44/100 of test
*** Iteration 45/100 of test
*** Iteration 46/100 of test
*** Iteration 47/100 of test
*** Iteration 48/100 of test
*** Iteration 49/100 of test
*** Iteration 50/100 of test
*** Iteration 51/100 of test
*** Iteration 52/100 of test
*** Iteration 53/100 of test
*** Iteration 54/100 of test
*** Iteration 55/100 of test
*** Iteration 56/100 of test
*** Iteration 57/100 of test
*** Iteration 58/100 of test
*** Iteration 59/100 of test
*** Iteration 60/100 of test
*** Iteration 61/100 of test
*** Iteration 62/100 of test
*** Iteration 63/100 of test
*** Iteration 64/100 of test
*** Iteration 65/100 of test
*** Iteration 66/100 of test
*** Iteration 67/100 of test
*** Iteration 68/100 of test
*** Iteration 69/100 of test
*** Iteration 70/100 of test
*** Iteration 71/100 of test
*** Iteration 72/100 of test
*** Iteration 73/100 of test
*** Iteration 74/100 of test
*** Iteration 75/100 of test
*** Iteration 76/100 of test
*** Iteration 77/100 of test
*** Iteration 78/100 of test
*** Iteration 79/100 of test
*** Iteration 80/100 of test
*** Iteration 81/100 of test
*** Iteration 82/100 of test
*** Iteration 83/100 of test
*** Iteration 84/100 of test
*** Iteration 85/100 of test
*** Iteration 86/100 of test
*** Iteration 87/100 of test
*** Iteration 88/100 of test
*** Iteration 89/100 of test
*** Iteration 90/100 of test
*** Iteration 91/100 of test
*** Iteration 92/100 of test
*** Iteration 93/100 of test
*** Iteration 94/100 of test
*** Iteration 95/100 of test
*** Iteration 96/100 of test
*** Iteration 97/100 of test
*** Iteration 98/100 of test
*** Iteration 99/100 of test
*** Iteration 100/100 of test
*** Iteration 1/100 of test
*** Iteration 2/100 of test
*** Iteration 3/100 of test
*** Iteration 4/100 of test
*** Iteration 5/100 of test
*** Iteration 6/100 of test
*** Iteration 7/100 of test
*** Iteration 8/100 of test
*** Iteration 9/100 of test
*** Iteration 10/100 of test
*** Iteration 11/100 of test
*** Iteration 12/100 of test
*** Iteration 13/100 of test
*** Iteration 14/100 of test
*** Iteration 15/100 of test
*** Iteration 16/100 of test
*** Iteration 17/100 of test
*** Iteration 18/100 of test
*** Iteration 19/100 of test
*** Iteration 20/100 of test
*** Iteration 21/100 of test
*** Iteration 22/100 of test
*** Iteration 23/100 of test
*** Iteration 24/100 of test
*** Iteration 25/100 of test
*** Iteration 26/100 of test
*** Iteration 27/100 of test
*** Iteration 28/100 of test
*** Iteration 29/100 of test
*** Iteration 30/100 of test
*** Iteration 31/100 of test
*** Iteration 32/100 of test
*** Iteration 33/100 of test
*** Iteration 34/100 of test
*** Iteration 35/100 of test
*** Iteration 36/100 of test
*** Iteration 37/100 of test
*** Iteration 38/100 of test
*** Iteration 39/100 of test
*** Iteration 40/100 of test
*** Iteration 41/100 of test
*** Iteration 42/100 of test
*** Iteration 43/100 of test
*** Iteration 44/100 of test
*** Iteration 45/100 of test
*** Iteration 46/100 of test
*** Iteration 47/100 of test
*** Iteration 48/100 of test
*** Iteration 49/100 of test
*** Iteration 50/100 of test
*** Iteration 51/100 of test
*** Iteration 52/100 of test
*** Iteration 53/100 of test
*** Iteration 54/100 of test
*** Iteration 55/100 of test
*** Iteration 56/100 of test
*** Iteration 57/100 of test
*** Iteration 58/100 of test
*** Iteration 59/100 of test
*** Iteration 60/100 of test
*** Iteration 61/100 of test
*** Iteration 62/100 of test
*** Iteration 63/100 of test
*** Iteration 64/100 of test
*** Iteration 65/100 of test
*** Iteration 66/100 of test
*** Iteration 67/100 of test
*** Iteration 68/100 of test
*** Iteration 69/100 of test
*** Iteration 70/100 of test
*** Iteration 71/100 of test
*** Iteration 72/100 of test
*** Iteration 73/100 of test
*** Iteration 74/100 of test
*** Iteration 75/100 of test
*** Iteration 76/100 of test
*** Iteration 77/100 of test
*** Iteration 78/100 of test
*** Iteration 79/100 of test
*** Iteration 80/100 of test
*** Iteration 81/100 of test
*** Iteration 82/100 of test
*** Iteration 83/100 of test
*** Iteration 84/100 of test
*** Iteration 85/100 of test
*** Iteration 86/100 of test
*** Iteration 87/100 of test
*** Iteration 88/100 of test
*** Iteration 89/100 of test
*** Iteration 90/100 of test
*** Iteration 91/100 of test
*** Iteration 92/100 of test
*** Iteration 93/100 of test
*** Iteration 94/100 of test
*** Iteration 95/100 of test
*** Iteration 96/100 of test
*** Iteration 97/100 of test
*** Iteration 98/100 of test
*** Iteration 99/100 of test
*** Iteration 100/100 of test
Tests run: 101, Failures: 0, Errors: 0, Skipped: 0, Time elapsed: 8.049 sec - in io.vertx.core.shareddata.LocalAsyncMapTest
Running io.vertx.core.shareddata.ClusteredAsyncMapTest
Tests run: 101, Failures: 0, Errors: 0, Skipped: 0, Time elapsed: 2.174 sec - in io.vertx.core.shareddata.ClusteredAsyncMapTest
Running io.vertx.core.VerticleFactoryTest
Tests run: 23, Failures: 0, Errors: 0, Skipped: 0, Time elapsed: 0.221 sec - in io.vertx.core.VerticleFactoryTest
Running io.vertx.core.json.JsonArrayTest
Tests run: 57, Failures: 0, Errors: 0, Skipped: 0, Time elapsed: 0.026 sec - in io.vertx.core.json.JsonArrayTest
Running io.vertx.core.json.JsonMapperTest
Tests run: 9, Failures: 0, Errors: 0, Skipped: 0, Time elapsed: 0.088 sec - in io.vertx.core.json.JsonMapperTest
Running io.vertx.core.json.JsonObjectTest
Tests run: 79, Failures: 0, Errors: 0, Skipped: 0, Time elapsed: 0.021 sec - in io.vertx.core.json.JsonObjectTest
Running io.vertx.core.json.JsonPOJOMapperTest
Tests run: 4, Failures: 0, Errors: 0, Skipped: 0, Time elapsed: 0.029 sec - in io.vertx.core.json.JsonPOJOMapperTest
Running io.vertx.core.ClasspathVerticleFactoryTest
Tests run: 1, Failures: 0, Errors: 0, Skipped: 0, Time elapsed: 0.005 sec - in io.vertx.core.ClasspathVerticleFactoryTest
Running io.vertx.core.ExecuteBlockingTest
Tests run: 6, Failures: 0, Errors: 0, Skipped: 0, Time elapsed: 4.054 sec - in io.vertx.core.ExecuteBlockingTest
Running io.vertx.core.CreateVertxTest
Tests run: 6, Failures: 0, Errors: 0, Skipped: 0, Time elapsed: 0.112 sec - in io.vertx.core.CreateVertxTest
Running io.vertx.core.queue.QueueTest
Tests run: 38, Failures: 0, Errors: 0, Skipped: 0, Time elapsed: 0.413 sec - in io.vertx.core.queue.QueueTest
Running io.vertx.core.VertxTest
Tests run: 3, Failures: 0, Errors: 0, Skipped: 0, Time elapsed: 0.021 sec - in io.vertx.core.VertxTest
Running io.vertx.core.IsolatingClassLoaderTest
Tests run: 5, Failures: 0, Errors: 0, Skipped: 0, Time elapsed: 0.005 sec - in io.vertx.core.IsolatingClassLoaderTest
Running io.vertx.core.HATest
Tests run: 10, Failures: 0, Errors: 0, Skipped: 0, Time elapsed: 9.401 sec - in io.vertx.core.HATest
Running io.vertx.core.VertxOptionsTest
Tests run: 5, Failures: 0, Errors: 0, Skipped: 0, Time elapsed: 0.033 sec - in io.vertx.core.VertxOptionsTest
Running io.vertx.core.ServiceHelperTest
Tests run: 7, Failures: 0, Errors: 0, Skipped: 0, Time elapsed: 1.047 sec - in io.vertx.core.ServiceHelperTest
Running io.vertx.core.LauncherTest
Hello vert.x
Hello vert.x
Tests run: 33, Failures: 0, Errors: 0, Skipped: 0, Time elapsed: 0.636 sec - in io.vertx.core.LauncherTest
Running io.vertx.core.DeploymentTest
Tests run: 78, Failures: 0, Errors: 0, Skipped: 0, Time elapsed: 5.418 sec - in io.vertx.core.DeploymentTest
Running io.vertx.core.datagram.DatagramTest
Tests run: 25, Failures: 0, Errors: 0, Skipped: 0, Time elapsed: 13.347 sec - in io.vertx.core.datagram.DatagramTest
Running io.vertx.core.buffer.BufferTest
Tests run: 83, Failures: 0, Errors: 0, Skipped: 0, Time elapsed: 0.055 sec - in io.vertx.core.buffer.BufferTest
Running io.vertx.core.ConversionHelperTest
Tests run: 7, Failures: 0, Errors: 0, Skipped: 0, Time elapsed: 0.002 sec - in io.vertx.core.ConversionHelperTest
Running io.vertx.core.StarterTest
Tests run: 16, Failures: 0, Errors: 0, Skipped: 0, Time elapsed: 0.355 sec - in io.vertx.core.StarterTest
Running io.vertx.core.ComplexHATest
*** Iteration 1/10 of test
*** Iteration 2/10 of test
*** Iteration 3/10 of test
*** Iteration 4/10 of test
*** Iteration 5/10 of test
*** Iteration 6/10 of test
*** Iteration 7/10 of test
*** Iteration 8/10 of test
*** Iteration 9/10 of test
*** Iteration 10/10 of test
Tests run: 1, Failures: 0, Errors: 0, Skipped: 0, Time elapsed: 2.634 sec - in io.vertx.core.ComplexHATest
Running io.vertx.core.BlockedThreadCheckerTest
Tests run: 4, Failures: 0, Errors: 0, Skipped: 0, Time elapsed: 15.057 sec - in io.vertx.core.BlockedThreadCheckerTest
Running io.vertx.core.dns.DNSTest
Tests run: 26, Failures: 0, Errors: 0, Skipped: 0, Time elapsed: 5.397 sec - in io.vertx.core.dns.DNSTest
Running io.vertx.core.dns.HostnameResolutionTest
Tests run: 24, Failures: 0, Errors: 0, Skipped: 0, Time elapsed: 5.602 sec - in io.vertx.core.dns.HostnameResolutionTest
Running io.vertx.core.ContextTest
Tests run: 16, Failures: 0, Errors: 0, Skipped: 0, Time elapsed: 0.157 sec - in io.vertx.core.ContextTest
Running io.vertx.core.AbstractVerticleTest
Tests run: 1, Failures: 0, Errors: 0, Skipped: 0, Time elapsed: 0.008 sec - in io.vertx.core.AbstractVerticleTest
Running io.vertx.core.NamedWorkerPoolTest
Tests run: 12, Failures: 0, Errors: 0, Skipped: 0, Time elapsed: 5.23 sec - in io.vertx.core.NamedWorkerPoolTest
Running io.vertx.core.FutureTest
Tests run: 79, Failures: 0, Errors: 0, Skipped: 0, Time elapsed: 0.766 sec - in io.vertx.core.FutureTest
Running io.vertx.core.TimerTest
Tests run: 16, Failures: 0, Errors: 0, Skipped: 0, Time elapsed: 5.409 sec - in io.vertx.core.TimerTest
Running io.vertx.core.spi.metrics.MetricsContextTest
Tests run: 22, Failures: 0, Errors: 0, Skipped: 1, Time elapsed: 0.507 sec - in io.vertx.core.spi.metrics.MetricsContextTest
Running io.vertx.core.spi.metrics.MetricsOptionsTest
Tests run: 7, Failures: 0, Errors: 0, Skipped: 0, Time elapsed: 0.055 sec - in io.vertx.core.spi.metrics.MetricsOptionsTest
Running io.vertx.core.spi.metrics.MetricsTest
Tests run: 39, Failures: 0, Errors: 0, Skipped: 0, Time elapsed: 12.482 sec - in io.vertx.core.spi.metrics.MetricsTest
Running io.vertx.core.spi.metrics.DummyMetricsTest
Tests run: 7, Failures: 0, Errors: 0, Skipped: 0, Time elapsed: 0.042 sec - in io.vertx.core.spi.metrics.DummyMetricsTest
Running io.vertx.test.core.AsyncTestBaseTest
Tests run: 17, Failures: 0, Errors: 0, Skipped: 0, Time elapsed: 6.528 sec - in io.vertx.test.core.AsyncTestBaseTest

Results :

Failed tests: 
  FileSystemTest.lambda$testChownFails$145:511->AsyncTestBase.assertTrue:372 null
  Http1xTest>AsyncTestBase.lambda$onFailure$0:586->AsyncTestBase.assertFalse:208 null
  Http2Test>AsyncTestBase.lambda$onFailure$0:586->AsyncTestBase.assertFalse:208 null
  NetTest.lambda$testListenInvalidPort$46:911->AsyncTestBase.assertTrue:372 null

Tests run: 3627, Failures: 4, Errors: 0, Skipped: 12

[INFO] ------------------------------------------------------------------------
[INFO] BUILD FAILURE
[INFO] ------------------------------------------------------------------------
[INFO] Total time: 09:12 min
[INFO] Finished at: 2018-10-04T22:24:20+02:00
[INFO] Final Memory: 41M/787M
[INFO] ------------------------------------------------------------------------
[ERROR] Failed to execute goal org.apache.maven.plugins:maven-surefire-plugin:2.18.1:test (default-test) on project vertx-core: There are test failures.
[ERROR] 
[ERROR] Please refer to /root/workspace/eclipse-vertx/vert.x/437307181/target/surefire-reports for the individual test results.
[ERROR] -> [Help 1]
[ERROR] 
[ERROR] To see the full stack trace of the errors, re-run Maven with the -e switch.
[ERROR] Re-run Maven using the -X switch to enable full debug logging.
[ERROR] 
[ERROR] For more information about the errors and possible solutions, please read the following articles:
[ERROR] [Help 1] http://cwiki.apache.org/confluence/display/MAVEN/MojoFailureException
