[INFO] Scanning for projects...
[INFO] ------------------------------------------------------------------------
[INFO] Reactor Build Order:
[INFO] 
[INFO] selenide-framework
[INFO] api-tests
[INFO] gui-tests
[INFO] performance-tests
[INFO]                                                                         
[INFO] ------------------------------------------------------------------------
[INFO] Building selenide-framework 1.0-SNAPSHOT
[INFO] ------------------------------------------------------------------------
[INFO]                                                                         
[INFO] ------------------------------------------------------------------------
[INFO] Building api-tests 1.0-SNAPSHOT
[INFO] ------------------------------------------------------------------------
[INFO] 
[INFO] --- maven-resources-plugin:2.6:resources (default-resources) @ api-tests ---
[INFO] Using 'UTF-8' encoding to copy filtered resources.
[INFO] skip non existing resourceDirectory /root/workspace/symonk/sylenium-framework/436032151/api-tests/src/main/resources
[INFO] 
[INFO] --- maven-compiler-plugin:3.1:compile (default-compile) @ api-tests ---
[INFO] No sources to compile
[INFO] 
[INFO] --- maven-resources-plugin:2.6:testResources (default-testResources) @ api-tests ---
[INFO] Using 'UTF-8' encoding to copy filtered resources.
[INFO] skip non existing resourceDirectory /root/workspace/symonk/sylenium-framework/436032151/api-tests/src/test/resources
[INFO] 
[INFO] --- maven-compiler-plugin:3.1:testCompile (default-testCompile) @ api-tests ---
[INFO] No sources to compile
[INFO] 
[INFO] --- maven-surefire-plugin:2.12.4:test (default-test) @ api-tests ---
[INFO] No tests to run.
[INFO]                                                                         
[INFO] ------------------------------------------------------------------------
[INFO] Building gui-tests 1.0-SNAPSHOT
[INFO] ------------------------------------------------------------------------
[INFO] 
[INFO] --- maven-resources-plugin:2.6:resources (default-resources) @ gui-tests ---
[INFO] Using 'UTF-8' encoding to copy filtered resources.
[INFO] skip non existing resourceDirectory /root/workspace/symonk/sylenium-framework/436032151/gui-tests/src/main/resources
[INFO] 
[INFO] --- maven-compiler-plugin:3.7.0:compile (default-compile) @ gui-tests ---
[INFO] No sources to compile
[INFO] 
[INFO] --- maven-resources-plugin:2.6:testResources (default-testResources) @ gui-tests ---
[INFO] Using 'UTF-8' encoding to copy filtered resources.
[INFO] Copying 8 resources
[INFO] 
[INFO] --- maven-compiler-plugin:3.7.0:testCompile (default-testCompile) @ gui-tests ---
[INFO] Changes detected - recompiling the module!
[INFO] Compiling 29 source files to /root/workspace/symonk/sylenium-framework/436032151/gui-tests/target/test-classes
[INFO] 
[INFO] --- maven-surefire-plugin:2.22.0:test (default-test) @ gui-tests ---
[INFO] Downloading: https://repo.maven.apache.org/maven2/org/apache/maven/surefire/surefire-testng/2.22.0/surefire-testng-2.22.0.pom
[INFO] Downloaded: https://repo.maven.apache.org/maven2/org/apache/maven/surefire/surefire-testng/2.22.0/surefire-testng-2.22.0.pom (3 KB at 5.4 KB/sec)
[INFO] Downloading: https://repo.maven.apache.org/maven2/org/apache/maven/surefire/surefire-providers/2.22.0/surefire-providers-2.22.0.pom
[INFO] Downloaded: https://repo.maven.apache.org/maven2/org/apache/maven/surefire/surefire-providers/2.22.0/surefire-providers-2.22.0.pom (3 KB at 69.4 KB/sec)
[INFO] Downloading: https://repo.maven.apache.org/maven2/org/apache/maven/surefire/common-java5/2.22.0/common-java5-2.22.0.pom
[INFO] Downloaded: https://repo.maven.apache.org/maven2/org/apache/maven/surefire/common-java5/2.22.0/common-java5-2.22.0.pom (3 KB at 70.7 KB/sec)
[INFO] Downloading: https://repo.maven.apache.org/maven2/org/apache/maven/surefire/surefire-testng-utils/2.22.0/surefire-testng-utils-2.22.0.pom
[INFO] Downloaded: https://repo.maven.apache.org/maven2/org/apache/maven/surefire/surefire-testng-utils/2.22.0/surefire-testng-utils-2.22.0.pom (4 KB at 80.9 KB/sec)
[INFO] Downloading: https://repo.maven.apache.org/maven2/org/apache/maven/surefire/surefire-grouper/2.22.0/surefire-grouper-2.22.0.pom
[INFO] Downloaded: https://repo.maven.apache.org/maven2/org/apache/maven/surefire/surefire-grouper/2.22.0/surefire-grouper-2.22.0.pom (3 KB at 71.5 KB/sec)
[INFO] Downloading: https://repo.maven.apache.org/maven2/org/apache/maven/surefire/surefire-testng-utils/2.22.0/surefire-testng-utils-2.22.0.jar
[INFO] Downloading: https://repo.maven.apache.org/maven2/org/apache/maven/surefire/surefire-testng/2.22.0/surefire-testng-2.22.0.jar
[INFO] Downloading: https://repo.maven.apache.org/maven2/org/apache/maven/surefire/surefire-grouper/2.22.0/surefire-grouper-2.22.0.jar
[INFO] Downloading: https://repo.maven.apache.org/maven2/org/apache/maven/surefire/common-java5/2.22.0/common-java5-2.22.0.jar
[INFO] Downloaded: https://repo.maven.apache.org/maven2/org/apache/maven/surefire/surefire-testng-utils/2.22.0/surefire-testng-utils-2.22.0.jar (27 KB at 405.2 KB/sec)
[INFO] Downloaded: https://repo.maven.apache.org/maven2/org/apache/maven/surefire/surefire-testng/2.22.0/surefire-testng-2.22.0.jar (43 KB at 354.2 KB/sec)
[INFO] Downloaded: https://repo.maven.apache.org/maven2/org/apache/maven/surefire/surefire-grouper/2.22.0/surefire-grouper-2.22.0.jar (40 KB at 325.4 KB/sec)
[INFO] Downloaded: https://repo.maven.apache.org/maven2/org/apache/maven/surefire/common-java5/2.22.0/common-java5-2.22.0.jar (50 KB at 413.2 KB/sec)
[INFO] 
[INFO] -------------------------------------------------------
[INFO]  T E S T S
[INFO] -------------------------------------------------------
[INFO] Running TestSuite
...
... TestNG 7.0.0-beta1 by Cédric Beust (cedric@beust.com)
...


 11:09:54 main INFO TestExecutionListener test run starting!
 11:09:55 main INFO TestExecutionListener configuring the test run!
 11:09:55 main INFO TestExecutionListener pushing report information
 11:09:55 TestNG-test=Regression Pack-2 INFO TestBaseTemplate Multi threaded logger initialized for test: adoptingHannahWithoutAnyOptions
 11:09:55 TestNG-test=Regression Pack-3 INFO TestBaseTemplate Multi threaded logger initialized for test: optionsAreCorrectlyBilled
 11:09:55 TestNG-test=Regression Pack-1 INFO TestBaseTemplate Multi threaded logger initialized for test: adoptingBrookWithAllOptions
 11:09:55 TestNG-test=Regression Pack-3 INFO TestBaseTemplate Executing: + optionsAreCorrectlyBilled
 11:09:55 TestNG-test=Regression Pack-2 INFO TestBaseTemplate Executing: + adoptingHannahWithoutAnyOptions
 11:09:55 TestNG-test=Regression Pack-1 INFO TestBaseTemplate Executing: + adoptingBrookWithAllOptions
 11:09:57 TestNG-test=Regression Pack-3 INFO WebDriverManager Reading https://chromedriver.storage.googleapis.com/ to seek chromedriver
 11:09:57 TestNG-test=Regression Pack-3 INFO Downloader Downloading https://chromedriver.storage.googleapis.com/2.41/chromedriver_linux64.zip
 11:09:58 TestNG-test=Regression Pack-3 INFO Downloader Extracting binary from compressed file chromedriver_linux64.zip
 11:09:58 TestNG-test=Regression Pack-3 INFO WebDriverManager Exporting webdriver.chrome.driver as /root/.m2/repository/webdriver/chromedriver
 11:09:58 TestNG-test=Regression Pack-2 INFO WebDriverManager Reading https://chromedriver.storage.googleapis.com/ to seek chromedriver
 11:09:58 TestNG-test=Regression Pack-2 INFO Downloader Using binary driver previously downloaded
 11:09:58 TestNG-test=Regression Pack-2 INFO WebDriverManager Exporting webdriver.chrome.driver as /root/.m2/repository/webdriver/chromedriver
 11:09:58 TestNG-test=Regression Pack-1 INFO WebDriverManager Reading https://chromedriver.storage.googleapis.com/ to seek chromedriver
 11:09:59 TestNG-test=Regression Pack-1 INFO Downloader Using binary driver previously downloaded
 11:09:59 TestNG-test=Regression Pack-1 INFO WebDriverManager Exporting webdriver.chrome.driver as /root/.m2/repository/webdriver/chromedriver
 11:09:59 TestNG-test=Regression Pack-3 INFO TestBaseTemplate Multi threaded logger initialized for test: optionsAreCorrectlyBilled
 11:09:59 TestNG-test=Regression Pack-1 INFO TestBaseTemplate Multi threaded logger initialized for test: adoptingBrookWithAllOptions
 11:09:59 TestNG-test=Regression Pack-2 INFO TestBaseTemplate Multi threaded logger initialized for test: adoptingHannahWithoutAnyOptions
 11:09:59 TestNG-test=Regression Pack-2 INFO TestBaseTemplate Executing: + adoptingHannahWithoutAnyOptions
 11:09:59 TestNG-test=Regression Pack-3 INFO TestBaseTemplate Executing: + optionsAreCorrectlyBilled
 11:09:59 TestNG-test=Regression Pack-1 INFO TestBaseTemplate Executing: + adoptingBrookWithAllOptions
 11:09:59 TestNG-test=Regression Pack-3 INFO PuppyAdoptionTests This runs after each class
 11:10:00 main INFO TestExecutionListener test run finished![ERROR] Tests run: 6, Failures: 3, Errors: 0, Skipped: 3, Time elapsed: 8.018 s <<< FAILURE! - in TestSuite
[ERROR] adoptingHannahWithoutAnyOptions(io.github.symonk.testcases.PuppyAdoptionTests)  Time elapsed: 0.176 s  <<< FAILURE!
org.openqa.selenium.WebDriverException: 
unknown error: cannot find Chrome binary
  (Driver info: chromedriver=2.41.578700 (2f1ed5f9343c13f73144538f15c00b370eda6706),platform=Linux 3.10.0-862.3.2.el7.x86_64 x86_64) (WARNING: The server did not provide any stacktrace information)
Command duration or timeout: 7 milliseconds
Build info: version: '3.14.0', revision: 'aacccce0', time: '2018-08-02T20:19:58.91Z'
System info: host: 'cyclone1', ip: '172.17.0.3', os.name: 'Linux', os.arch: 'amd64', os.version: '3.10.0-862.3.2.el7.x86_64', java.version: '1.8.0_121'
Driver info: driver.version: ChromeDriver
	at io.github.symonk.testcases.PuppyAdoptionTests.adoptingHannahWithoutAnyOptions(PuppyAdoptionTests.java:41)

[ERROR] optionsAreCorrectlyBilled(io.github.symonk.testcases.PuppyAdoptionTests)  Time elapsed: 0.226 s  <<< FAILURE!
org.openqa.selenium.WebDriverException: 
unknown error: cannot find Chrome binary
  (Driver info: chromedriver=2.41.578700 (2f1ed5f9343c13f73144538f15c00b370eda6706),platform=Linux 3.10.0-862.3.2.el7.x86_64 x86_64) (WARNING: The server did not provide any stacktrace information)
Command duration or timeout: 36 milliseconds
Build info: version: '3.14.0', revision: 'aacccce0', time: '2018-08-02T20:19:58.91Z'
System info: host: 'cyclone1', ip: '172.17.0.3', os.name: 'Linux', os.arch: 'amd64', os.version: '3.10.0-862.3.2.el7.x86_64', java.version: '1.8.0_121'
Driver info: driver.version: ChromeDriver
	at io.github.symonk.testcases.PuppyAdoptionTests.optionsAreCorrectlyBilled(PuppyAdoptionTests.java:73)

[ERROR] adoptingBrookWithAllOptions(io.github.symonk.testcases.PuppyAdoptionTests)  Time elapsed: 0.227 s  <<< FAILURE!
org.openqa.selenium.WebDriverException: 
unknown error: cannot find Chrome binary
  (Driver info: chromedriver=2.41.578700 (2f1ed5f9343c13f73144538f15c00b370eda6706),platform=Linux 3.10.0-862.3.2.el7.x86_64 x86_64) (WARNING: The server did not provide any stacktrace information)
Command duration or timeout: 6 milliseconds
Build info: version: '3.14.0', revision: 'aacccce0', time: '2018-08-02T20:19:58.91Z'
System info: host: 'cyclone1', ip: '172.17.0.3', os.name: 'Linux', os.arch: 'amd64', os.version: '3.10.0-862.3.2.el7.x86_64', java.version: '1.8.0_121'
Driver info: driver.version: ChromeDriver
	at io.github.symonk.testcases.PuppyAdoptionTests.adoptingBrookWithAllOptions(PuppyAdoptionTests.java:57)

[INFO] 
[INFO] Results:
[INFO] 
[ERROR] Failures: 
[ERROR] io.github.symonk.testcases.PuppyAdoptionTests.adoptingBrookWithAllOptions(io.github.symonk.testcases.PuppyAdoptionTests)
[INFO]   Run 1: PASS
[ERROR]   Run 2: PuppyAdoptionTests.adoptingBrookWithAllOptions:57 » WebDriver unknown error: c...
[INFO] 
[ERROR] io.github.symonk.testcases.PuppyAdoptionTests.adoptingHannahWithoutAnyOptions(io.github.symonk.testcases.PuppyAdoptionTests)
[INFO]   Run 1: PASS
[ERROR]   Run 2: PuppyAdoptionTests.adoptingHannahWithoutAnyOptions:41 » WebDriver unknown erro...
[INFO] 
[ERROR] io.github.symonk.testcases.PuppyAdoptionTests.optionsAreCorrectlyBilled(io.github.symonk.testcases.PuppyAdoptionTests)
[INFO]   Run 1: PASS
[ERROR]   Run 2: PuppyAdoptionTests.optionsAreCorrectlyBilled:73 » WebDriver unknown error: can...
[INFO] 
[INFO] 
[ERROR] Tests run: 3, Failures: 3, Errors: 0, Skipped: 0
[INFO] 
[INFO] ------------------------------------------------------------------------
[INFO] Reactor Summary:
[INFO] 
[INFO] selenide-framework ................................. SUCCESS [  0.003 s]
[INFO] api-tests .......................................... SUCCESS [  1.357 s]
[INFO] gui-tests .......................................... FAILURE [ 16.063 s]
[INFO] performance-tests .................................. SKIPPED
[INFO] ------------------------------------------------------------------------
[INFO] BUILD FAILURE
[INFO] ------------------------------------------------------------------------
[INFO] Total time: 17.580 s
[INFO] Finished at: 2018-10-02T11:10:00+02:00
[INFO] Final Memory: 32M/376M
[INFO] ------------------------------------------------------------------------
[ERROR] Failed to execute goal org.apache.maven.plugins:maven-surefire-plugin:2.22.0:test (default-test) on project gui-tests: There are test failures.
[ERROR] 
[ERROR] Please refer to /root/workspace/symonk/sylenium-framework/436032151/gui-tests/target/surefire-reports for the individual test results.
[ERROR] Please refer to dump files (if any exist) [date]-jvmRun[N].dump, [date].dumpstream and [date]-jvmRun[N].dumpstream.
[ERROR] -> [Help 1]
[ERROR] 
[ERROR] To see the full stack trace of the errors, re-run Maven with the -e switch.
[ERROR] Re-run Maven using the -X switch to enable full debug logging.
[ERROR] 
[ERROR] For more information about the errors and possible solutions, please read the following articles:
[ERROR] [Help 1] http://cwiki.apache.org/confluence/display/MAVEN/MojoFailureException
[ERROR] 
[ERROR] After correcting the problems, you can resume the build with the command
[ERROR]   mvn <goals> -rf :gui-tests
