[INFO] Scanning for projects...
[INFO] Inspecting build with total of 4 modules...
[INFO] Installing Nexus Staging features:
[INFO]   ... total of 4 executions of maven-deploy-plugin replaced with nexus-staging-maven-plugin
[INFO] ------------------------------------------------------------------------
[INFO] Reactor Build Order:
[INFO] 
[INFO] jargo-parent
[INFO] common-test
[INFO] jargo
[INFO] jargo-addons
[INFO]                                                                         
[INFO] ------------------------------------------------------------------------
[INFO] Building jargo-parent 0.4.12-SNAPSHOT
[INFO] ------------------------------------------------------------------------
[INFO] 
[INFO] --- maven-enforcer-plugin:1.4:enforce (enforce-maven) @ jargo-parent ---
[INFO] Skipping Rule Enforcement.
[INFO] 
[INFO] --- jacoco-maven-plugin:0.8.1:prepare-agent (prepare-agent) @ jargo-parent ---
[INFO] argLine set to -javaagent:/root/./workspace/jontejj/jargo/384056244/.m2/org/jacoco/org.jacoco.agent/0.8.1/org.jacoco.agent-0.8.1-runtime.jar=destfile=/root/jargo/jacoco.exec
[INFO] 
[INFO] --- formatter-maven-plugin:2.7.2:format (default) @ jargo-parent ---
[INFO] Using 'UTF-8' encoding to format source files.
[INFO] Number of files to be formatted: 0
[INFO]                                                                         
[INFO] ------------------------------------------------------------------------
[INFO] Building common-test 0.4.12-SNAPSHOT
[INFO] ------------------------------------------------------------------------
[INFO] 
[INFO] --- maven-enforcer-plugin:1.4:enforce (enforce-maven) @ common-test ---
[INFO] Skipping Rule Enforcement.
[INFO] 
[INFO] --- jacoco-maven-plugin:0.8.1:prepare-agent (prepare-agent) @ common-test ---
[INFO] argLine set to -javaagent:/root/./workspace/jontejj/jargo/384056244/.m2/org/jacoco/org.jacoco.agent/0.8.1/org.jacoco.agent-0.8.1-runtime.jar=destfile=/root/jargo/jacoco.exec
[INFO] 
[INFO] --- formatter-maven-plugin:2.7.2:format (default) @ common-test ---
[INFO] Using 'UTF-8' encoding to format source files.
[INFO] Number of files to be formatted: 33
[INFO] Successfully formatted:          0 file(s)
[INFO] Fail to format:                  0 file(s)
[INFO] Skipped:                         33 file(s)
[INFO] Read only skipped:               0 file(s)
[INFO] Approximate time taken:          1s
[INFO] 
[INFO] --- maven-resources-plugin:2.6:resources (default-resources) @ common-test ---
[INFO] Using 'UTF-8' encoding to copy filtered resources.
[INFO] skip non existing resourceDirectory /root/workspace/jontejj/jargo/384056244/common-test/src/main/resources
[INFO] 
[INFO] --- maven-compiler-plugin:2.4:compile (default-compile) @ common-test ---
[INFO] Nothing to compile - all classes are up to date
[INFO] 
[INFO] --- maven-resources-plugin:2.6:testResources (default-testResources) @ common-test ---
[INFO] Using 'UTF-8' encoding to copy filtered resources.
[INFO] Copying 1 resource
[INFO] 
[INFO] --- maven-compiler-plugin:2.4:testCompile (default-testCompile) @ common-test ---
[INFO] Nothing to compile - all classes are up to date
[INFO] 
[INFO] --- maven-surefire-plugin:2.21.0:test (default-test) @ common-test ---
[INFO] Downloading: https://repo.maven.apache.org/maven2/org/apache/maven/surefire/surefire-junit47/2.21.0/surefire-junit47-2.21.0.pom
[INFO] Downloaded: https://repo.maven.apache.org/maven2/org/apache/maven/surefire/surefire-junit47/2.21.0/surefire-junit47-2.21.0.pom (7 KB at 16.0 KB/sec)
[INFO] Downloading: https://repo.maven.apache.org/maven2/org/apache/maven/surefire/surefire-providers/2.21.0/surefire-providers-2.21.0.pom
[INFO] Downloaded: https://repo.maven.apache.org/maven2/org/apache/maven/surefire/surefire-providers/2.21.0/surefire-providers-2.21.0.pom (3 KB at 111.6 KB/sec)
[INFO] Downloading: https://repo.maven.apache.org/maven2/org/apache/maven/surefire/common-junit48/2.21.0/common-junit48-2.21.0.pom
[INFO] Downloaded: https://repo.maven.apache.org/maven2/org/apache/maven/surefire/common-junit48/2.21.0/common-junit48-2.21.0.pom (4 KB at 93.1 KB/sec)
[INFO] Downloading: https://repo.maven.apache.org/maven2/org/apache/maven/surefire/common-junit4/2.21.0/common-junit4-2.21.0.pom
[INFO] Downloaded: https://repo.maven.apache.org/maven2/org/apache/maven/surefire/common-junit4/2.21.0/common-junit4-2.21.0.pom (3 KB at 97.3 KB/sec)
[INFO] Downloading: https://repo.maven.apache.org/maven2/org/apache/maven/surefire/common-junit3/2.21.0/common-junit3-2.21.0.pom
[INFO] Downloaded: https://repo.maven.apache.org/maven2/org/apache/maven/surefire/common-junit3/2.21.0/common-junit3-2.21.0.pom (2 KB at 45.3 KB/sec)
[INFO] Downloading: https://repo.maven.apache.org/maven2/org/apache/maven/surefire/common-java5/2.21.0/common-java5-2.21.0.pom
[INFO] Downloaded: https://repo.maven.apache.org/maven2/org/apache/maven/surefire/common-java5/2.21.0/common-java5-2.21.0.pom (3 KB at 104.6 KB/sec)
[INFO] Downloading: https://repo.maven.apache.org/maven2/org/apache/maven/shared/maven-shared-utils/0.9/maven-shared-utils-0.9.pom
[INFO] Downloaded: https://repo.maven.apache.org/maven2/org/apache/maven/shared/maven-shared-utils/0.9/maven-shared-utils-0.9.pom (7 KB at 173.7 KB/sec)
[INFO] Downloading: https://repo.maven.apache.org/maven2/org/apache/maven/shared/maven-shared-components/21/maven-shared-components-21.pom
[INFO] Downloaded: https://repo.maven.apache.org/maven2/org/apache/maven/shared/maven-shared-components/21/maven-shared-components-21.pom (5 KB at 277.1 KB/sec)
[INFO] Downloading: https://repo.maven.apache.org/maven2/org/apache/maven/maven-parent/25/maven-parent-25.pom
[INFO] Downloaded: https://repo.maven.apache.org/maven2/org/apache/maven/maven-parent/25/maven-parent-25.pom (37 KB at 1305.8 KB/sec)
[INFO] Downloading: https://repo.maven.apache.org/maven2/org/apache/apache/15/apache-15.pom
[INFO] Downloaded: https://repo.maven.apache.org/maven2/org/apache/apache/15/apache-15.pom (15 KB at 783.1 KB/sec)
[INFO] Downloading: https://repo.maven.apache.org/maven2/org/apache/maven/surefire/surefire-grouper/2.21.0/surefire-grouper-2.21.0.pom
[INFO] Downloaded: https://repo.maven.apache.org/maven2/org/apache/maven/surefire/surefire-grouper/2.21.0/surefire-grouper-2.21.0.pom (3 KB at 139.3 KB/sec)
[INFO] Downloading: https://repo.maven.apache.org/maven2/org/apache/maven/surefire/common-junit3/2.21.0/common-junit3-2.21.0.jar
[INFO] Downloading: https://repo.maven.apache.org/maven2/org/apache/maven/surefire/common-junit4/2.21.0/common-junit4-2.21.0.jar
[INFO] Downloading: https://repo.maven.apache.org/maven2/org/apache/maven/surefire/common-java5/2.21.0/common-java5-2.21.0.jar
[INFO] Downloading: https://repo.maven.apache.org/maven2/org/apache/maven/surefire/surefire-junit47/2.21.0/surefire-junit47-2.21.0.jar
[INFO] Downloading: https://repo.maven.apache.org/maven2/org/apache/maven/surefire/common-junit48/2.21.0/common-junit48-2.21.0.jar
[INFO] Downloaded: https://repo.maven.apache.org/maven2/org/apache/maven/surefire/common-junit3/2.21.0/common-junit3-2.21.0.jar (12 KB at 408.0 KB/sec)
[INFO] Downloading: https://repo.maven.apache.org/maven2/org/apache/maven/shared/maven-shared-utils/0.9/maven-shared-utils-0.9.jar
[INFO] Downloaded: https://repo.maven.apache.org/maven2/org/apache/maven/surefire/common-junit48/2.21.0/common-junit48-2.21.0.jar (22 KB at 466.9 KB/sec)
[INFO] Downloaded: https://repo.maven.apache.org/maven2/org/apache/maven/surefire/common-junit4/2.21.0/common-junit4-2.21.0.jar (28 KB at 550.1 KB/sec)
[INFO] Downloading: https://repo.maven.apache.org/maven2/org/apache/maven/surefire/surefire-grouper/2.21.0/surefire-grouper-2.21.0.jar
[INFO] Downloaded: https://repo.maven.apache.org/maven2/org/apache/maven/surefire/common-java5/2.21.0/common-java5-2.21.0.jar (50 KB at 724.5 KB/sec)
[INFO] Downloaded: https://repo.maven.apache.org/maven2/org/apache/maven/surefire/surefire-grouper/2.21.0/surefire-grouper-2.21.0.jar (40 KB at 1184.7 KB/sec)
[INFO] Downloaded: https://repo.maven.apache.org/maven2/org/apache/maven/surefire/surefire-junit47/2.21.0/surefire-junit47-2.21.0.jar (163 KB at 1961.8 KB/sec)
[INFO] Downloaded: https://repo.maven.apache.org/maven2/org/apache/maven/shared/maven-shared-utils/0.9/maven-shared-utils-0.9.jar (168 KB at 2993.7 KB/sec)
[INFO] 
[INFO] -------------------------------------------------------
[INFO]  T E S T S
[INFO] -------------------------------------------------------
[INFO] Running se.softhouse.common.testlib.SimulatedExceptionTest
[INFO] Tests run: 2, Failures: 0, Errors: 0, Skipped: 0, Time elapsed: 0.029 s - in se.softhouse.common.testlib.SimulatedExceptionTest
[INFO] Running se.softhouse.common.testlib.ExplanationTest
[INFO] Tests run: 1, Failures: 0, Errors: 0, Skipped: 0, Time elapsed: 0.052 s - in se.softhouse.common.testlib.ExplanationTest
[INFO] Running se.softhouse.common.testlib.ConstantsTest
[INFO] Tests run: 3, Failures: 0, Errors: 0, Skipped: 0, Time elapsed: 0.037 s - in se.softhouse.common.testlib.ConstantsTest
[INFO] Running se.softhouse.common.testlib.EnumTesterTest
[INFO] Tests run: 6, Failures: 0, Errors: 0, Skipped: 0, Time elapsed: 0.059 s - in se.softhouse.common.testlib.EnumTesterTest
[INFO] Running se.softhouse.common.testlib.SerializerTest
[INFO] Tests run: 4, Failures: 0, Errors: 0, Skipped: 0, Time elapsed: 0.289 s - in se.softhouse.common.testlib.SerializerTest
[INFO] Running se.softhouse.common.testlib.ThrowerTest
[WARNING] Tests run: 3, Failures: 0, Errors: 0, Skipped: 1, Time elapsed: 0.18 s - in se.softhouse.common.testlib.ThrowerTest
[INFO] Running se.softhouse.common.testlib.ConcurrencyTesterTest
[INFO] Tests run: 7, Failures: 0, Errors: 0, Skipped: 0, Time elapsed: 0.407 s - in se.softhouse.common.testlib.ConcurrencyTesterTest
[INFO] Running se.softhouse.common.testlib.UtilityClassTesterTest
[INFO] Tests run: 6, Failures: 0, Errors: 0, Skipped: 0, Time elapsed: 0.478 s - in se.softhouse.common.testlib.UtilityClassTesterTest
[INFO] Running se.softhouse.common.testlib.ConcurrentlyTest
[INFO] Tests run: 3, Failures: 0, Errors: 0, Skipped: 0, Time elapsed: 0.072 s - in se.softhouse.common.testlib.ConcurrentlyTest
[INFO] Running se.softhouse.common.testlib.LocalesTest
[INFO] Tests run: 3, Failures: 0, Errors: 0, Skipped: 0, Time elapsed: 0.054 s - in se.softhouse.common.testlib.LocalesTest
[INFO] Running se.softhouse.common.testlib.MemoryTesterTest
[INFO] Tests run: 3, Failures: 0, Errors: 0, Skipped: 0, Time elapsed: 0.292 s - in se.softhouse.common.testlib.MemoryTesterTest
[INFO] Running se.softhouse.common.testlib.ResourceLoaderTest
[INFO] Tests run: 3, Failures: 0, Errors: 0, Skipped: 0, Time elapsed: 0.041 s - in se.softhouse.common.testlib.ResourceLoaderTest
[INFO] Running se.softhouse.common.testlib.LauncherTest
[INFO] Tests run: 5, Failures: 0, Errors: 0, Skipped: 0, Time elapsed: 0.529 s - in se.softhouse.common.testlib.LauncherTest
[INFO] Running se.softhouse.common.testlib.StreamsTest
[INFO] Tests run: 2, Failures: 0, Errors: 0, Skipped: 0, Time elapsed: 0.079 s - in se.softhouse.common.testlib.StreamsTest
[INFO] 
[INFO] Results:
[INFO] 
[WARNING] Tests run: 51, Failures: 0, Errors: 0, Skipped: 1
[INFO] 
[INFO]                                                                         
[INFO] ------------------------------------------------------------------------
[INFO] Building jargo 0.4.12-SNAPSHOT
[INFO] ------------------------------------------------------------------------
[INFO] 
[INFO] --- maven-enforcer-plugin:1.4:enforce (enforce-maven) @ jargo ---
[INFO] Skipping Rule Enforcement.
[INFO] 
[INFO] --- jacoco-maven-plugin:0.8.1:prepare-agent (prepare-agent) @ jargo ---
[INFO] argLine set to -javaagent:/root/./workspace/jontejj/jargo/384056244/.m2/org/jacoco/org.jacoco.agent/0.8.1/org.jacoco.agent-0.8.1-runtime.jar=destfile=/root/jargo/jacoco.exec
[INFO] 
[INFO] --- formatter-maven-plugin:2.7.2:format (default) @ jargo ---
[INFO] Using 'UTF-8' encoding to format source files.
[INFO] Number of files to be formatted: 141
[INFO] Successfully formatted:          0 file(s)
[INFO] Fail to format:                  0 file(s)
[INFO] Skipped:                         141 file(s)
[INFO] Read only skipped:               0 file(s)
[INFO] Approximate time taken:          2s
[INFO] 
[INFO] --- maven-resources-plugin:2.6:resources (default-resources) @ jargo ---
[INFO] Using 'UTF-8' encoding to copy filtered resources.
[INFO] skip non existing resourceDirectory /root/workspace/jontejj/jargo/384056244/jargo/src/main/resources
[INFO] 
[INFO] --- maven-compiler-plugin:2.4:compile (default-compile) @ jargo ---
[INFO] Nothing to compile - all classes are up to date
[INFO] 
[INFO] --- maven-resources-plugin:2.6:testResources (default-testResources) @ jargo ---
[INFO] Using 'UTF-8' encoding to copy filtered resources.
[INFO] Copying 24 resources
[INFO] 
[INFO] --- maven-compiler-plugin:2.4:testCompile (default-testCompile) @ jargo ---
[INFO] Nothing to compile - all classes are up to date
[INFO] 
[INFO] --- maven-surefire-plugin:2.21.0:test (default-test) @ jargo ---
[INFO] 
[INFO] -------------------------------------------------------
[INFO]  T E S T S
[INFO] -------------------------------------------------------
[INFO] Running se.softhouse.common.strings.StringBuildersTest
[INFO] Tests run: 1, Failures: 0, Errors: 0, Skipped: 0, Time elapsed: 0.129 s - in se.softhouse.common.strings.StringBuildersTest
[INFO] Running se.softhouse.common.strings.LinesTest
[INFO] Tests run: 1, Failures: 0, Errors: 0, Skipped: 0, Time elapsed: 0.271 s - in se.softhouse.common.strings.LinesTest
[INFO] Running se.softhouse.common.guavaextensions.Lists2Test
[INFO] Tests run: 2, Failures: 0, Errors: 0, Skipped: 0, Time elapsed: 0.327 s - in se.softhouse.common.guavaextensions.Lists2Test
[INFO] Running se.softhouse.common.guavaextensions.Preconditions2Test
[INFO] Tests run: 3, Failures: 0, Errors: 0, Skipped: 0, Time elapsed: 0.342 s - in se.softhouse.common.guavaextensions.Preconditions2Test
[INFO] Running se.softhouse.common.guavaextensions.Suppliers2Test
[INFO] Tests run: 9, Failures: 0, Errors: 0, Skipped: 0, Time elapsed: 0.348 s - in se.softhouse.common.guavaextensions.Suppliers2Test
[INFO] Running se.softhouse.common.strings.StringsUtilTest
[INFO] Tests run: 17, Failures: 0, Errors: 0, Skipped: 0, Time elapsed: 0.251 s - in se.softhouse.common.strings.StringsUtilTest
[INFO] Running se.softhouse.common.guavaextensions.Sets2Test
[INFO] Tests run: 3, Failures: 0, Errors: 0, Skipped: 0, Time elapsed: 0.331 s - in se.softhouse.common.guavaextensions.Sets2Test
[INFO] Running se.softhouse.common.guavaextensions.Functions2Test
[INFO] Tests run: 17, Failures: 0, Errors: 0, Skipped: 0, Time elapsed: 0.32 s - in se.softhouse.common.guavaextensions.Functions2Test
[INFO] Running se.softhouse.common.strings.DescribablesTest
[INFO] Tests run: 9, Failures: 0, Errors: 0, Skipped: 0, Time elapsed: 0.276 s - in se.softhouse.common.strings.DescribablesTest
[INFO] Running se.softhouse.common.guavaextensions.Predicates2Test
[INFO] Tests run: 10, Failures: 0, Errors: 0, Skipped: 0, Time elapsed: 0.367 s - in se.softhouse.common.guavaextensions.Predicates2Test
[INFO] Running com.google.common.collect.testing.testers.MapClearTester
[INFO] Tests run: 3, Failures: 0, Errors: 0, Skipped: 0, Time elapsed: 0.407 s - in com.google.common.collect.testing.testers.MapClearTester
[INFO] Running com.google.common.collect.testing.testers.MapComputeTester
[INFO] Tests run: 15, Failures: 0, Errors: 0, Skipped: 0, Time elapsed: 0.352 s - in com.google.common.collect.testing.testers.MapComputeTester
[INFO] Running com.google.common.collect.testing.testers.MapComputeIfAbsentTester
[INFO] Tests run: 14, Failures: 0, Errors: 0, Skipped: 0, Time elapsed: 0.346 s - in com.google.common.collect.testing.testers.MapComputeIfAbsentTester
[INFO] Running com.google.common.collect.testing.testers.MapComputeIfPresentTester
[INFO] Tests run: 9, Failures: 0, Errors: 0, Skipped: 0, Time elapsed: 0.3 s - in com.google.common.collect.testing.testers.MapComputeIfPresentTester
[INFO] Running com.google.common.collect.testing.testers.MapContainsKeyTester
[INFO] Tests run: 11, Failures: 0, Errors: 0, Skipped: 0, Time elapsed: 0.302 s - in com.google.common.collect.testing.testers.MapContainsKeyTester
[INFO] Running com.google.common.collect.testing.testers.MapContainsValueTester
[INFO] Tests run: 11, Failures: 0, Errors: 0, Skipped: 0, Time elapsed: 0.314 s - in com.google.common.collect.testing.testers.MapContainsValueTester
[INFO] Running com.google.common.collect.testing.testers.MapCreationTester
[INFO] Tests run: 5, Failures: 0, Errors: 0, Skipped: 0, Time elapsed: 0.164 s - in com.google.common.collect.testing.testers.MapCreationTester
[INFO] Running com.google.common.collect.testing.testers.MapEntrySetTester
[INFO] Tests run: 9, Failures: 0, Errors: 0, Skipped: 0, Time elapsed: 0.315 s - in com.google.common.collect.testing.testers.MapEntrySetTester
[INFO] Running com.google.common.collect.testing.testers.MapEqualsTester
[INFO] Tests run: 17, Failures: 0, Errors: 0, Skipped: 0, Time elapsed: 0.315 s - in com.google.common.collect.testing.testers.MapEqualsTester
[INFO] Running com.google.common.collect.testing.testers.MapForEachTester
[INFO] Tests run: 3, Failures: 0, Errors: 0, Skipped: 0, Time elapsed: 0.315 s - in com.google.common.collect.testing.testers.MapForEachTester
[INFO] Running com.google.common.collect.testing.testers.MapGetTester
[INFO] Tests run: 11, Failures: 0, Errors: 0, Skipped: 0, Time elapsed: 0.315 s - in com.google.common.collect.testing.testers.MapGetTester
[INFO] Running com.google.common.collect.testing.testers.MapGetOrDefaultTester
[INFO] Tests run: 16, Failures: 0, Errors: 0, Skipped: 0, Time elapsed: 0.316 s - in com.google.common.collect.testing.testers.MapGetOrDefaultTester
[INFO] Running com.google.common.collect.testing.testers.MapHashCodeTester
[INFO] Tests run: 3, Failures: 0, Errors: 0, Skipped: 0, Time elapsed: 0.316 s - in com.google.common.collect.testing.testers.MapHashCodeTester
[INFO] Running com.google.common.collect.testing.testers.MapIsEmptyTester
[INFO] Tests run: 3, Failures: 0, Errors: 0, Skipped: 0, Time elapsed: 0.316 s - in com.google.common.collect.testing.testers.MapIsEmptyTester
[INFO] Running com.google.common.collect.testing.testers.MapMergeTester
[INFO] Tests run: 15, Failures: 0, Errors: 0, Skipped: 0, Time elapsed: 0.316 s - in com.google.common.collect.testing.testers.MapMergeTester
[INFO] Running com.google.common.collect.testing.testers.MapPutTester
[INFO] Tests run: 13, Failures: 0, Errors: 0, Skipped: 0, Time elapsed: 0.325 s - in com.google.common.collect.testing.testers.MapPutTester
[INFO] Running com.google.common.collect.testing.testers.MapPutAllTester
[INFO] Tests run: 17, Failures: 0, Errors: 0, Skipped: 0, Time elapsed: 0.325 s - in com.google.common.collect.testing.testers.MapPutAllTester
[INFO] Running com.google.common.collect.testing.testers.MapPutIfAbsentTester
[INFO] Tests run: 13, Failures: 0, Errors: 0, Skipped: 0, Time elapsed: 0.326 s - in com.google.common.collect.testing.testers.MapPutIfAbsentTester
[INFO] Running com.google.common.collect.testing.testers.MapRemoveTester
[INFO] Tests run: 11, Failures: 0, Errors: 0, Skipped: 0, Time elapsed: 0.326 s - in com.google.common.collect.testing.testers.MapRemoveTester
[INFO] Running com.google.common.collect.testing.testers.MapRemoveEntryTester
[INFO] Tests run: 17, Failures: 0, Errors: 0, Skipped: 0, Time elapsed: 0.327 s - in com.google.common.collect.testing.testers.MapRemoveEntryTester
[INFO] Running com.google.common.collect.testing.testers.MapReplaceTester
[INFO] Tests run: 15, Failures: 0, Errors: 0, Skipped: 0, Time elapsed: 0.328 s - in com.google.common.collect.testing.testers.MapReplaceTester
[INFO] Running com.google.common.collect.testing.testers.MapReplaceAllTester
[INFO] Tests run: 3, Failures: 0, Errors: 0, Skipped: 0, Time elapsed: 0.329 s - in com.google.common.collect.testing.testers.MapReplaceAllTester
[INFO] Running com.google.common.collect.testing.testers.MapReplaceEntryTester
[INFO] Tests run: 19, Failures: 0, Errors: 0, Skipped: 0, Time elapsed: 0.33 s - in com.google.common.collect.testing.testers.MapReplaceEntryTester
[INFO] Running com.google.common.collect.testing.testers.MapSizeTester
[INFO] Tests run: 3, Failures: 0, Errors: 0, Skipped: 0, Time elapsed: 0.33 s - in com.google.common.collect.testing.testers.MapSizeTester
[INFO] Running com.google.common.collect.testing.testers.MapToStringTester
[INFO] Tests run: 8, Failures: 0, Errors: 0, Skipped: 0, Time elapsed: 0.331 s - in com.google.common.collect.testing.testers.MapToStringTester
[INFO] Running se.softhouse.common.numbers.NumberTypeTest
[INFO] Tests run: 22, Failures: 0, Errors: 0, Skipped: 0, Time elapsed: 0.072 s - in se.softhouse.common.numbers.NumberTypeTest
[INFO] Running se.softhouse.common.collections.CharacterTrieTest
[INFO] Tests run: 17, Failures: 0, Errors: 0, Skipped: 0, Time elapsed: 0.068 s - in se.softhouse.common.collections.CharacterTrieTest
[INFO] Running se.softhouse.common.strings.DescribersTest
[INFO] Tests run: 17, Failures: 0, Errors: 0, Skipped: 0, Time elapsed: 0.246 s - in se.softhouse.common.strings.DescribersTest
[INFO] Running se.softhouse.jargo.IgnoringCaseTest
[INFO] Tests run: 5, Failures: 0, Errors: 0, Skipped: 0, Time elapsed: 0.138 s - in se.softhouse.jargo.IgnoringCaseTest
[INFO] Running se.softhouse.jargo.stringparsers.StringArgumentTest
[INFO] Tests run: 1, Failures: 0, Errors: 0, Skipped: 0, Time elapsed: 0 s - in se.softhouse.jargo.stringparsers.StringArgumentTest
[INFO] Running se.softhouse.jargo.stringparsers.FileArgumentTest
[INFO] Tests run: 4, Failures: 0, Errors: 0, Skipped: 0, Time elapsed: 0.004 s - in se.softhouse.jargo.stringparsers.FileArgumentTest
[INFO] Running se.softhouse.jargo.stringparsers.custom.ForwardingStringParserTest
[INFO] Tests run: 2, Failures: 0, Errors: 0, Skipped: 0, Time elapsed: 0.048 s - in se.softhouse.jargo.stringparsers.custom.ForwardingStringParserTest
[INFO] Running se.softhouse.jargo.stringparsers.CharArgumentTest
[INFO] Tests run: 4, Failures: 0, Errors: 0, Skipped: 0, Time elapsed: 0.037 s - in se.softhouse.jargo.stringparsers.CharArgumentTest
[INFO] Running se.softhouse.jargo.stringparsers.OptionalArgumentTest
[INFO] Tests run: 15, Failures: 0, Errors: 0, Skipped: 0, Time elapsed: 0.01 s - in se.softhouse.jargo.stringparsers.OptionalArgumentTest
[INFO] Running se.softhouse.jargo.stringparsers.BooleanArgumentTest
[INFO] Tests run: 5, Failures: 0, Errors: 0, Skipped: 0, Time elapsed: 0.014 s - in se.softhouse.jargo.stringparsers.BooleanArgumentTest
[INFO] Running se.softhouse.jargo.stringparsers.BigIntegerArgumentTest
[INFO] Tests run: 4, Failures: 0, Errors: 0, Skipped: 0, Time elapsed: 0.036 s - in se.softhouse.jargo.stringparsers.BigIntegerArgumentTest
[INFO] Running se.softhouse.jargo.stringparsers.custom.RollYourOwnStringParserTest
[INFO] Tests run: 2, Failures: 0, Errors: 0, Skipped: 0, Time elapsed: 0.052 s - in se.softhouse.jargo.stringparsers.custom.RollYourOwnStringParserTest
[INFO] Running se.softhouse.jargo.stringparsers.StringParserAsFunctionTest
[INFO] Tests run: 2, Failures: 0, Errors: 0, Skipped: 0, Time elapsed: 0.018 s - in se.softhouse.jargo.stringparsers.StringParserAsFunctionTest
[INFO] Running se.softhouse.jargo.stringparsers.NumberArgumentTest
[INFO] Tests run: 7, Failures: 0, Errors: 0, Skipped: 0, Time elapsed: 0.076 s - in se.softhouse.jargo.stringparsers.NumberArgumentTest
[INFO] Running se.softhouse.jargo.argumentbuilder.CustomArgumentBuilderTest
[INFO] Tests run: 1, Failures: 0, Errors: 0, Skipped: 0, Time elapsed: 0.002 s - in se.softhouse.jargo.argumentbuilder.CustomArgumentBuilderTest
[INFO] Running se.softhouse.jargo.stringparsers.EnumArgumentTest
[INFO] Tests run: 9, Failures: 0, Errors: 0, Skipped: 0, Time elapsed: 0.045 s - in se.softhouse.jargo.stringparsers.EnumArgumentTest
[INFO] Running se.softhouse.jargo.stringparsers.HelpArgumentTest
[INFO] Tests run: 10, Failures: 0, Errors: 0, Skipped: 0, Time elapsed: 0.039 s - in se.softhouse.jargo.stringparsers.HelpArgumentTest
[INFO] Running se.softhouse.jargo.CombinedOptionsTest
[INFO] Tests run: 7, Failures: 0, Errors: 0, Skipped: 0, Time elapsed: 0.027 s - in se.softhouse.jargo.CombinedOptionsTest
[INFO] Running se.softhouse.jargo.TransformTest
[INFO] Tests run: 12, Failures: 0, Errors: 0, Skipped: 0, Time elapsed: 0.014 s - in se.softhouse.jargo.TransformTest
[INFO] Running se.softhouse.jargo.limiters.LimiterTest
[INFO] Tests run: 11, Failures: 0, Errors: 0, Skipped: 0, Time elapsed: 0.009 s - in se.softhouse.jargo.limiters.LimiterTest
[INFO] Running se.softhouse.jargo.exceptions.ArgumentExceptionTest
[INFO] Tests run: 9, Failures: 0, Errors: 0, Skipped: 0, Time elapsed: 0.046 s - in se.softhouse.jargo.exceptions.ArgumentExceptionTest
[INFO] Running se.softhouse.jargo.RequiredArgumentTest
[INFO] Tests run: 6, Failures: 0, Errors: 0, Skipped: 0, Time elapsed: 0.002 s - in se.softhouse.jargo.RequiredArgumentTest
[INFO] Running se.softhouse.jargo.completions.NoCompleterTest
[INFO] Tests run: 1, Failures: 0, Errors: 0, Skipped: 0, Time elapsed: 0.256 s - in se.softhouse.jargo.completions.NoCompleterTest
[INFO] Running se.softhouse.jargo.RepeatedArgumentTest
[INFO] Tests run: 15, Failures: 0, Errors: 0, Skipped: 0, Time elapsed: 0.004 s - in se.softhouse.jargo.RepeatedArgumentTest
[INFO] Running se.softhouse.jargo.IndexedArgumentTest
[INFO] Tests run: 6, Failures: 0, Errors: 0, Skipped: 0, Time elapsed: 0.26 s - in se.softhouse.jargo.IndexedArgumentTest
[INFO] Running se.softhouse.jargo.nonfunctional.MemoryLeakTest
[INFO] Tests run: 1, Failures: 0, Errors: 0, Skipped: 0, Time elapsed: 0.298 s - in se.softhouse.jargo.nonfunctional.MemoryLeakTest
[INFO] Running se.softhouse.jargo.SplitWithTest
[INFO] Tests run: 14, Failures: 0, Errors: 0, Skipped: 0, Time elapsed: 0.003 s - in se.softhouse.jargo.SplitWithTest
[INFO] Running se.softhouse.jargo.completions.BashCompletionTest
[WARNING] Tests run: 13, Failures: 0, Errors: 0, Skipped: 1, Time elapsed: 0.294 s - in se.softhouse.jargo.completions.BashCompletionTest
[INFO] Running se.softhouse.jargo.UsageTest
[INFO] Tests run: 28, Failures: 0, Errors: 0, Skipped: 0, Time elapsed: 0.272 s - in se.softhouse.jargo.UsageTest
[INFO] Running se.softhouse.jargo.FinalizerTest
[INFO] Tests run: 9, Failures: 0, Errors: 0, Skipped: 0, Time elapsed: 0.01 s - in se.softhouse.jargo.FinalizerTest
[INFO] Running se.softhouse.jargo.LocaleTest
[INFO] Tests run: 4, Failures: 0, Errors: 0, Skipped: 0, Time elapsed: 0.003 s - in se.softhouse.jargo.LocaleTest
[INFO] Running se.softhouse.jargo.SeparatorTest
[INFO] Tests run: 12, Failures: 0, Errors: 0, Skipped: 0, Time elapsed: 0.003 s - in se.softhouse.jargo.SeparatorTest
[INFO] Running com.google.common.collect.testing.testers.SetCreationTester
[INFO] Tests run: 2, Failures: 0, Errors: 0, Skipped: 0, Time elapsed: 0.348 s - in com.google.common.collect.testing.testers.SetCreationTester
[INFO] Running com.google.common.collect.testing.testers.SetHashCodeTester
[INFO] Tests run: 6, Failures: 0, Errors: 0, Skipped: 0, Time elapsed: 0.734 s - in com.google.common.collect.testing.testers.SetHashCodeTester
[INFO] Running com.google.common.collect.testing.testers.SetEqualsTester
[INFO] Tests run: 30, Failures: 0, Errors: 0, Skipped: 0, Time elapsed: 0.735 s - in com.google.common.collect.testing.testers.SetEqualsTester
[INFO] Running com.google.common.collect.testing.testers.SetRemoveTester
[INFO] Tests run: 4, Failures: 0, Errors: 0, Skipped: 0, Time elapsed: 0.646 s - in com.google.common.collect.testing.testers.SetRemoveTester
[INFO] Running com.google.common.collect.testing.testers.CollectionAddAllTester
[INFO] Tests run: 30, Failures: 0, Errors: 0, Skipped: 0, Time elapsed: 0.821 s - in com.google.common.collect.testing.testers.CollectionAddAllTester
[INFO] Running com.google.common.collect.testing.testers.CollectionAddTester
[INFO] Tests run: 15, Failures: 0, Errors: 0, Skipped: 0, Time elapsed: 0.823 s - in com.google.common.collect.testing.testers.CollectionAddTester
[INFO] Running com.google.common.collect.testing.testers.CollectionClearTester
[INFO] Tests run: 12, Failures: 0, Errors: 0, Skipped: 0, Time elapsed: 0.825 s - in com.google.common.collect.testing.testers.CollectionClearTester
[INFO] Running com.google.common.collect.testing.testers.CollectionContainsAllTester
[INFO] Tests run: 69, Failures: 0, Errors: 0, Skipped: 0, Time elapsed: 0.85 s - in com.google.common.collect.testing.testers.CollectionContainsAllTester
[INFO] Running com.google.common.collect.testing.testers.CollectionContainsTester
[INFO] Tests run: 33, Failures: 0, Errors: 0, Skipped: 0, Time elapsed: 0.853 s - in com.google.common.collect.testing.testers.CollectionContainsTester
[INFO] Running com.google.common.collect.testing.testers.CollectionCreationTester
[INFO] Tests run: 6, Failures: 0, Errors: 0, Skipped: 0, Time elapsed: 0.714 s - in com.google.common.collect.testing.testers.CollectionCreationTester
[INFO] Running com.google.common.collect.testing.testers.CollectionEqualsTester
[INFO] Tests run: 27, Failures: 0, Errors: 0, Skipped: 0, Time elapsed: 0.864 s - in com.google.common.collect.testing.testers.CollectionEqualsTester
[INFO] Running com.google.common.collect.testing.testers.CollectionForEachTester
[INFO] Tests run: 9, Failures: 0, Errors: 0, Skipped: 0, Time elapsed: 0.865 s - in com.google.common.collect.testing.testers.CollectionForEachTester
[INFO] Running com.google.common.collect.testing.testers.CollectionIsEmptyTester
[INFO] Tests run: 9, Failures: 0, Errors: 0, Skipped: 0, Time elapsed: 0.866 s - in com.google.common.collect.testing.testers.CollectionIsEmptyTester
[INFO] Running com.google.common.collect.testing.testers.CollectionIteratorTester
[INFO] Tests run: 33, Failures: 0, Errors: 0, Skipped: 0, Time elapsed: 0.93 s - in com.google.common.collect.testing.testers.CollectionIteratorTester
[INFO] Running com.google.common.collect.testing.testers.CollectionRemoveAllTester
[INFO] Tests run: 66, Failures: 0, Errors: 0, Skipped: 0, Time elapsed: 0.879 s - in com.google.common.collect.testing.testers.CollectionRemoveAllTester
[INFO] Running com.google.common.collect.testing.testers.CollectionRemoveIfTester
[INFO] Tests run: 24, Failures: 0, Errors: 0, Skipped: 0, Time elapsed: 0.896 s - in com.google.common.collect.testing.testers.CollectionRemoveIfTester
[INFO] Running com.google.common.collect.testing.testers.CollectionRemoveTester
[INFO] Tests run: 36, Failures: 0, Errors: 0, Skipped: 0, Time elapsed: 0.908 s - in com.google.common.collect.testing.testers.CollectionRemoveTester
[INFO] Running com.google.common.collect.testing.testers.CollectionRetainAllTester
[INFO] Tests run: 66, Failures: 0, Errors: 0, Skipped: 0, Time elapsed: 0.918 s - in com.google.common.collect.testing.testers.CollectionRetainAllTester
[INFO] Running com.google.common.collect.testing.testers.CollectionSizeTester
[INFO] Tests run: 9, Failures: 0, Errors: 0, Skipped: 0, Time elapsed: 0.925 s - in com.google.common.collect.testing.testers.CollectionSizeTester
[INFO] Running com.google.common.collect.testing.testers.CollectionSpliteratorTester
[INFO] Tests run: 18, Failures: 0, Errors: 0, Skipped: 0, Time elapsed: 0.927 s - in com.google.common.collect.testing.testers.CollectionSpliteratorTester
[INFO] Running com.google.common.collect.testing.testers.CollectionStreamTester
[INFO] Tests run: 18, Failures: 0, Errors: 0, Skipped: 0, Time elapsed: 0.918 s - in com.google.common.collect.testing.testers.CollectionStreamTester
[INFO] Running com.google.common.collect.testing.testers.CollectionToArrayTester
[INFO] Tests run: 72, Failures: 0, Errors: 0, Skipped: 0, Time elapsed: 0.915 s - in com.google.common.collect.testing.testers.CollectionToArrayTester
[INFO] Running com.google.common.collect.testing.testers.CollectionToStringTester
[INFO] Tests run: 15, Failures: 0, Errors: 0, Skipped: 0, Time elapsed: 0.937 s - in com.google.common.collect.testing.testers.CollectionToStringTester
[INFO] Running se.softhouse.common.classes.ClassesTest
[INFO] Tests run: 4, Failures: 0, Errors: 0, Skipped: 0, Time elapsed: 0.9 s - in se.softhouse.common.classes.ClassesTest
[INFO] Running se.softhouse.jargo.PackagePrivateTest
[INFO] Tests run: 16, Failures: 0, Errors: 0, Skipped: 0, Time elapsed: 0.245 s - in se.softhouse.jargo.PackagePrivateTest
[INFO] Running se.softhouse.jargo.NullPointerTest
[ERROR] Tests run: 2, Failures: 1, Errors: 0, Skipped: 0, Time elapsed: 0.562 s <<< FAILURE! - in se.softhouse.jargo.NullPointerTest
[ERROR] testThatNullContractsAreCheckedEagerly(se.softhouse.jargo.NullPointerTest)  Time elapsed: 0.561 s  <<< FAILURE!
junit.framework.AssertionFailedError: No exception thrown for parameter at index 0 from se.softhouse.jargo.ArgumentBuilder$DefaultArgumentBuilder.public se.softhouse.jargo.ArgumentBuilder se.softhouse.jargo.ArgumentBuilder.limitTo(java.util.function.Predicate,se.softhouse.common.strings.Describable)[null, Dummy proxy for se.softhouse.common.strings.Describable] for class se.softhouse.jargo.ArgumentBuilder
	at se.softhouse.jargo.NullPointerTest.testThatNullContractsAreCheckedEagerly(NullPointerTest.java:56)

[INFO] Running se.softhouse.jargo.nonfunctional.ConcurrencyTest
[INFO] Tests run: 3, Failures: 0, Errors: 0, Skipped: 0, Time elapsed: 1.791 s - in se.softhouse.jargo.nonfunctional.ConcurrencyTest
[INFO] Running se.softhouse.jargo.CommandLineParserTest
[ERROR] Tests run: 31, Failures: 0, Errors: 1, Skipped: 0, Time elapsed: 0.297 s <<< FAILURE! - in se.softhouse.jargo.CommandLineParserTest
[ERROR] testThatReadingFromUnreadableFileThrowsArgumentException(se.softhouse.jargo.CommandLineParserTest)  Time elapsed: 0.001 s  <<< ERROR!
java.lang.IndexOutOfBoundsException: Index: 1, Size: 1
	at se.softhouse.jargo.CommandLineParserTest.testThatReadingFromUnreadableFileThrowsArgumentException(CommandLineParserTest.java:322)

[INFO] Running se.softhouse.jargo.ArityArgumentTest
[INFO] Tests run: 11, Failures: 0, Errors: 0, Skipped: 0, Time elapsed: 0.009 s - in se.softhouse.jargo.ArityArgumentTest
[INFO] Running se.softhouse.jargo.commands.CommandTest
[ERROR] Tests run: 42, Failures: 1, Errors: 0, Skipped: 1, Time elapsed: 0.182 s <<< FAILURE! - in se.softhouse.jargo.commands.CommandTest
[ERROR] testThatLimiterErrorMessageLooksGoodForCommandArguments(se.softhouse.jargo.commands.CommandTest)  Time elapsed: 0.052 s  <<< FAILURE!
org.junit.ComparisonFailure: 
expected:<''[]> but was:<''[no' is not se.softhouse.jargo.commands.CommandTest$$Lambda$133/248114792@1d3c3f6d. See usage for -p for proper values.


-p <string>    <string>: se.softhouse.jargo.commands.CommandTest$$Lambda$133/248114792@1d3c3f6d
               Default: pppp
']>
	at se.softhouse.jargo.commands.CommandTest.testThatLimiterErrorMessageLooksGoodForCommandArguments(CommandTest.java:833)

[INFO] Running se.softhouse.jargo.defaultvalues.DefaultValueTest
[INFO] Tests run: 28, Failures: 0, Errors: 0, Skipped: 0, Time elapsed: 0.039 s - in se.softhouse.jargo.defaultvalues.DefaultValueTest
[INFO] Running se.softhouse.common.PackagePrivateTest
[INFO] Tests run: 1, Failures: 0, Errors: 0, Skipped: 0, Time elapsed: 0.67 s - in se.softhouse.common.PackagePrivateTest
[INFO] Running se.softhouse.jargo.nonfunctional.SecurityTest
[INFO] Tests run: 1, Failures: 0, Errors: 0, Skipped: 0, Time elapsed: 1.842 s - in se.softhouse.jargo.nonfunctional.SecurityTest
[INFO] Running se.softhouse.jargo.PropertyMapTest
[INFO] Tests run: 33, Failures: 0, Errors: 0, Skipped: 0, Time elapsed: 0.029 s - in se.softhouse.jargo.PropertyMapTest
[INFO] Running se.softhouse.jargo.UsagePowerMockTest
[WARNING] Tests run: 1, Failures: 0, Errors: 0, Skipped: 1, Time elapsed: 0 s - in se.softhouse.jargo.UsagePowerMockTest
[INFO] 
[INFO] Results:
[INFO] 
[ERROR] Failures: 
[ERROR]   NullPointerTest.testThatNullContractsAreCheckedEagerly:56 No exception thrown for parameter at index 0 from se.softhouse.jargo.ArgumentBuilder$DefaultArgumentBuilder.public se.softhouse.jargo.ArgumentBuilder se.softhouse.jargo.ArgumentBuilder.limitTo(java.util.function.Predicate,se.softhouse.common.strings.Describable)[null, Dummy proxy for se.softhouse.common.strings.Describable] for class se.softhouse.jargo.ArgumentBuilder
[ERROR]   CommandTest.testThatLimiterErrorMessageLooksGoodForCommandArguments:833 expected:<''[]> but was:<''[no' is not se.softhouse.jargo.commands.CommandTest$$Lambda$133/248114792@1d3c3f6d. See usage for -p for proper values.


-p <string>    <string>: se.softhouse.jargo.commands.CommandTest$$Lambda$133/248114792@1d3c3f6d
               Default: pppp
']>
[ERROR] Errors: 
[ERROR]   CommandLineParserTest.testThatReadingFromUnreadableFileThrowsArgumentException:322 » IndexOutOfBounds
[INFO] 
[ERROR] Tests run: 1393, Failures: 2, Errors: 1, Skipped: 3
[INFO] 
[INFO] ------------------------------------------------------------------------
[INFO] Reactor Summary:
[INFO] 
[INFO] jargo-parent ....................................... SUCCESS [  1.158 s]
[INFO] common-test ........................................ SUCCESS [  5.844 s]
[INFO] jargo .............................................. FAILURE [  8.926 s]
[INFO] jargo-addons ....................................... SKIPPED
[INFO] ------------------------------------------------------------------------
[INFO] BUILD FAILURE
[INFO] ------------------------------------------------------------------------
[INFO] Total time: 16.755 s
[INFO] Finished at: 2018-05-26T13:10:11+02:00
[INFO] Final Memory: 28M/532M
[INFO] ------------------------------------------------------------------------
[ERROR] Failed to execute goal org.apache.maven.plugins:maven-surefire-plugin:2.21.0:test (default-test) on project jargo: There are test failures.
[ERROR] 
[ERROR] Please refer to /root/workspace/jontejj/jargo/384056244/jargo/target/surefire-reports for the individual test results.
[ERROR] Please refer to dump files (if any exist) [date]-jvmRun[N].dump, [date].dumpstream and [date]-jvmRun[N].dumpstream.
[ERROR] -> [Help 1]
[ERROR] 
[ERROR] To see the full stack trace of the errors, re-run Maven with the -e switch.
[ERROR] Re-run Maven using the -X switch to enable full debug logging.
[ERROR] 
[ERROR] For more information about the errors and possible solutions, please read the following articles:
[ERROR] [Help 1] http://cwiki.apache.org/confluence/display/MAVEN/MojoFailureException
[ERROR] 
[ERROR] After correcting the problems, you can resume the build with the command
[ERROR]   mvn <goals> -rf :jargo
