[INFO] Scanning for projects...
[INFO] ------------------------------------------------------------------------
[INFO] Reactor Build Order:
[INFO] 
[INFO] Calcite
[INFO] Calcite Linq4j
[INFO] Calcite Core
[INFO] Calcite Babel
[INFO] Calcite Cassandra
[INFO] Calcite Druid
[INFO] Calcite Elasticsearch
[INFO] Calcite Examples
[INFO] Calcite Example CSV
[INFO] Calcite Example Function
[INFO] Calcite File
[INFO] Calcite Geode
[INFO] Calcite MongoDB
[INFO] Calcite Pig
[INFO] Calcite Piglet
[INFO] Calcite Plus
[INFO] Calcite Server
[INFO] Calcite Spark
[INFO] Calcite Splunk
[INFO] Calcite Ubenchmark
[INFO]                                                                         
[INFO] ------------------------------------------------------------------------
[INFO] Building Calcite 1.18.0-SNAPSHOT
[INFO] ------------------------------------------------------------------------
[INFO] 
[INFO] --- maven-checkstyle-plugin:3.0.0:check (validate) @ calcite ---
[INFO] 
[INFO] --- maven-enforcer-plugin:3.0.0-M2:enforce (enforce-java) @ calcite ---
[INFO] Skipping Rule Enforcement.
[INFO] 
[INFO] --- maven-enforcer-plugin:3.0.0-M2:enforce (enforce-maven-version) @ calcite ---
[INFO] Skipping Rule Enforcement.
[INFO] 
[INFO] --- build-helper-maven-plugin:3.0.0:add-resource (add-resource) @ calcite ---
[INFO] 
[INFO] --- build-helper-maven-plugin:3.0.0:add-test-resource (add-resource) @ calcite ---
[INFO] 
[INFO] --- maven-remote-resources-plugin:1.5:process (process-resource-bundles) @ calcite ---
[INFO] 
[INFO] --- build-helper-maven-plugin:3.0.0:add-test-source (add-test-sources) @ calcite ---
[INFO] Test Source directory: /root/workspace/apache/calcite/432870131/target/generated-test-sources/javacc added.
[INFO]                                                                         
[INFO] ------------------------------------------------------------------------
[INFO] Building Calcite Linq4j 1.18.0-SNAPSHOT
[INFO] ------------------------------------------------------------------------
[INFO] 
[INFO] --- maven-checkstyle-plugin:3.0.0:check (validate) @ calcite-linq4j ---
[INFO] 
[INFO] --- maven-enforcer-plugin:3.0.0-M2:enforce (enforce-java) @ calcite-linq4j ---
[INFO] Skipping Rule Enforcement.
[INFO] 
[INFO] --- maven-enforcer-plugin:3.0.0-M2:enforce (enforce-maven-version) @ calcite-linq4j ---
[INFO] Skipping Rule Enforcement.
[INFO] 
[INFO] --- build-helper-maven-plugin:3.0.0:add-resource (add-resource) @ calcite-linq4j ---
[INFO] 
[INFO] --- build-helper-maven-plugin:3.0.0:add-test-resource (add-resource) @ calcite-linq4j ---
[INFO] 
[INFO] --- maven-remote-resources-plugin:1.5:process (process-resource-bundles) @ calcite-linq4j ---
[INFO] 
[INFO] --- maven-resources-plugin:3.1.0:resources (default-resources) @ calcite-linq4j ---
[INFO] Using 'UTF-8' encoding to copy filtered resources.
[INFO] skip non existing resourceDirectory /root/workspace/apache/calcite/432870131/linq4j/src/main/resources
[INFO] Copying 2 resources to META-INF
[INFO] Copying 1 resource to META-INF
[INFO] 
[INFO] --- maven-compiler-plugin:3.7.0:compile (default-compile) @ calcite-linq4j ---
[INFO] Nothing to compile - all classes are up to date
[INFO] 
[INFO] --- build-helper-maven-plugin:3.0.0:add-test-source (add-test-sources) @ calcite-linq4j ---
[INFO] Test Source directory: /root/workspace/apache/calcite/432870131/linq4j/target/generated-test-sources/javacc added.
[INFO] 
[INFO] --- maven-resources-plugin:3.1.0:testResources (default-testResources) @ calcite-linq4j ---
[INFO] Using 'UTF-8' encoding to copy filtered resources.
[INFO] skip non existing resourceDirectory /root/workspace/apache/calcite/432870131/linq4j/src/test/resources
[INFO] Copying 2 resources to META-INF
[INFO] Copying 1 resource to META-INF
[INFO] 
[INFO] --- maven-compiler-plugin:3.7.0:testCompile (default-testCompile) @ calcite-linq4j ---
[INFO] Nothing to compile - all classes are up to date
[INFO] 
[INFO] --- maven-surefire-plugin:2.22.0:test (default-test) @ calcite-linq4j ---
[INFO] Downloading: https://repo.maven.apache.org/maven2/org/apache/maven/surefire/surefire-junit47/2.22.0/surefire-junit47-2.22.0.pom
[INFO] Downloaded: https://repo.maven.apache.org/maven2/org/apache/maven/surefire/surefire-junit47/2.22.0/surefire-junit47-2.22.0.pom (7 KB at 11.0 KB/sec)
[INFO] Downloading: https://repo.maven.apache.org/maven2/org/apache/maven/surefire/surefire-providers/2.22.0/surefire-providers-2.22.0.pom
[INFO] Downloaded: https://repo.maven.apache.org/maven2/org/apache/maven/surefire/surefire-providers/2.22.0/surefire-providers-2.22.0.pom (3 KB at 67.5 KB/sec)
[INFO] Downloading: https://repo.maven.apache.org/maven2/org/apache/maven/surefire/common-junit48/2.22.0/common-junit48-2.22.0.pom
[INFO] Downloaded: https://repo.maven.apache.org/maven2/org/apache/maven/surefire/common-junit48/2.22.0/common-junit48-2.22.0.pom (4 KB at 68.8 KB/sec)
[INFO] Downloading: https://repo.maven.apache.org/maven2/org/apache/maven/surefire/common-junit4/2.22.0/common-junit4-2.22.0.pom
[INFO] Downloaded: https://repo.maven.apache.org/maven2/org/apache/maven/surefire/common-junit4/2.22.0/common-junit4-2.22.0.pom (3 KB at 46.3 KB/sec)
[INFO] Downloading: https://repo.maven.apache.org/maven2/org/apache/maven/surefire/common-junit3/2.22.0/common-junit3-2.22.0.pom
[INFO] Downloaded: https://repo.maven.apache.org/maven2/org/apache/maven/surefire/common-junit3/2.22.0/common-junit3-2.22.0.pom (2 KB at 39.5 KB/sec)
[INFO] Downloading: https://repo.maven.apache.org/maven2/org/apache/maven/surefire/common-java5/2.22.0/common-java5-2.22.0.pom
[INFO] Downloaded: https://repo.maven.apache.org/maven2/org/apache/maven/surefire/common-java5/2.22.0/common-java5-2.22.0.pom (3 KB at 43.6 KB/sec)
[INFO] Downloading: https://repo.maven.apache.org/maven2/org/apache/maven/shared/maven-shared-utils/0.9/maven-shared-utils-0.9.pom
[INFO] Downloaded: https://repo.maven.apache.org/maven2/org/apache/maven/shared/maven-shared-utils/0.9/maven-shared-utils-0.9.pom (7 KB at 138.2 KB/sec)
[INFO] Downloading: https://repo.maven.apache.org/maven2/org/apache/maven/surefire/surefire-grouper/2.22.0/surefire-grouper-2.22.0.pom
[INFO] Downloaded: https://repo.maven.apache.org/maven2/org/apache/maven/surefire/surefire-grouper/2.22.0/surefire-grouper-2.22.0.pom (3 KB at 54.7 KB/sec)
[INFO] Downloading: https://repo.maven.apache.org/maven2/org/apache/maven/surefire/surefire-junit47/2.22.0/surefire-junit47-2.22.0.jar
[INFO] Downloading: https://repo.maven.apache.org/maven2/org/apache/maven/surefire/common-junit4/2.22.0/common-junit4-2.22.0.jar
[INFO] Downloading: https://repo.maven.apache.org/maven2/org/apache/maven/surefire/common-junit3/2.22.0/common-junit3-2.22.0.jar
[INFO] Downloading: https://repo.maven.apache.org/maven2/org/apache/maven/surefire/common-java5/2.22.0/common-java5-2.22.0.jar
[INFO] Downloading: https://repo.maven.apache.org/maven2/org/apache/maven/surefire/common-junit48/2.22.0/common-junit48-2.22.0.jar
[INFO] Downloaded: https://repo.maven.apache.org/maven2/org/apache/maven/surefire/common-junit3/2.22.0/common-junit3-2.22.0.jar (12 KB at 122.3 KB/sec)
[INFO] Downloading: https://repo.maven.apache.org/maven2/org/apache/maven/shared/maven-shared-utils/0.9/maven-shared-utils-0.9.jar
[INFO] Downloaded: https://repo.maven.apache.org/maven2/org/apache/maven/surefire/common-junit4/2.22.0/common-junit4-2.22.0.jar (28 KB at 274.5 KB/sec)
[INFO] Downloading: https://repo.maven.apache.org/maven2/org/apache/maven/surefire/surefire-grouper/2.22.0/surefire-grouper-2.22.0.jar
[INFO] Downloaded: https://repo.maven.apache.org/maven2/org/apache/maven/surefire/surefire-junit47/2.22.0/surefire-junit47-2.22.0.jar (157 KB at 948.4 KB/sec)
[INFO] Downloaded: https://repo.maven.apache.org/maven2/org/apache/maven/surefire/common-java5/2.22.0/common-java5-2.22.0.jar (50 KB at 290.7 KB/sec)
[INFO] Downloaded: https://repo.maven.apache.org/maven2/org/apache/maven/surefire/common-junit48/2.22.0/common-junit48-2.22.0.jar (22 KB at 149.9 KB/sec)
[INFO] Downloaded: https://repo.maven.apache.org/maven2/org/apache/maven/surefire/surefire-grouper/2.22.0/surefire-grouper-2.22.0.jar (40 KB at 438.7 KB/sec)
[INFO] Downloaded: https://repo.maven.apache.org/maven2/org/apache/maven/shared/maven-shared-utils/0.9/maven-shared-utils-0.9.jar (168 KB at 1352.0 KB/sec)
[INFO] 
[INFO] -------------------------------------------------------
[INFO]  T E S T S
[INFO] -------------------------------------------------------
[INFO] Running org.apache.calcite.linq4j.test.ExpressionTest
[INFO] Tests run: 32, Failures: 0, Errors: 0, Skipped: 0, Time elapsed: 0.193 s - in org.apache.calcite.linq4j.test.ExpressionTest
[INFO] Running org.apache.calcite.linq4j.test.PrimitiveTest
[INFO] Tests run: 9, Failures: 0, Errors: 0, Skipped: 0, Time elapsed: 0.189 s - in org.apache.calcite.linq4j.test.PrimitiveTest
[INFO] Running org.apache.calcite.linq4j.test.Linq4jTest
[INFO] Tests run: 115, Failures: 0, Errors: 0, Skipped: 0, Time elapsed: 0.147 s - in org.apache.calcite.linq4j.test.Linq4jTest
[INFO] Running org.apache.calcite.linq4j.test.OptimizerTest
[INFO] Tests run: 80, Failures: 0, Errors: 0, Skipped: 0, Time elapsed: 0.027 s - in org.apache.calcite.linq4j.test.OptimizerTest
[INFO] Running org.apache.calcite.linq4j.test.InlinerTest
[INFO] Tests run: 9, Failures: 0, Errors: 0, Skipped: 0, Time elapsed: 0.007 s - in org.apache.calcite.linq4j.test.InlinerTest
[INFO] Running org.apache.calcite.linq4j.test.LookupImplTest
[INFO] Tests run: 2, Failures: 0, Errors: 0, Skipped: 0, Time elapsed: 0.006 s - in org.apache.calcite.linq4j.test.LookupImplTest
[INFO] Running org.apache.calcite.linq4j.test.DeterministicTest
[INFO] Tests run: 16, Failures: 0, Errors: 0, Skipped: 0, Time elapsed: 0.009 s - in org.apache.calcite.linq4j.test.DeterministicTest
[INFO] Running org.apache.calcite.linq4j.tree.TypeTest
[INFO] Tests run: 1, Failures: 0, Errors: 0, Skipped: 0, Time elapsed: 0 s - in org.apache.calcite.linq4j.tree.TypeTest
[INFO] Running org.apache.calcite.linq4j.test.CorrelateJoinTest
[INFO] Tests run: 4, Failures: 0, Errors: 0, Skipped: 0, Time elapsed: 0.007 s - in org.apache.calcite.linq4j.test.CorrelateJoinTest
[INFO] Running org.apache.calcite.linq4j.test.BlockBuilderTest
[INFO] Tests run: 5, Failures: 0, Errors: 0, Skipped: 0, Time elapsed: 0.009 s - in org.apache.calcite.linq4j.test.BlockBuilderTest
[INFO] Running org.apache.calcite.linq4j.function.FunctionTest
[INFO] Tests run: 4, Failures: 0, Errors: 0, Skipped: 0, Time elapsed: 0.009 s - in org.apache.calcite.linq4j.function.FunctionTest
[INFO] 
[INFO] Results:
[INFO] 
[INFO] Tests run: 277, Failures: 0, Errors: 0, Skipped: 0
[INFO] 
[INFO]                                                                         
[INFO] ------------------------------------------------------------------------
[INFO] Building Calcite Core 1.18.0-SNAPSHOT
[INFO] ------------------------------------------------------------------------
[INFO] 
[INFO] --- drill-fmpp-maven-plugin:1.14.0:generate (generate-fmpp-sources) @ calcite-core ---
[INFO] Freemarker generation:
 scope: compile,
 config: /root/workspace/apache/calcite/432870131/core/src/main/codegen/config.fmpp,
 templates: /root/workspace/apache/calcite/432870131/core/src/main/codegen/templates
[INFO] Adding maven data loader
.
[INFO] Freemarker generation took 589ms
[INFO] Incremental output update took 0ms
[INFO] new: 0
[INFO] changed: 0
[INFO] unchanged: 1
[INFO] 
[INFO] --- drill-fmpp-maven-plugin:1.14.0:generate (generate-fmpp-test-sources) @ calcite-core ---
[INFO] Freemarker generation:
 scope: test,
 config: /root/workspace/apache/calcite/432870131/core/src/test/codegen/config.fmpp,
 templates: /root/workspace/apache/calcite/432870131/core/src/main/codegen/templates
[INFO] Adding maven data loader
.
[INFO] Freemarker generation took 123ms
[INFO] Incremental output update took 0ms
[INFO] new: 0
[INFO] changed: 0
[INFO] unchanged: 1
[INFO] 
[INFO] --- maven-checkstyle-plugin:3.0.0:check (validate) @ calcite-core ---
[INFO] 
[INFO] --- maven-enforcer-plugin:3.0.0-M2:enforce (enforce-java) @ calcite-core ---
[INFO] Skipping Rule Enforcement.
[INFO] 
[INFO] --- maven-enforcer-plugin:3.0.0-M2:enforce (enforce-maven-version) @ calcite-core ---
[INFO] Skipping Rule Enforcement.
[INFO] 
[INFO] --- javacc-maven-plugin:2.4:javacc (javacc) @ calcite-core ---
[INFO] Skipping - all grammars up to date
[INFO] 
[INFO] --- hydromatic-resource-maven-plugin:0.6:generate-sources (default) @ calcite-core ---
[INFO] /root/workspace/apache/calcite/432870131/core/target/generated-sources/resgen/org/apache/calcite/runtime/Resources.java is up to date
[INFO] 
[INFO] --- build-helper-maven-plugin:3.0.0:add-resource (add-resource) @ calcite-core ---
[INFO] 
[INFO] --- build-helper-maven-plugin:3.0.0:add-test-resource (add-resource) @ calcite-core ---
[INFO] 
[INFO] --- maven-remote-resources-plugin:1.5:process (process-resource-bundles) @ calcite-core ---
[INFO] 
[INFO] --- maven-resources-plugin:3.1.0:resources (default-resources) @ calcite-core ---
[INFO] Using 'UTF-8' encoding to copy filtered resources.
[INFO] Copying 2 resources
[INFO] Copying 4 resources to codegen
[INFO] Copying 1 resource
[INFO] Copying 2 resources to META-INF
[INFO] Copying 1 resource to META-INF
[INFO] 
[INFO] --- maven-compiler-plugin:3.7.0:compile (java-compile) @ calcite-core ---
[INFO] Nothing to compile - all classes are up to date
[INFO] 
[INFO] --- build-helper-maven-plugin:3.0.0:add-test-source (add-test-sources) @ calcite-core ---
[INFO] Test Source directory: /root/workspace/apache/calcite/432870131/core/target/generated-test-sources/javacc added.
[INFO] 
[INFO] --- javacc-maven-plugin:2.4:javacc (javacc-test) @ calcite-core ---
[INFO] Skipping - all grammars up to date
[INFO] 
[INFO] --- maven-resources-plugin:3.1.0:testResources (default-testResources) @ calcite-core ---
[INFO] Using 'UTF-8' encoding to copy filtered resources.
[INFO] Copying 27 resources
[INFO] Copying 2 resources to META-INF
[INFO] Copying 1 resource to META-INF
[INFO] 
[INFO] --- kotlin-maven-plugin:1.2.71:test-compile (test-compile) @ calcite-core ---
[INFO] 
[INFO] --- maven-compiler-plugin:3.7.0:testCompile (java-test-compile) @ calcite-core ---
[INFO] Nothing to compile - all classes are up to date
[INFO] 
[INFO] --- maven-surefire-plugin:2.22.0:test (default-test) @ calcite-core ---
[INFO] 
[INFO] -------------------------------------------------------
[INFO]  T E S T S
[INFO] -------------------------------------------------------
[INFO] Running org.apache.calcite.TestKtTest
[INFO] Tests run: 1, Failures: 0, Errors: 0, Skipped: 0, Time elapsed: 0.058 s - in org.apache.calcite.TestKtTest
[INFO] Running org.apache.calcite.util.ReflectVisitorTest
[INFO] Tests run: 5, Failures: 0, Errors: 0, Skipped: 0, Time elapsed: 0.02 s - in org.apache.calcite.util.ReflectVisitorTest
2018-09-25 12:42:22,558 [pool-1-thread-4] INFO  - open start - state modified
2018-09-25 12:42:22,594 [pool-1-thread-4] INFO  - Checkpoint start
2018-09-25 12:42:22,594 [pool-1-thread-4] INFO  - Checkpoint end - txts: 25
[INFO] Running org.apache.calcite.adapter.clone.ArrayTableTest
[INFO] Tests run: 11, Failures: 0, Errors: 0, Skipped: 0, Time elapsed: 0.416 s - in org.apache.calcite.adapter.clone.ArrayTableTest
[INFO] Running org.apache.calcite.util.BitSetsTest
[INFO] Tests run: 10, Failures: 0, Errors: 0, Skipped: 0, Time elapsed: 0.173 s - in org.apache.calcite.util.BitSetsTest
[INFO] Running org.apache.calcite.util.graph.DirectedGraphTest
[INFO] Tests run: 9, Failures: 0, Errors: 0, Skipped: 0, Time elapsed: 0.105 s - in org.apache.calcite.util.graph.DirectedGraphTest
[INFO] Running org.apache.calcite.plan.RelOptUtilTest
[INFO] Tests run: 5, Failures: 0, Errors: 0, Skipped: 0, Time elapsed: 0.016 s - in org.apache.calcite.plan.RelOptUtilTest
[INFO] Running org.apache.calcite.rel.RelCollationTest
[INFO] Tests run: 2, Failures: 0, Errors: 0, Skipped: 0, Time elapsed: 0.012 s - in org.apache.calcite.rel.RelCollationTest
[INFO] Running org.apache.calcite.util.ImmutableBitSetTest
[INFO] Tests run: 26, Failures: 0, Errors: 0, Skipped: 0, Time elapsed: 0.898 s - in org.apache.calcite.util.ImmutableBitSetTest
[INFO] Running org.apache.calcite.util.PrecedenceClimbingParserTest
[INFO] Tests run: 9, Failures: 0, Errors: 0, Skipped: 0, Time elapsed: 0.019 s - in org.apache.calcite.util.PrecedenceClimbingParserTest
[INFO] Running org.apache.calcite.util.mapping.MappingTest
[INFO] Tests run: 7, Failures: 0, Errors: 0, Skipped: 0, Time elapsed: 0.016 s - in org.apache.calcite.util.mapping.MappingTest
[INFO] Running org.apache.calcite.util.SourceTest
[INFO] Tests run: 5, Failures: 0, Errors: 0, Skipped: 0, Time elapsed: 0.009 s - in org.apache.calcite.util.SourceTest
[INFO] Running org.apache.calcite.test.FilteratorTest
[INFO] Tests run: 4, Failures: 0, Errors: 0, Skipped: 0, Time elapsed: 0.015 s - in org.apache.calcite.test.FilteratorTest
[INFO] Running org.apache.calcite.util.PermutationTestCase
[INFO] Tests run: 5, Failures: 0, Errors: 0, Skipped: 0, Time elapsed: 0.002 s - in org.apache.calcite.util.PermutationTestCase
[INFO] Running org.apache.calcite.test.CalciteResourceTest
[INFO] Tests run: 1, Failures: 0, Errors: 0, Skipped: 0, Time elapsed: 0.002 s - in org.apache.calcite.test.CalciteResourceTest
[INFO] Running org.apache.calcite.test.SqlFunctionsTest
[INFO] Tests run: 34, Failures: 0, Errors: 0, Skipped: 0, Time elapsed: 0.016 s - in org.apache.calcite.test.SqlFunctionsTest
[INFO] Running org.apache.calcite.sql.test.SqlTypeNameTest
[INFO] Tests run: 36, Failures: 0, Errors: 0, Skipped: 0, Time elapsed: 0.026 s - in org.apache.calcite.sql.test.SqlTypeNameTest
[INFO] Running org.apache.calcite.test.ModelTest
[INFO] Tests run: 10, Failures: 0, Errors: 0, Skipped: 0, Time elapsed: 0.964 s - in org.apache.calcite.test.ModelTest
[INFO] Running org.apache.calcite.test.SqlValidatorFeatureTest
[INFO] Tests run: 6, Failures: 0, Errors: 0, Skipped: 0, Time elapsed: 0.202 s - in org.apache.calcite.test.SqlValidatorFeatureTest
[INFO] Running org.apache.calcite.plan.volcano.VolcanoPlannerTraitTest
[WARNING] Tests run: 3, Failures: 0, Errors: 0, Skipped: 2, Time elapsed: 0.446 s - in org.apache.calcite.plan.volcano.VolcanoPlannerTraitTest
[INFO] Running org.apache.calcite.util.TestUtilTest
[INFO] Tests run: 2, Failures: 0, Errors: 0, Skipped: 0, Time elapsed: 0.001 s - in org.apache.calcite.util.TestUtilTest
[INFO] Running org.apache.calcite.test.InterpreterTest
[INFO] Tests run: 12, Failures: 0, Errors: 0, Skipped: 0, Time elapsed: 0.584 s - in org.apache.calcite.test.InterpreterTest
[INFO] Running org.apache.calcite.plan.RelTraitTest
[INFO] Tests run: 3, Failures: 0, Errors: 0, Skipped: 0, Time elapsed: 0.002 s - in org.apache.calcite.plan.RelTraitTest
[INFO] Running org.apache.calcite.plan.volcano.VolcanoPlannerTest
[WARNING] Tests run: 10, Failures: 0, Errors: 0, Skipped: 4, Time elapsed: 0.277 s - in org.apache.calcite.plan.volcano.VolcanoPlannerTest
[INFO] Running org.apache.calcite.rel.RelDistributionTest
[INFO] Tests run: 1, Failures: 0, Errors: 0, Skipped: 0, Time elapsed: 0.003 s - in org.apache.calcite.rel.RelDistributionTest
[INFO] Running org.apache.calcite.plan.volcano.TraitPropagationTest
[INFO] Tests run: 1, Failures: 0, Errors: 0, Skipped: 0, Time elapsed: 0.475 s - in org.apache.calcite.plan.volcano.TraitPropagationTest
[INFO] Running org.apache.calcite.test.RexProgramTest
[WARNING] Tests run: 45, Failures: 0, Errors: 0, Skipped: 1, Time elapsed: 0.586 s - in org.apache.calcite.test.RexProgramTest
[INFO] Running org.apache.calcite.plan.RelWriterTest
LogicalAggregate#479
[INFO] Tests run: 2, Failures: 0, Errors: 0, Skipped: 0, Time elapsed: 0.04 s - in org.apache.calcite.plan.RelWriterTest
[INFO] Running org.apache.calcite.runtime.BinarySearchTest
[INFO] Tests run: 6, Failures: 0, Errors: 0, Skipped: 0, Time elapsed: 0.001 s - in org.apache.calcite.runtime.BinarySearchTest
[INFO] Running org.apache.calcite.test.RexTransformerTest
[INFO] Tests run: 18, Failures: 0, Errors: 0, Skipped: 0, Time elapsed: 0.04 s - in org.apache.calcite.test.RexTransformerTest
[INFO] Running org.apache.calcite.runtime.EnumerablesTest
[INFO] Tests run: 11, Failures: 0, Errors: 0, Skipped: 0, Time elapsed: 0.01 s - in org.apache.calcite.runtime.EnumerablesTest
[INFO] Running org.apache.calcite.test.SqlOperatorBindingTest
[INFO] Tests run: 2, Failures: 0, Errors: 0, Skipped: 0, Time elapsed: 0.002 s - in org.apache.calcite.test.SqlOperatorBindingTest
[INFO] Running org.apache.calcite.plan.RelOptPlanReaderTest
[INFO] Tests run: 1, Failures: 0, Errors: 0, Skipped: 0, Time elapsed: 0.005 s - in org.apache.calcite.plan.RelOptPlanReaderTest
[INFO] Running org.apache.calcite.rex.RexBuilderTest
[INFO] Tests run: 14, Failures: 0, Errors: 0, Skipped: 0, Time elapsed: 0.005 s - in org.apache.calcite.rex.RexBuilderTest
[INFO] Running org.apache.calcite.test.InduceGroupingTypeTest
[INFO] Tests run: 3, Failures: 0, Errors: 0, Skipped: 0, Time elapsed: 0.003 s - in org.apache.calcite.test.InduceGroupingTypeTest
[INFO] Running org.apache.calcite.test.ExceptionMessageTest
[INFO] Tests run: 5, Failures: 0, Errors: 0, Skipped: 0, Time elapsed: 0.188 s - in org.apache.calcite.test.ExceptionMessageTest
[INFO] Running org.apache.calcite.sql.type.SqlTypeFactoryTest
[INFO] Tests run: 6, Failures: 0, Errors: 0, Skipped: 0, Time elapsed: 0.014 s - in org.apache.calcite.sql.type.SqlTypeFactoryTest
[INFO] Running org.apache.calcite.sql.type.SqlTypeUtilTest
[INFO] Tests run: 6, Failures: 0, Errors: 0, Skipped: 0, Time elapsed: 0.004 s - in org.apache.calcite.sql.type.SqlTypeUtilTest
[INFO] Running org.apache.calcite.sql.validate.SqlValidatorUtilTest
[INFO] Tests run: 8, Failures: 0, Errors: 0, Skipped: 0, Time elapsed: 0.006 s - in org.apache.calcite.sql.validate.SqlValidatorUtilTest
[INFO] Running org.apache.calcite.util.UtilTest
[INFO] Tests run: 69, Failures: 0, Errors: 0, Skipped: 0, Time elapsed: 5.41 s - in org.apache.calcite.util.UtilTest
[INFO] Running org.apache.calcite.sql.parser.SqlParserTest
[WARNING] Tests run: 315, Failures: 0, Errors: 0, Skipped: 4, Time elapsed: 0.576 s - in org.apache.calcite.sql.parser.SqlParserTest
[INFO] Running org.apache.calcite.test.HepPlannerTest
[INFO] Tests run: 12, Failures: 0, Errors: 0, Skipped: 0, Time elapsed: 2.795 s - in org.apache.calcite.test.HepPlannerTest
[INFO] Running org.apache.calcite.sql.SqlSetOptionOperatorTest
[INFO] Tests run: 4, Failures: 0, Errors: 0, Skipped: 0, Time elapsed: 0.001 s - in org.apache.calcite.sql.SqlSetOptionOperatorTest
[INFO] Running org.apache.calcite.sql.test.SqlPrettyWriterTest
[WARNING] Tests run: 21, Failures: 0, Errors: 0, Skipped: 1, Time elapsed: 0.055 s - in org.apache.calcite.sql.test.SqlPrettyWriterTest
[INFO] Running org.apache.calcite.test.SqlValidatorDynamicTest
[INFO] Tests run: 5, Failures: 0, Errors: 0, Skipped: 0, Time elapsed: 0.013 s - in org.apache.calcite.test.SqlValidatorDynamicTest
[INFO] Running org.apache.calcite.test.SqlValidatorMatchTest
[INFO] Tests run: 16, Failures: 0, Errors: 0, Skipped: 0, Time elapsed: 0.018 s - in org.apache.calcite.test.SqlValidatorMatchTest
[INFO] Running org.apache.calcite.sql.test.SqlAdvisorTest
[WARNING] Tests run: 37, Failures: 0, Errors: 0, Skipped: 3, Time elapsed: 0.29 s - in org.apache.calcite.sql.test.SqlAdvisorTest
[INFO] Running org.apache.calcite.rel.rules.DateRangeRulesTest
[INFO] Tests run: 27, Failures: 0, Errors: 0, Skipped: 0, Time elapsed: 0.116 s - in org.apache.calcite.rel.rules.DateRangeRulesTest
[INFO] Running org.apache.calcite.test.SqlValidatorTest
[WARNING] Tests run: 385, Failures: 0, Errors: 0, Skipped: 5, Time elapsed: 2.411 s - in org.apache.calcite.test.SqlValidatorTest
[INFO] Running org.apache.calcite.test.RelOptRulesTest
[WARNING] Tests run: 305, Failures: 0, Errors: 0, Skipped: 8, Time elapsed: 9.175 s - in org.apache.calcite.test.RelOptRulesTest
[INFO] Running org.apache.calcite.test.SqlLimitsTest
[INFO] Tests run: 1, Failures: 0, Errors: 0, Skipped: 0, Time elapsed: 0.016 s - in org.apache.calcite.test.SqlLimitsTest
[INFO] Running org.apache.calcite.test.ScannableTableTest
[INFO] Tests run: 16, Failures: 0, Errors: 0, Skipped: 0, Time elapsed: 1.077 s - in org.apache.calcite.test.ScannableTableTest
[INFO] Running org.apache.calcite.test.JdbcFrontLinqBackTest
[WARNING] Tests run: 19, Failures: 0, Errors: 0, Skipped: 1, Time elapsed: 0.581 s - in org.apache.calcite.test.JdbcFrontLinqBackTest
[INFO] Running org.apache.calcite.rex.RexExecutorTest
[INFO] Tests run: 10, Failures: 0, Errors: 0, Skipped: 0, Time elapsed: 1.257 s - in org.apache.calcite.rex.RexExecutorTest
[INFO] Running org.apache.calcite.test.JdbcFrontJdbcBackTest
2018-09-25 12:42:42,522 [pool-1-thread-8] INFO  - open start - state modified
2018-09-25 12:42:53,601 [pool-1-thread-8] INFO  - Checkpoint start
2018-09-25 12:42:53,601 [pool-1-thread-8] INFO  - Checkpoint end - txts: 279
[WARNING] Tests run: 6, Failures: 0, Errors: 0, Skipped: 1, Time elapsed: 11.367 s - in org.apache.calcite.test.JdbcFrontJdbcBackTest
[INFO] Running org.apache.calcite.test.SqlToRelConverterTest
[WARNING] Tests run: 342, Failures: 0, Errors: 0, Skipped: 4, Time elapsed: 14.12 s - in org.apache.calcite.test.SqlToRelConverterTest
[INFO] Running org.apache.calcite.rel.rel2sql.RelToSqlConverterTest
[INFO] Tests run: 142, Failures: 0, Errors: 0, Skipped: 0, Time elapsed: 1.898 s - in org.apache.calcite.rel.rel2sql.RelToSqlConverterTest
[INFO] Running org.apache.calcite.tools.FrameworksTest
[INFO] Tests run: 7, Failures: 0, Errors: 0, Skipped: 0, Time elapsed: 0.143 s - in org.apache.calcite.tools.FrameworksTest
[INFO] Running org.apache.calcite.sql.test.SqlOperatorTest
[WARNING] Tests run: 227, Failures: 0, Errors: 0, Skipped: 1, Time elapsed: 2.863 s - in org.apache.calcite.sql.test.SqlOperatorTest
[INFO] Running org.apache.calcite.prepare.LookupOperatorOverloadsTest
[INFO] Tests run: 5, Failures: 0, Errors: 0, Skipped: 0, Time elapsed: 0.027 s - in org.apache.calcite.prepare.LookupOperatorOverloadsTest
[INFO] Running org.apache.calcite.plan.volcano.TraitConversionTest
[INFO] Tests run: 1, Failures: 0, Errors: 0, Skipped: 0, Time elapsed: 0.099 s - in org.apache.calcite.plan.volcano.TraitConversionTest
[INFO] Running org.apache.calcite.test.enumerable.EnumerableCorrelateTest
[INFO] Tests run: 2, Failures: 0, Errors: 0, Skipped: 0, Time elapsed: 0.454 s - in org.apache.calcite.test.enumerable.EnumerableCorrelateTest
[INFO] Running org.apache.calcite.plan.volcano.CollationConversionTest
[INFO] Tests run: 1, Failures: 0, Errors: 0, Skipped: 0, Time elapsed: 0.105 s - in org.apache.calcite.plan.volcano.CollationConversionTest
[INFO] Running org.apache.calcite.plan.volcano.ComboRuleTest
[INFO] Tests run: 1, Failures: 0, Errors: 0, Skipped: 0, Time elapsed: 0.03 s - in org.apache.calcite.plan.volcano.ComboRuleTest
[INFO] Running org.apache.calcite.sql.validate.LexCaseSensitiveTest
[INFO] Tests run: 15, Failures: 0, Errors: 0, Skipped: 0, Time elapsed: 0.281 s - in org.apache.calcite.sql.validate.LexCaseSensitiveTest
[INFO] Running org.apache.calcite.test.MutableRelTest
[INFO] Tests run: 18, Failures: 0, Errors: 0, Skipped: 0, Time elapsed: 0.057 s - in org.apache.calcite.test.MutableRelTest
[INFO] Running org.apache.calcite.test.UdtTest
[INFO] Tests run: 1, Failures: 0, Errors: 0, Skipped: 0, Time elapsed: 0.018 s - in org.apache.calcite.test.UdtTest
[INFO] Running org.apache.calcite.test.UdfTest
[WARNING] Tests run: 25, Failures: 0, Errors: 0, Skipped: 1, Time elapsed: 1.447 s - in org.apache.calcite.test.UdfTest
[INFO] Running org.apache.calcite.test.TableFunctionTest
[WARNING] Tests run: 18, Failures: 0, Errors: 0, Skipped: 3, Time elapsed: 0.31 s - in org.apache.calcite.test.TableFunctionTest
[INFO] Running org.apache.calcite.util.ChunkListTest
[INFO] Tests run: 5, Failures: 0, Errors: 0, Skipped: 0, Time elapsed: 4.446 s - in org.apache.calcite.util.ChunkListTest
[INFO] Running org.apache.calcite.test.RelBuilderTest
[WARNING] Tests run: 98, Failures: 0, Errors: 0, Skipped: 1, Time elapsed: 1.511 s - in org.apache.calcite.test.RelBuilderTest
[INFO] Running org.apache.calcite.test.PigRelBuilderTest
[INFO] Tests run: 22, Failures: 0, Errors: 0, Skipped: 0, Time elapsed: 0.115 s - in org.apache.calcite.test.PigRelBuilderTest
[INFO] Running org.apache.calcite.test.RexImplicationCheckerTest
2018-09-25 12:43:07,783 [pool-1-thread-4] WARN  - BOOLEAN for value of class class java.lang.Boolean is being handled in default way
2018-09-25 12:43:07,807 [pool-1-thread-2] WARN  - $11 is not handled for null for checking implication
2018-09-25 12:43:07,816 [pool-1-thread-2] WARN  - $11 is not handled for null for checking implication
2018-09-25 12:43:07,825 [pool-1-thread-2] WARN  - $11 is not handled for null for checking implication
2018-09-25 12:43:07,825 [pool-1-thread-2] WARN  - $11 is not handled for null for checking implication
2018-09-25 12:43:07,825 [pool-1-thread-2] WARN  - $11 is not handled for null for checking implication
[INFO] Tests run: 19, Failures: 0, Errors: 0, Skipped: 0, Time elapsed: 0.208 s - in org.apache.calcite.test.RexImplicationCheckerTest
[INFO] Running org.apache.calcite.tools.PlannerTest
[WARNING] Tests run: 39, Failures: 0, Errors: 0, Skipped: 1, Time elapsed: 7.889 s - in org.apache.calcite.tools.PlannerTest
[INFO] Running org.apache.calcite.test.JdbcAdapterTest
[INFO] Tests run: 34, Failures: 0, Errors: 0, Skipped: 0, Time elapsed: 5.208 s - in org.apache.calcite.test.JdbcAdapterTest
[INFO] Running org.apache.calcite.test.LinqFrontJdbcBackTest
[INFO] Tests run: 1, Failures: 0, Errors: 0, Skipped: 0, Time elapsed: 0.058 s - in org.apache.calcite.test.LinqFrontJdbcBackTest
[INFO] Running org.apache.calcite.test.JdbcFrontJdbcBackLinqMiddleTest
[WARNING] Tests run: 14, Failures: 0, Errors: 0, Skipped: 4, Time elapsed: 1.095 s - in org.apache.calcite.test.JdbcFrontJdbcBackLinqMiddleTest
[INFO] Running org.apache.calcite.test.CalciteSqlOperatorTest
[WARNING] Tests run: 227, Failures: 0, Errors: 0, Skipped: 1, Time elapsed: 23.574 s - in org.apache.calcite.test.CalciteSqlOperatorTest
[INFO] Running org.apache.calcite.profile.ProfilerTest
[WARNING] Tests run: 10, Failures: 0, Errors: 0, Skipped: 2, Time elapsed: 0.619 s - in org.apache.calcite.profile.ProfilerTest
[INFO] Running org.apache.calcite.test.fuzzer.RexProgramFuzzyTest
2018-09-25 12:44:17,879 [pool-1-thread-6] INFO  - Using seed 44 for rex fuzzing
2018-09-25 12:44:17,892 [pool-1-thread-6] INFO  - Rex fuzzing results: number of cases tested=18, failed cases=0, duplicate failures=0, fuzz rate=1384 per second
2018-09-25 12:44:17,907 [pool-1-thread-6] INFO  - Rex fuzzing results: number of cases tested=9, failed cases=1, duplicate failures=0, fuzz rate=600 per second
2018-09-25 12:44:17,911 [pool-1-thread-6] INFO  - Randomized test identified a potential defect. Feel free to fix that issue
java.lang.AssertionError: COALESCE(CASE(=(IS DISTINCT FROM(?0.int0, -(CAST(-1):INTEGER, null)), >(+(?0.notNullInt0), CASE(true, 0, null))), IS NOT NULL(-(CAST(-1):INTEGER)), =(IS DISTINCT FROM(?0.int0, -(CAST(-1):INTEGER, null)), true), CASE(=(+(?0.int1), COALESCE(null, 100500)), IS NOT NULL(?0.int0), =(+(?0.int1), CASE(=(true, ?0.notNullBool1), ?0.notNullInt0, null)), IS TRUE(IS TRUE(true)), OR(>=(null, CAST(1):INTEGER), CASE(=(?0.notNullBool0, ?0.notNullBool0), true, ?0.notNullBool0), CASE(=(?0.notNullBool0, false), ?0.bool1, ?0.bool1), AND(false, ?0.bool0))), =(IS DISTINCT FROM(?0.int0, -(CAST(-1):INTEGER, null)), >=(IS NOT DISTINCT FROM(?0.notNullInt1, ?0.int0), true)), CASE(>(true, ?0.bool0), >=(>(?0.int1, -1), <(?0.notNullInt0, ?0.int1)), IS NOT NULL(true), true, IS NOT UNKNOWN(?0.notNullBool1), >=(+(null), null), IS UNKNOWN(NOT(true))), CASE(=(IS DISTINCT FROM(true, ?0.bool1), >(?0.notNullBool1, ?0.notNullBool1)), IS NOT UNKNOWN(>(?0.int1, CAST(100500):INTEGER)), =(IS DISTINCT FROM(true, ?0.bool1), CASE(=(?0.bool0, ?0.notNullBool1), ?0.bool0, true)), false, IS DISTINCT FROM(COALESCE(false, ?0.notNullBool0, false, false), CASE(false, ?0.notNullBool1, ?0.bool1)))), CASE(?0.notNullBool1, CASE(IS DISTINCT FROM(false, ?0.bool1), ?0.bool1, IS NOT DISTINCT FROM(*(null, 100500), -(?0.int1, null))), <>(<=(null, ?0.int0), AND(true, true, ?0.notNullBool1, true)), OR(IS NOT TRUE(IS NOT NULL(CAST(-1599881099):INTEGER)), IS DISTINCT FROM(NOT(false), IS NOT UNKNOWN(100500)), AND(?0.bool0, IS NOT NULL(false), CASE(true, ?0.notNullBool0, true)), OR(<(null, ?0.int0), false, IS FALSE(?0.notNullBool0), IS TRUE(?0.bool1))), ?0.notNullBool1, <(CAST(-1):INTEGER, -(-(null), *(null, CAST(100500):INTEGER))), IS FALSE(<(CASE(=(true, ?0.notNullBool0), CAST(0):INTEGER, null), null))), IS NOT NULL(AND(=(IS NOT NULL(null), CASE(=(?0.notNullInt0, null), false, ?0.bool0)), ?0.notNullBool1, ?0.notNullBool0, >=(IS NOT UNKNOWN(?0.notNullInt1), true))))
coalesce(case_(eq(isDistinctFrom(vInt(0), sub(rexBuilder.makeCall(SqlStdOperatorTable.CAST, literal(-1)), nullInt)), gt(unaryPlus(vIntNotNull(0)), case_(trueLiteral, literal(0), nullInt))), isNotNull(unaryMinus(rexBuilder.makeCall(SqlStdOperatorTable.CAST, literal(-1)))), eq(isDistinctFrom(vInt(0), sub(rexBuilder.makeCall(SqlStdOperatorTable.CAST, literal(-1)), nullInt)), trueLiteral), case_(eq(unaryPlus(vInt(1)), coalesce(nullInt, literal(100500))), isNotNull(vInt(0)), eq(unaryPlus(vInt(1)), case_(eq(trueLiteral, vBoolNotNull(1)), vIntNotNull(0), nullInt)), isTrue(isTrue(trueLiteral)), or(ge(nullInt, rexBuilder.makeCall(SqlStdOperatorTable.CAST, literal(1))), case_(eq(vBoolNotNull(0), vBoolNotNull(0)), trueLiteral, vBoolNotNull(0)), case_(eq(vBoolNotNull(0), falseLiteral), vBool(1), vBool(1)), and(falseLiteral, vBool(0)))), eq(isDistinctFrom(vInt(0), sub(rexBuilder.makeCall(SqlStdOperatorTable.CAST, literal(-1)), nullInt)), ge(isNotDistinctFrom(vIntNotNull(1), vInt(0)), trueLiteral)), case_(gt(trueLiteral, vBool(0)), ge(gt(vInt(1), literal(-1)), lt(vIntNotNull(0), vInt(1))), isNotNull(trueLiteral), trueLiteral, rexBuilder.makeCall(SqlStdOperatorTable.IS_NOT_UNKNOWN, vBoolNotNull(1)), ge(unaryPlus(nullInt), nullInt), isUnknown(not(trueLiteral))), case_(eq(isDistinctFrom(trueLiteral, vBool(1)), gt(vBoolNotNull(1), vBoolNotNull(1))), rexBuilder.makeCall(SqlStdOperatorTable.IS_NOT_UNKNOWN, gt(vInt(1), rexBuilder.makeCall(SqlStdOperatorTable.CAST, literal(100500)))), eq(isDistinctFrom(trueLiteral, vBool(1)), case_(eq(vBool(0), vBoolNotNull(1)), vBool(0), trueLiteral)), falseLiteral, isDistinctFrom(coalesce(falseLiteral, vBoolNotNull(0), falseLiteral, falseLiteral), case_(falseLiteral, vBoolNotNull(1), vBool(1))))), case_(vBoolNotNull(1), case_(isDistinctFrom(falseLiteral, vBool(1)), vBool(1), isNotDistinctFrom(rexBuilder.makeCall(SqlStdOperatorTable.*, nullInt, literal(100500)), sub(vInt(1), nullInt))), ne(le(nullInt, vInt(0)), and(trueLiteral, trueLiteral, vBoolNotNull(1), trueLiteral)), or(isNotTrue(isNotNull(rexBuilder.makeCall(SqlStdOperatorTable.CAST, literal(-1599881099)))), isDistinctFrom(not(falseLiteral), rexBuilder.makeCall(SqlStdOperatorTable.IS_NOT_UNKNOWN, literal(100500))), and(vBool(0), isNotNull(falseLiteral), case_(trueLiteral, vBoolNotNull(0), trueLiteral)), or(lt(nullInt, vInt(0)), falseLiteral, isFalse(vBoolNotNull(0)), isTrue(vBool(1)))), vBoolNotNull(1), lt(rexBuilder.makeCall(SqlStdOperatorTable.CAST, literal(-1)), sub(unaryMinus(nullInt), rexBuilder.makeCall(SqlStdOperatorTable.*, nullInt, rexBuilder.makeCall(SqlStdOperatorTable.CAST, literal(100500))))), isFalse(lt(case_(eq(trueLiteral, vBoolNotNull(0)), rexBuilder.makeCall(SqlStdOperatorTable.CAST, literal(0)), nullInt), nullInt))), isNotNull(and(eq(isNotNull(nullInt), case_(eq(vIntNotNull(0), nullInt), falseLiteral, vBool(0))), vBoolNotNull(1), vBoolNotNull(0), ge(rexBuilder.makeCall(SqlStdOperatorTable.IS_NOT_UNKNOWN, vIntNotNull(1)), trueLiteral)))) had non-nullable type BOOLEAN, and it was optimized to CASE(=(IS DISTINCT FROM(?0.int0, -(CAST(-1):INTEGER, null)), >(+(?0.notNullInt0), CASE(true, 0, null))), IS NOT NULL(-(CAST(-1):INTEGER)), =(IS DISTINCT FROM(?0.int0, -(CAST(-1):INTEGER, null)), true), CASE(=(+(?0.int1), COALESCE(null, 100500)), IS NOT NULL(?0.int0), =(+(?0.int1), CASE(=(true, ?0.notNullBool1), ?0.notNullInt0, null)), IS TRUE(IS TRUE(true)), OR(>=(null, CAST(1):INTEGER), CASE(=(?0.notNullBool0, ?0.notNullBool0), true, ?0.notNullBool0), CASE(=(?0.notNullBool0, false), ?0.bool1, ?0.bool1), AND(false, ?0.bool0))), =(IS DISTINCT FROM(?0.int0, -(CAST(-1):INTEGER, null)), >=(IS NOT DISTINCT FROM(?0.notNullInt1, ?0.int0), true)), CASE(>(true, ?0.bool0), >=(>(?0.int1, -1), <(?0.notNullInt0, ?0.int1)), IS NOT NULL(true), true, IS NOT UNKNOWN(?0.notNullBool1), >=(+(null), null), IS UNKNOWN(NOT(true))), CASE(=(IS DISTINCT FROM(true, ?0.bool1), >(?0.notNullBool1, ?0.notNullBool1)), IS NOT UNKNOWN(>(?0.int1, CAST(100500):INTEGER)), =(IS DISTINCT FROM(true, ?0.bool1), CASE(=(?0.bool0, ?0.notNullBool1), ?0.bool0, true)), false, IS DISTINCT FROM(COALESCE(false, ?0.notNullBool0, false, false), CASE(false, ?0.notNullBool1, ?0.bool1))))
case_(eq(isDistinctFrom(vInt(0), sub(rexBuilder.makeCall(SqlStdOperatorTable.CAST, literal(-1)), nullInt)), gt(unaryPlus(vIntNotNull(0)), case_(trueLiteral, literal(0), nullInt))), isNotNull(unaryMinus(rexBuilder.makeCall(SqlStdOperatorTable.CAST, literal(-1)))), eq(isDistinctFrom(vInt(0), sub(rexBuilder.makeCall(SqlStdOperatorTable.CAST, literal(-1)), nullInt)), trueLiteral), case_(eq(unaryPlus(vInt(1)), coalesce(nullInt, literal(100500))), isNotNull(vInt(0)), eq(unaryPlus(vInt(1)), case_(eq(trueLiteral, vBoolNotNull(1)), vIntNotNull(0), nullInt)), isTrue(isTrue(trueLiteral)), or(ge(nullInt, rexBuilder.makeCall(SqlStdOperatorTable.CAST, literal(1))), case_(eq(vBoolNotNull(0), vBoolNotNull(0)), trueLiteral, vBoolNotNull(0)), case_(eq(vBoolNotNull(0), falseLiteral), vBool(1), vBool(1)), and(falseLiteral, vBool(0)))), eq(isDistinctFrom(vInt(0), sub(rexBuilder.makeCall(SqlStdOperatorTable.CAST, literal(-1)), nullInt)), ge(isNotDistinctFrom(vIntNotNull(1), vInt(0)), trueLiteral)), case_(gt(trueLiteral, vBool(0)), ge(gt(vInt(1), literal(-1)), lt(vIntNotNull(0), vInt(1))), isNotNull(trueLiteral), trueLiteral, rexBuilder.makeCall(SqlStdOperatorTable.IS_NOT_UNKNOWN, vBoolNotNull(1)), ge(unaryPlus(nullInt), nullInt), isUnknown(not(trueLiteral))), case_(eq(isDistinctFrom(trueLiteral, vBool(1)), gt(vBoolNotNull(1), vBoolNotNull(1))), rexBuilder.makeCall(SqlStdOperatorTable.IS_NOT_UNKNOWN, gt(vInt(1), rexBuilder.makeCall(SqlStdOperatorTable.CAST, literal(100500)))), eq(isDistinctFrom(trueLiteral, vBool(1)), case_(eq(vBool(0), vBoolNotNull(1)), vBool(0), trueLiteral)), falseLiteral, isDistinctFrom(coalesce(falseLiteral, vBoolNotNull(0), falseLiteral, falseLiteral), case_(falseLiteral, vBoolNotNull(1), vBool(1))))) that has nullable type BOOLEAN, unknownAsFalse 
	at org.junit.Assert.fail(Assert.java:88)
	at org.apache.calcite.test.fuzzer.RexProgramFuzzyTest.checkTrueFalse(RexProgramFuzzyTest.java:248)
	at org.apache.calcite.test.fuzzer.RexProgramFuzzyTest.checkTrueFalse(RexProgramFuzzyTest.java:163)
	at org.apache.calcite.test.fuzzer.RexProgramFuzzyTest.generateRexAndCheckTrueFalse(RexProgramFuzzyTest.java:382)
	Suppressed: org.apache.calcite.test.fuzzer.RexProgramFuzzyTest$1: seed 3576329063111429699
[WARNING] Tests run: 4, Failures: 0, Errors: 0, Skipped: 2, Time elapsed: 0.034 s - in org.apache.calcite.test.fuzzer.RexProgramFuzzyTest
[INFO] Running org.apache.calcite.test.ReflectiveSchemaTest
[WARNING] Tests run: 31, Failures: 0, Errors: 0, Skipped: 5, Time elapsed: 12.01 s - in org.apache.calcite.test.ReflectiveSchemaTest
2018-09-25 12:45:42,162 [pool-1-thread-4] INFO  - Logging initialized @203071ms
2018-09-25 12:45:42,244 [pool-1-thread-4] INFO  - jetty-9.2.19.v20160908
2018-09-25 12:45:42,325 [pool-1-thread-4] INFO  - Started ServerConnector@107a42d0{HTTP/1.1}{0.0.0.0:36984}
2018-09-25 12:45:42,326 [pool-1-thread-4] INFO  - Started @203234ms
2018-09-25 12:45:42,326 [pool-1-thread-4] INFO  - Service listening on port 36984.
2018-09-25 12:45:44,609 [pool-1-thread-4] INFO  - Service terminating.
2018-09-25 12:45:44,620 [pool-1-thread-4] INFO  - Stopped ServerConnector@107a42d0{HTTP/1.1}{0.0.0.0:0}
[INFO] Running org.apache.calcite.jdbc.CalciteRemoteDriverTest
[INFO] Tests run: 28, Failures: 0, Errors: 0, Skipped: 0, Time elapsed: 1.386 s - in org.apache.calcite.jdbc.CalciteRemoteDriverTest
[INFO] Running org.apache.calcite.test.StreamTest
[WARNING] Tests run: 9, Failures: 0, Errors: 0, Skipped: 2, Time elapsed: 0.575 s - in org.apache.calcite.test.StreamTest
[INFO] Running org.apache.calcite.test.TableInRootSchemaTest
[INFO] Tests run: 1, Failures: 0, Errors: 0, Skipped: 0, Time elapsed: 0.021 s - in org.apache.calcite.test.TableInRootSchemaTest
[INFO] Running org.apache.calcite.test.SqlAdvisorJdbcTest
[INFO] Tests run: 8, Failures: 0, Errors: 0, Skipped: 0, Time elapsed: 0.251 s - in org.apache.calcite.test.SqlAdvisorJdbcTest
[INFO] Running org.apache.calcite.test.JdbcTest
[WARNING] Tests run: 279, Failures: 0, Errors: 0, Skipped: 18, Time elapsed: 29.985 s - in org.apache.calcite.test.JdbcTest
[INFO] Running org.apache.calcite.test.MultiJdbcSchemaJoinTest
[INFO] Tests run: 6, Failures: 0, Errors: 0, Skipped: 0, Time elapsed: 0.715 s - in org.apache.calcite.test.MultiJdbcSchemaJoinTest
[INFO] Running org.apache.calcite.test.RelMdColumnOriginsTest
[INFO] Tests run: 1, Failures: 0, Errors: 0, Skipped: 0, Time elapsed: 0.046 s - in org.apache.calcite.test.RelMdColumnOriginsTest
[INFO] Running org.apache.calcite.test.CollectionTypeTest
[INFO] Tests run: 12, Failures: 0, Errors: 0, Skipped: 0, Time elapsed: 0.192 s - in org.apache.calcite.test.CollectionTypeTest
[INFO] Running org.apache.calcite.test.SqlLineTest
[INFO] Tests run: 1, Failures: 0, Errors: 0, Skipped: 0, Time elapsed: 0.08 s - in org.apache.calcite.test.SqlLineTest
[INFO] Running org.apache.calcite.test.LatticeTest
2018-09-25 12:44:21,245 [pool-1-thread-5] WARN  - PoolableConnectionFactory not linked to pool. Calling setPool() to fix the configuration.
[WARNING] Tests run: 38, Failures: 0, Errors: 0, Skipped: 2, Time elapsed: 113.632 s - in org.apache.calcite.test.LatticeTest
[INFO] Running org.apache.calcite.test.SqlToRelConverterExtendedTest
[WARNING] Tests run: 342, Failures: 0, Errors: 0, Skipped: 4, Time elapsed: 11.088 s - in org.apache.calcite.test.SqlToRelConverterExtendedTest
[INFO] Running org.apache.calcite.sql.parser.parserextensiontesting.ExtensionSqlParserTest
[WARNING] Tests run: 319, Failures: 0, Errors: 0, Skipped: 6, Time elapsed: 0.915 s - in org.apache.calcite.sql.parser.parserextensiontesting.ExtensionSqlParserTest
[INFO] Running org.apache.calcite.util.PartiallyOrderedSetTest
[WARNING] Tests run: 15, Failures: 0, Errors: 0, Skipped: 2, Time elapsed: 1.147 s - in org.apache.calcite.util.PartiallyOrderedSetTest
[INFO] Running org.apache.calcite.sql.parser.SqlUnParserTest
[WARNING] Tests run: 315, Failures: 0, Errors: 0, Skipped: 6, Time elapsed: 0.676 s - in org.apache.calcite.sql.parser.SqlUnParserTest
[INFO] Running org.apache.calcite.test.RelMetadataTest
[WARNING] Tests run: 140, Failures: 0, Errors: 0, Skipped: 7, Time elapsed: 5.095 s - in org.apache.calcite.test.RelMetadataTest
[INFO] Running org.apache.calcite.test.CoreQuidemTest
[ERROR] Tests run: 16, Failures: 0, Errors: 1, Skipped: 0, Time elapsed: 31.957 s <<< FAILURE! - in org.apache.calcite.test.CoreQuidemTest
[ERROR] test[1: quidem(sql/misc.iq)](org.apache.calcite.test.CoreQuidemTest)  Time elapsed: 9.976 s  <<< ERROR!
java.lang.reflect.InvocationTargetException
	at org.apache.calcite.test.CoreQuidemTest.testSqlMisc(CoreQuidemTest.java:67)

[INFO] Running org.apache.calcite.test.MaterializationTest
[ERROR] Tests run: 130, Failures: 1, Errors: 0, Skipped: 17, Time elapsed: 127.663 s <<< FAILURE! - in org.apache.calcite.test.MaterializationTest
[ERROR] testAggregateRollUp(org.apache.calcite.test.MaterializationTest)  Time elapsed: 0.068 s  <<< FAILURE!
java.lang.AssertionError: 

Expected: a string containing "EnumerableCalc(expr#0..1=[{inputs}], expr#2=[1], expr#3=[+($t1, $t2)], $f0=[$t3], deptno=[$t0])\n  EnumerableAggregate(group=[{1}], agg#0=[$SUM0($2)])\n    EnumerableTableScan(table=[[hr, m0]])"
     but: was "PLAN=EnumerableCalc(expr#0..1=[{inputs}], expr#2=[1], expr#3=[+($t1, $t2)], C=[$t3], deptno=[$t0])\n  EnumerableAggregate(group=[{1}], agg#0=[$SUM0($2)])\n    EnumerableTableScan(table=[[hr, m0]])\n\n"
	at org.apache.calcite.test.MaterializationTest.checkThatMaterialize(MaterializationTest.java:232)
	at org.apache.calcite.test.MaterializationTest.checkMaterialize(MaterializationTest.java:207)
	at org.apache.calcite.test.MaterializationTest.checkMaterialize(MaterializationTest.java:200)
	at org.apache.calcite.test.MaterializationTest.testAggregateRollUp(MaterializationTest.java:541)

[INFO] 
[INFO] Results:
[INFO] 
[ERROR] Failures: 
[ERROR]   MaterializationTest.testAggregateRollUp:541->checkMaterialize:200->checkMaterialize:207->checkThatMaterialize:232 
Expected: a string containing "EnumerableCalc(expr#0..1=[{inputs}], expr#2=[1], expr#3=[+($t1, $t2)], $f0=[$t3], deptno=[$t0])\n  EnumerableAggregate(group=[{1}], agg#0=[$SUM0($2)])\n    EnumerableTableScan(table=[[hr, m0]])"
     but: was "PLAN=EnumerableCalc(expr#0..1=[{inputs}], expr#2=[1], expr#3=[+($t1, $t2)], C=[$t3], deptno=[$t0])\n  EnumerableAggregate(group=[{1}], agg#0=[$SUM0($2)])\n    EnumerableTableScan(table=[[hr, m0]])\n\n"
[ERROR] Errors: 
[ERROR]   CoreQuidemTest>QuidemTest.test:197 » InvocationTarget
[INFO] 
[ERROR] Tests run: 4562, Failures: 1, Errors: 1, Skipped: 119
[INFO] 
[INFO] ------------------------------------------------------------------------
[INFO] Reactor Summary:
[INFO] 
[INFO] Calcite ............................................ SUCCESS [  1.612 s]
[INFO] Calcite Linq4j ..................................... SUCCESS [  5.181 s]
[INFO] Calcite Core ....................................... FAILURE [04:07 min]
[INFO] Calcite Babel ...................................... SKIPPED
[INFO] Calcite Cassandra .................................. SKIPPED
[INFO] Calcite Druid ...................................... SKIPPED
[INFO] Calcite Elasticsearch .............................. SKIPPED
[INFO] Calcite Examples ................................... SKIPPED
[INFO] Calcite Example CSV ................................ SKIPPED
[INFO] Calcite Example Function ........................... SKIPPED
[INFO] Calcite File ....................................... SKIPPED
[INFO] Calcite Geode ...................................... SKIPPED
[INFO] Calcite MongoDB .................................... SKIPPED
[INFO] Calcite Pig ........................................ SKIPPED
[INFO] Calcite Piglet ..................................... SKIPPED
[INFO] Calcite Plus ....................................... SKIPPED
[INFO] Calcite Server ..................................... SKIPPED
[INFO] Calcite Spark ...................................... SKIPPED
[INFO] Calcite Splunk ..................................... SKIPPED
[INFO] Calcite Ubenchmark ................................. SKIPPED
[INFO] ------------------------------------------------------------------------
[INFO] BUILD FAILURE
[INFO] ------------------------------------------------------------------------
[INFO] Total time: 04:15 min
[INFO] Finished at: 2018-09-25T12:46:17+02:00
[INFO] Final Memory: 60M/719M
[INFO] ------------------------------------------------------------------------
[ERROR] Failed to execute goal org.apache.maven.plugins:maven-surefire-plugin:2.22.0:test (default-test) on project calcite-core: There are test failures.
[ERROR] 
[ERROR] Please refer to /root/workspace/apache/calcite/432870131/core/target/surefire-reports for the individual test results.
[ERROR] Please refer to dump files (if any exist) [date]-jvmRun[N].dump, [date].dumpstream and [date]-jvmRun[N].dumpstream.
[ERROR] -> [Help 1]
[ERROR] 
[ERROR] To see the full stack trace of the errors, re-run Maven with the -e switch.
[ERROR] Re-run Maven using the -X switch to enable full debug logging.
[ERROR] 
[ERROR] For more information about the errors and possible solutions, please read the following articles:
[ERROR] [Help 1] http://cwiki.apache.org/confluence/display/MAVEN/MojoFailureException
[ERROR] 
[ERROR] After correcting the problems, you can resume the build with the command
[ERROR]   mvn <goals> -rf :calcite-core
