[INFO] Scanning for projects...
[INFO]                                                                         
[INFO] ------------------------------------------------------------------------
[INFO] Building oar-dist-service 1.1.X
[INFO] ------------------------------------------------------------------------
[INFO] 
[INFO] --- jacoco-maven-plugin:0.7.6.201602180812:prepare-agent (jacoco-initialize-ut) @ oar-dist-service ---
[INFO] surefireArgLine set to -javaagent:/root/./workspace/RayPlante/oar-dist-service/430829786/.m2/org/jacoco/org.jacoco.agent/0.7.6.201602180812/org.jacoco.agent-0.7.6.201602180812-runtime.jar=destfile=/root/workspace/RayPlante/oar-dist-service/430829786/target/coverage-reports/jacoco-ut.exec,append=true
[INFO] 
[INFO] --- maven-resources-plugin:3.0.1:resources (default-resources) @ oar-dist-service ---
[INFO] Using 'UTF-8' encoding to copy filtered resources.
[INFO] Copying 0 resource
[INFO] Copying 3 resources
[INFO] 
[INFO] --- maven-compiler-plugin:3.7.0:compile (default-compile) @ oar-dist-service ---
[INFO] Changes detected - recompiling the module!
[INFO] Compiling 33 source files to /root/workspace/RayPlante/oar-dist-service/430829786/target/classes
[INFO] 
[INFO] --- maven-resources-plugin:3.0.1:testResources (default-testResources) @ oar-dist-service ---
[INFO] Using 'UTF-8' encoding to copy filtered resources.
[INFO] Copying 2 resources
[INFO] 
[INFO] --- maven-compiler-plugin:3.7.0:testCompile (default-testCompile) @ oar-dist-service ---
[INFO] Nothing to compile - all classes are up to date
[INFO] 
[INFO] --- maven-surefire-plugin:2.21.0:test (default-test) @ oar-dist-service ---
[INFO] Downloading: https://repo.maven.apache.org/maven2/org/apache/maven/surefire/surefire-junit4/2.21.0/surefire-junit4-2.21.0.pom
[INFO] Downloaded: https://repo.maven.apache.org/maven2/org/apache/maven/surefire/surefire-junit4/2.21.0/surefire-junit4-2.21.0.pom (4 KB at 7.8 KB/sec)
[INFO] Downloading: https://repo.maven.apache.org/maven2/org/apache/maven/surefire/surefire-providers/2.21.0/surefire-providers-2.21.0.pom
[INFO] Downloaded: https://repo.maven.apache.org/maven2/org/apache/maven/surefire/surefire-providers/2.21.0/surefire-providers-2.21.0.pom (3 KB at 68.2 KB/sec)
[INFO] Downloading: https://repo.maven.apache.org/maven2/org/apache/maven/surefire/surefire-junit4/2.21.0/surefire-junit4-2.21.0.jar
[INFO] Downloaded: https://repo.maven.apache.org/maven2/org/apache/maven/surefire/surefire-junit4/2.21.0/surefire-junit4-2.21.0.jar (83 KB at 995.9 KB/sec)
[INFO] 
[INFO] -------------------------------------------------------
[INFO]  T E S T S
[INFO] -------------------------------------------------------
[INFO] Running gov.nist.oar.distrib.FileDescriptionTest
[INFO] Tests run: 5, Failures: 0, Errors: 0, Skipped: 0, Time elapsed: 0.907 s - in gov.nist.oar.distrib.FileDescriptionTest
[INFO] Running gov.nist.oar.distrib.web.VersionControllerTest
04:10:33,356 |-INFO in ch.qos.logback.classic.LoggerContext[default] - Could NOT find resource [logback-test.xml]
04:10:33,356 |-INFO in ch.qos.logback.classic.LoggerContext[default] - Could NOT find resource [logback.groovy]
04:10:33,356 |-INFO in ch.qos.logback.classic.LoggerContext[default] - Found resource [logback.xml] at [file:/root/workspace/RayPlante/oar-dist-service/430829786/target/classes/logback.xml]
04:10:33,484 |-INFO in ch.qos.logback.classic.joran.action.ConfigurationAction - debug attribute not set
04:10:33,485 |-INFO in ch.qos.logback.core.joran.action.AppenderAction - About to instantiate appender of type [ch.qos.logback.core.ConsoleAppender]
04:10:33,498 |-INFO in ch.qos.logback.core.joran.action.AppenderAction - Naming appender as [STDOUT]
04:10:33,507 |-INFO in ch.qos.logback.core.joran.action.NestedComplexPropertyIA - Assuming default type [ch.qos.logback.classic.encoder.PatternLayoutEncoder] for [encoder] property
04:10:33,546 |-INFO in ch.qos.logback.core.joran.action.AppenderAction - About to instantiate appender of type [ch.qos.logback.core.rolling.RollingFileAppender]
04:10:33,552 |-INFO in ch.qos.logback.core.joran.action.AppenderAction - Naming appender as [SAVE-TO-FILE]
04:10:33,565 |-INFO in ch.qos.logback.core.rolling.FixedWindowRollingPolicy@5d68be4f - No compression will be used
04:10:33,565 |-WARN in ch.qos.logback.core.rolling.FixedWindowRollingPolicy@5d68be4f - Large window sizes are not allowed.
04:10:33,565 |-WARN in ch.qos.logback.core.rolling.FixedWindowRollingPolicy@5d68be4f - MaxIndex reduced to 22
04:10:33,570 |-INFO in ch.qos.logback.core.rolling.RollingFileAppender[SAVE-TO-FILE] - Active log file name: LOG_PATH_IS_UNDEFINED/distservice.log
04:10:33,570 |-INFO in ch.qos.logback.core.rolling.RollingFileAppender[SAVE-TO-FILE] - File property is set to [LOG_PATH_IS_UNDEFINED/distservice.log]
04:10:33,573 |-INFO in ch.qos.logback.classic.joran.action.LoggerAction - Setting level of logger [org.springframework] to INFO
04:10:33,573 |-INFO in ch.qos.logback.classic.joran.action.LoggerAction - Setting additivity of logger [org.springframework] to false
04:10:33,573 |-INFO in ch.qos.logback.core.joran.action.AppenderRefAction - Attaching appender named [STDOUT] to Logger[org.springframework]
04:10:33,574 |-INFO in ch.qos.logback.core.joran.action.AppenderRefAction - Attaching appender named [SAVE-TO-FILE] to Logger[org.springframework]
04:10:33,574 |-INFO in ch.qos.logback.classic.joran.action.LoggerAction - Setting level of logger [gov.nist.oar.ds] to DEBUG
04:10:33,574 |-INFO in ch.qos.logback.classic.joran.action.LoggerAction - Setting additivity of logger [gov.nist.oar.ds] to false
04:10:33,574 |-INFO in ch.qos.logback.core.joran.action.AppenderRefAction - Attaching appender named [STDOUT] to Logger[gov.nist.oar.ds]
04:10:33,574 |-INFO in ch.qos.logback.core.joran.action.AppenderRefAction - Attaching appender named [SAVE-TO-FILE] to Logger[gov.nist.oar.ds]
04:10:33,574 |-INFO in ch.qos.logback.classic.joran.action.RootLoggerAction - Setting level of ROOT logger to INFO
04:10:33,574 |-INFO in ch.qos.logback.core.joran.action.AppenderRefAction - Attaching appender named [STDOUT] to Logger[ROOT]
04:10:33,574 |-INFO in ch.qos.logback.core.joran.action.AppenderRefAction - Attaching appender named [SAVE-TO-FILE] to Logger[ROOT]
04:10:33,574 |-INFO in ch.qos.logback.classic.joran.action.ConfigurationAction - End of configuration.
04:10:33,576 |-INFO in ch.qos.logback.classic.joran.JoranConfigurator@34eb5d01 - Registering current configuration as safe fallback point

2018-09-20 04:10:33 [main] INFO  org.springframework.boot.test.context.SpringBootTestContextBootstrapper:buildDefaultMergedContextConfiguration:308 - Neither @ContextConfiguration nor @ContextHierarchy found for test class [gov.nist.oar.distrib.web.VersionControllerTest], using SpringBootContextLoader
2018-09-20 04:10:33 [main] INFO  org.springframework.test.context.support.AbstractContextLoader:generateDefaultLocations:264 - Could not detect default resource locations for test class [gov.nist.oar.distrib.web.VersionControllerTest]: no resource found for suffixes {-context.xml, Context.groovy}.
2018-09-20 04:10:33 [main] INFO  org.springframework.test.context.support.AnnotationConfigContextLoaderUtils:detectDefaultConfigurationClasses:83 - Could not detect default configuration classes for test class [gov.nist.oar.distrib.web.VersionControllerTest]: VersionControllerTest does not declare any static, non-private, non-final, nested classes annotated with @Configuration.
2018-09-20 04:10:34 [main] INFO  org.springframework.boot.test.context.SpringBootTestContextBootstrapper:getOrFindConfigurationClasses:244 - Found @SpringBootConfiguration gov.nist.oar.distrib.web.NISTDistribServiceConfig for test class gov.nist.oar.distrib.web.VersionControllerTest
2018-09-20 04:10:34 [main] INFO  org.springframework.boot.test.context.SpringBootTestContextBootstrapper:getDefaultTestExecutionListenerClassNames:248 - Loaded default TestExecutionListener class names from location [META-INF/spring.factories]: [org.springframework.boot.test.mock.mockito.MockitoTestExecutionListener, org.springframework.boot.test.mock.mockito.ResetMocksTestExecutionListener, org.springframework.boot.test.autoconfigure.restdocs.RestDocsTestExecutionListener, org.springframework.boot.test.autoconfigure.web.client.MockRestServiceServerResetTestExecutionListener, org.springframework.boot.test.autoconfigure.web.servlet.MockMvcPrintOnlyOnFailureTestExecutionListener, org.springframework.boot.test.autoconfigure.web.servlet.WebDriverTestExecutionListener, org.springframework.test.context.web.ServletTestExecutionListener, org.springframework.test.context.support.DirtiesContextBeforeModesTestExecutionListener, org.springframework.test.context.support.DependencyInjectionTestExecutionListener, org.springframework.test.context.support.DirtiesContextTestExecutionListener, org.springframework.test.context.transaction.TransactionalTestExecutionListener, org.springframework.test.context.jdbc.SqlScriptsTestExecutionListener]
2018-09-20 04:10:34 [main] INFO  org.springframework.boot.test.context.SpringBootTestContextBootstrapper:getTestExecutionListeners:177 - Using TestExecutionListeners: [org.springframework.test.context.web.ServletTestExecutionListener@2b0df4ba, org.springframework.test.context.support.DirtiesContextBeforeModesTestExecutionListener@6f647464, org.springframework.boot.test.mock.mockito.MockitoTestExecutionListener@12504d49, org.springframework.boot.test.autoconfigure.SpringBootDependencyInjectionTestExecutionListener@f8dfcbe, org.springframework.test.context.support.DirtiesContextTestExecutionListener@4be171d1, org.springframework.boot.test.mock.mockito.ResetMocksTestExecutionListener@76afb9d, org.springframework.boot.test.autoconfigure.restdocs.RestDocsTestExecutionListener@17c0d43c, org.springframework.boot.test.autoconfigure.web.client.MockRestServiceServerResetTestExecutionListener@77c8b276, org.springframework.boot.test.autoconfigure.web.servlet.MockMvcPrintOnlyOnFailureTestExecutionListener@37672aa7, org.springframework.boot.test.autoconfigure.web.servlet.WebDriverTestExecutionListener@670199c5]
2018-09-20 04:10:36 [main] INFO  org.springframework.context.annotation.AnnotationConfigApplicationContext:prepareRefresh:590 - Refreshing org.springframework.context.annotation.AnnotationConfigApplicationContext@49d52df2: startup date [Thu Sep 20 04:10:36 CEST 2018]; root of context hierarchy
2018-09-20 04:10:36 [main] INFO  org.springframework.beans.factory.annotation.AutowiredAnnotationBeanPostProcessor:<init>:154 - JSR-330 'javax.inject.Inject' annotation found and supported for autowiring
2018-09-20 04:10:36 [main] INFO  org.springframework.context.support.PostProcessorRegistrationDelegate$BeanPostProcessorChecker:postProcessAfterInitialization:328 - Bean 'configurationPropertiesRebinderAutoConfiguration' of type [org.springframework.cloud.autoconfigure.ConfigurationPropertiesRebinderAutoConfiguration$$EnhancerBySpringCGLIB$$df7cc9a1] is not eligible for getting processed by all BeanPostProcessors (for example: not eligible for auto-proxying)

  .   ____          _            __ _ _
 /\\ / ___'_ __ _ _(_)_ __  __ _ \ \ \ \
( ( )\___ | '_ | '_| | '_ \/ _` | \ \ \ \
 \\/  ___)| |_)| | | | | || (_| |  ) ) ) )
  '  |____| .__|_| |_|_| |_\__, | / / / /
 =========|_|==============|___/=/_/_/_/
 :: Spring Boot ::        (v2.0.1.RELEASE)

2018-09-20 04:10:37 [main] INFO  org.springframework.cloud.config.client.ConfigServicePropertySourceLocator:locate:83 - Fetching config from server at: http://localhost:8084
2018-09-20 04:10:37 [main] WARN  org.springframework.cloud.config.client.ConfigServicePropertySourceLocator:locate:134 - Could not locate PropertySource: I/O error on GET request for "http://localhost:8084/oar-dist-service/default,aws": Connection refused (Connection refused); nested exception is java.net.ConnectException: Connection refused (Connection refused)
2018-09-20 04:10:37 [main] INFO  gov.nist.oar.distrib.web.VersionControllerTest:logStartupProfileInfo:663 - The following profiles are active: default,aws
2018-09-20 04:10:37 [main] INFO  org.springframework.boot.web.servlet.context.AnnotationConfigServletWebServerApplicationContext:prepareRefresh:590 - Refreshing org.springframework.boot.web.servlet.context.AnnotationConfigServletWebServerApplicationContext@79b3937a: startup date [Thu Sep 20 04:10:37 CEST 2018]; parent: org.springframework.context.annotation.AnnotationConfigApplicationContext@49d52df2
2018-09-20 04:10:38 [main] INFO  org.springframework.beans.factory.support.DefaultListableBeanFactory:registerBeanDefinition:824 - Overriding bean definition for bean 'environmentWebEndpointExtension' with a different definition: replacing [Root bean: class [null]; scope=; abstract=false; lazyInit=false; autowireMode=3; dependencyCheck=0; autowireCandidate=true; primary=false; factoryBeanName=org.springframework.boot.actuate.autoconfigure.env.EnvironmentEndpointAutoConfiguration; factoryMethodName=environmentWebEndpointExtension; initMethodName=null; destroyMethodName=(inferred); defined in class path resource [org/springframework/boot/actuate/autoconfigure/env/EnvironmentEndpointAutoConfiguration.class]] with [Root bean: class [null]; scope=; abstract=false; lazyInit=false; autowireMode=3; dependencyCheck=0; autowireCandidate=true; primary=false; factoryBeanName=org.springframework.cloud.autoconfigure.LifecycleMvcEndpointAutoConfiguration$EndpointConfiguration; factoryMethodName=environmentWebEndpointExtension; initMethodName=null; destroyMethodName=(inferred); defined in class path resource [org/springframework/cloud/autoconfigure/LifecycleMvcEndpointAutoConfiguration$EndpointConfiguration.class]]
2018-09-20 04:10:39 [main] INFO  org.springframework.cloud.context.scope.GenericScope:setSerializationId:293 - BeanFactory id=e0827430-7159-3ddb-8e1e-c4ce459e090f
2018-09-20 04:10:39 [main] INFO  org.springframework.beans.factory.annotation.AutowiredAnnotationBeanPostProcessor:<init>:154 - JSR-330 'javax.inject.Inject' annotation found and supported for autowiring
2018-09-20 04:10:39 [main] INFO  org.springframework.context.support.PostProcessorRegistrationDelegate$BeanPostProcessorChecker:postProcessAfterInitialization:328 - Bean 'org.springframework.cloud.autoconfigure.ConfigurationPropertiesRebinderAutoConfiguration' of type [org.springframework.cloud.autoconfigure.ConfigurationPropertiesRebinderAutoConfiguration$$EnhancerBySpringCGLIB$$df7cc9a1] is not eligible for getting processed by all BeanPostProcessors (for example: not eligible for auto-proxying)
2018-09-20 04:10:39 [main] INFO  org.springframework.boot.web.embedded.tomcat.TomcatWebServer:initialize:91 - Tomcat initialized with port(s): 0 (http)
2018-09-20 04:10:39 [main] INFO  org.apache.coyote.http11.Http11NioProtocol:log:180 - Initializing ProtocolHandler ["http-nio-auto-1"]
2018-09-20 04:10:39 [main] INFO  org.apache.catalina.core.StandardService:log:180 - Starting service [Tomcat]
2018-09-20 04:10:39 [main] INFO  org.apache.catalina.core.StandardEngine:log:180 - Starting Servlet Engine: Apache Tomcat/8.5.29
2018-09-20 04:10:39 [localhost-startStop-1] INFO  org.apache.catalina.core.AprLifecycleListener:log:180 - The APR based Apache Tomcat Native library which allows optimal performance in production environments was not found on the java.library.path: [/usr/java/packages/lib/amd64:/usr/lib/x86_64-linux-gnu/jni:/lib/x86_64-linux-gnu:/usr/lib/x86_64-linux-gnu:/usr/lib/jni:/lib:/usr/lib]
2018-09-20 04:10:39 [localhost-startStop-1] INFO  org.apache.catalina.core.ContainerBase.[Tomcat].[localhost].[/oar-dist-service]:log:180 - Initializing Spring embedded WebApplicationContext
2018-09-20 04:10:39 [localhost-startStop-1] INFO  org.springframework.web.context.ContextLoader:prepareWebApplicationContext:285 - Root WebApplicationContext: initialization completed in 2738 ms
2018-09-20 04:10:41 [localhost-startStop-1] INFO  org.springframework.boot.web.servlet.ServletRegistrationBean:addRegistration:185 - Servlet dispatcherServlet mapped to [/]
2018-09-20 04:10:41 [localhost-startStop-1] INFO  org.springframework.boot.web.servlet.FilterRegistrationBean:configure:244 - Mapping filter: 'characterEncodingFilter' to: [/*]
2018-09-20 04:10:41 [localhost-startStop-1] INFO  org.springframework.boot.web.servlet.FilterRegistrationBean:configure:244 - Mapping filter: 'hiddenHttpMethodFilter' to: [/*]
2018-09-20 04:10:41 [localhost-startStop-1] INFO  org.springframework.boot.web.servlet.FilterRegistrationBean:configure:244 - Mapping filter: 'httpPutFormContentFilter' to: [/*]
2018-09-20 04:10:41 [localhost-startStop-1] INFO  org.springframework.boot.web.servlet.FilterRegistrationBean:configure:244 - Mapping filter: 'requestContextFilter' to: [/*]
2018-09-20 04:10:41 [localhost-startStop-1] INFO  org.springframework.boot.web.servlet.FilterRegistrationBean:configure:244 - Mapping filter: 'httpTraceFilter' to: [/*]
2018-09-20 04:10:41 [localhost-startStop-1] INFO  org.springframework.boot.web.servlet.FilterRegistrationBean:configure:244 - Mapping filter: 'webMvcMetricsFilter' to: [/*]
2018-09-20 04:10:41 [main] INFO  gov.nist.oar.distrib.storage.FilesystemLongTermStorage:<init>:69 - Creating FilesystemLongTermStorage rooted at /root/workspace/RayPlante/oar-dist-service/430829786/src/test/resources
2018-09-20 04:10:41 [main] INFO  org.springframework.web.servlet.handler.SimpleUrlHandlerMapping:registerHandler:373 - Mapped URL path [/**/favicon.ico] onto handler of type [class org.springframework.web.servlet.resource.ResourceHttpRequestHandler]
2018-09-20 04:10:41 [main] INFO  org.springframework.web.servlet.mvc.method.annotation.RequestMappingHandlerAdapter:initControllerAdviceCache:574 - Looking for @ControllerAdvice: org.springframework.boot.web.servlet.context.AnnotationConfigServletWebServerApplicationContext@79b3937a: startup date [Thu Sep 20 04:10:37 CEST 2018]; parent: org.springframework.context.annotation.AnnotationConfigApplicationContext@49d52df2
2018-09-20 04:10:42 [main] INFO  org.springframework.web.servlet.mvc.method.annotation.RequestMappingHandlerMapping:register:547 - Mapped "{[/ds/_aip/{name}]}" onto public void gov.nist.oar.distrib.web.AIPAccessController.downloadAIP(java.lang.String,javax.servlet.http.HttpServletResponse) throws gov.nist.oar.distrib.ResourceNotFoundException,gov.nist.oar.distrib.DistributionException,java.io.IOException
2018-09-20 04:10:42 [main] INFO  org.springframework.web.servlet.mvc.method.annotation.RequestMappingHandlerMapping:register:547 - Mapped "{[/ds/_aip/{name}/_info]}" onto public gov.nist.oar.distrib.FileDescription gov.nist.oar.distrib.web.AIPAccessController.describeAIP(java.lang.String) throws gov.nist.oar.distrib.ResourceNotFoundException,gov.nist.oar.distrib.DistributionException
2018-09-20 04:10:42 [main] INFO  org.springframework.web.servlet.mvc.method.annotation.RequestMappingHandlerMapping:register:547 - Mapped "{[/ds/{dsid}/_aip],methods=[GET]}" onto public java.util.List<gov.nist.oar.distrib.FileDescription> gov.nist.oar.distrib.web.DatasetAccessController.describeAIPs(java.lang.String) throws gov.nist.oar.distrib.ResourceNotFoundException,gov.nist.oar.distrib.DistributionException
2018-09-20 04:10:42 [main] INFO  org.springframework.web.servlet.mvc.method.annotation.RequestMappingHandlerMapping:register:547 - Mapped "{[/ds/{dsid}/_aip/_v],methods=[GET]}" onto public java.util.List<java.lang.String> gov.nist.oar.distrib.web.DatasetAccessController.listAIPVersions(java.lang.String) throws gov.nist.oar.distrib.ResourceNotFoundException,gov.nist.oar.distrib.DistributionException
2018-09-20 04:10:42 [main] INFO  org.springframework.web.servlet.mvc.method.annotation.RequestMappingHandlerMapping:register:547 - Mapped "{[/ds/{dsid}/_aip/_v/{ver}],methods=[GET]}" onto public java.util.List<gov.nist.oar.distrib.FileDescription> gov.nist.oar.distrib.web.DatasetAccessController.describeAIPsForVersion(java.lang.String,java.lang.String) throws gov.nist.oar.distrib.ResourceNotFoundException,gov.nist.oar.distrib.DistributionException
2018-09-20 04:10:42 [main] INFO  org.springframework.web.servlet.mvc.method.annotation.RequestMappingHandlerMapping:register:547 - Mapped "{[/ds/{dsid}/_aip/_v/{ver}/_head],methods=[GET]}" onto public gov.nist.oar.distrib.FileDescription gov.nist.oar.distrib.web.DatasetAccessController.describeHeadAIPForVersion(java.lang.String,java.lang.String) throws gov.nist.oar.distrib.ResourceNotFoundException,gov.nist.oar.distrib.DistributionException
2018-09-20 04:10:42 [main] INFO  org.springframework.web.servlet.mvc.method.annotation.RequestMappingHandlerMapping:register:547 - Mapped "{[/ds/{dsid}/_aip/_head],methods=[GET]}" onto public gov.nist.oar.distrib.FileDescription gov.nist.oar.distrib.web.DatasetAccessController.describeLatestHeadAIP(java.lang.String) throws gov.nist.oar.distrib.ResourceNotFoundException,gov.nist.oar.distrib.DistributionException
2018-09-20 04:10:42 [main] INFO  org.springframework.web.servlet.mvc.method.annotation.RequestMappingHandlerMapping:register:547 - Mapped "{[/ds/{dsid}/**],methods=[GET]}" onto public void gov.nist.oar.distrib.web.DatasetAccessController.downloadFile(java.lang.String,javax.servlet.http.HttpServletRequest,javax.servlet.http.HttpServletResponse) throws gov.nist.oar.distrib.ResourceNotFoundException,java.io.FileNotFoundException,gov.nist.oar.distrib.DistributionException,java.io.IOException
2018-09-20 04:10:42 [main] INFO  org.springframework.web.servlet.mvc.method.annotation.RequestMappingHandlerMapping:register:547 - Mapped "{[/ds/_v]}" onto public gov.nist.oar.distrib.web.VersionController$VersionInfo gov.nist.oar.distrib.web.VersionController.getServiceVersion()
2018-09-20 04:10:42 [main] INFO  org.springframework.web.servlet.mvc.method.annotation.RequestMappingHandlerMapping:register:547 - Mapped "{[/error],produces=[text/html]}" onto public org.springframework.web.servlet.ModelAndView org.springframework.boot.autoconfigure.web.servlet.error.BasicErrorController.errorHtml(javax.servlet.http.HttpServletRequest,javax.servlet.http.HttpServletResponse)
2018-09-20 04:10:42 [main] INFO  org.springframework.web.servlet.mvc.method.annotation.RequestMappingHandlerMapping:register:547 - Mapped "{[/error]}" onto public org.springframework.http.ResponseEntity<java.util.Map<java.lang.String, java.lang.Object>> org.springframework.boot.autoconfigure.web.servlet.error.BasicErrorController.error(javax.servlet.http.HttpServletRequest)
2018-09-20 04:10:42 [main] INFO  org.springframework.web.servlet.handler.SimpleUrlHandlerMapping:registerHandler:373 - Mapped URL path [/webjars/**] onto handler of type [class org.springframework.web.servlet.resource.ResourceHttpRequestHandler]
2018-09-20 04:10:42 [main] INFO  org.springframework.web.servlet.handler.SimpleUrlHandlerMapping:registerHandler:373 - Mapped URL path [/**] onto handler of type [class org.springframework.web.servlet.resource.ResourceHttpRequestHandler]
2018-09-20 04:10:42 [main] INFO  org.springframework.boot.actuate.endpoint.web.EndpointLinksResolver:<init>:59 - Exposing 2 endpoint(s) beneath base path '/actuator'
2018-09-20 04:10:42 [main] INFO  org.springframework.boot.actuate.endpoint.web.servlet.WebMvcEndpointHandlerMapping:register:547 - Mapped "{[/actuator/health],methods=[GET],produces=[application/vnd.spring-boot.actuator.v2+json || application/json]}" onto public java.lang.Object org.springframework.boot.actuate.endpoint.web.servlet.AbstractWebMvcEndpointHandlerMapping$OperationHandler.handle(javax.servlet.http.HttpServletRequest,java.util.Map<java.lang.String, java.lang.String>)
2018-09-20 04:10:42 [main] INFO  org.springframework.boot.actuate.endpoint.web.servlet.WebMvcEndpointHandlerMapping:register:547 - Mapped "{[/actuator/info],methods=[GET],produces=[application/vnd.spring-boot.actuator.v2+json || application/json]}" onto public java.lang.Object org.springframework.boot.actuate.endpoint.web.servlet.AbstractWebMvcEndpointHandlerMapping$OperationHandler.handle(javax.servlet.http.HttpServletRequest,java.util.Map<java.lang.String, java.lang.String>)
2018-09-20 04:10:42 [main] INFO  org.springframework.boot.actuate.endpoint.web.servlet.WebMvcEndpointHandlerMapping:register:547 - Mapped "{[/actuator],methods=[GET],produces=[application/vnd.spring-boot.actuator.v2+json || application/json]}" onto protected java.lang.Object org.springframework.boot.actuate.endpoint.web.servlet.WebMvcEndpointHandlerMapping.links(javax.servlet.http.HttpServletRequest,javax.servlet.http.HttpServletResponse)
2018-09-20 04:10:43 [main] INFO  org.apache.coyote.http11.Http11NioProtocol:log:180 - Starting ProtocolHandler ["http-nio-auto-1"]
2018-09-20 04:10:43 [main] INFO  org.apache.tomcat.util.net.NioSelectorPool:log:180 - Using a shared selector for servlet write/read
2018-09-20 04:10:43 [main] INFO  org.springframework.boot.web.embedded.tomcat.TomcatWebServer:start:206 - Tomcat started on port(s): 42581 (http) with context path '/oar-dist-service'
2018-09-20 04:10:43 [main] INFO  gov.nist.oar.distrib.web.VersionControllerTest:logStarted:59 - Started VersionControllerTest in 7.996 seconds (JVM running for 12.047)
2018-09-20 04:10:43 [http-nio-auto-1-exec-1] INFO  org.apache.catalina.core.ContainerBase.[Tomcat].[localhost].[/oar-dist-service]:log:180 - Initializing Spring FrameworkServlet 'dispatcherServlet'
2018-09-20 04:10:43 [http-nio-auto-1-exec-1] INFO  org.springframework.web.servlet.DispatcherServlet:initServletBean:494 - FrameworkServlet 'dispatcherServlet': initialization started
2018-09-20 04:10:43 [http-nio-auto-1-exec-1] INFO  org.springframework.web.servlet.DispatcherServlet:initServletBean:509 - FrameworkServlet 'dispatcherServlet': initialization completed in 28 ms
2018-09-20 04:10:43 [main] INFO  gov.nist.oar.distrib.web.VersionControllerTest:testGetServiceVersion:65 - ### version response: {"serviceName":"oar-dist-service","version":"not set"}
[INFO] Tests run: 1, Failures: 0, Errors: 0, Skipped: 0, Time elapsed: 10.424 s - in gov.nist.oar.distrib.web.VersionControllerTest
[INFO] Running gov.nist.oar.distrib.web.AIPAccessControllerTest
2018-09-20 04:10:43 [main] INFO  org.springframework.boot.test.context.SpringBootTestContextBootstrapper:buildDefaultMergedContextConfiguration:308 - Neither @ContextConfiguration nor @ContextHierarchy found for test class [gov.nist.oar.distrib.web.AIPAccessControllerTest], using SpringBootContextLoader
2018-09-20 04:10:43 [main] INFO  org.springframework.test.context.support.AbstractContextLoader:generateDefaultLocations:264 - Could not detect default resource locations for test class [gov.nist.oar.distrib.web.AIPAccessControllerTest]: no resource found for suffixes {-context.xml, Context.groovy}.
2018-09-20 04:10:43 [main] INFO  org.springframework.boot.test.context.SpringBootTestContextBootstrapper:getDefaultTestExecutionListenerClassNames:248 - Loaded default TestExecutionListener class names from location [META-INF/spring.factories]: [org.springframework.boot.test.mock.mockito.MockitoTestExecutionListener, org.springframework.boot.test.mock.mockito.ResetMocksTestExecutionListener, org.springframework.boot.test.autoconfigure.restdocs.RestDocsTestExecutionListener, org.springframework.boot.test.autoconfigure.web.client.MockRestServiceServerResetTestExecutionListener, org.springframework.boot.test.autoconfigure.web.servlet.MockMvcPrintOnlyOnFailureTestExecutionListener, org.springframework.boot.test.autoconfigure.web.servlet.WebDriverTestExecutionListener, org.springframework.test.context.web.ServletTestExecutionListener, org.springframework.test.context.support.DirtiesContextBeforeModesTestExecutionListener, org.springframework.test.context.support.DependencyInjectionTestExecutionListener, org.springframework.test.context.support.DirtiesContextTestExecutionListener, org.springframework.test.context.transaction.TransactionalTestExecutionListener, org.springframework.test.context.jdbc.SqlScriptsTestExecutionListener]
2018-09-20 04:10:43 [main] INFO  org.springframework.boot.test.context.SpringBootTestContextBootstrapper:getTestExecutionListeners:177 - Using TestExecutionListeners: [org.springframework.test.context.web.ServletTestExecutionListener@3b72a58, org.springframework.test.context.support.DirtiesContextBeforeModesTestExecutionListener@e549c60, org.springframework.boot.test.mock.mockito.MockitoTestExecutionListener@47375282, org.springframework.boot.test.autoconfigure.SpringBootDependencyInjectionTestExecutionListener@6ee87c28, org.springframework.test.context.support.DirtiesContextTestExecutionListener@54b76e47, org.springframework.boot.test.mock.mockito.ResetMocksTestExecutionListener@7eaa4f2d, org.springframework.boot.test.autoconfigure.restdocs.RestDocsTestExecutionListener@3f4b138, org.springframework.boot.test.autoconfigure.web.client.MockRestServiceServerResetTestExecutionListener@2e508452, org.springframework.boot.test.autoconfigure.web.servlet.MockMvcPrintOnlyOnFailureTestExecutionListener@417a0289, org.springframework.boot.test.autoconfigure.web.servlet.WebDriverTestExecutionListener@6d05feac]
2018-09-20 04:10:43 [main] INFO  org.springframework.context.annotation.AnnotationConfigApplicationContext:prepareRefresh:590 - Refreshing org.springframework.context.annotation.AnnotationConfigApplicationContext@16427496: startup date [Thu Sep 20 04:10:43 CEST 2018]; root of context hierarchy
2018-09-20 04:10:43 [main] INFO  org.springframework.beans.factory.annotation.AutowiredAnnotationBeanPostProcessor:<init>:154 - JSR-330 'javax.inject.Inject' annotation found and supported for autowiring
2018-09-20 04:10:43 [main] INFO  org.springframework.context.support.PostProcessorRegistrationDelegate$BeanPostProcessorChecker:postProcessAfterInitialization:328 - Bean 'configurationPropertiesRebinderAutoConfiguration' of type [org.springframework.cloud.autoconfigure.ConfigurationPropertiesRebinderAutoConfiguration$$EnhancerBySpringCGLIB$$df7cc9a1] is not eligible for getting processed by all BeanPostProcessors (for example: not eligible for auto-proxying)

  .   ____          _            __ _ _
 /\\ / ___'_ __ _ _(_)_ __  __ _ \ \ \ \
( ( )\___ | '_ | '_| | '_ \/ _` | \ \ \ \
 \\/  ___)| |_)| | | | | || (_| |  ) ) ) )
  '  |____| .__|_| |_|_| |_\__, | / / / /
 =========|_|==============|___/=/_/_/_/
 :: Spring Boot ::        (v2.0.1.RELEASE)

2018-09-20 04:10:43 [main] INFO  org.springframework.cloud.config.client.ConfigServicePropertySourceLocator:locate:83 - Fetching config from server at: http://localhost:8084
2018-09-20 04:10:43 [main] WARN  org.springframework.cloud.config.client.ConfigServicePropertySourceLocator:locate:134 - Could not locate PropertySource: I/O error on GET request for "http://localhost:8084/oar-dist-service/default,aws": Connection refused (Connection refused); nested exception is java.net.ConnectException: Connection refused (Connection refused)
2018-09-20 04:10:43 [main] INFO  gov.nist.oar.distrib.web.AIPAccessControllerTest:logStartupProfileInfo:663 - The following profiles are active: default,aws
2018-09-20 04:10:43 [main] INFO  org.springframework.boot.web.servlet.context.AnnotationConfigServletWebServerApplicationContext:prepareRefresh:590 - Refreshing org.springframework.boot.web.servlet.context.AnnotationConfigServletWebServerApplicationContext@4c77ab24: startup date [Thu Sep 20 04:10:43 CEST 2018]; parent: org.springframework.context.annotation.AnnotationConfigApplicationContext@16427496
2018-09-20 04:10:44 [main] INFO  org.springframework.beans.factory.support.DefaultListableBeanFactory:registerBeanDefinition:824 - Overriding bean definition for bean 'environmentWebEndpointExtension' with a different definition: replacing [Root bean: class [null]; scope=; abstract=false; lazyInit=false; autowireMode=3; dependencyCheck=0; autowireCandidate=true; primary=false; factoryBeanName=org.springframework.boot.actuate.autoconfigure.env.EnvironmentEndpointAutoConfiguration; factoryMethodName=environmentWebEndpointExtension; initMethodName=null; destroyMethodName=(inferred); defined in class path resource [org/springframework/boot/actuate/autoconfigure/env/EnvironmentEndpointAutoConfiguration.class]] with [Root bean: class [null]; scope=; abstract=false; lazyInit=false; autowireMode=3; dependencyCheck=0; autowireCandidate=true; primary=false; factoryBeanName=org.springframework.cloud.autoconfigure.LifecycleMvcEndpointAutoConfiguration$EndpointConfiguration; factoryMethodName=environmentWebEndpointExtension; initMethodName=null; destroyMethodName=(inferred); defined in class path resource [org/springframework/cloud/autoconfigure/LifecycleMvcEndpointAutoConfiguration$EndpointConfiguration.class]]
2018-09-20 04:10:44 [main] INFO  org.springframework.cloud.context.scope.GenericScope:setSerializationId:293 - BeanFactory id=e0827430-7159-3ddb-8e1e-c4ce459e090f
2018-09-20 04:10:44 [main] INFO  org.springframework.beans.factory.annotation.AutowiredAnnotationBeanPostProcessor:<init>:154 - JSR-330 'javax.inject.Inject' annotation found and supported for autowiring
2018-09-20 04:10:44 [main] INFO  org.springframework.context.support.PostProcessorRegistrationDelegate$BeanPostProcessorChecker:postProcessAfterInitialization:328 - Bean 'org.springframework.cloud.autoconfigure.ConfigurationPropertiesRebinderAutoConfiguration' of type [org.springframework.cloud.autoconfigure.ConfigurationPropertiesRebinderAutoConfiguration$$EnhancerBySpringCGLIB$$df7cc9a1] is not eligible for getting processed by all BeanPostProcessors (for example: not eligible for auto-proxying)
2018-09-20 04:10:44 [main] INFO  org.springframework.boot.web.embedded.tomcat.TomcatWebServer:initialize:91 - Tomcat initialized with port(s): 0 (http)
2018-09-20 04:10:44 [main] INFO  org.apache.coyote.http11.Http11NioProtocol:log:180 - Initializing ProtocolHandler ["http-nio-auto-2"]
2018-09-20 04:10:44 [main] INFO  org.apache.catalina.core.StandardService:log:180 - Starting service [Tomcat]
2018-09-20 04:10:44 [main] INFO  org.apache.catalina.core.StandardEngine:log:180 - Starting Servlet Engine: Apache Tomcat/8.5.29
2018-09-20 04:10:44 [localhost-startStop-1] INFO  org.apache.catalina.core.ContainerBase.[Tomcat-1].[localhost].[/oar-dist-service]:log:180 - Initializing Spring embedded WebApplicationContext
2018-09-20 04:10:44 [localhost-startStop-1] INFO  org.springframework.web.context.ContextLoader:prepareWebApplicationContext:285 - Root WebApplicationContext: initialization completed in 675 ms
2018-09-20 04:10:45 [localhost-startStop-1] INFO  org.springframework.boot.web.servlet.ServletRegistrationBean:addRegistration:185 - Servlet dispatcherServlet mapped to [/]
2018-09-20 04:10:45 [localhost-startStop-1] INFO  org.springframework.boot.web.servlet.FilterRegistrationBean:configure:244 - Mapping filter: 'characterEncodingFilter' to: [/*]
2018-09-20 04:10:45 [localhost-startStop-1] INFO  org.springframework.boot.web.servlet.FilterRegistrationBean:configure:244 - Mapping filter: 'hiddenHttpMethodFilter' to: [/*]
2018-09-20 04:10:45 [localhost-startStop-1] INFO  org.springframework.boot.web.servlet.FilterRegistrationBean:configure:244 - Mapping filter: 'httpPutFormContentFilter' to: [/*]
2018-09-20 04:10:45 [localhost-startStop-1] INFO  org.springframework.boot.web.servlet.FilterRegistrationBean:configure:244 - Mapping filter: 'requestContextFilter' to: [/*]
2018-09-20 04:10:45 [localhost-startStop-1] INFO  org.springframework.boot.web.servlet.FilterRegistrationBean:configure:244 - Mapping filter: 'httpTraceFilter' to: [/*]
2018-09-20 04:10:45 [localhost-startStop-1] INFO  org.springframework.boot.web.servlet.FilterRegistrationBean:configure:244 - Mapping filter: 'webMvcMetricsFilter' to: [/*]
2018-09-20 04:10:45 [main] INFO  gov.nist.oar.distrib.storage.FilesystemLongTermStorage:<init>:69 - Creating FilesystemLongTermStorage rooted at /root/workspace/RayPlante/oar-dist-service/430829786/src/test/resources
2018-09-20 04:10:45 [main] INFO  org.springframework.web.servlet.handler.SimpleUrlHandlerMapping:registerHandler:373 - Mapped URL path [/**/favicon.ico] onto handler of type [class org.springframework.web.servlet.resource.ResourceHttpRequestHandler]
2018-09-20 04:10:45 [main] INFO  org.springframework.web.servlet.mvc.method.annotation.RequestMappingHandlerAdapter:initControllerAdviceCache:574 - Looking for @ControllerAdvice: org.springframework.boot.web.servlet.context.AnnotationConfigServletWebServerApplicationContext@4c77ab24: startup date [Thu Sep 20 04:10:43 CEST 2018]; parent: org.springframework.context.annotation.AnnotationConfigApplicationContext@16427496
2018-09-20 04:10:45 [main] INFO  org.springframework.web.servlet.mvc.method.annotation.RequestMappingHandlerMapping:register:547 - Mapped "{[/ds/_aip/{name}]}" onto public void gov.nist.oar.distrib.web.AIPAccessController.downloadAIP(java.lang.String,javax.servlet.http.HttpServletResponse) throws gov.nist.oar.distrib.ResourceNotFoundException,gov.nist.oar.distrib.DistributionException,java.io.IOException
2018-09-20 04:10:45 [main] INFO  org.springframework.web.servlet.mvc.method.annotation.RequestMappingHandlerMapping:register:547 - Mapped "{[/ds/_aip/{name}/_info]}" onto public gov.nist.oar.distrib.FileDescription gov.nist.oar.distrib.web.AIPAccessController.describeAIP(java.lang.String) throws gov.nist.oar.distrib.ResourceNotFoundException,gov.nist.oar.distrib.DistributionException
2018-09-20 04:10:45 [main] INFO  org.springframework.web.servlet.mvc.method.annotation.RequestMappingHandlerMapping:register:547 - Mapped "{[/ds/{dsid}/_aip],methods=[GET]}" onto public java.util.List<gov.nist.oar.distrib.FileDescription> gov.nist.oar.distrib.web.DatasetAccessController.describeAIPs(java.lang.String) throws gov.nist.oar.distrib.ResourceNotFoundException,gov.nist.oar.distrib.DistributionException
2018-09-20 04:10:45 [main] INFO  org.springframework.web.servlet.mvc.method.annotation.RequestMappingHandlerMapping:register:547 - Mapped "{[/ds/{dsid}/_aip/_v],methods=[GET]}" onto public java.util.List<java.lang.String> gov.nist.oar.distrib.web.DatasetAccessController.listAIPVersions(java.lang.String) throws gov.nist.oar.distrib.ResourceNotFoundException,gov.nist.oar.distrib.DistributionException
2018-09-20 04:10:45 [main] INFO  org.springframework.web.servlet.mvc.method.annotation.RequestMappingHandlerMapping:register:547 - Mapped "{[/ds/{dsid}/_aip/_v/{ver}],methods=[GET]}" onto public java.util.List<gov.nist.oar.distrib.FileDescription> gov.nist.oar.distrib.web.DatasetAccessController.describeAIPsForVersion(java.lang.String,java.lang.String) throws gov.nist.oar.distrib.ResourceNotFoundException,gov.nist.oar.distrib.DistributionException
2018-09-20 04:10:45 [main] INFO  org.springframework.web.servlet.mvc.method.annotation.RequestMappingHandlerMapping:register:547 - Mapped "{[/ds/{dsid}/_aip/_v/{ver}/_head],methods=[GET]}" onto public gov.nist.oar.distrib.FileDescription gov.nist.oar.distrib.web.DatasetAccessController.describeHeadAIPForVersion(java.lang.String,java.lang.String) throws gov.nist.oar.distrib.ResourceNotFoundException,gov.nist.oar.distrib.DistributionException
2018-09-20 04:10:45 [main] INFO  org.springframework.web.servlet.mvc.method.annotation.RequestMappingHandlerMapping:register:547 - Mapped "{[/ds/{dsid}/_aip/_head],methods=[GET]}" onto public gov.nist.oar.distrib.FileDescription gov.nist.oar.distrib.web.DatasetAccessController.describeLatestHeadAIP(java.lang.String) throws gov.nist.oar.distrib.ResourceNotFoundException,gov.nist.oar.distrib.DistributionException
2018-09-20 04:10:45 [main] INFO  org.springframework.web.servlet.mvc.method.annotation.RequestMappingHandlerMapping:register:547 - Mapped "{[/ds/{dsid}/**],methods=[GET]}" onto public void gov.nist.oar.distrib.web.DatasetAccessController.downloadFile(java.lang.String,javax.servlet.http.HttpServletRequest,javax.servlet.http.HttpServletResponse) throws gov.nist.oar.distrib.ResourceNotFoundException,java.io.FileNotFoundException,gov.nist.oar.distrib.DistributionException,java.io.IOException
2018-09-20 04:10:45 [main] INFO  org.springframework.web.servlet.mvc.method.annotation.RequestMappingHandlerMapping:register:547 - Mapped "{[/ds/_v]}" onto public gov.nist.oar.distrib.web.VersionController$VersionInfo gov.nist.oar.distrib.web.VersionController.getServiceVersion()
2018-09-20 04:10:45 [main] INFO  org.springframework.web.servlet.mvc.method.annotation.RequestMappingHandlerMapping:register:547 - Mapped "{[/error],produces=[text/html]}" onto public org.springframework.web.servlet.ModelAndView org.springframework.boot.autoconfigure.web.servlet.error.BasicErrorController.errorHtml(javax.servlet.http.HttpServletRequest,javax.servlet.http.HttpServletResponse)
2018-09-20 04:10:45 [main] INFO  org.springframework.web.servlet.mvc.method.annotation.RequestMappingHandlerMapping:register:547 - Mapped "{[/error]}" onto public org.springframework.http.ResponseEntity<java.util.Map<java.lang.String, java.lang.Object>> org.springframework.boot.autoconfigure.web.servlet.error.BasicErrorController.error(javax.servlet.http.HttpServletRequest)
2018-09-20 04:10:45 [main] INFO  org.springframework.web.servlet.handler.SimpleUrlHandlerMapping:registerHandler:373 - Mapped URL path [/webjars/**] onto handler of type [class org.springframework.web.servlet.resource.ResourceHttpRequestHandler]
2018-09-20 04:10:45 [main] INFO  org.springframework.web.servlet.handler.SimpleUrlHandlerMapping:registerHandler:373 - Mapped URL path [/**] onto handler of type [class org.springframework.web.servlet.resource.ResourceHttpRequestHandler]
2018-09-20 04:10:45 [main] INFO  org.springframework.boot.actuate.endpoint.web.EndpointLinksResolver:<init>:59 - Exposing 2 endpoint(s) beneath base path '/actuator'
2018-09-20 04:10:45 [main] INFO  org.springframework.boot.actuate.endpoint.web.servlet.WebMvcEndpointHandlerMapping:register:547 - Mapped "{[/actuator/health],methods=[GET],produces=[application/vnd.spring-boot.actuator.v2+json || application/json]}" onto public java.lang.Object org.springframework.boot.actuate.endpoint.web.servlet.AbstractWebMvcEndpointHandlerMapping$OperationHandler.handle(javax.servlet.http.HttpServletRequest,java.util.Map<java.lang.String, java.lang.String>)
2018-09-20 04:10:45 [main] INFO  org.springframework.boot.actuate.endpoint.web.servlet.WebMvcEndpointHandlerMapping:register:547 - Mapped "{[/actuator/info],methods=[GET],produces=[application/vnd.spring-boot.actuator.v2+json || application/json]}" onto public java.lang.Object org.springframework.boot.actuate.endpoint.web.servlet.AbstractWebMvcEndpointHandlerMapping$OperationHandler.handle(javax.servlet.http.HttpServletRequest,java.util.Map<java.lang.String, java.lang.String>)
2018-09-20 04:10:45 [main] INFO  org.springframework.boot.actuate.endpoint.web.servlet.WebMvcEndpointHandlerMapping:register:547 - Mapped "{[/actuator],methods=[GET],produces=[application/vnd.spring-boot.actuator.v2+json || application/json]}" onto protected java.lang.Object org.springframework.boot.actuate.endpoint.web.servlet.WebMvcEndpointHandlerMapping.links(javax.servlet.http.HttpServletRequest,javax.servlet.http.HttpServletResponse)
2018-09-20 04:10:45 [main] INFO  org.apache.coyote.http11.Http11NioProtocol:log:180 - Starting ProtocolHandler ["http-nio-auto-2"]
2018-09-20 04:10:45 [main] INFO  org.apache.tomcat.util.net.NioSelectorPool:log:180 - Using a shared selector for servlet write/read
2018-09-20 04:10:45 [main] INFO  org.springframework.boot.web.embedded.tomcat.TomcatWebServer:start:206 - Tomcat started on port(s): 34123 (http) with context path '/oar-dist-service'
2018-09-20 04:10:45 [main] INFO  gov.nist.oar.distrib.web.AIPAccessControllerTest:logStarted:59 - Started AIPAccessControllerTest in 2.186 seconds (JVM running for 14.865)
2018-09-20 04:10:45 [http-nio-auto-2-exec-1] INFO  org.apache.catalina.core.ContainerBase.[Tomcat-1].[localhost].[/oar-dist-service]:log:180 - Initializing Spring FrameworkServlet 'dispatcherServlet'
2018-09-20 04:10:45 [http-nio-auto-2-exec-1] INFO  org.springframework.web.servlet.DispatcherServlet:initServletBean:494 - FrameworkServlet 'dispatcherServlet': initialization started
2018-09-20 04:10:45 [http-nio-auto-2-exec-1] INFO  org.springframework.web.servlet.DispatcherServlet:initServletBean:509 - FrameworkServlet 'dispatcherServlet': initialization completed in 14 ms
2018-09-20 04:10:45 [http-nio-auto-2-exec-1] WARN  gov.nist.oar.distrib.storage.FilesystemLongTermStorage:getChecksum:104 - No cached checksum available for mds1491.mbag0_2-0.zip
2018-09-20 04:10:45 [http-nio-auto-2-exec-1] INFO  gov.nist.oar.distrib.web.AIPAccessController:downloadAIP:95 - AIP requested: mds1491.mbag0_2-0.zip
2018-09-20 04:10:45 [http-nio-auto-2-exec-1] INFO  gov.nist.oar.distrib.web.AIPAccessController:downloadAIP:117 - AIP delivered: mds1491.mbag0_2-0.zip
2018-09-20 04:10:45 [http-nio-auto-2-exec-2] WARN  gov.nist.oar.distrib.storage.FilesystemLongTermStorage:getChecksum:104 - No cached checksum available for mds1491.mbag0_2-0.zip
[INFO] Tests run: 2, Failures: 0, Errors: 0, Skipped: 0, Time elapsed: 2.369 s - in gov.nist.oar.distrib.web.AIPAccessControllerTest
[INFO] Running gov.nist.oar.distrib.web.DatasetAccessControllerTest
2018-09-20 04:10:46 [main] INFO  org.springframework.boot.test.context.SpringBootTestContextBootstrapper:buildDefaultMergedContextConfiguration:308 - Neither @ContextConfiguration nor @ContextHierarchy found for test class [gov.nist.oar.distrib.web.DatasetAccessControllerTest], using SpringBootContextLoader
2018-09-20 04:10:46 [main] INFO  org.springframework.test.context.support.AbstractContextLoader:generateDefaultLocations:264 - Could not detect default resource locations for test class [gov.nist.oar.distrib.web.DatasetAccessControllerTest]: no resource found for suffixes {-context.xml, Context.groovy}.
2018-09-20 04:10:46 [main] INFO  org.springframework.boot.test.context.SpringBootTestContextBootstrapper:getDefaultTestExecutionListenerClassNames:248 - Loaded default TestExecutionListener class names from location [META-INF/spring.factories]: [org.springframework.boot.test.mock.mockito.MockitoTestExecutionListener, org.springframework.boot.test.mock.mockito.ResetMocksTestExecutionListener, org.springframework.boot.test.autoconfigure.restdocs.RestDocsTestExecutionListener, org.springframework.boot.test.autoconfigure.web.client.MockRestServiceServerResetTestExecutionListener, org.springframework.boot.test.autoconfigure.web.servlet.MockMvcPrintOnlyOnFailureTestExecutionListener, org.springframework.boot.test.autoconfigure.web.servlet.WebDriverTestExecutionListener, org.springframework.test.context.web.ServletTestExecutionListener, org.springframework.test.context.support.DirtiesContextBeforeModesTestExecutionListener, org.springframework.test.context.support.DependencyInjectionTestExecutionListener, org.springframework.test.context.support.DirtiesContextTestExecutionListener, org.springframework.test.context.transaction.TransactionalTestExecutionListener, org.springframework.test.context.jdbc.SqlScriptsTestExecutionListener]
2018-09-20 04:10:46 [main] INFO  org.springframework.boot.test.context.SpringBootTestContextBootstrapper:getTestExecutionListeners:177 - Using TestExecutionListeners: [org.springframework.test.context.web.ServletTestExecutionListener@6e192d00, org.springframework.test.context.support.DirtiesContextBeforeModesTestExecutionListener@5c823dc5, org.springframework.boot.test.mock.mockito.MockitoTestExecutionListener@3564166c, org.springframework.boot.test.autoconfigure.SpringBootDependencyInjectionTestExecutionListener@50db8192, org.springframework.test.context.support.DirtiesContextTestExecutionListener@770dd7a4, org.springframework.boot.test.mock.mockito.ResetMocksTestExecutionListener@3a2cb095, org.springframework.boot.test.autoconfigure.restdocs.RestDocsTestExecutionListener@2f6e06ca, org.springframework.boot.test.autoconfigure.web.client.MockRestServiceServerResetTestExecutionListener@2335c5a4, org.springframework.boot.test.autoconfigure.web.servlet.MockMvcPrintOnlyOnFailureTestExecutionListener@3a1c9691, org.springframework.boot.test.autoconfigure.web.servlet.WebDriverTestExecutionListener@656b215f]
2018-09-20 04:10:46 [http-nio-auto-2-exec-3] INFO  gov.nist.oar.distrib.web.DatasetAccessController:handleResourceNotFoundException:395 - Non-existent resource requested: /oar-dist-service/ds/%253Cscript%253Egoober%253C%252Fscript%253E/_aip
  Resource not found with ID=%3Cscript%3Egoober%3C%2Fscript%3E
2018-09-20 04:10:46 [http-nio-auto-2-exec-4] INFO  gov.nist.oar.distrib.web.DatasetAccessController:handleResourceNotFoundException:395 - Non-existent resource requested: /oar-dist-service/ds/goober/_aip/_v
  Resource not found with ID=goober
2018-09-20 04:10:46 [http-nio-auto-2-exec-5] WARN  gov.nist.oar.distrib.storage.FilesystemLongTermStorage:getChecksum:104 - No cached checksum available for mds1491.mbag0_2-0.zip
2018-09-20 04:10:46 [http-nio-auto-2-exec-5] WARN  gov.nist.oar.distrib.storage.FilesystemLongTermStorage:getChecksum:104 - No cached checksum available for mds1491.1_1_0.mbag0_4-1.zip
2018-09-20 04:10:46 [http-nio-auto-2-exec-6] INFO  gov.nist.oar.distrib.web.DatasetAccessController:downloadFile:317 - Download requested for mds1491/trial1.json
2018-09-20 04:10:46 [http-nio-auto-2-exec-6] WARN  gov.nist.oar.distrib.storage.FilesystemLongTermStorage:getChecksum:104 - No cached checksum available for mds1491.1_1_0.mbag0_4-1.zip
2018-09-20 04:10:46 [http-nio-auto-2-exec-6] WARN  gov.nist.oar.distrib.storage.FilesystemLongTermStorage:getChecksum:104 - No cached checksum available for mds1491.1_1_0.mbag0_4-1.zip
2018-09-20 04:10:46 [http-nio-auto-2-exec-6] INFO  gov.nist.oar.distrib.web.DatasetAccessController:downloadFile:343 - Data File delivered: trial1.json
2018-09-20 04:10:46 [http-nio-auto-2-exec-6] INFO  gov.nist.oar.distrib.web.DatasetAccessController:downloadFile:317 - Download requested for mds1491/trial1.json
2018-09-20 04:10:46 [http-nio-auto-2-exec-6] WARN  gov.nist.oar.distrib.storage.FilesystemLongTermStorage:getChecksum:104 - No cached checksum available for mds1491.1_1_0.mbag0_4-1.zip
2018-09-20 04:10:46 [http-nio-auto-2-exec-6] WARN  gov.nist.oar.distrib.storage.FilesystemLongTermStorage:getChecksum:104 - No cached checksum available for mds1491.1_1_0.mbag0_4-1.zip
2018-09-20 04:10:46 [http-nio-auto-2-exec-6] INFO  gov.nist.oar.distrib.web.DatasetAccessController:downloadFile:343 - Data File delivered: trial1.json
2018-09-20 04:10:46 [http-nio-auto-2-exec-2] INFO  gov.nist.oar.distrib.web.DatasetAccessController:handleResourceNotFoundException:395 - Non-existent resource requested: /oar-dist-service/ds/goober/_aip/_head
  Resource not found with ID=goober
2018-09-20 04:10:46 [http-nio-auto-2-exec-3] WARN  gov.nist.oar.distrib.storage.FilesystemLongTermStorage:getChecksum:104 - No cached checksum available for mds1491.mbag0_2-0.zip
2018-09-20 04:10:46 [http-nio-auto-2-exec-3] WARN  gov.nist.oar.distrib.storage.FilesystemLongTermStorage:getChecksum:104 - No cached checksum available for mds1491.1_1_0.mbag0_4-1.zip
2018-09-20 04:10:46 [http-nio-auto-2-exec-4] WARN  gov.nist.oar.distrib.storage.FilesystemLongTermStorage:getChecksum:104 - No cached checksum available for mds1491.mbag0_2-0.zip
2018-09-20 04:10:46 [http-nio-auto-2-exec-4] WARN  gov.nist.oar.distrib.storage.FilesystemLongTermStorage:getChecksum:104 - No cached checksum available for mds1491.1_1_0.mbag0_4-1.zip
2018-09-20 04:10:46 [http-nio-auto-2-exec-5] INFO  gov.nist.oar.distrib.web.DatasetAccessController:handleResourceNotFoundException:395 - Non-existent resource requested: /oar-dist-service/ds/goober/_aip
  Resource not found with ID=goober
2018-09-20 04:10:46 [http-nio-auto-2-exec-9] WARN  gov.nist.oar.distrib.storage.FilesystemLongTermStorage:getChecksum:104 - No cached checksum available for mds1491.1_1_0.mbag0_4-1.zip
2018-09-20 04:10:46 [http-nio-auto-2-exec-8] WARN  gov.nist.oar.distrib.storage.FilesystemLongTermStorage:getChecksum:104 - No cached checksum available for mds1491.mbag0_2-0.zip
2018-09-20 04:10:46 [http-nio-auto-2-exec-10] WARN  gov.nist.oar.distrib.storage.FilesystemLongTermStorage:getChecksum:104 - No cached checksum available for mds1491.1_1_0.mbag0_4-1.zip
2018-09-20 04:10:46 [http-nio-auto-2-exec-7] INFO  gov.nist.oar.distrib.web.DatasetAccessController:handleResourceNotFoundException:395 - Non-existent resource requested: /oar-dist-service/ds/goober/_aip/_v/0
  Resource not found with ID=goober
2018-09-20 04:10:46 [http-nio-auto-2-exec-1] WARN  gov.nist.oar.distrib.storage.FilesystemLongTermStorage:getChecksum:104 - No cached checksum available for mds1491.mbag0_2-0.zip
2018-09-20 04:10:46 [http-nio-auto-2-exec-1] WARN  gov.nist.oar.distrib.storage.FilesystemLongTermStorage:getChecksum:104 - No cached checksum available for mds1491.1_1_0.mbag0_4-1.zip
2018-09-20 04:10:46 [http-nio-auto-2-exec-1] INFO  gov.nist.oar.distrib.web.DatasetAccessController:handleResourceNotFoundException:401 - Non-existent resource version requested: /oar-dist-service/ds/mds1491/_aip/_v/12.32
  Version 12.32 not found for resource with ID=mds1491
2018-09-20 04:10:46 [http-nio-auto-2-exec-6] INFO  gov.nist.oar.distrib.web.DatasetAccessController:downloadFile:317 - Download requested for goober/trial1.json
2018-09-20 04:10:46 [http-nio-auto-2-exec-6] INFO  gov.nist.oar.distrib.web.DatasetAccessController:handleResourceNotFoundException:395 - Non-existent resource requested: /oar-dist-service/ds/goober/trial1.json
  Resource not found with ID=goober
2018-09-20 04:10:46 [http-nio-auto-2-exec-2] INFO  gov.nist.oar.distrib.web.DatasetAccessController:downloadFile:317 - Download requested for mds1491/goober/trial1.json
2018-09-20 04:10:46 [http-nio-auto-2-exec-2] WARN  gov.nist.oar.distrib.storage.FilesystemLongTermStorage:getChecksum:104 - No cached checksum available for mds1491.1_1_0.mbag0_4-1.zip
2018-09-20 04:10:46 [http-nio-auto-2-exec-2] INFO  gov.nist.oar.distrib.web.DatasetAccessController:handleResourceNotFoundException:412 - Non-existent file requested from resource: /oar-dist-service/ds/mds1491/goober/trial1.json
  data/goober/trial1.json: Filepath not found in dataset id=mds1491
2018-09-20 04:10:46 [http-nio-auto-2-exec-3] INFO  gov.nist.oar.distrib.web.DatasetAccessController:handleServiceSyntaxException:432 - Malformed input detected in /oar-dist-service/ds/goob%20er/trial1.json
  Malformed value for dsid parameter: goob er
2018-09-20 04:10:46 [http-nio-auto-2-exec-4] INFO  gov.nist.oar.distrib.web.DatasetAccessController:handleServiceSyntaxException:432 - Malformed input detected in /oar-dist-service/ds/mds1491/.trial3a.json
  Malformed value for filepath parameter: .trial3a.json
2018-09-20 04:10:46 [http-nio-auto-2-exec-9] INFO  gov.nist.oar.distrib.web.DatasetAccessController:downloadFile:317 - Download requested for mds1491/trial1.json
2018-09-20 04:10:46 [http-nio-auto-2-exec-9] WARN  gov.nist.oar.distrib.storage.FilesystemLongTermStorage:getChecksum:104 - No cached checksum available for mds1491.1_1_0.mbag0_4-1.zip
2018-09-20 04:10:46 [http-nio-auto-2-exec-9] WARN  gov.nist.oar.distrib.storage.FilesystemLongTermStorage:getChecksum:104 - No cached checksum available for mds1491.1_1_0.mbag0_4-1.zip
2018-09-20 04:10:46 [http-nio-auto-2-exec-9] INFO  gov.nist.oar.distrib.web.DatasetAccessController:downloadFile:343 - Data File delivered: trial1.json
[INFO] Tests run: 16, Failures: 0, Errors: 0, Skipped: 0, Time elapsed: 0.493 s - in gov.nist.oar.distrib.web.DatasetAccessControllerTest
[INFO] Running gov.nist.oar.distrib.web.ErrorInfoTest
[INFO] Tests run: 2, Failures: 0, Errors: 0, Skipped: 0, Time elapsed: 0.007 s - in gov.nist.oar.distrib.web.ErrorInfoTest
[INFO] Running gov.nist.oar.distrib.web.NISTDistribServiceConfigTest
2018-09-20 04:10:46 [main] INFO  org.springframework.test.context.support.DefaultTestContextBootstrapper:getDefaultTestExecutionListenerClassNames:248 - Loaded default TestExecutionListener class names from location [META-INF/spring.factories]: [org.springframework.boot.test.mock.mockito.MockitoTestExecutionListener, org.springframework.boot.test.mock.mockito.ResetMocksTestExecutionListener, org.springframework.boot.test.autoconfigure.restdocs.RestDocsTestExecutionListener, org.springframework.boot.test.autoconfigure.web.client.MockRestServiceServerResetTestExecutionListener, org.springframework.boot.test.autoconfigure.web.servlet.MockMvcPrintOnlyOnFailureTestExecutionListener, org.springframework.boot.test.autoconfigure.web.servlet.WebDriverTestExecutionListener, org.springframework.test.context.web.ServletTestExecutionListener, org.springframework.test.context.support.DirtiesContextBeforeModesTestExecutionListener, org.springframework.test.context.support.DependencyInjectionTestExecutionListener, org.springframework.test.context.support.DirtiesContextTestExecutionListener, org.springframework.test.context.transaction.TransactionalTestExecutionListener, org.springframework.test.context.jdbc.SqlScriptsTestExecutionListener]
2018-09-20 04:10:46 [main] INFO  org.springframework.test.context.support.DefaultTestContextBootstrapper:getTestExecutionListeners:177 - Using TestExecutionListeners: [org.springframework.test.context.web.ServletTestExecutionListener@464b3f64, org.springframework.test.context.support.DirtiesContextBeforeModesTestExecutionListener@409a57a0, org.springframework.boot.test.mock.mockito.MockitoTestExecutionListener@3a7cdcdd, org.springframework.test.context.support.DependencyInjectionTestExecutionListener@6bdbf67d, org.springframework.test.context.support.DirtiesContextTestExecutionListener@74f4447d, org.springframework.boot.test.mock.mockito.ResetMocksTestExecutionListener@66413a14, org.springframework.boot.test.autoconfigure.restdocs.RestDocsTestExecutionListener@3a078835, org.springframework.boot.test.autoconfigure.web.client.MockRestServiceServerResetTestExecutionListener@e5bf916, org.springframework.boot.test.autoconfigure.web.servlet.MockMvcPrintOnlyOnFailureTestExecutionListener@585a830c, org.springframework.boot.test.autoconfigure.web.servlet.WebDriverTestExecutionListener@37249389]
2018-09-20 04:10:46 [main] INFO  org.springframework.context.support.GenericApplicationContext:prepareRefresh:590 - Refreshing org.springframework.context.support.GenericApplicationContext@6c6892e0: startup date [Thu Sep 20 04:10:46 CEST 2018]; root of context hierarchy
2018-09-20 04:10:47 [main] INFO  org.springframework.cloud.context.scope.GenericScope:setSerializationId:293 - BeanFactory id=a2caf2fa-8cca-3208-bd6b-e5cb5cb517e0
2018-09-20 04:10:47 [main] INFO  org.springframework.beans.factory.annotation.AutowiredAnnotationBeanPostProcessor:<init>:154 - JSR-330 'javax.inject.Inject' annotation found and supported for autowiring
2018-09-20 04:10:47 [main] INFO  org.springframework.context.support.PostProcessorRegistrationDelegate$BeanPostProcessorChecker:postProcessAfterInitialization:328 - Bean 'org.springframework.cloud.autoconfigure.ConfigurationPropertiesRebinderAutoConfiguration' of type [org.springframework.cloud.autoconfigure.ConfigurationPropertiesRebinderAutoConfiguration$$EnhancerBySpringCGLIB$$df7cc9a1] is not eligible for getting processed by all BeanPostProcessors (for example: not eligible for auto-proxying)
2018-09-20 04:10:47 [main] INFO  gov.nist.oar.distrib.storage.FilesystemLongTermStorage:<init>:69 - Creating FilesystemLongTermStorage rooted at /root/workspace/RayPlante/oar-dist-service/430829786/src/test/resources
2018-09-20 04:10:47 [main] INFO  org.springframework.jmx.export.annotation.AnnotationMBeanExporter:afterSingletonsInstantiated:433 - Registering beans for JMX exposure on startup
2018-09-20 04:10:47 [main] INFO  org.springframework.jmx.export.annotation.AnnotationMBeanExporter:autodetect:895 - Bean with name 'configurationPropertiesRebinder' has been autodetected for JMX exposure
2018-09-20 04:10:47 [main] INFO  org.springframework.jmx.export.annotation.AnnotationMBeanExporter:autodetect:895 - Bean with name 'environmentManager' has been autodetected for JMX exposure
2018-09-20 04:10:47 [main] INFO  org.springframework.jmx.export.annotation.AnnotationMBeanExporter:autodetect:895 - Bean with name 'refreshScope' has been autodetected for JMX exposure
2018-09-20 04:10:47 [main] INFO  org.springframework.jmx.export.annotation.AnnotationMBeanExporter:registerBeanInstance:675 - Located managed bean 'environmentManager': registering with JMX server as MBean [org.springframework.cloud.context.environment:name=environmentManager,type=EnvironmentManager]
2018-09-20 04:10:47 [main] INFO  org.springframework.jmx.export.annotation.AnnotationMBeanExporter:registerBeanInstance:675 - Located managed bean 'refreshScope': registering with JMX server as MBean [org.springframework.cloud.context.scope.refresh:name=refreshScope,type=RefreshScope]
2018-09-20 04:10:47 [main] INFO  org.springframework.jmx.export.annotation.AnnotationMBeanExporter:registerBeanInstance:675 - Located managed bean 'configurationPropertiesRebinder': registering with JMX server as MBean [org.springframework.cloud.context.properties:name=configurationPropertiesRebinder,type=ConfigurationPropertiesRebinder]
[INFO] Tests run: 1, Failures: 0, Errors: 0, Skipped: 0, Time elapsed: 1.331 s - in gov.nist.oar.distrib.web.NISTDistribServiceConfigTest
[INFO] Running gov.nist.oar.distrib.StreamHandleTest
[INFO] Tests run: 5, Failures: 0, Errors: 0, Skipped: 0, Time elapsed: 0 s - in gov.nist.oar.distrib.StreamHandleTest
[INFO] Running gov.nist.oar.distrib.service.FromBagFileDownloadServiceTest
2018-09-20 04:10:47 [main] INFO  gov.nist.oar.distrib.storage.FilesystemLongTermStorage:<init>:69 - Creating FilesystemLongTermStorage rooted at /root/workspace/RayPlante/oar-dist-service/430829786/_unittest1749070650917358869
2018-09-20 04:10:47 [main] INFO  gov.nist.oar.distrib.storage.FilesystemLongTermStorage:<init>:69 - Creating FilesystemLongTermStorage rooted at /root/workspace/RayPlante/oar-dist-service/430829786/_unittest1749070650917358869
2018-09-20 04:10:47 [main] INFO  gov.nist.oar.distrib.storage.FilesystemLongTermStorage:<init>:69 - Creating FilesystemLongTermStorage rooted at /root/workspace/RayPlante/oar-dist-service/430829786/_unittest1749070650917358869
2018-09-20 04:10:47 [main] WARN  gov.nist.oar.distrib.storage.FilesystemLongTermStorage:getChecksum:104 - No cached checksum available for mds1491.mbag0_2-0.zip
2018-09-20 04:10:47 [main] WARN  gov.nist.oar.distrib.storage.FilesystemLongTermStorage:getChecksum:104 - No cached checksum available for mds1491.mbag0_2-0.zip
2018-09-20 04:10:47 [main] WARN  gov.nist.oar.distrib.storage.FilesystemLongTermStorage:getChecksum:104 - No cached checksum available for mds1491.1_1_0.mbag0_4-1.zip
2018-09-20 04:10:47 [main] WARN  gov.nist.oar.distrib.storage.FilesystemLongTermStorage:getChecksum:104 - No cached checksum available for mds1491.1_1_0.mbag0_4-1.zip
2018-09-20 04:10:47 [main] WARN  gov.nist.oar.distrib.storage.FilesystemLongTermStorage:getChecksum:104 - No cached checksum available for mds1491.1_1_0.mbag0_4-1.zip
2018-09-20 04:10:47 [main] WARN  gov.nist.oar.distrib.storage.FilesystemLongTermStorage:getChecksum:104 - No cached checksum available for mds1491.1_1_0.mbag0_4-1.zip
2018-09-20 04:10:47 [main] INFO  gov.nist.oar.distrib.storage.FilesystemLongTermStorage:<init>:69 - Creating FilesystemLongTermStorage rooted at /root/workspace/RayPlante/oar-dist-service/430829786/_unittest1749070650917358869
2018-09-20 04:10:47 [main] INFO  gov.nist.oar.distrib.storage.FilesystemLongTermStorage:<init>:69 - Creating FilesystemLongTermStorage rooted at /root/workspace/RayPlante/oar-dist-service/430829786/_unittest1749070650917358869
2018-09-20 04:10:47 [main] WARN  gov.nist.oar.distrib.storage.FilesystemLongTermStorage:getChecksum:104 - No cached checksum available for mds1491.mbag0_2-0.zip
2018-09-20 04:10:47 [main] INFO  gov.nist.oar.distrib.storage.FilesystemLongTermStorage:<init>:69 - Creating FilesystemLongTermStorage rooted at /root/workspace/RayPlante/oar-dist-service/430829786/_unittest1749070650917358869
2018-09-20 04:10:47 [main] INFO  gov.nist.oar.distrib.storage.FilesystemLongTermStorage:<init>:69 - Creating FilesystemLongTermStorage rooted at /root/workspace/RayPlante/oar-dist-service/430829786/_unittest1749070650917358869
2018-09-20 04:10:47 [main] WARN  gov.nist.oar.distrib.storage.FilesystemLongTermStorage:getChecksum:104 - No cached checksum available for mds1491.mbag0_2-0.zip
2018-09-20 04:10:47 [main] WARN  gov.nist.oar.distrib.storage.FilesystemLongTermStorage:getChecksum:104 - No cached checksum available for mds1491.1_1_0.mbag0_4-1.zip
2018-09-20 04:10:47 [main] INFO  gov.nist.oar.distrib.storage.FilesystemLongTermStorage:<init>:69 - Creating FilesystemLongTermStorage rooted at /root/workspace/RayPlante/oar-dist-service/430829786/_unittest1749070650917358869
2018-09-20 04:10:47 [main] INFO  gov.nist.oar.distrib.storage.FilesystemLongTermStorage:<init>:69 - Creating FilesystemLongTermStorage rooted at /root/workspace/RayPlante/oar-dist-service/430829786/_unittest1749070650917358869
2018-09-20 04:10:47 [main] WARN  gov.nist.oar.distrib.storage.FilesystemLongTermStorage:getChecksum:104 - No cached checksum available for mds1491.mbag0_2-0.zip
2018-09-20 04:10:47 [main] WARN  gov.nist.oar.distrib.storage.FilesystemLongTermStorage:getChecksum:104 - No cached checksum available for mds1491.mbag0_2-0.zip
[INFO] Tests run: 9, Failures: 0, Errors: 0, Skipped: 0, Time elapsed: 0.058 s - in gov.nist.oar.distrib.service.FromBagFileDownloadServiceTest
[INFO] Running gov.nist.oar.distrib.service.DefaultPreservationBagServiceTest
2018-09-20 04:10:47 [main] INFO  gov.nist.oar.distrib.storage.FilesystemLongTermStorage:<init>:69 - Creating FilesystemLongTermStorage rooted at /root/workspace/RayPlante/oar-dist-service/430829786/_unittest2917147169836259252
2018-09-20 04:10:47 [main] INFO  gov.nist.oar.distrib.storage.FilesystemLongTermStorage:<init>:69 - Creating FilesystemLongTermStorage rooted at /root/workspace/RayPlante/oar-dist-service/430829786/_unittest2917147169836259252
2018-09-20 04:10:47 [main] INFO  gov.nist.oar.distrib.storage.FilesystemLongTermStorage:<init>:69 - Creating FilesystemLongTermStorage rooted at /root/workspace/RayPlante/oar-dist-service/430829786/_unittest2917147169836259252
2018-09-20 04:10:47 [main] INFO  gov.nist.oar.distrib.storage.FilesystemLongTermStorage:<init>:69 - Creating FilesystemLongTermStorage rooted at /root/workspace/RayPlante/oar-dist-service/430829786/_unittest2917147169836259252
2018-09-20 04:10:47 [main] INFO  gov.nist.oar.distrib.storage.FilesystemLongTermStorage:<init>:69 - Creating FilesystemLongTermStorage rooted at /root/workspace/RayPlante/oar-dist-service/430829786/_unittest2917147169836259252
2018-09-20 04:10:47 [main] INFO  gov.nist.oar.distrib.storage.FilesystemLongTermStorage:<init>:69 - Creating FilesystemLongTermStorage rooted at /root/workspace/RayPlante/oar-dist-service/430829786/_unittest2917147169836259252
2018-09-20 04:10:47 [main] INFO  gov.nist.oar.distrib.storage.FilesystemLongTermStorage:<init>:69 - Creating FilesystemLongTermStorage rooted at /root/workspace/RayPlante/oar-dist-service/430829786/_unittest2917147169836259252
2018-09-20 04:10:47 [main] INFO  gov.nist.oar.distrib.storage.FilesystemLongTermStorage:<init>:69 - Creating FilesystemLongTermStorage rooted at /root/workspace/RayPlante/oar-dist-service/430829786/_unittest2917147169836259252
[INFO] Tests run: 8, Failures: 0, Errors: 0, Skipped: 0, Time elapsed: 0.05 s - in gov.nist.oar.distrib.service.DefaultPreservationBagServiceTest
[INFO] Running gov.nist.oar.distrib.ChecksumTest
[INFO] Tests run: 2, Failures: 0, Errors: 0, Skipped: 0, Time elapsed: 0 s - in gov.nist.oar.distrib.ChecksumTest
[INFO] Running gov.nist.oar.distrib.storage.FilesystemLongTermStorageTest
2018-09-20 04:10:48 [main] INFO  gov.nist.oar.distrib.storage.FilesystemLongTermStorage:<init>:69 - Creating FilesystemLongTermStorage rooted at /root/workspace/RayPlante/oar-dist-service/430829786/_unittest4711147311974539030
2018-09-20 04:10:48 [main] INFO  gov.nist.oar.distrib.storage.FilesystemLongTermStorage:<init>:69 - Creating FilesystemLongTermStorage rooted at /root/workspace/RayPlante/oar-dist-service/430829786/_unittest3028582507020374347
2018-09-20 04:10:48 [main] INFO  gov.nist.oar.distrib.storage.FilesystemLongTermStorage:<init>:69 - Creating FilesystemLongTermStorage rooted at /root/workspace/RayPlante/oar-dist-service/430829786/_unittest8675530453494137626
2018-09-20 04:10:48 [main] INFO  gov.nist.oar.distrib.storage.FilesystemLongTermStorage:<init>:69 - Creating FilesystemLongTermStorage rooted at /root/workspace/RayPlante/oar-dist-service/430829786/_unittest50204803682296382
2018-09-20 04:10:48 [main] INFO  gov.nist.oar.distrib.storage.FilesystemLongTermStorage:<init>:69 - Creating FilesystemLongTermStorage rooted at /root/workspace/RayPlante/oar-dist-service/430829786/_unittest886632451161770204
2018-09-20 04:10:48 [main] INFO  gov.nist.oar.distrib.storage.FilesystemLongTermStorage:<init>:69 - Creating FilesystemLongTermStorage rooted at /root/workspace/RayPlante/oar-dist-service/430829786/_unittest2156822907778741792
[INFO] Tests run: 6, Failures: 0, Errors: 0, Skipped: 0, Time elapsed: 0.062 s - in gov.nist.oar.distrib.storage.FilesystemLongTermStorageTest
[INFO] Running gov.nist.oar.distrib.storage.AWSS3LongTermStorageTest
2018-09-20 04:10:48 [main] INFO  cloud.localstack.Localstack:ensureInstallation:141 - Installing LocalStack to temporary directory (this may take a while): /tmp/localstack_install_dir
[ERROR] Tests run: 1, Failures: 0, Errors: 1, Skipped: 0, Time elapsed: 1.903 s <<< FAILURE! - in gov.nist.oar.distrib.storage.AWSS3LongTermStorageTest
[ERROR] gov.nist.oar.distrib.storage.AWSS3LongTermStorageTest  Time elapsed: 1.903 s  <<< ERROR!
java.lang.RuntimeException: 
java.lang.IllegalStateException: Failed to run command 'bash -c cd "/tmp/localstack_install_dir"; make install', return code 127.
STDOUT: 
STDERR: bash: make: command not found

	at org.apache.maven.surefire.junit4.JUnit4Provider.execute(JUnit4Provider.java:365)
	at org.apache.maven.surefire.junit4.JUnit4Provider.executeWithRerun(JUnit4Provider.java:273)
	at org.apache.maven.surefire.junit4.JUnit4Provider.executeTestSet(JUnit4Provider.java:238)
	at org.apache.maven.surefire.junit4.JUnit4Provider.invoke(JUnit4Provider.java:159)
Caused by: java.lang.IllegalStateException: 
Failed to run command 'bash -c cd "/tmp/localstack_install_dir"; make install', return code 127.
STDOUT: 
STDERR: bash: make: command not found

	at org.apache.maven.surefire.junit4.JUnit4Provider.execute(JUnit4Provider.java:365)
	at org.apache.maven.surefire.junit4.JUnit4Provider.executeWithRerun(JUnit4Provider.java:273)
	at org.apache.maven.surefire.junit4.JUnit4Provider.executeTestSet(JUnit4Provider.java:238)
	at org.apache.maven.surefire.junit4.JUnit4Provider.invoke(JUnit4Provider.java:159)

[INFO] Running gov.nist.oar.distrib.BagDescriptionTest
[INFO] Tests run: 6, Failures: 0, Errors: 0, Skipped: 0, Time elapsed: 0.003 s - in gov.nist.oar.distrib.BagDescriptionTest
[INFO] Running gov.nist.oar.distrib.DistributionExceptionTest
[INFO] Tests run: 2, Failures: 0, Errors: 0, Skipped: 0, Time elapsed: 0 s - in gov.nist.oar.distrib.DistributionExceptionTest
[INFO] Running gov.nist.oar.bags.preservation.ZipBagUtilsTest
[INFO] Tests run: 5, Failures: 0, Errors: 0, Skipped: 0, Time elapsed: 0.001 s - in gov.nist.oar.bags.preservation.ZipBagUtilsTest
[INFO] Running gov.nist.oar.bags.preservation.HeadBagUtilsTest
[INFO] Tests run: 3, Failures: 0, Errors: 0, Skipped: 0, Time elapsed: 0 s - in gov.nist.oar.bags.preservation.HeadBagUtilsTest
[INFO] Running gov.nist.oar.bags.preservation.BagUtilsTest
[INFO] Tests run: 10, Failures: 0, Errors: 0, Skipped: 0, Time elapsed: 0.001 s - in gov.nist.oar.bags.preservation.BagUtilsTest
2018-09-20 04:10:50 [Thread-9] INFO  org.springframework.boot.web.servlet.context.AnnotationConfigServletWebServerApplicationContext:doClose:993 - Closing org.springframework.boot.web.servlet.context.AnnotationConfigServletWebServerApplicationContext@79b3937a: startup date [Thu Sep 20 04:10:37 CEST 2018]; parent: org.springframework.context.annotation.AnnotationConfigApplicationContext@49d52df2
2018-09-20 04:10:50 [Thread-20] INFO  org.springframework.context.support.GenericApplicationContext:doClose:993 - Closing org.springframework.context.support.GenericApplicationContext@6c6892e0: startup date [Thu Sep 20 04:10:46 CEST 2018]; root of context hierarchy
2018-09-20 04:10:50 [Thread-15] INFO  org.springframework.boot.web.servlet.context.AnnotationConfigServletWebServerApplicationContext:doClose:993 - Closing org.springframework.boot.web.servlet.context.AnnotationConfigServletWebServerApplicationContext@4c77ab24: startup date [Thu Sep 20 04:10:43 CEST 2018]; parent: org.springframework.context.annotation.AnnotationConfigApplicationContext@16427496
2018-09-20 04:10:50 [Thread-20] INFO  org.springframework.jmx.export.annotation.AnnotationMBeanExporter:destroy:451 - Unregistering JMX-exposed beans on shutdown
2018-09-20 04:10:50 [Thread-20] INFO  org.springframework.jmx.export.annotation.AnnotationMBeanExporter:unregisterBeans:183 - Unregistering JMX-exposed beans
[INFO] 
[INFO] Results:
[INFO] 
[ERROR] Errors: 
[ERROR]   JUnit4Provider.invoke:159->executeTestSet:238->executeWithRerun:273->execute:365  Runtime
[INFO] 
[ERROR] Tests run: 84, Failures: 0, Errors: 1, Skipped: 0
[INFO] 
[INFO] ------------------------------------------------------------------------
[INFO] BUILD FAILURE
[INFO] ------------------------------------------------------------------------
[INFO] Total time: 25.217 s
[INFO] Finished at: 2018-09-20T04:10:50+02:00
[INFO] Final Memory: 45M/401M
[INFO] ------------------------------------------------------------------------
[ERROR] Failed to execute goal org.apache.maven.plugins:maven-surefire-plugin:2.21.0:test (default-test) on project oar-dist-service: There are test failures.
[ERROR] 
[ERROR] Please refer to /root/workspace/RayPlante/oar-dist-service/430829786/target/surefire-reports for the individual test results.
[ERROR] Please refer to dump files (if any exist) [date]-jvmRun[N].dump, [date].dumpstream and [date]-jvmRun[N].dumpstream.
[ERROR] -> [Help 1]
[ERROR] 
[ERROR] To see the full stack trace of the errors, re-run Maven with the -e switch.
[ERROR] Re-run Maven using the -X switch to enable full debug logging.
[ERROR] 
[ERROR] For more information about the errors and possible solutions, please read the following articles:
[ERROR] [Help 1] http://cwiki.apache.org/confluence/display/MAVEN/MojoFailureException
