[INFO] Scanning for projects...
[WARNING] 
[WARNING] Some problems were encountered while building the effective model for de.swt.inf:Karlender:jar:0.0.2
[WARNING] 'dependencies.dependency.(groupId:artifactId:type:classifier)' must be unique: com.h2database:h2:jar -> version (?) vs 1.4.197 @ line 69, column 21
[WARNING] 
[WARNING] It is highly recommended to fix these problems because they threaten the stability of your build.
[WARNING] 
[WARNING] For this reason, future Maven versions might no longer support building such malformed projects.
[WARNING] 
[INFO]                                                                         
[INFO] ------------------------------------------------------------------------
[INFO] Building Karlender 0.0.2
[INFO] ------------------------------------------------------------------------
[INFO] 
[INFO] --- maven-resources-plugin:2.6:resources (default-resources) @ Karlender ---
[INFO] Using 'UTF-8' encoding to copy filtered resources.
[INFO] Copying 1 resource
[INFO] Copying 25 resources
[INFO] 
[INFO] --- maven-compiler-plugin:3.1:compile (default-compile) @ Karlender ---
[INFO] Nothing to compile - all classes are up to date
[INFO] 
[INFO] --- maven-resources-plugin:2.6:testResources (default-testResources) @ Karlender ---
[INFO] Using 'UTF-8' encoding to copy filtered resources.
[INFO] skip non existing resourceDirectory /root/workspace/TetrisIQ/SWT-II/432365318/src/test/resources
[INFO] 
[INFO] --- maven-compiler-plugin:3.1:testCompile (default-testCompile) @ Karlender ---
[INFO] Changes detected - recompiling the module!
[INFO] Compiling 8 source files to /root/workspace/TetrisIQ/SWT-II/432365318/target/test-classes
[INFO] 
[INFO] --- maven-surefire-plugin:2.18.1:test (default-test) @ Karlender ---
[INFO] Surefire report directory: /root/workspace/TetrisIQ/SWT-II/432365318/target/surefire-reports
[INFO] Downloading: https://repo.maven.apache.org/maven2/org/apache/maven/surefire/surefire-junit4/2.18.1/surefire-junit4-2.18.1.pom
[INFO] Downloaded: https://repo.maven.apache.org/maven2/org/apache/maven/surefire/surefire-junit4/2.18.1/surefire-junit4-2.18.1.pom (3 KB at 7.9 KB/sec)
[INFO] Downloading: https://repo.maven.apache.org/maven2/org/apache/maven/surefire/surefire-providers/2.18.1/surefire-providers-2.18.1.pom
[INFO] Downloaded: https://repo.maven.apache.org/maven2/org/apache/maven/surefire/surefire-providers/2.18.1/surefire-providers-2.18.1.pom (3 KB at 71.0 KB/sec)
[INFO] Downloading: https://repo.maven.apache.org/maven2/org/apache/maven/surefire/surefire-junit4/2.18.1/surefire-junit4-2.18.1.jar
[INFO] Downloaded: https://repo.maven.apache.org/maven2/org/apache/maven/surefire/surefire-junit4/2.18.1/surefire-junit4-2.18.1.jar (67 KB at 935.1 KB/sec)

-------------------------------------------------------
 T E S T S
-------------------------------------------------------
Running de.swt.inf.model.UserRegistrationTest

  .   ____          _            __ _ _
 /\\ / ___'_ __ _ _(_)_ __  __ _ \ \ \ \
( ( )\___ | '_ | '_| | '_ \/ _` | \ \ \ \
 \\/  ___)| |_)| | | | | || (_| |  ) ) ) )
  '  |____| .__|_| |_|_| |_\__, | / / / /
 =========|_|==============|___/=/_/_/_/
 :: Spring Boot ::        (v1.5.9.RELEASE)

2018-09-24 10:21:14.558  INFO 151 --- [           main] o.a.maven.surefire.booter.ForkedBooter   : Starting ForkedBooter v2.18.1 on cyclone1 with PID 151 (started by root in /root/workspace/TetrisIQ/SWT-II/432365318)
2018-09-24 10:21:14.562  INFO 151 --- [           main] o.a.maven.surefire.booter.ForkedBooter   : No active profile set, falling back to default profiles: default
2018-09-24 10:21:14.622  INFO 151 --- [           main] ationConfigEmbeddedWebApplicationContext : Refreshing org.springframework.boot.context.embedded.AnnotationConfigEmbeddedWebApplicationContext@14dd9eb7: startup date [Mon Sep 24 10:21:14 CEST 2018]; root of context hierarchy
2018-09-24 10:21:15.491  INFO 151 --- [           main] o.s.b.f.s.DefaultListableBeanFactory     : Overriding bean definition for bean 'dataSource' with a different definition: replacing [Root bean: class [null]; scope=; abstract=false; lazyInit=false; autowireMode=3; dependencyCheck=0; autowireCandidate=true; primary=false; factoryBeanName=org.springframework.boot.autoconfigure.jdbc.DataSourceConfiguration$Dbcp; factoryMethodName=dataSource; initMethodName=null; destroyMethodName=(inferred); defined in class path resource [org/springframework/boot/autoconfigure/jdbc/DataSourceConfiguration$Dbcp.class]] with [Root bean: class [null]; scope=; abstract=false; lazyInit=false; autowireMode=3; dependencyCheck=0; autowireCandidate=true; primary=false; factoryBeanName=org.springframework.boot.autoconfigure.jdbc.DataSourceConfiguration$Tomcat; factoryMethodName=dataSource; initMethodName=null; destroyMethodName=(inferred); defined in class path resource [org/springframework/boot/autoconfigure/jdbc/DataSourceConfiguration$Tomcat.class]]
2018-09-24 10:21:16.714  INFO 151 --- [           main] s.b.c.e.t.TomcatEmbeddedServletContainer : Tomcat initialized with port(s): 8080 (http)
2018-09-24 10:21:16.735  INFO 151 --- [           main] o.apache.catalina.core.StandardService   : Starting service [Tomcat]
2018-09-24 10:21:16.737  INFO 151 --- [           main] org.apache.catalina.core.StandardEngine  : Starting Servlet Engine: Apache Tomcat/8.5.23
2018-09-24 10:21:16.871  INFO 151 --- [ost-startStop-1] o.a.c.c.C.[Tomcat].[localhost].[/]       : Initializing Spring embedded WebApplicationContext
2018-09-24 10:21:16.871  INFO 151 --- [ost-startStop-1] o.s.web.context.ContextLoader            : Root WebApplicationContext: initialization completed in 2253 ms
2018-09-24 10:21:17.138  INFO 151 --- [ost-startStop-1] o.s.b.w.servlet.ServletRegistrationBean  : Mapping servlet: 'dispatcherServlet' to [/]
2018-09-24 10:21:17.139  INFO 151 --- [ost-startStop-1] o.s.b.w.servlet.ServletRegistrationBean  : Mapping servlet: 'webServlet' to [/h2-console/*]
2018-09-24 10:21:17.142  INFO 151 --- [ost-startStop-1] o.s.b.w.servlet.FilterRegistrationBean   : Mapping filter: 'metricsFilter' to: [/*]
2018-09-24 10:21:17.143  INFO 151 --- [ost-startStop-1] o.s.b.w.servlet.FilterRegistrationBean   : Mapping filter: 'characterEncodingFilter' to: [/*]
2018-09-24 10:21:17.143  INFO 151 --- [ost-startStop-1] o.s.b.w.servlet.FilterRegistrationBean   : Mapping filter: 'hiddenHttpMethodFilter' to: [/*]
2018-09-24 10:21:17.143  INFO 151 --- [ost-startStop-1] o.s.b.w.servlet.FilterRegistrationBean   : Mapping filter: 'httpPutFormContentFilter' to: [/*]
2018-09-24 10:21:17.143  INFO 151 --- [ost-startStop-1] o.s.b.w.servlet.FilterRegistrationBean   : Mapping filter: 'requestContextFilter' to: [/*]
2018-09-24 10:21:17.144  INFO 151 --- [ost-startStop-1] o.s.b.w.servlet.FilterRegistrationBean   : Mapping filter: 'webRequestLoggingFilter' to: [/*]
2018-09-24 10:21:17.144  INFO 151 --- [ost-startStop-1] o.s.b.w.servlet.FilterRegistrationBean   : Mapping filter: 'applicationContextIdFilter' to: [/*]
2018-09-24 10:21:17.751  INFO 151 --- [           main] s.w.s.m.m.a.RequestMappingHandlerAdapter : Looking for @ControllerAdvice: org.springframework.boot.context.embedded.AnnotationConfigEmbeddedWebApplicationContext@14dd9eb7: startup date [Mon Sep 24 10:21:14 CEST 2018]; root of context hierarchy
2018-09-24 10:21:17.831  INFO 151 --- [           main] s.w.s.m.m.a.RequestMappingHandlerMapping : Mapped "{[/termin],methods=[POST]}" onto public java.lang.String de.swt.inf.controler.AddTerminControler.addTermin(javax.servlet.http.HttpServletRequest,org.springframework.ui.Model) throws java.text.ParseException
2018-09-24 10:21:17.832  INFO 151 --- [           main] s.w.s.m.m.a.RequestMappingHandlerMapping : Mapped "{[/termin],methods=[GET]}" onto public java.lang.String de.swt.inf.controler.AddTerminControler.termin(org.springframework.ui.Model)
2018-09-24 10:21:17.833  INFO 151 --- [           main] s.w.s.m.m.a.RequestMappingHandlerMapping : Mapped "{[/termin],methods=[DELETE]}" onto public java.lang.String de.swt.inf.controler.AddTerminControler.delTermin(javax.servlet.http.HttpServletRequest,org.springframework.ui.Model)
2018-09-24 10:21:17.835  INFO 151 --- [           main] s.w.s.m.m.a.RequestMappingHandlerMapping : Mapped "{[/dashboard],methods=[GET]}" onto public java.lang.String de.swt.inf.controler.DashboardController.dashboard(javax.servlet.http.HttpServletRequest,javax.servlet.http.HttpServletResponse,org.springframework.ui.Model) throws java.text.ParseException
2018-09-24 10:21:17.836  INFO 151 --- [           main] s.w.s.m.m.a.RequestMappingHandlerMapping : Mapped "{[/dashboard/monat/dec],methods=[GET]}" onto public java.lang.String de.swt.inf.controler.DashboardController.decMonat(javax.servlet.http.HttpServletRequest,javax.servlet.http.HttpServletResponse,org.springframework.ui.Model)
2018-09-24 10:21:17.836  INFO 151 --- [           main] s.w.s.m.m.a.RequestMappingHandlerMapping : Mapped "{[/dashboard/monat/add],methods=[GET]}" onto public java.lang.String de.swt.inf.controler.DashboardController.addMonat(javax.servlet.http.HttpServletRequest,javax.servlet.http.HttpServletResponse,org.springframework.ui.Model)
2018-09-24 10:21:17.836  INFO 151 --- [           main] s.w.s.m.m.a.RequestMappingHandlerMapping : Mapped "{[/dashboard/monat],methods=[GET]}" onto public java.lang.String de.swt.inf.controler.DashboardController.viewMonat(javax.servlet.http.HttpServletRequest,javax.servlet.http.HttpServletResponse,org.springframework.ui.Model) throws java.text.ParseException
2018-09-24 10:21:17.836  INFO 151 --- [           main] s.w.s.m.m.a.RequestMappingHandlerMapping : Mapped "{[/dashboard/jahr],methods=[GET]}" onto public java.lang.String de.swt.inf.controler.DashboardController.viewJahr(javax.servlet.http.HttpServletRequest,javax.servlet.http.HttpServletResponse,org.springframework.ui.Model)
2018-09-24 10:21:17.837  INFO 151 --- [           main] s.w.s.m.m.a.RequestMappingHandlerMapping : Mapped "{[/dashboard/tag/dec],methods=[GET]}" onto public java.lang.String de.swt.inf.controler.DashboardController.decTag(javax.servlet.http.HttpServletRequest,javax.servlet.http.HttpServletResponse,org.springframework.ui.Model)
2018-09-24 10:21:17.837  INFO 151 --- [           main] s.w.s.m.m.a.RequestMappingHandlerMapping : Mapped "{[/dashboard/tag/add],methods=[GET]}" onto public java.lang.String de.swt.inf.controler.DashboardController.addTag(javax.servlet.http.HttpServletRequest,javax.servlet.http.HttpServletResponse,org.springframework.ui.Model)
2018-09-24 10:21:17.837  INFO 151 --- [           main] s.w.s.m.m.a.RequestMappingHandlerMapping : Mapped "{[/dashboard/tag],methods=[GET]}" onto public java.lang.String de.swt.inf.controler.DashboardController.viewTag(javax.servlet.http.HttpServletRequest,javax.servlet.http.HttpServletResponse,org.springframework.ui.Model)
2018-09-24 10:21:17.838  INFO 151 --- [           main] s.w.s.m.m.a.RequestMappingHandlerMapping : Mapped "{[/dashboard/woche/add],methods=[GET]}" onto public java.lang.String de.swt.inf.controler.DashboardController.addWoche(javax.servlet.http.HttpServletRequest,javax.servlet.http.HttpServletResponse,org.springframework.ui.Model) throws java.text.ParseException
2018-09-24 10:21:17.838  INFO 151 --- [           main] s.w.s.m.m.a.RequestMappingHandlerMapping : Mapped "{[/dashboard/woche/dec],methods=[GET]}" onto public java.lang.String de.swt.inf.controler.DashboardController.decWoche(javax.servlet.http.HttpServletRequest,javax.servlet.http.HttpServletResponse,org.springframework.ui.Model) throws java.text.ParseException
2018-09-24 10:21:17.838  INFO 151 --- [           main] s.w.s.m.m.a.RequestMappingHandlerMapping : Mapped "{[/dashboard/woche],methods=[GET]}" onto public java.lang.String de.swt.inf.controler.DashboardController.viewWoche(javax.servlet.http.HttpServletRequest,javax.servlet.http.HttpServletResponse,org.springframework.ui.Model) throws java.text.ParseException
2018-09-24 10:21:17.841  INFO 151 --- [           main] s.w.s.m.m.a.RequestMappingHandlerMapping : Mapped "{[/delete],methods=[GET]}" onto public java.lang.String de.swt.inf.controler.EditTerminController.deleteTermin(org.springframework.ui.Model,javax.servlet.http.HttpServletRequest)
2018-09-24 10:21:17.842  INFO 151 --- [           main] s.w.s.m.m.a.RequestMappingHandlerMapping : Mapped "{[/edit],methods=[GET]}" onto public java.lang.String de.swt.inf.controler.EditTerminController.editTermin(org.springframework.ui.Model,javax.servlet.http.HttpServletRequest)
2018-09-24 10:21:17.842  INFO 151 --- [           main] s.w.s.m.m.a.RequestMappingHandlerMapping : Mapped "{[/edit],methods=[POST]}" onto private java.lang.String de.swt.inf.controler.EditTerminController.saveTermin(org.springframework.ui.Model,javax.servlet.http.HttpServletRequest)
2018-09-24 10:21:17.843  INFO 151 --- [           main] s.w.s.m.m.a.RequestMappingHandlerMapping : Mapped "{[/dashboard/fragekatalog],methods=[GET]}" onto public java.lang.String de.swt.inf.controler.FragekatalogController.fragekatalog(javax.servlet.http.HttpServletRequest,org.springframework.ui.Model)
2018-09-24 10:21:17.843  INFO 151 --- [           main] s.w.s.m.m.a.RequestMappingHandlerMapping : Mapped "{[/dashboard/fragekatalog],methods=[POST]}" onto public java.lang.String de.swt.inf.controler.FragekatalogController.addFragekatalog(javax.servlet.http.HttpServletRequest,org.springframework.ui.Model)
2018-09-24 10:21:17.844  INFO 151 --- [           main] s.w.s.m.m.a.RequestMappingHandlerMapping : Mapped "{[/login],methods=[POST]}" onto public void de.swt.inf.controler.LoginController.getLoginData(javax.servlet.http.HttpServletRequest,javax.servlet.http.HttpServletResponse) throws java.text.ParseException
2018-09-24 10:21:17.845  INFO 151 --- [           main] s.w.s.m.m.a.RequestMappingHandlerMapping : Mapped "{[/logout]}" onto public void de.swt.inf.controler.SimpleGetMappings.logout(javax.servlet.http.HttpServletRequest,javax.servlet.http.HttpServletResponse)
2018-09-24 10:21:17.845  INFO 151 --- [           main] s.w.s.m.m.a.RequestMappingHandlerMapping : Mapped "{[/login]}" onto public java.lang.String de.swt.inf.controler.SimpleGetMappings.login()
2018-09-24 10:21:17.845  INFO 151 --- [           main] s.w.s.m.m.a.RequestMappingHandlerMapping : Mapped "{[/about]}" onto public java.lang.String de.swt.inf.controler.SimpleGetMappings.about()
2018-09-24 10:21:17.845  INFO 151 --- [           main] s.w.s.m.m.a.RequestMappingHandlerMapping : Mapped "{[/greeting]}" onto public java.lang.String de.swt.inf.controler.SimpleGetMappings.greeting(javax.servlet.http.HttpServletRequest,org.springframework.ui.Model)
2018-09-24 10:21:17.846  INFO 151 --- [           main] s.w.s.m.m.a.RequestMappingHandlerMapping : Mapped "{[/registration],methods=[GET]}" onto public java.lang.String de.swt.inf.controler.UserRegistrationController.UserRegistration(org.springframework.ui.Model)
2018-09-24 10:21:17.846  INFO 151 --- [           main] s.w.s.m.m.a.RequestMappingHandlerMapping : Mapped "{[/registration],methods=[POST]}" onto public java.lang.String de.swt.inf.controler.UserRegistrationController.sendUserRegistration(javax.servlet.http.HttpServletRequest,org.springframework.ui.Model)
2018-09-24 10:21:17.850  INFO 151 --- [           main] s.w.s.m.m.a.RequestMappingHandlerMapping : Mapped "{[/error],produces=[text/html]}" onto public org.springframework.web.servlet.ModelAndView org.springframework.boot.autoconfigure.web.BasicErrorController.errorHtml(javax.servlet.http.HttpServletRequest,javax.servlet.http.HttpServletResponse)
2018-09-24 10:21:17.850  INFO 151 --- [           main] s.w.s.m.m.a.RequestMappingHandlerMapping : Mapped "{[/error]}" onto public org.springframework.http.ResponseEntity<java.util.Map<java.lang.String, java.lang.Object>> org.springframework.boot.autoconfigure.web.BasicErrorController.error(javax.servlet.http.HttpServletRequest)
2018-09-24 10:21:17.896  INFO 151 --- [           main] o.s.w.s.handler.SimpleUrlHandlerMapping  : Mapped URL path [/webjars/**] onto handler of type [class org.springframework.web.servlet.resource.ResourceHttpRequestHandler]
2018-09-24 10:21:17.897  INFO 151 --- [           main] o.s.w.s.handler.SimpleUrlHandlerMapping  : Mapped URL path [/**] onto handler of type [class org.springframework.web.servlet.resource.ResourceHttpRequestHandler]
2018-09-24 10:21:17.952  INFO 151 --- [           main] o.s.w.s.handler.SimpleUrlHandlerMapping  : Mapped URL path [/**/favicon.ico] onto handler of type [class org.springframework.web.servlet.resource.ResourceHttpRequestHandler]
2018-09-24 10:21:18.105  INFO 151 --- [           main] oConfiguration$WelcomePageHandlerMapping : Adding welcome page: class path resource [static/index.html]
2018-09-24 10:21:18.361  INFO 151 --- [           main] o.s.jdbc.datasource.init.ScriptUtils     : Executing SQL script from URL [file:/root/workspace/TetrisIQ/SWT-II/432365318/target/classes/schema.sql]
2018-09-24 10:21:18.400  INFO 151 --- [           main] o.s.jdbc.datasource.init.ScriptUtils     : Executed SQL script from URL [file:/root/workspace/TetrisIQ/SWT-II/432365318/target/classes/schema.sql] in 38 ms.
2018-09-24 10:21:19.039  INFO 151 --- [           main] o.s.b.a.e.mvc.EndpointHandlerMapping     : Mapped "{[/trace || /trace.json],methods=[GET],produces=[application/vnd.spring-boot.actuator.v1+json || application/json]}" onto public java.lang.Object org.springframework.boot.actuate.endpoint.mvc.EndpointMvcAdapter.invoke()
2018-09-24 10:21:19.040  INFO 151 --- [           main] o.s.b.a.e.mvc.EndpointHandlerMapping     : Mapped "{[/mappings || /mappings.json],methods=[GET],produces=[application/vnd.spring-boot.actuator.v1+json || application/json]}" onto public java.lang.Object org.springframework.boot.actuate.endpoint.mvc.EndpointMvcAdapter.invoke()
2018-09-24 10:21:19.042  INFO 151 --- [           main] o.s.b.a.e.mvc.EndpointHandlerMapping     : Mapped "{[/metrics/{name:.*}],methods=[GET],produces=[application/vnd.spring-boot.actuator.v1+json || application/json]}" onto public java.lang.Object org.springframework.boot.actuate.endpoint.mvc.MetricsMvcEndpoint.value(java.lang.String)
2018-09-24 10:21:19.043  INFO 151 --- [           main] o.s.b.a.e.mvc.EndpointHandlerMapping     : Mapped "{[/metrics || /metrics.json],methods=[GET],produces=[application/vnd.spring-boot.actuator.v1+json || application/json]}" onto public java.lang.Object org.springframework.boot.actuate.endpoint.mvc.EndpointMvcAdapter.invoke()
2018-09-24 10:21:19.044  INFO 151 --- [           main] o.s.b.a.e.mvc.EndpointHandlerMapping     : Mapped "{[/dump || /dump.json],methods=[GET],produces=[application/vnd.spring-boot.actuator.v1+json || application/json]}" onto public java.lang.Object org.springframework.boot.actuate.endpoint.mvc.EndpointMvcAdapter.invoke()
2018-09-24 10:21:19.045  INFO 151 --- [           main] o.s.b.a.e.mvc.EndpointHandlerMapping     : Mapped "{[/beans || /beans.json],methods=[GET],produces=[application/vnd.spring-boot.actuator.v1+json || application/json]}" onto public java.lang.Object org.springframework.boot.actuate.endpoint.mvc.EndpointMvcAdapter.invoke()
2018-09-24 10:21:19.046  INFO 151 --- [           main] o.s.b.a.e.mvc.EndpointHandlerMapping     : Mapped "{[/health || /health.json],methods=[GET],produces=[application/vnd.spring-boot.actuator.v1+json || application/json]}" onto public java.lang.Object org.springframework.boot.actuate.endpoint.mvc.HealthMvcEndpoint.invoke(javax.servlet.http.HttpServletRequest,java.security.Principal)
2018-09-24 10:21:19.050  INFO 151 --- [           main] o.s.b.a.e.mvc.EndpointHandlerMapping     : Mapped "{[/env/{name:.*}],methods=[GET],produces=[application/vnd.spring-boot.actuator.v1+json || application/json]}" onto public java.lang.Object org.springframework.boot.actuate.endpoint.mvc.EnvironmentMvcEndpoint.value(java.lang.String)
2018-09-24 10:21:19.051  INFO 151 --- [           main] o.s.b.a.e.mvc.EndpointHandlerMapping     : Mapped "{[/env || /env.json],methods=[GET],produces=[application/vnd.spring-boot.actuator.v1+json || application/json]}" onto public java.lang.Object org.springframework.boot.actuate.endpoint.mvc.EndpointMvcAdapter.invoke()
2018-09-24 10:21:19.054  INFO 151 --- [           main] o.s.b.a.e.mvc.EndpointHandlerMapping     : Mapped "{[/loggers/{name:.*}],methods=[GET],produces=[application/vnd.spring-boot.actuator.v1+json || application/json]}" onto public java.lang.Object org.springframework.boot.actuate.endpoint.mvc.LoggersMvcEndpoint.get(java.lang.String)
2018-09-24 10:21:19.055  INFO 151 --- [           main] o.s.b.a.e.mvc.EndpointHandlerMapping     : Mapped "{[/loggers/{name:.*}],methods=[POST],consumes=[application/vnd.spring-boot.actuator.v1+json || application/json],produces=[application/vnd.spring-boot.actuator.v1+json || application/json]}" onto public java.lang.Object org.springframework.boot.actuate.endpoint.mvc.LoggersMvcEndpoint.set(java.lang.String,java.util.Map<java.lang.String, java.lang.String>)
2018-09-24 10:21:19.055  INFO 151 --- [           main] o.s.b.a.e.mvc.EndpointHandlerMapping     : Mapped "{[/loggers || /loggers.json],methods=[GET],produces=[application/vnd.spring-boot.actuator.v1+json || application/json]}" onto public java.lang.Object org.springframework.boot.actuate.endpoint.mvc.EndpointMvcAdapter.invoke()
2018-09-24 10:21:19.057  INFO 151 --- [           main] o.s.b.a.e.mvc.EndpointHandlerMapping     : Mapped "{[/info || /info.json],methods=[GET],produces=[application/vnd.spring-boot.actuator.v1+json || application/json]}" onto public java.lang.Object org.springframework.boot.actuate.endpoint.mvc.EndpointMvcAdapter.invoke()
2018-09-24 10:21:19.058  INFO 151 --- [           main] o.s.b.a.e.mvc.EndpointHandlerMapping     : Mapped "{[/configprops || /configprops.json],methods=[GET],produces=[application/vnd.spring-boot.actuator.v1+json || application/json]}" onto public java.lang.Object org.springframework.boot.actuate.endpoint.mvc.EndpointMvcAdapter.invoke()
2018-09-24 10:21:19.059  INFO 151 --- [           main] o.s.b.a.e.mvc.EndpointHandlerMapping     : Mapped "{[/auditevents || /auditevents.json],methods=[GET],produces=[application/vnd.spring-boot.actuator.v1+json || application/json]}" onto public org.springframework.http.ResponseEntity<?> org.springframework.boot.actuate.endpoint.mvc.AuditEventsMvcEndpoint.findByPrincipalAndAfterAndType(java.lang.String,java.util.Date,java.lang.String)
2018-09-24 10:21:19.061  INFO 151 --- [           main] o.s.b.a.e.mvc.EndpointHandlerMapping     : Mapped "{[/heapdump || /heapdump.json],methods=[GET],produces=[application/octet-stream]}" onto public void org.springframework.boot.actuate.endpoint.mvc.HeapdumpMvcEndpoint.invoke(boolean,javax.servlet.http.HttpServletRequest,javax.servlet.http.HttpServletResponse) throws java.io.IOException,javax.servlet.ServletException
2018-09-24 10:21:19.062  INFO 151 --- [           main] o.s.b.a.e.mvc.EndpointHandlerMapping     : Mapped "{[/autoconfig || /autoconfig.json],methods=[GET],produces=[application/vnd.spring-boot.actuator.v1+json || application/json]}" onto public java.lang.Object org.springframework.boot.actuate.endpoint.mvc.EndpointMvcAdapter.invoke()
2018-09-24 10:21:19.441  INFO 151 --- [           main] o.s.j.e.a.AnnotationMBeanExporter        : Registering beans for JMX exposure on startup
2018-09-24 10:21:19.458  INFO 151 --- [           main] o.s.c.support.DefaultLifecycleProcessor  : Starting beans in phase 0
2018-09-24 10:21:19.636  INFO 151 --- [           main] s.b.c.e.t.TomcatEmbeddedServletContainer : Tomcat started on port(s): 8080 (http)
2018-09-24 10:21:19.644  INFO 151 --- [           main] o.a.maven.surefire.booter.ForkedBooter   : Started ForkedBooter in 5.818 seconds (JVM running for 6.371)
2018-09-24 10:21:21.089  INFO 151 --- [nio-8080-exec-1] o.a.c.c.C.[Tomcat].[localhost].[/]       : Initializing Spring FrameworkServlet 'dispatcherServlet'
2018-09-24 10:21:21.089  INFO 151 --- [nio-8080-exec-1] o.s.web.servlet.DispatcherServlet        : FrameworkServlet 'dispatcherServlet': initialization started
2018-09-24 10:21:21.109  INFO 151 --- [nio-8080-exec-1] o.s.web.servlet.DispatcherServlet        : FrameworkServlet 'dispatcherServlet': initialization completed in 19 ms
2018-09-24 10:21:22.239  WARN 151 --- [           main] c.g.htmlunit.DefaultCssErrorHandler      : CSS error: 'https://maxcdn.bootstrapcdn.com/bootstrap/3.3.7/css/bootstrap.min.css' [5:115558] Invalid color "#000\9".
2018-09-24 10:21:22.882  WARN 151 --- [           main] c.g.htmlunit.DefaultCssErrorHandler      : CSS error: 'https://maxcdn.bootstrapcdn.com/bootstrap/3.3.7/css/bootstrap.min.css' [5:115558] Invalid color "#000\9".
2018-09-24 10:21:23.437  WARN 151 --- [           main] c.g.htmlunit.DefaultCssErrorHandler      : CSS error: 'https://maxcdn.bootstrapcdn.com/bootstrap/3.3.7/css/bootstrap.min.css' [5:115558] Invalid color "#000\9".
2018-09-24 10:21:23.774  WARN 151 --- [           main] c.g.htmlunit.DefaultCssErrorHandler      : CSS error: 'https://maxcdn.bootstrapcdn.com/bootstrap/3.3.7/css/bootstrap.min.css' [5:115558] Invalid color "#000\9".
2018-09-24 10:21:24.121  WARN 151 --- [           main] c.g.htmlunit.DefaultCssErrorHandler      : CSS error: 'https://maxcdn.bootstrapcdn.com/bootstrap/3.3.7/css/bootstrap.min.css' [5:115558] Invalid color "#000\9".
2018-09-24 10:21:24.481  WARN 151 --- [           main] c.g.htmlunit.DefaultCssErrorHandler      : CSS error: 'https://maxcdn.bootstrapcdn.com/bootstrap/3.3.7/css/bootstrap.min.css' [5:115558] Invalid color "#000\9".
2018-09-24 10:21:24.807  WARN 151 --- [           main] c.g.htmlunit.DefaultCssErrorHandler      : CSS error: 'https://maxcdn.bootstrapcdn.com/bootstrap/3.3.7/css/bootstrap.min.css' [5:115558] Invalid color "#000\9".
2018-09-24 10:21:25.095  WARN 151 --- [           main] c.g.htmlunit.DefaultCssErrorHandler      : CSS error: 'https://maxcdn.bootstrapcdn.com/bootstrap/3.3.7/css/bootstrap.min.css' [5:115558] Invalid color "#000\9".
2018-09-24 10:21:25.411  WARN 151 --- [           main] c.g.htmlunit.DefaultCssErrorHandler      : CSS error: 'https://maxcdn.bootstrapcdn.com/bootstrap/3.3.7/css/bootstrap.min.css' [5:115558] Invalid color "#000\9".
2018-09-24 10:21:25.691  WARN 151 --- [           main] c.g.htmlunit.DefaultCssErrorHandler      : CSS error: 'https://maxcdn.bootstrapcdn.com/bootstrap/3.3.7/css/bootstrap.min.css' [5:115558] Invalid color "#000\9".
2018-09-24 10:21:25.997  WARN 151 --- [           main] c.g.htmlunit.DefaultCssErrorHandler      : CSS error: 'https://maxcdn.bootstrapcdn.com/bootstrap/3.3.7/css/bootstrap.min.css' [5:115558] Invalid color "#000\9".
2018-09-24 10:21:26.292  WARN 151 --- [           main] c.g.htmlunit.DefaultCssErrorHandler      : CSS error: 'https://maxcdn.bootstrapcdn.com/bootstrap/3.3.7/css/bootstrap.min.css' [5:115558] Invalid color "#000\9".
2018-09-24 10:21:26.583  WARN 151 --- [           main] c.g.htmlunit.DefaultCssErrorHandler      : CSS error: 'https://maxcdn.bootstrapcdn.com/bootstrap/3.3.7/css/bootstrap.min.css' [5:115558] Invalid color "#000\9".
2018-09-24 10:21:37.474  WARN 151 --- [           main] c.g.htmlunit.DefaultCssErrorHandler      : CSS error: 'https://maxcdn.bootstrapcdn.com/bootstrap/3.3.7/css/bootstrap.min.css' [5:115558] Invalid color "#000\9".
2018-09-24 10:21:47.797  WARN 151 --- [           main] c.g.htmlunit.DefaultCssErrorHandler      : CSS error: 'https://maxcdn.bootstrapcdn.com/bootstrap/3.3.7/css/bootstrap.min.css' [5:115558] Invalid color "#000\9".
2018-09-24 10:21:58.119  WARN 151 --- [           main] c.g.htmlunit.DefaultCssErrorHandler      : CSS error: 'https://maxcdn.bootstrapcdn.com/bootstrap/3.3.7/css/bootstrap.min.css' [5:115558] Invalid color "#000\9".
2018-09-24 10:22:08.417  WARN 151 --- [           main] c.g.htmlunit.DefaultCssErrorHandler      : CSS error: 'https://maxcdn.bootstrapcdn.com/bootstrap/3.3.7/css/bootstrap.min.css' [5:115558] Invalid color "#000\9".
2018-09-24 10:22:18.752  WARN 151 --- [           main] c.g.htmlunit.DefaultCssErrorHandler      : CSS error: 'https://maxcdn.bootstrapcdn.com/bootstrap/3.3.7/css/bootstrap.min.css' [5:115558] Invalid color "#000\9".
2018-09-24 10:22:19.030  WARN 151 --- [           main] c.g.htmlunit.DefaultCssErrorHandler      : CSS error: 'https://maxcdn.bootstrapcdn.com/bootstrap/3.3.7/css/bootstrap.min.css' [5:115558] Invalid color "#000\9".
2018-09-24 10:22:19.307  WARN 151 --- [           main] c.g.htmlunit.DefaultCssErrorHandler      : CSS error: 'https://maxcdn.bootstrapcdn.com/bootstrap/3.3.7/css/bootstrap.min.css' [5:115558] Invalid color "#000\9".
2018-09-24 10:22:19.669  WARN 151 --- [           main] c.g.htmlunit.DefaultCssErrorHandler      : CSS error: 'https://maxcdn.bootstrapcdn.com/bootstrap/3.3.7/css/bootstrap.min.css' [5:115558] Invalid color "#000\9".
2018-09-24 10:22:30.006  WARN 151 --- [           main] c.g.htmlunit.DefaultCssErrorHandler      : CSS error: 'https://maxcdn.bootstrapcdn.com/bootstrap/3.3.7/css/bootstrap.min.css' [5:115558] Invalid color "#000\9".
2018-09-24 10:22:30.341  WARN 151 --- [           main] c.g.htmlunit.DefaultCssErrorHandler      : CSS error: 'https://maxcdn.bootstrapcdn.com/bootstrap/3.3.7/css/bootstrap.min.css' [5:115558] Invalid color "#000\9".
2018-09-24 10:22:30.606  WARN 151 --- [           main] c.g.htmlunit.DefaultCssErrorHandler      : CSS error: 'https://maxcdn.bootstrapcdn.com/bootstrap/3.3.7/css/bootstrap.min.css' [5:115558] Invalid color "#000\9".
Tests run: 52, Failures: 6, Errors: 0, Skipped: 0, Time elapsed: 77.04 sec <<< FAILURE! - in de.swt.inf.model.UserRegistrationTest
[0] KarlEnder, karlender@web.de, J4V4R@ck5 (seleniumTestRegistrationTrue)(de.swt.inf.model.UserRegistrationTest)  Time elapsed: 10.371 sec  <<< FAILURE!
java.lang.AssertionError: null
	at org.junit.Assert.fail(Assert.java:86)
	at org.junit.Assert.assertTrue(Assert.java:41)
	at org.junit.Assert.assertTrue(Assert.java:52)
	at de.swt.inf.model.UserRegistrationTest.seleniumTestRegistrationTrue(UserRegistrationTest.java:126)

[1] KlammerKarl, klammerkarl@yahoo.com, KarlenderR0ck$ (seleniumTestRegistrationTrue)(de.swt.inf.model.UserRegistrationTest)  Time elapsed: 10.825 sec  <<< FAILURE!
java.lang.AssertionError: null
	at org.junit.Assert.fail(Assert.java:86)
	at org.junit.Assert.assertTrue(Assert.java:41)
	at org.junit.Assert.assertTrue(Assert.java:52)
	at de.swt.inf.model.UserRegistrationTest.seleniumTestRegistrationTrue(UserRegistrationTest.java:126)

[2] ManniDasMamut, mannidasmamut@gmail.com, Ice4ge! (seleniumTestRegistrationTrue)(de.swt.inf.model.UserRegistrationTest)  Time elapsed: 10.326 sec  <<< FAILURE!
java.lang.AssertionError: null
	at org.junit.Assert.fail(Assert.java:86)
	at org.junit.Assert.assertTrue(Assert.java:41)
	at org.junit.Assert.assertTrue(Assert.java:52)
	at de.swt.inf.model.UserRegistrationTest.seleniumTestRegistrationTrue(UserRegistrationTest.java:126)

[3] DarthVader, todesstern@imperium.rus, 1luvImp! (seleniumTestRegistrationTrue)(de.swt.inf.model.UserRegistrationTest)  Time elapsed: 10.317 sec  <<< FAILURE!
java.lang.AssertionError: null
	at org.junit.Assert.fail(Assert.java:86)
	at org.junit.Assert.assertTrue(Assert.java:41)
	at org.junit.Assert.assertTrue(Assert.java:52)
	at de.swt.inf.model.UserRegistrationTest.seleniumTestRegistrationTrue(UserRegistrationTest.java:126)

[0] KarlEnder2, karlender2@web.de, J4V4R@ck5 (seleniumTestRegistrationUsernameFalse)(de.swt.inf.model.UserRegistrationTest)  Time elapsed: 10.284 sec  <<< FAILURE!
java.lang.AssertionError: null
	at org.junit.Assert.fail(Assert.java:86)
	at org.junit.Assert.assertTrue(Assert.java:41)
	at org.junit.Assert.assertTrue(Assert.java:52)
	at de.swt.inf.model.UserRegistrationTest.seleniumTestRegistrationUsernameFalse(UserRegistrationTest.java:204)

[0] KarlEnder1, karlender1@web.de, J4V4R@ck5 (seleniumTestRegistrationEmailFalse)(de.swt.inf.model.UserRegistrationTest)  Time elapsed: 10.374 sec  <<< FAILURE!
java.lang.AssertionError: null
	at org.junit.Assert.fail(Assert.java:86)
	at org.junit.Assert.assertTrue(Assert.java:41)
	at org.junit.Assert.assertTrue(Assert.java:52)
	at de.swt.inf.model.UserRegistrationTest.seleniumTestRegistrationEmailFalse(UserRegistrationTest.java:162)

Running de.swt.inf.model.TerminTest
Tests run: 4, Failures: 0, Errors: 0, Skipped: 0, Time elapsed: 0.001 sec - in de.swt.inf.model.TerminTest
Running de.swt.inf.model.SeleniumDashboardTest
2018-09-24 10:22:30.932  WARN 151 --- [           main] c.g.htmlunit.DefaultCssErrorHandler      : CSS error: 'https://maxcdn.bootstrapcdn.com/bootstrap/3.3.7/css/bootstrap.min.css' [5:115558] Invalid color "#000\9".
2018-09-24 10:22:31.004  INFO 151 --- [           main] c.g.htmlunit.html.InputElementFactory    : Bad input type: "email", creating a text input
2018-09-24 10:22:31.519  WARN 151 --- [           main] c.g.htmlunit.DefaultCssErrorHandler      : CSS error: 'https://maxcdn.bootstrapcdn.com/bootstrap/3.3.7/css/bootstrap.min.css' [5:115558] Invalid color "#000\9".
2018-09-24 10:22:31.549  INFO 151 --- [           main] c.g.htmlunit.html.InputElementFactory    : Bad input type: "email", creating a text input
2018-09-24 10:22:32.043  WARN 151 --- [           main] c.g.htmlunit.DefaultCssErrorHandler      : CSS error: 'https://maxcdn.bootstrapcdn.com/bootstrap/3.3.7/css/bootstrap.min.css' [5:115558] Invalid color "#000\9".
2018-09-24 10:22:32.076  INFO 151 --- [           main] c.g.htmlunit.html.InputElementFactory    : Bad input type: "email", creating a text input
2018-09-24 10:22:32.602  WARN 151 --- [           main] c.g.htmlunit.DefaultCssErrorHandler      : CSS error: 'https://maxcdn.bootstrapcdn.com/bootstrap/3.3.7/css/bootstrap.min.css' [5:115558] Invalid color "#000\9".
2018-09-24 10:22:32.633  INFO 151 --- [           main] c.g.htmlunit.html.InputElementFactory    : Bad input type: "email", creating a text input
Tests run: 4, Failures: 0, Errors: 4, Skipped: 0, Time elapsed: 2.185 sec <<< FAILURE! - in de.swt.inf.model.SeleniumDashboardTest
dashboardMonatSeleniumTest(de.swt.inf.model.SeleniumDashboardTest)  Time elapsed: 0.575 sec  <<< ERROR!
org.openqa.selenium.NoSuchElementException: No link found with text: Vorlesung
For documentation on this error, please visit: http://seleniumhq.org/exceptions/no_such_element.html
Build info: version: '2.53.1', revision: 'a36b8b1cd5757287168e54b817830adce9b0158d', time: '2016-06-30 19:26:09'
System info: host: 'cyclone1', ip: '172.17.0.4', os.name: 'Linux', os.arch: 'amd64', os.version: '3.10.0-862.3.2.el7.x86_64', java.version: '1.8.0_121'
Driver info: driver.version: HtmlUnitDriver
	at org.openqa.selenium.htmlunit.HtmlUnitDriver.findElementByLinkText(HtmlUnitDriver.java:972)
	at org.openqa.selenium.By$ByLinkText.findElement(By.java:246)
	at org.openqa.selenium.htmlunit.HtmlUnitDriver$5.call(HtmlUnitDriver.java:1707)
	at org.openqa.selenium.htmlunit.HtmlUnitDriver$5.call(HtmlUnitDriver.java:1703)
	at org.openqa.selenium.htmlunit.HtmlUnitDriver.implicitlyWaitFor(HtmlUnitDriver.java:1357)
	at org.openqa.selenium.htmlunit.HtmlUnitDriver.findElement(HtmlUnitDriver.java:1703)
	at org.openqa.selenium.htmlunit.HtmlUnitDriver.findElement(HtmlUnitDriver.java:595)
	at de.swt.inf.model.SeleniumDashboardTest.addTermin(SeleniumDashboardTest.java:77)

dashboardWocheSeleniumTest(de.swt.inf.model.SeleniumDashboardTest)  Time elapsed: 0.523 sec  <<< ERROR!
org.openqa.selenium.NoSuchElementException: No link found with text: Vorlesung
For documentation on this error, please visit: http://seleniumhq.org/exceptions/no_such_element.html
Build info: version: '2.53.1', revision: 'a36b8b1cd5757287168e54b817830adce9b0158d', time: '2016-06-30 19:26:09'
System info: host: 'cyclone1', ip: '172.17.0.4', os.name: 'Linux', os.arch: 'amd64', os.version: '3.10.0-862.3.2.el7.x86_64', java.version: '1.8.0_121'
Driver info: driver.version: HtmlUnitDriver
	at org.openqa.selenium.htmlunit.HtmlUnitDriver.findElementByLinkText(HtmlUnitDriver.java:972)
	at org.openqa.selenium.By$ByLinkText.findElement(By.java:246)
	at org.openqa.selenium.htmlunit.HtmlUnitDriver$5.call(HtmlUnitDriver.java:1707)
	at org.openqa.selenium.htmlunit.HtmlUnitDriver$5.call(HtmlUnitDriver.java:1703)
	at org.openqa.selenium.htmlunit.HtmlUnitDriver.implicitlyWaitFor(HtmlUnitDriver.java:1357)
	at org.openqa.selenium.htmlunit.HtmlUnitDriver.findElement(HtmlUnitDriver.java:1703)
	at org.openqa.selenium.htmlunit.HtmlUnitDriver.findElement(HtmlUnitDriver.java:595)
	at de.swt.inf.model.SeleniumDashboardTest.addTermin(SeleniumDashboardTest.java:77)

dashboardTagSeleniumTest(de.swt.inf.model.SeleniumDashboardTest)  Time elapsed: 0.545 sec  <<< ERROR!
org.openqa.selenium.NoSuchElementException: No link found with text: Vorlesung
For documentation on this error, please visit: http://seleniumhq.org/exceptions/no_such_element.html
Build info: version: '2.53.1', revision: 'a36b8b1cd5757287168e54b817830adce9b0158d', time: '2016-06-30 19:26:09'
System info: host: 'cyclone1', ip: '172.17.0.4', os.name: 'Linux', os.arch: 'amd64', os.version: '3.10.0-862.3.2.el7.x86_64', java.version: '1.8.0_121'
Driver info: driver.version: HtmlUnitDriver
	at org.openqa.selenium.htmlunit.HtmlUnitDriver.findElementByLinkText(HtmlUnitDriver.java:972)
	at org.openqa.selenium.By$ByLinkText.findElement(By.java:246)
	at org.openqa.selenium.htmlunit.HtmlUnitDriver$5.call(HtmlUnitDriver.java:1707)
	at org.openqa.selenium.htmlunit.HtmlUnitDriver$5.call(HtmlUnitDriver.java:1703)
	at org.openqa.selenium.htmlunit.HtmlUnitDriver.implicitlyWaitFor(HtmlUnitDriver.java:1357)
	at org.openqa.selenium.htmlunit.HtmlUnitDriver.findElement(HtmlUnitDriver.java:1703)
	at org.openqa.selenium.htmlunit.HtmlUnitDriver.findElement(HtmlUnitDriver.java:595)
	at de.swt.inf.model.SeleniumDashboardTest.addTermin(SeleniumDashboardTest.java:77)

dashboardJahrSeleniumTest(de.swt.inf.model.SeleniumDashboardTest)  Time elapsed: 0.542 sec  <<< ERROR!
org.openqa.selenium.NoSuchElementException: No link found with text: Vorlesung
For documentation on this error, please visit: http://seleniumhq.org/exceptions/no_such_element.html
Build info: version: '2.53.1', revision: 'a36b8b1cd5757287168e54b817830adce9b0158d', time: '2016-06-30 19:26:09'
System info: host: 'cyclone1', ip: '172.17.0.4', os.name: 'Linux', os.arch: 'amd64', os.version: '3.10.0-862.3.2.el7.x86_64', java.version: '1.8.0_121'
Driver info: driver.version: HtmlUnitDriver
	at org.openqa.selenium.htmlunit.HtmlUnitDriver.findElementByLinkText(HtmlUnitDriver.java:972)
	at org.openqa.selenium.By$ByLinkText.findElement(By.java:246)
	at org.openqa.selenium.htmlunit.HtmlUnitDriver$5.call(HtmlUnitDriver.java:1707)
	at org.openqa.selenium.htmlunit.HtmlUnitDriver$5.call(HtmlUnitDriver.java:1703)
	at org.openqa.selenium.htmlunit.HtmlUnitDriver.implicitlyWaitFor(HtmlUnitDriver.java:1357)
	at org.openqa.selenium.htmlunit.HtmlUnitDriver.findElement(HtmlUnitDriver.java:1703)
	at org.openqa.selenium.htmlunit.HtmlUnitDriver.findElement(HtmlUnitDriver.java:595)
	at de.swt.inf.model.SeleniumDashboardTest.addTermin(SeleniumDashboardTest.java:77)

Running de.swt.inf.model.SeleniumEinrichtungsfunktionTest
2018-09-24 10:22:33.122  WARN 151 --- [           main] c.g.htmlunit.DefaultCssErrorHandler      : CSS error: 'https://maxcdn.bootstrapcdn.com/bootstrap/3.3.7/css/bootstrap.min.css' [5:115558] Invalid color "#000\9".
Fragekatalog URL: http://localhost:8080/dashboard/fragekatalog
Name:http://localhost:8080/dashboard/woche
Title is: Dashboard/Woche
Tests run: 1, Failures: 0, Errors: 1, Skipped: 0, Time elapsed: 0.763 sec <<< FAILURE! - in de.swt.inf.model.SeleniumEinrichtungsfunktionTest
SeleniumTestEinrichtungsfunktion(de.swt.inf.model.SeleniumEinrichtungsfunktionTest)  Time elapsed: 0.763 sec  <<< ERROR!
org.openqa.selenium.NoSuchElementException: No link found with text: Deichbrand Festival
For documentation on this error, please visit: http://seleniumhq.org/exceptions/no_such_element.html
Build info: version: '2.53.1', revision: 'a36b8b1cd5757287168e54b817830adce9b0158d', time: '2016-06-30 19:26:09'
System info: host: 'cyclone1', ip: '172.17.0.4', os.name: 'Linux', os.arch: 'amd64', os.version: '3.10.0-862.3.2.el7.x86_64', java.version: '1.8.0_121'
Driver info: driver.version: HtmlUnitDriver
	at org.openqa.selenium.htmlunit.HtmlUnitDriver.findElementByLinkText(HtmlUnitDriver.java:972)
	at org.openqa.selenium.By$ByLinkText.findElement(By.java:246)
	at org.openqa.selenium.htmlunit.HtmlUnitDriver$5.call(HtmlUnitDriver.java:1707)
	at org.openqa.selenium.htmlunit.HtmlUnitDriver$5.call(HtmlUnitDriver.java:1703)
	at org.openqa.selenium.htmlunit.HtmlUnitDriver.implicitlyWaitFor(HtmlUnitDriver.java:1357)
	at org.openqa.selenium.htmlunit.HtmlUnitDriver.findElement(HtmlUnitDriver.java:1703)
	at org.openqa.selenium.htmlunit.HtmlUnitDriver.findElement(HtmlUnitDriver.java:595)
	at de.swt.inf.model.SeleniumEinrichtungsfunktionTest.SeleniumTestEinrichtungsfunktion(SeleniumEinrichtungsfunktionTest.java:68)

Running de.swt.inf.model.TestLoginTest
2018-09-24 10:22:33.931  WARN 151 --- [           main] c.g.htmlunit.DefaultCssErrorHandler      : CSS error: 'https://maxcdn.bootstrapcdn.com/bootstrap/3.3.7/css/bootstrap.min.css' [5:115558] Invalid color "#000\9".
Username: TEST
Password: TEST
Successfully LoggedIn!
Successfully logged out!
2018-09-24 10:22:34.525  WARN 151 --- [           main] c.g.htmlunit.DefaultCssErrorHandler      : CSS error: 'https://maxcdn.bootstrapcdn.com/bootstrap/3.3.7/css/bootstrap.min.css' [5:115558] Invalid color "#000\9".
Username: TEST
Password: TEST
Successfully LoggedIn!
2018-09-24 10:22:34.770  WARN 151 --- [           main] c.g.htmlunit.DefaultCssErrorHandler      : CSS error: 'https://maxcdn.bootstrapcdn.com/bootstrap/3.3.7/css/bootstrap.min.css' [5:115558] Invalid color "#000\9".
Username: TEST
Password: TEST
Successfully LoggedIn!
Tests run: 4, Failures: 0, Errors: 0, Skipped: 0, Time elapsed: 1.125 sec - in de.swt.inf.model.TestLoginTest
Running de.swt.inf.model.SeleniumTerminTest
2018-09-24 10:22:34.830  INFO 151 --- [           main] c.g.htmlunit.html.InputElementFactory    : Bad input type: "email", creating a text input
2018-09-24 10:22:35.027  WARN 151 --- [           main] c.g.htmlunit.DefaultCssErrorHandler      : CSS error: 'https://maxcdn.bootstrapcdn.com/bootstrap/3.3.7/css/bootstrap.min.css' [5:115558] Invalid color "#000\9".
Name:http://localhost:8080/login
Title is: Login
2018-09-24 10:22:35.304  WARN 151 --- [           main] c.g.htmlunit.DefaultCssErrorHandler      : CSS error: 'https://maxcdn.bootstrapcdn.com/bootstrap/3.3.7/css/bootstrap.min.css' [5:115558] Invalid color "#000\9".
Tests run: 2, Failures: 1, Errors: 1, Skipped: 0, Time elapsed: 0.706 sec <<< FAILURE! - in de.swt.inf.model.SeleniumTerminTest
SeleniumTestAddTermin(de.swt.inf.model.SeleniumTerminTest)  Time elapsed: 0.271 sec  <<< FAILURE!
java.lang.AssertionError: null
	at org.junit.Assert.fail(Assert.java:86)
	at org.junit.Assert.assertTrue(Assert.java:41)
	at org.junit.Assert.assertTrue(Assert.java:52)
	at de.swt.inf.model.SeleniumTerminTest.SeleniumTestAddTermin(SeleniumTerminTest.java:55)

SeleniumTestDeleteTermin(de.swt.inf.model.SeleniumTerminTest)  Time elapsed: 0.435 sec  <<< ERROR!
org.openqa.selenium.NoSuchElementException: No link found with text: Neuer Termin
For documentation on this error, please visit: http://seleniumhq.org/exceptions/no_such_element.html
Build info: version: '2.53.1', revision: 'a36b8b1cd5757287168e54b817830adce9b0158d', time: '2016-06-30 19:26:09'
System info: host: 'cyclone1', ip: '172.17.0.4', os.name: 'Linux', os.arch: 'amd64', os.version: '3.10.0-862.3.2.el7.x86_64', java.version: '1.8.0_121'
Driver info: driver.version: HtmlUnitDriver
	at org.openqa.selenium.htmlunit.HtmlUnitDriver.findElementByLinkText(HtmlUnitDriver.java:972)
	at org.openqa.selenium.By$ByLinkText.findElement(By.java:246)
	at org.openqa.selenium.htmlunit.HtmlUnitDriver$5.call(HtmlUnitDriver.java:1707)
	at org.openqa.selenium.htmlunit.HtmlUnitDriver$5.call(HtmlUnitDriver.java:1703)
	at org.openqa.selenium.htmlunit.HtmlUnitDriver.implicitlyWaitFor(HtmlUnitDriver.java:1357)
	at org.openqa.selenium.htmlunit.HtmlUnitDriver.findElement(HtmlUnitDriver.java:1703)
	at org.openqa.selenium.htmlunit.HtmlUnitDriver.findElement(HtmlUnitDriver.java:595)
	at de.swt.inf.model.SeleniumTerminTest.SeleniumTestDeleteTermin(SeleniumTerminTest.java:74)

Running de.swt.inf.model.SeleniumWiederholungTest
Go to Dashboard: http://localhost:8080/login
2018-09-24 10:22:35.739  WARN 151 --- [           main] c.g.htmlunit.DefaultCssErrorHandler      : CSS error: 'https://maxcdn.bootstrapcdn.com/bootstrap/3.3.7/css/bootstrap.min.css' [5:115558] Invalid color "#000\9".
Go to Dashboard: http://localhost:8080/login
2018-09-24 10:22:36.164  WARN 151 --- [           main] c.g.htmlunit.DefaultCssErrorHandler      : CSS error: 'https://maxcdn.bootstrapcdn.com/bootstrap/3.3.7/css/bootstrap.min.css' [5:115558] Invalid color "#000\9".
2018-09-24 10:22:36.598  WARN 151 --- [           main] c.g.htmlunit.DefaultCssErrorHandler      : CSS error: 'https://maxcdn.bootstrapcdn.com/bootstrap/3.3.7/css/bootstrap.min.css' [5:115558] Invalid color "#000\9".
2018-09-24 10:22:37.048  WARN 151 --- [           main] c.g.htmlunit.DefaultCssErrorHandler      : CSS error: 'https://maxcdn.bootstrapcdn.com/bootstrap/3.3.7/css/bootstrap.min.css' [5:115558] Invalid color "#000\9".
2018-09-24 10:22:37.485  WARN 151 --- [           main] c.g.htmlunit.DefaultCssErrorHandler      : CSS error: 'https://maxcdn.bootstrapcdn.com/bootstrap/3.3.7/css/bootstrap.min.css' [5:115558] Invalid color "#000\9".
Tests run: 5, Failures: 0, Errors: 5, Skipped: 0, Time elapsed: 2.176 sec <<< FAILURE! - in de.swt.inf.model.SeleniumWiederholungTest
WdhTestStuendlich(de.swt.inf.model.SeleniumWiederholungTest)  Time elapsed: 0.431 sec  <<< ERROR!
org.openqa.selenium.NoSuchElementException: No link found with text: Neuer Termin
For documentation on this error, please visit: http://seleniumhq.org/exceptions/no_such_element.html
Build info: version: '2.53.1', revision: 'a36b8b1cd5757287168e54b817830adce9b0158d', time: '2016-06-30 19:26:09'
System info: host: 'cyclone1', ip: '172.17.0.4', os.name: 'Linux', os.arch: 'amd64', os.version: '3.10.0-862.3.2.el7.x86_64', java.version: '1.8.0_121'
Driver info: driver.version: HtmlUnitDriver
	at org.openqa.selenium.htmlunit.HtmlUnitDriver.findElementByLinkText(HtmlUnitDriver.java:972)
	at org.openqa.selenium.By$ByLinkText.findElement(By.java:246)
	at org.openqa.selenium.htmlunit.HtmlUnitDriver$5.call(HtmlUnitDriver.java:1707)
	at org.openqa.selenium.htmlunit.HtmlUnitDriver$5.call(HtmlUnitDriver.java:1703)
	at org.openqa.selenium.htmlunit.HtmlUnitDriver.implicitlyWaitFor(HtmlUnitDriver.java:1357)
	at org.openqa.selenium.htmlunit.HtmlUnitDriver.findElement(HtmlUnitDriver.java:1703)
	at org.openqa.selenium.htmlunit.HtmlUnitDriver.findElement(HtmlUnitDriver.java:595)
	at de.swt.inf.model.SeleniumWiederholungTest.WdhTestStuendlich(SeleniumWiederholungTest.java:106)

WdhTestTaeglich(de.swt.inf.model.SeleniumWiederholungTest)  Time elapsed: 0.425 sec  <<< ERROR!
org.openqa.selenium.NoSuchElementException: No link found with text: Neuer Termin
For documentation on this error, please visit: http://seleniumhq.org/exceptions/no_such_element.html
Build info: version: '2.53.1', revision: 'a36b8b1cd5757287168e54b817830adce9b0158d', time: '2016-06-30 19:26:09'
System info: host: 'cyclone1', ip: '172.17.0.4', os.name: 'Linux', os.arch: 'amd64', os.version: '3.10.0-862.3.2.el7.x86_64', java.version: '1.8.0_121'
Driver info: driver.version: HtmlUnitDriver
	at org.openqa.selenium.htmlunit.HtmlUnitDriver.findElementByLinkText(HtmlUnitDriver.java:972)
	at org.openqa.selenium.By$ByLinkText.findElement(By.java:246)
	at org.openqa.selenium.htmlunit.HtmlUnitDriver$5.call(HtmlUnitDriver.java:1707)
	at org.openqa.selenium.htmlunit.HtmlUnitDriver$5.call(HtmlUnitDriver.java:1703)
	at org.openqa.selenium.htmlunit.HtmlUnitDriver.implicitlyWaitFor(HtmlUnitDriver.java:1357)
	at org.openqa.selenium.htmlunit.HtmlUnitDriver.findElement(HtmlUnitDriver.java:1703)
	at org.openqa.selenium.htmlunit.HtmlUnitDriver.findElement(HtmlUnitDriver.java:595)
	at de.swt.inf.model.SeleniumWiederholungTest.WdhTestTaeglich(SeleniumWiederholungTest.java:45)

WdhTestjaerhlich(de.swt.inf.model.SeleniumWiederholungTest)  Time elapsed: 0.433 sec  <<< ERROR!
org.openqa.selenium.NoSuchElementException: No link found with text: Neuer Termin
For documentation on this error, please visit: http://seleniumhq.org/exceptions/no_such_element.html
Build info: version: '2.53.1', revision: 'a36b8b1cd5757287168e54b817830adce9b0158d', time: '2016-06-30 19:26:09'
System info: host: 'cyclone1', ip: '172.17.0.4', os.name: 'Linux', os.arch: 'amd64', os.version: '3.10.0-862.3.2.el7.x86_64', java.version: '1.8.0_121'
Driver info: driver.version: HtmlUnitDriver
	at org.openqa.selenium.htmlunit.HtmlUnitDriver.findElementByLinkText(HtmlUnitDriver.java:972)
	at org.openqa.selenium.By$ByLinkText.findElement(By.java:246)
	at org.openqa.selenium.htmlunit.HtmlUnitDriver$5.call(HtmlUnitDriver.java:1707)
	at org.openqa.selenium.htmlunit.HtmlUnitDriver$5.call(HtmlUnitDriver.java:1703)
	at org.openqa.selenium.htmlunit.HtmlUnitDriver.implicitlyWaitFor(HtmlUnitDriver.java:1357)
	at org.openqa.selenium.htmlunit.HtmlUnitDriver.findElement(HtmlUnitDriver.java:1703)
	at org.openqa.selenium.htmlunit.HtmlUnitDriver.findElement(HtmlUnitDriver.java:595)
	at de.swt.inf.model.SeleniumWiederholungTest.WdhTestjaerhlich(SeleniumWiederholungTest.java:285)

WdhTestWoechentlich(de.swt.inf.model.SeleniumWiederholungTest)  Time elapsed: 0.45 sec  <<< ERROR!
org.openqa.selenium.NoSuchElementException: No link found with text: Neuer Termin
For documentation on this error, please visit: http://seleniumhq.org/exceptions/no_such_element.html
Build info: version: '2.53.1', revision: 'a36b8b1cd5757287168e54b817830adce9b0158d', time: '2016-06-30 19:26:09'
System info: host: 'cyclone1', ip: '172.17.0.4', os.name: 'Linux', os.arch: 'amd64', os.version: '3.10.0-862.3.2.el7.x86_64', java.version: '1.8.0_121'
Driver info: driver.version: HtmlUnitDriver
	at org.openqa.selenium.htmlunit.HtmlUnitDriver.findElementByLinkText(HtmlUnitDriver.java:972)
	at org.openqa.selenium.By$ByLinkText.findElement(By.java:246)
	at org.openqa.selenium.htmlunit.HtmlUnitDriver$5.call(HtmlUnitDriver.java:1707)
	at org.openqa.selenium.htmlunit.HtmlUnitDriver$5.call(HtmlUnitDriver.java:1703)
	at org.openqa.selenium.htmlunit.HtmlUnitDriver.implicitlyWaitFor(HtmlUnitDriver.java:1357)
	at org.openqa.selenium.htmlunit.HtmlUnitDriver.findElement(HtmlUnitDriver.java:1703)
	at org.openqa.selenium.htmlunit.HtmlUnitDriver.findElement(HtmlUnitDriver.java:595)
	at de.swt.inf.model.SeleniumWiederholungTest.WdhTestWoechentlich(SeleniumWiederholungTest.java:163)

WdhTestMonatlich(de.swt.inf.model.SeleniumWiederholungTest)  Time elapsed: 0.437 sec  <<< ERROR!
org.openqa.selenium.NoSuchElementException: No link found with text: Neuer Termin
For documentation on this error, please visit: http://seleniumhq.org/exceptions/no_such_element.html
Build info: version: '2.53.1', revision: 'a36b8b1cd5757287168e54b817830adce9b0158d', time: '2016-06-30 19:26:09'
System info: host: 'cyclone1', ip: '172.17.0.4', os.name: 'Linux', os.arch: 'amd64', os.version: '3.10.0-862.3.2.el7.x86_64', java.version: '1.8.0_121'
Driver info: driver.version: HtmlUnitDriver
	at org.openqa.selenium.htmlunit.HtmlUnitDriver.findElementByLinkText(HtmlUnitDriver.java:972)
	at org.openqa.selenium.By$ByLinkText.findElement(By.java:246)
	at org.openqa.selenium.htmlunit.HtmlUnitDriver$5.call(HtmlUnitDriver.java:1707)
	at org.openqa.selenium.htmlunit.HtmlUnitDriver$5.call(HtmlUnitDriver.java:1703)
	at org.openqa.selenium.htmlunit.HtmlUnitDriver.implicitlyWaitFor(HtmlUnitDriver.java:1357)
	at org.openqa.selenium.htmlunit.HtmlUnitDriver.findElement(HtmlUnitDriver.java:1703)
	at org.openqa.selenium.htmlunit.HtmlUnitDriver.findElement(HtmlUnitDriver.java:595)
	at de.swt.inf.model.SeleniumWiederholungTest.WdhTestMonatlich(SeleniumWiederholungTest.java:224)

2018-09-24 10:22:37.696  INFO 151 --- [       Thread-5] ationConfigEmbeddedWebApplicationContext : Closing org.springframework.boot.context.embedded.AnnotationConfigEmbeddedWebApplicationContext@14dd9eb7: startup date [Mon Sep 24 10:21:14 CEST 2018]; root of context hierarchy
2018-09-24 10:22:37.700  INFO 151 --- [       Thread-5] o.s.c.support.DefaultLifecycleProcessor  : Stopping beans in phase 0
2018-09-24 10:22:37.701  INFO 151 --- [       Thread-5] o.s.j.e.a.AnnotationMBeanExporter        : Unregistering JMX-exposed beans on shutdown

Results :

Failed tests: 
  SeleniumTerminTest.SeleniumTestAddTermin:55 null
  UserRegistrationTest.seleniumTestRegistrationTrue:126 null
  UserRegistrationTest.seleniumTestRegistrationEmailFalse:162 null
  UserRegistrationTest.seleniumTestRegistrationUsernameFalse:204 null
  UserRegistrationTest.seleniumTestRegistrationTrue:126 null
  UserRegistrationTest.seleniumTestRegistrationTrue:126 null
  UserRegistrationTest.seleniumTestRegistrationTrue:126 null
Tests in error: 
  SeleniumDashboardTest.addTermin:77  NoSuchElement No link found with text: Vo...
  SeleniumDashboardTest.addTermin:77  NoSuchElement No link found with text: Vo...
  SeleniumDashboardTest.addTermin:77  NoSuchElement No link found with text: Vo...
  SeleniumDashboardTest.addTermin:77  NoSuchElement No link found with text: Vo...
  SeleniumEinrichtungsfunktionTest.SeleniumTestEinrichtungsfunktion:68  NoSuchElement
  SeleniumTerminTest.SeleniumTestDeleteTermin:74  NoSuchElement No link found w...
  SeleniumWiederholungTest.WdhTestMonatlich:224  NoSuchElement No link found wi...
  SeleniumWiederholungTest.WdhTestStuendlich:106  NoSuchElement No link found w...
  SeleniumWiederholungTest.WdhTestTaeglich:45  NoSuchElement No link found with...
  SeleniumWiederholungTest.WdhTestWoechentlich:163  NoSuchElement No link found...
  SeleniumWiederholungTest.WdhTestjaerhlich:285  NoSuchElement No link found wi...

Tests run: 72, Failures: 7, Errors: 11, Skipped: 0

[INFO] ------------------------------------------------------------------------
[INFO] BUILD FAILURE
[INFO] ------------------------------------------------------------------------
[INFO] Total time: 01:28 min
[INFO] Finished at: 2018-09-24T10:22:37+02:00
[INFO] Final Memory: 36M/389M
[INFO] ------------------------------------------------------------------------
[ERROR] Failed to execute goal org.apache.maven.plugins:maven-surefire-plugin:2.18.1:test (default-test) on project Karlender: There are test failures.
[ERROR] 
[ERROR] Please refer to /root/workspace/TetrisIQ/SWT-II/432365318/target/surefire-reports for the individual test results.
[ERROR] -> [Help 1]
[ERROR] 
[ERROR] To see the full stack trace of the errors, re-run Maven with the -e switch.
[ERROR] Re-run Maven using the -X switch to enable full debug logging.
[ERROR] 
[ERROR] For more information about the errors and possible solutions, please read the following articles:
[ERROR] [Help 1] http://cwiki.apache.org/confluence/display/MAVEN/MojoFailureException
