[INFO] Scanning for projects...
[INFO] ------------------------------------------------------------------------
[INFO] Reactor Build Order:
[INFO] 
[INFO] Calcite
[INFO] Calcite Linq4j
[INFO] Calcite Core
[INFO] Calcite Babel
[INFO] Calcite Cassandra
[INFO] Calcite Druid
[INFO] Calcite Elasticsearch
[INFO] Calcite Examples
[INFO] Calcite Example CSV
[INFO] Calcite Example Function
[INFO] Calcite File
[INFO] Calcite Geode
[INFO] Calcite MongoDB
[INFO] Calcite Pig
[INFO] Calcite Piglet
[INFO] Calcite Plus
[INFO] Calcite Server
[INFO] Calcite Spark
[INFO] Calcite Splunk
[INFO] Calcite Ubenchmark
[INFO]                                                                         
[INFO] ------------------------------------------------------------------------
[INFO] Building Calcite 1.18.0-SNAPSHOT
[INFO] ------------------------------------------------------------------------
[INFO] 
[INFO] --- maven-checkstyle-plugin:3.0.0:check (validate) @ calcite ---
[INFO] 
[INFO] --- maven-enforcer-plugin:3.0.0-M2:enforce (enforce-java) @ calcite ---
[INFO] Skipping Rule Enforcement.
[INFO] 
[INFO] --- maven-enforcer-plugin:3.0.0-M2:enforce (enforce-maven-version) @ calcite ---
[INFO] Skipping Rule Enforcement.
[INFO] 
[INFO] --- build-helper-maven-plugin:3.0.0:add-resource (add-resource) @ calcite ---
[INFO] 
[INFO] --- build-helper-maven-plugin:3.0.0:add-test-resource (add-resource) @ calcite ---
[INFO] 
[INFO] --- maven-remote-resources-plugin:1.5:process (process-resource-bundles) @ calcite ---
[INFO] 
[INFO] --- build-helper-maven-plugin:3.0.0:add-test-source (add-test-sources) @ calcite ---
[INFO] Test Source directory: /root/workspace/apache/calcite/432128278/target/generated-test-sources/javacc added.
[INFO]                                                                         
[INFO] ------------------------------------------------------------------------
[INFO] Building Calcite Linq4j 1.18.0-SNAPSHOT
[INFO] ------------------------------------------------------------------------
[INFO] 
[INFO] --- maven-checkstyle-plugin:3.0.0:check (validate) @ calcite-linq4j ---
[INFO] 
[INFO] --- maven-enforcer-plugin:3.0.0-M2:enforce (enforce-java) @ calcite-linq4j ---
[INFO] Skipping Rule Enforcement.
[INFO] 
[INFO] --- maven-enforcer-plugin:3.0.0-M2:enforce (enforce-maven-version) @ calcite-linq4j ---
[INFO] Skipping Rule Enforcement.
[INFO] 
[INFO] --- build-helper-maven-plugin:3.0.0:add-resource (add-resource) @ calcite-linq4j ---
[INFO] 
[INFO] --- build-helper-maven-plugin:3.0.0:add-test-resource (add-resource) @ calcite-linq4j ---
[INFO] 
[INFO] --- maven-remote-resources-plugin:1.5:process (process-resource-bundles) @ calcite-linq4j ---
[INFO] 
[INFO] --- maven-resources-plugin:3.1.0:resources (default-resources) @ calcite-linq4j ---
[INFO] Using 'UTF-8' encoding to copy filtered resources.
[INFO] skip non existing resourceDirectory /root/workspace/apache/calcite/432128278/linq4j/src/main/resources
[INFO] Copying 2 resources to META-INF
[INFO] Copying 1 resource to META-INF
[INFO] 
[INFO] --- maven-compiler-plugin:3.7.0:compile (default-compile) @ calcite-linq4j ---
[INFO] Nothing to compile - all classes are up to date
[INFO] 
[INFO] --- build-helper-maven-plugin:3.0.0:add-test-source (add-test-sources) @ calcite-linq4j ---
[INFO] Test Source directory: /root/workspace/apache/calcite/432128278/linq4j/target/generated-test-sources/javacc added.
[INFO] 
[INFO] --- maven-resources-plugin:3.1.0:testResources (default-testResources) @ calcite-linq4j ---
[INFO] Using 'UTF-8' encoding to copy filtered resources.
[INFO] skip non existing resourceDirectory /root/workspace/apache/calcite/432128278/linq4j/src/test/resources
[INFO] Copying 2 resources to META-INF
[INFO] Copying 1 resource to META-INF
[INFO] 
[INFO] --- maven-compiler-plugin:3.7.0:testCompile (default-testCompile) @ calcite-linq4j ---
[INFO] Nothing to compile - all classes are up to date
[INFO] 
[INFO] --- maven-surefire-plugin:2.22.0:test (default-test) @ calcite-linq4j ---
[INFO] Downloading: https://repo.maven.apache.org/maven2/org/apache/maven/surefire/surefire-junit47/2.22.0/surefire-junit47-2.22.0.pom
[INFO] Downloaded: https://repo.maven.apache.org/maven2/org/apache/maven/surefire/surefire-junit47/2.22.0/surefire-junit47-2.22.0.pom (7 KB at 14.8 KB/sec)
[INFO] Downloading: https://repo.maven.apache.org/maven2/org/apache/maven/surefire/surefire-providers/2.22.0/surefire-providers-2.22.0.pom
[INFO] Downloaded: https://repo.maven.apache.org/maven2/org/apache/maven/surefire/surefire-providers/2.22.0/surefire-providers-2.22.0.pom (3 KB at 67.5 KB/sec)
[INFO] Downloading: https://repo.maven.apache.org/maven2/org/apache/maven/surefire/common-junit48/2.22.0/common-junit48-2.22.0.pom
[INFO] Downloaded: https://repo.maven.apache.org/maven2/org/apache/maven/surefire/common-junit48/2.22.0/common-junit48-2.22.0.pom (4 KB at 85.5 KB/sec)
[INFO] Downloading: https://repo.maven.apache.org/maven2/org/apache/maven/surefire/common-junit4/2.22.0/common-junit4-2.22.0.pom
[INFO] Downloaded: https://repo.maven.apache.org/maven2/org/apache/maven/surefire/common-junit4/2.22.0/common-junit4-2.22.0.pom (3 KB at 56.3 KB/sec)
[INFO] Downloading: https://repo.maven.apache.org/maven2/org/apache/maven/surefire/common-junit3/2.22.0/common-junit3-2.22.0.pom
[INFO] Downloaded: https://repo.maven.apache.org/maven2/org/apache/maven/surefire/common-junit3/2.22.0/common-junit3-2.22.0.pom (2 KB at 39.5 KB/sec)
[INFO] Downloading: https://repo.maven.apache.org/maven2/org/apache/maven/surefire/common-java5/2.22.0/common-java5-2.22.0.pom
[INFO] Downloaded: https://repo.maven.apache.org/maven2/org/apache/maven/surefire/common-java5/2.22.0/common-java5-2.22.0.pom (3 KB at 68.8 KB/sec)
[INFO] Downloading: https://repo.maven.apache.org/maven2/org/apache/maven/shared/maven-shared-utils/0.9/maven-shared-utils-0.9.pom
[INFO] Downloaded: https://repo.maven.apache.org/maven2/org/apache/maven/shared/maven-shared-utils/0.9/maven-shared-utils-0.9.pom (7 KB at 168.9 KB/sec)
[INFO] Downloading: https://repo.maven.apache.org/maven2/org/apache/maven/surefire/surefire-grouper/2.22.0/surefire-grouper-2.22.0.pom
[INFO] Downloaded: https://repo.maven.apache.org/maven2/org/apache/maven/surefire/surefire-grouper/2.22.0/surefire-grouper-2.22.0.pom (3 KB at 75.7 KB/sec)
[INFO] Downloading: https://repo.maven.apache.org/maven2/org/apache/maven/surefire/common-java5/2.22.0/common-java5-2.22.0.jar
[INFO] Downloading: https://repo.maven.apache.org/maven2/org/apache/maven/surefire/common-junit4/2.22.0/common-junit4-2.22.0.jar
[INFO] Downloading: https://repo.maven.apache.org/maven2/org/apache/maven/surefire/surefire-junit47/2.22.0/surefire-junit47-2.22.0.jar
[INFO] Downloading: https://repo.maven.apache.org/maven2/org/apache/maven/surefire/common-junit48/2.22.0/common-junit48-2.22.0.jar
[INFO] Downloading: https://repo.maven.apache.org/maven2/org/apache/maven/surefire/common-junit3/2.22.0/common-junit3-2.22.0.jar
[INFO] Downloaded: https://repo.maven.apache.org/maven2/org/apache/maven/surefire/common-junit4/2.22.0/common-junit4-2.22.0.jar (28 KB at 442.8 KB/sec)
[INFO] Downloading: https://repo.maven.apache.org/maven2/org/apache/maven/shared/maven-shared-utils/0.9/maven-shared-utils-0.9.jar
[INFO] Downloaded: https://repo.maven.apache.org/maven2/org/apache/maven/surefire/common-junit3/2.22.0/common-junit3-2.22.0.jar (12 KB at 147.7 KB/sec)
[INFO] Downloading: https://repo.maven.apache.org/maven2/org/apache/maven/surefire/surefire-grouper/2.22.0/surefire-grouper-2.22.0.jar
[INFO] Downloaded: https://repo.maven.apache.org/maven2/org/apache/maven/surefire/common-junit48/2.22.0/common-junit48-2.22.0.jar (22 KB at 240.8 KB/sec)
[INFO] Downloaded: https://repo.maven.apache.org/maven2/org/apache/maven/surefire/common-java5/2.22.0/common-java5-2.22.0.jar (50 KB at 476.1 KB/sec)
[INFO] Downloaded: https://repo.maven.apache.org/maven2/org/apache/maven/surefire/surefire-grouper/2.22.0/surefire-grouper-2.22.0.jar (40 KB at 796.8 KB/sec)
[INFO] Downloaded: https://repo.maven.apache.org/maven2/org/apache/maven/surefire/surefire-junit47/2.22.0/surefire-junit47-2.22.0.jar (157 KB at 1194.6 KB/sec)
[INFO] Downloaded: https://repo.maven.apache.org/maven2/org/apache/maven/shared/maven-shared-utils/0.9/maven-shared-utils-0.9.jar (168 KB at 2361.3 KB/sec)
[INFO] 
[INFO] -------------------------------------------------------
[INFO]  T E S T S
[INFO] -------------------------------------------------------
[INFO] Running org.apache.calcite.linq4j.test.PrimitiveTest
[INFO] Tests run: 9, Failures: 0, Errors: 0, Skipped: 0, Time elapsed: 0.097 s - in org.apache.calcite.linq4j.test.PrimitiveTest
[INFO] Running org.apache.calcite.linq4j.test.OptimizerTest
[INFO] Tests run: 80, Failures: 0, Errors: 0, Skipped: 0, Time elapsed: 0.046 s - in org.apache.calcite.linq4j.test.OptimizerTest
[INFO] Running org.apache.calcite.linq4j.test.ExpressionTest
[INFO] Tests run: 32, Failures: 0, Errors: 0, Skipped: 0, Time elapsed: 0.141 s - in org.apache.calcite.linq4j.test.ExpressionTest
[INFO] Running org.apache.calcite.linq4j.test.Linq4jTest
[INFO] Tests run: 115, Failures: 0, Errors: 0, Skipped: 0, Time elapsed: 0.143 s - in org.apache.calcite.linq4j.test.Linq4jTest
[INFO] Running org.apache.calcite.linq4j.test.InlinerTest
[INFO] Tests run: 9, Failures: 0, Errors: 0, Skipped: 0, Time elapsed: 0.001 s - in org.apache.calcite.linq4j.test.InlinerTest
[INFO] Running org.apache.calcite.linq4j.test.BlockBuilderTest
[INFO] Tests run: 5, Failures: 0, Errors: 0, Skipped: 0, Time elapsed: 0.002 s - in org.apache.calcite.linq4j.test.BlockBuilderTest
[INFO] Running org.apache.calcite.linq4j.test.DeterministicTest
[INFO] Tests run: 16, Failures: 0, Errors: 0, Skipped: 0, Time elapsed: 0.021 s - in org.apache.calcite.linq4j.test.DeterministicTest
[INFO] Running org.apache.calcite.linq4j.tree.TypeTest
[INFO] Tests run: 1, Failures: 0, Errors: 0, Skipped: 0, Time elapsed: 0.002 s - in org.apache.calcite.linq4j.tree.TypeTest
[INFO] Running org.apache.calcite.linq4j.function.FunctionTest
[INFO] Tests run: 4, Failures: 0, Errors: 0, Skipped: 0, Time elapsed: 0.006 s - in org.apache.calcite.linq4j.function.FunctionTest
[INFO] Running org.apache.calcite.linq4j.test.CorrelateJoinTest
[INFO] Tests run: 4, Failures: 0, Errors: 0, Skipped: 0, Time elapsed: 0.004 s - in org.apache.calcite.linq4j.test.CorrelateJoinTest
[INFO] Running org.apache.calcite.linq4j.test.LookupImplTest
[INFO] Tests run: 2, Failures: 0, Errors: 0, Skipped: 0, Time elapsed: 0.004 s - in org.apache.calcite.linq4j.test.LookupImplTest
[INFO] 
[INFO] Results:
[INFO] 
[INFO] Tests run: 277, Failures: 0, Errors: 0, Skipped: 0
[INFO] 
[INFO]                                                                         
[INFO] ------------------------------------------------------------------------
[INFO] Building Calcite Core 1.18.0-SNAPSHOT
[INFO] ------------------------------------------------------------------------
[INFO] 
[INFO] --- drill-fmpp-maven-plugin:1.14.0:generate (generate-fmpp-sources) @ calcite-core ---
[INFO] Freemarker generation:
 scope: compile,
 config: /root/workspace/apache/calcite/432128278/core/src/main/codegen/config.fmpp,
 templates: /root/workspace/apache/calcite/432128278/core/src/main/codegen/templates
[INFO] Adding maven data loader
.
[INFO] Freemarker generation took 447ms
[INFO] Incremental output update took 0ms
[INFO] new: 0
[INFO] changed: 0
[INFO] unchanged: 1
[INFO] 
[INFO] --- drill-fmpp-maven-plugin:1.14.0:generate (generate-fmpp-test-sources) @ calcite-core ---
[INFO] Freemarker generation:
 scope: test,
 config: /root/workspace/apache/calcite/432128278/core/src/test/codegen/config.fmpp,
 templates: /root/workspace/apache/calcite/432128278/core/src/main/codegen/templates
[INFO] Adding maven data loader
.
[INFO] Freemarker generation took 115ms
[INFO] Incremental output update took 0ms
[INFO] new: 0
[INFO] changed: 0
[INFO] unchanged: 1
[INFO] 
[INFO] --- maven-checkstyle-plugin:3.0.0:check (validate) @ calcite-core ---
[INFO] 
[INFO] --- maven-enforcer-plugin:3.0.0-M2:enforce (enforce-java) @ calcite-core ---
[INFO] Skipping Rule Enforcement.
[INFO] 
[INFO] --- maven-enforcer-plugin:3.0.0-M2:enforce (enforce-maven-version) @ calcite-core ---
[INFO] Skipping Rule Enforcement.
[INFO] 
[INFO] --- javacc-maven-plugin:2.4:javacc (javacc) @ calcite-core ---
[INFO] Skipping - all grammars up to date
[INFO] 
[INFO] --- hydromatic-resource-maven-plugin:0.6:generate-sources (default) @ calcite-core ---
[INFO] /root/workspace/apache/calcite/432128278/core/target/generated-sources/resgen/org/apache/calcite/runtime/Resources.java is up to date
[INFO] 
[INFO] --- build-helper-maven-plugin:3.0.0:add-resource (add-resource) @ calcite-core ---
[INFO] 
[INFO] --- build-helper-maven-plugin:3.0.0:add-test-resource (add-resource) @ calcite-core ---
[INFO] 
[INFO] --- maven-remote-resources-plugin:1.5:process (process-resource-bundles) @ calcite-core ---
[INFO] 
[INFO] --- maven-resources-plugin:3.1.0:resources (default-resources) @ calcite-core ---
[INFO] Using 'UTF-8' encoding to copy filtered resources.
[INFO] Copying 2 resources
[INFO] Copying 4 resources to codegen
[INFO] Copying 1 resource
[INFO] Copying 2 resources to META-INF
[INFO] Copying 1 resource to META-INF
[INFO] 
[INFO] --- maven-compiler-plugin:3.7.0:compile (default-compile) @ calcite-core ---
[INFO] Nothing to compile - all classes are up to date
[INFO] 
[INFO] --- build-helper-maven-plugin:3.0.0:add-test-source (add-test-sources) @ calcite-core ---
[INFO] Test Source directory: /root/workspace/apache/calcite/432128278/core/target/generated-test-sources/javacc added.
[INFO] 
[INFO] --- javacc-maven-plugin:2.4:javacc (javacc-test) @ calcite-core ---
[INFO] Skipping - all grammars up to date
[INFO] 
[INFO] --- maven-resources-plugin:3.1.0:testResources (default-testResources) @ calcite-core ---
[INFO] Using 'UTF-8' encoding to copy filtered resources.
[INFO] Copying 27 resources
[INFO] Copying 2 resources to META-INF
[INFO] Copying 1 resource to META-INF
[INFO] 
[INFO] --- maven-compiler-plugin:3.7.0:testCompile (default-testCompile) @ calcite-core ---
[INFO] Nothing to compile - all classes are up to date
[INFO] 
[INFO] --- maven-surefire-plugin:2.22.0:test (default-test) @ calcite-core ---
[INFO] 
[INFO] -------------------------------------------------------
[INFO]  T E S T S
[INFO] -------------------------------------------------------
[INFO] Running org.apache.calcite.util.graph.DirectedGraphTest
[INFO] Tests run: 9, Failures: 0, Errors: 0, Skipped: 0, Time elapsed: 0.052 s - in org.apache.calcite.util.graph.DirectedGraphTest
[INFO] Running org.apache.calcite.util.BitSetsTest
[INFO] Tests run: 10, Failures: 0, Errors: 0, Skipped: 0, Time elapsed: 0.117 s - in org.apache.calcite.util.BitSetsTest
2018-09-23 15:22:33,569 [pool-1-thread-8] INFO  - open start - state modified
2018-09-23 15:22:33,597 [pool-1-thread-8] INFO  - Checkpoint start
2018-09-23 15:22:33,598 [pool-1-thread-8] INFO  - Checkpoint end - txts: 25
[INFO] Running org.apache.calcite.adapter.clone.ArrayTableTest
[INFO] Tests run: 11, Failures: 0, Errors: 0, Skipped: 0, Time elapsed: 0.156 s - in org.apache.calcite.adapter.clone.ArrayTableTest
[INFO] Running org.apache.calcite.util.ReflectVisitorTest
[INFO] Tests run: 5, Failures: 0, Errors: 0, Skipped: 0, Time elapsed: 0.015 s - in org.apache.calcite.util.ReflectVisitorTest
[INFO] Running org.apache.calcite.plan.RelOptUtilTest
[INFO] Tests run: 5, Failures: 0, Errors: 0, Skipped: 0, Time elapsed: 0.009 s - in org.apache.calcite.plan.RelOptUtilTest
[INFO] Running org.apache.calcite.rel.RelCollationTest
[INFO] Tests run: 2, Failures: 0, Errors: 0, Skipped: 0, Time elapsed: 0.007 s - in org.apache.calcite.rel.RelCollationTest
[INFO] Running org.apache.calcite.util.ImmutableBitSetTest
[INFO] Tests run: 26, Failures: 0, Errors: 0, Skipped: 0, Time elapsed: 0.526 s - in org.apache.calcite.util.ImmutableBitSetTest
[INFO] Running org.apache.calcite.util.SourceTest
[INFO] Tests run: 5, Failures: 0, Errors: 0, Skipped: 0, Time elapsed: 0.008 s - in org.apache.calcite.util.SourceTest
[INFO] Running org.apache.calcite.util.PrecedenceClimbingParserTest
[INFO] Tests run: 9, Failures: 0, Errors: 0, Skipped: 0, Time elapsed: 0.006 s - in org.apache.calcite.util.PrecedenceClimbingParserTest
[INFO] Running org.apache.calcite.util.mapping.MappingTest
[INFO] Tests run: 7, Failures: 0, Errors: 0, Skipped: 0, Time elapsed: 0.019 s - in org.apache.calcite.util.mapping.MappingTest
[INFO] Running org.apache.calcite.test.FilteratorTest
[INFO] Tests run: 4, Failures: 0, Errors: 0, Skipped: 0, Time elapsed: 0.004 s - in org.apache.calcite.test.FilteratorTest
[INFO] Running org.apache.calcite.util.PermutationTestCase
[INFO] Tests run: 5, Failures: 0, Errors: 0, Skipped: 0, Time elapsed: 0.003 s - in org.apache.calcite.util.PermutationTestCase
[INFO] Running org.apache.calcite.test.CalciteResourceTest
[INFO] Tests run: 1, Failures: 0, Errors: 0, Skipped: 0, Time elapsed: 0 s - in org.apache.calcite.test.CalciteResourceTest
[INFO] Running org.apache.calcite.test.SqlFunctionsTest
[INFO] Tests run: 34, Failures: 0, Errors: 0, Skipped: 0, Time elapsed: 0.017 s - in org.apache.calcite.test.SqlFunctionsTest
[INFO] Running org.apache.calcite.sql.test.SqlTypeNameTest
[INFO] Tests run: 36, Failures: 0, Errors: 0, Skipped: 0, Time elapsed: 0.018 s - in org.apache.calcite.sql.test.SqlTypeNameTest
[INFO] Running org.apache.calcite.test.ModelTest
[INFO] Tests run: 10, Failures: 0, Errors: 0, Skipped: 0, Time elapsed: 1.702 s - in org.apache.calcite.test.ModelTest
[INFO] Running org.apache.calcite.test.SqlValidatorFeatureTest
[INFO] Tests run: 6, Failures: 0, Errors: 0, Skipped: 0, Time elapsed: 0.153 s - in org.apache.calcite.test.SqlValidatorFeatureTest
[INFO] Running org.apache.calcite.plan.volcano.VolcanoPlannerTraitTest
[WARNING] Tests run: 3, Failures: 0, Errors: 0, Skipped: 2, Time elapsed: 0.246 s - in org.apache.calcite.plan.volcano.VolcanoPlannerTraitTest
[INFO] Running org.apache.calcite.util.TestUtilTest
[INFO] Tests run: 2, Failures: 0, Errors: 0, Skipped: 0, Time elapsed: 0.001 s - in org.apache.calcite.util.TestUtilTest
[INFO] Running org.apache.calcite.test.InterpreterTest
[INFO] Tests run: 12, Failures: 0, Errors: 0, Skipped: 0, Time elapsed: 0.387 s - in org.apache.calcite.test.InterpreterTest
[INFO] Running org.apache.calcite.rel.RelDistributionTest
[INFO] Tests run: 1, Failures: 0, Errors: 0, Skipped: 0, Time elapsed: 0.017 s - in org.apache.calcite.rel.RelDistributionTest
[INFO] Running org.apache.calcite.plan.volcano.TraitPropagationTest
[INFO] Tests run: 1, Failures: 0, Errors: 0, Skipped: 0, Time elapsed: 0.177 s - in org.apache.calcite.plan.volcano.TraitPropagationTest
[INFO] Running org.apache.calcite.test.SqlOperatorBindingTest
[INFO] Tests run: 2, Failures: 0, Errors: 0, Skipped: 0, Time elapsed: 0.001 s - in org.apache.calcite.test.SqlOperatorBindingTest
[INFO] Running org.apache.calcite.test.RexTransformerTest
[INFO] Tests run: 18, Failures: 0, Errors: 0, Skipped: 0, Time elapsed: 0.027 s - in org.apache.calcite.test.RexTransformerTest
[INFO] Running org.apache.calcite.runtime.BinarySearchTest
[INFO] Tests run: 6, Failures: 0, Errors: 0, Skipped: 0, Time elapsed: 0.001 s - in org.apache.calcite.runtime.BinarySearchTest
[INFO] Running org.apache.calcite.test.RexProgramTest
[WARNING] Tests run: 44, Failures: 0, Errors: 0, Skipped: 1, Time elapsed: 0.391 s - in org.apache.calcite.test.RexProgramTest
[INFO] Running org.apache.calcite.plan.RelWriterTest
rel#515:LogicalAggregate#515
[INFO] Tests run: 2, Failures: 0, Errors: 0, Skipped: 0, Time elapsed: 0.041 s - in org.apache.calcite.plan.RelWriterTest
[INFO] Running org.apache.calcite.test.InduceGroupingTypeTest
[INFO] Tests run: 3, Failures: 0, Errors: 0, Skipped: 0, Time elapsed: 0.003 s - in org.apache.calcite.test.InduceGroupingTypeTest
[INFO] Running org.apache.calcite.runtime.EnumerablesTest
[INFO] Tests run: 11, Failures: 0, Errors: 0, Skipped: 0, Time elapsed: 0.02 s - in org.apache.calcite.runtime.EnumerablesTest
[INFO] Running org.apache.calcite.plan.RelOptPlanReaderTest
[INFO] Tests run: 1, Failures: 0, Errors: 0, Skipped: 0, Time elapsed: 0.008 s - in org.apache.calcite.plan.RelOptPlanReaderTest
[INFO] Running org.apache.calcite.test.ExceptionMessageTest
[INFO] Tests run: 5, Failures: 0, Errors: 0, Skipped: 0, Time elapsed: 0.203 s - in org.apache.calcite.test.ExceptionMessageTest
[INFO] Running org.apache.calcite.rex.RexBuilderTest
[INFO] Tests run: 14, Failures: 0, Errors: 0, Skipped: 0, Time elapsed: 0.017 s - in org.apache.calcite.rex.RexBuilderTest
[INFO] Running org.apache.calcite.sql.type.SqlTypeFactoryTest
[INFO] Tests run: 6, Failures: 0, Errors: 0, Skipped: 0, Time elapsed: 0.007 s - in org.apache.calcite.sql.type.SqlTypeFactoryTest
[INFO] Running org.apache.calcite.sql.validate.SqlValidatorUtilTest
[INFO] Tests run: 8, Failures: 0, Errors: 0, Skipped: 0, Time elapsed: 0.004 s - in org.apache.calcite.sql.validate.SqlValidatorUtilTest
[INFO] Running org.apache.calcite.sql.type.SqlTypeUtilTest
[INFO] Tests run: 6, Failures: 0, Errors: 0, Skipped: 0, Time elapsed: 0.002 s - in org.apache.calcite.sql.type.SqlTypeUtilTest
[INFO] Running org.apache.calcite.sql.parser.SqlParserTest
[WARNING] Tests run: 315, Failures: 0, Errors: 0, Skipped: 4, Time elapsed: 0.58 s - in org.apache.calcite.sql.parser.SqlParserTest
[INFO] Running org.apache.calcite.util.UtilTest
[INFO] Tests run: 69, Failures: 0, Errors: 0, Skipped: 0, Time elapsed: 4.129 s - in org.apache.calcite.util.UtilTest
[INFO] Running org.apache.calcite.sql.SqlSetOptionOperatorTest
[INFO] Tests run: 4, Failures: 0, Errors: 0, Skipped: 0, Time elapsed: 0.004 s - in org.apache.calcite.sql.SqlSetOptionOperatorTest
[INFO] Running org.apache.calcite.sql.test.SqlPrettyWriterTest
[WARNING] Tests run: 21, Failures: 0, Errors: 0, Skipped: 1, Time elapsed: 0.067 s - in org.apache.calcite.sql.test.SqlPrettyWriterTest
[INFO] Running org.apache.calcite.test.HepPlannerTest
[INFO] Tests run: 12, Failures: 0, Errors: 0, Skipped: 0, Time elapsed: 2.452 s - in org.apache.calcite.test.HepPlannerTest
[INFO] Running org.apache.calcite.test.SqlValidatorDynamicTest
[INFO] Tests run: 5, Failures: 0, Errors: 0, Skipped: 0, Time elapsed: 0.013 s - in org.apache.calcite.test.SqlValidatorDynamicTest
[INFO] Running org.apache.calcite.test.SqlValidatorMatchTest
[INFO] Tests run: 16, Failures: 0, Errors: 0, Skipped: 0, Time elapsed: 0.025 s - in org.apache.calcite.test.SqlValidatorMatchTest
[INFO] Running org.apache.calcite.sql.test.SqlAdvisorTest
[WARNING] Tests run: 37, Failures: 0, Errors: 0, Skipped: 3, Time elapsed: 0.204 s - in org.apache.calcite.sql.test.SqlAdvisorTest
[INFO] Running org.apache.calcite.rel.rules.DateRangeRulesTest
[INFO] Tests run: 27, Failures: 0, Errors: 0, Skipped: 0, Time elapsed: 0.116 s - in org.apache.calcite.rel.rules.DateRangeRulesTest
[INFO] Running org.apache.calcite.test.SqlValidatorTest
[WARNING] Tests run: 385, Failures: 0, Errors: 0, Skipped: 5, Time elapsed: 2.469 s - in org.apache.calcite.test.SqlValidatorTest
[INFO] Running org.apache.calcite.test.RelOptRulesTest
[WARNING] Tests run: 305, Failures: 0, Errors: 0, Skipped: 8, Time elapsed: 9.543 s - in org.apache.calcite.test.RelOptRulesTest
[INFO] Running org.apache.calcite.test.SqlLimitsTest
[INFO] Tests run: 1, Failures: 0, Errors: 0, Skipped: 0, Time elapsed: 0.012 s - in org.apache.calcite.test.SqlLimitsTest
[INFO] Running org.apache.calcite.test.ScannableTableTest
[INFO] Tests run: 16, Failures: 0, Errors: 0, Skipped: 0, Time elapsed: 0.96 s - in org.apache.calcite.test.ScannableTableTest
[INFO] Running org.apache.calcite.test.JdbcFrontLinqBackTest
[WARNING] Tests run: 19, Failures: 0, Errors: 0, Skipped: 1, Time elapsed: 0.568 s - in org.apache.calcite.test.JdbcFrontLinqBackTest
[INFO] Running org.apache.calcite.rex.RexExecutorTest
[INFO] Tests run: 10, Failures: 0, Errors: 0, Skipped: 0, Time elapsed: 0.825 s - in org.apache.calcite.rex.RexExecutorTest
[INFO] Running org.apache.calcite.test.JdbcFrontJdbcBackTest
2018-09-23 15:22:51,193 [pool-1-thread-8] INFO  - open start - state modified
2018-09-23 15:23:02,703 [pool-1-thread-8] INFO  - Checkpoint start
2018-09-23 15:23:02,703 [pool-1-thread-8] INFO  - Checkpoint end - txts: 279
[WARNING] Tests run: 6, Failures: 0, Errors: 0, Skipped: 1, Time elapsed: 11.775 s - in org.apache.calcite.test.JdbcFrontJdbcBackTest
[INFO] Running org.apache.calcite.test.SqlToRelConverterTest
[WARNING] Tests run: 342, Failures: 0, Errors: 0, Skipped: 4, Time elapsed: 12.207 s - in org.apache.calcite.test.SqlToRelConverterTest
[INFO] Running org.apache.calcite.rel.rel2sql.RelToSqlConverterTest
[INFO] Tests run: 142, Failures: 0, Errors: 0, Skipped: 0, Time elapsed: 1.361 s - in org.apache.calcite.rel.rel2sql.RelToSqlConverterTest
[INFO] Running org.apache.calcite.tools.FrameworksTest
[INFO] Tests run: 7, Failures: 0, Errors: 0, Skipped: 0, Time elapsed: 0.11 s - in org.apache.calcite.tools.FrameworksTest
[INFO] Running org.apache.calcite.test.enumerable.EnumerableCorrelateTest
[INFO] Tests run: 2, Failures: 0, Errors: 0, Skipped: 0, Time elapsed: 0.265 s - in org.apache.calcite.test.enumerable.EnumerableCorrelateTest
[INFO] Running org.apache.calcite.prepare.LookupOperatorOverloadsTest
[INFO] Tests run: 5, Failures: 0, Errors: 0, Skipped: 0, Time elapsed: 0.007 s - in org.apache.calcite.prepare.LookupOperatorOverloadsTest
[INFO] Running org.apache.calcite.sql.test.SqlOperatorTest
[WARNING] Tests run: 227, Failures: 0, Errors: 0, Skipped: 1, Time elapsed: 2.341 s - in org.apache.calcite.sql.test.SqlOperatorTest
[INFO] Running org.apache.calcite.plan.volcano.TraitConversionTest
[INFO] Tests run: 1, Failures: 0, Errors: 0, Skipped: 0, Time elapsed: 0.053 s - in org.apache.calcite.plan.volcano.TraitConversionTest
[INFO] Running org.apache.calcite.plan.volcano.CollationConversionTest
[INFO] Tests run: 1, Failures: 0, Errors: 0, Skipped: 0, Time elapsed: 0.061 s - in org.apache.calcite.plan.volcano.CollationConversionTest
[INFO] Running org.apache.calcite.plan.volcano.ComboRuleTest
[INFO] Tests run: 1, Failures: 0, Errors: 0, Skipped: 0, Time elapsed: 0.041 s - in org.apache.calcite.plan.volcano.ComboRuleTest
[INFO] Running org.apache.calcite.test.MutableRelTest
[INFO] Tests run: 18, Failures: 0, Errors: 0, Skipped: 0, Time elapsed: 0.044 s - in org.apache.calcite.test.MutableRelTest
[INFO] Running org.apache.calcite.sql.validate.LexCaseSensitiveTest
[INFO] Tests run: 15, Failures: 0, Errors: 0, Skipped: 0, Time elapsed: 0.236 s - in org.apache.calcite.sql.validate.LexCaseSensitiveTest
[INFO] Running org.apache.calcite.test.UdtTest
[INFO] Tests run: 1, Failures: 0, Errors: 0, Skipped: 0, Time elapsed: 0.017 s - in org.apache.calcite.test.UdtTest
[INFO] Running org.apache.calcite.test.UdfTest
[WARNING] Tests run: 25, Failures: 0, Errors: 0, Skipped: 1, Time elapsed: 0.794 s - in org.apache.calcite.test.UdfTest
[INFO] Running org.apache.calcite.test.TableFunctionTest
[WARNING] Tests run: 18, Failures: 0, Errors: 0, Skipped: 3, Time elapsed: 0.183 s - in org.apache.calcite.test.TableFunctionTest
[INFO] Running org.apache.calcite.test.RelBuilderTest
[WARNING] Tests run: 98, Failures: 0, Errors: 0, Skipped: 1, Time elapsed: 1.446 s - in org.apache.calcite.test.RelBuilderTest
[INFO] Running org.apache.calcite.test.PigRelBuilderTest
[INFO] Tests run: 22, Failures: 0, Errors: 0, Skipped: 0, Time elapsed: 0.073 s - in org.apache.calcite.test.PigRelBuilderTest
[INFO] Running org.apache.calcite.test.RexImplicationCheckerTest
2018-09-23 15:23:11,701 [pool-1-thread-1] WARN  - BOOLEAN for value of class class java.lang.Boolean is being handled in default way
2018-09-23 15:23:11,709 [pool-1-thread-6] WARN  - $11 is not handled for null for checking implication
2018-09-23 15:23:11,721 [pool-1-thread-6] WARN  - $11 is not handled for null for checking implication
2018-09-23 15:23:11,724 [pool-1-thread-6] WARN  - $11 is not handled for null for checking implication
2018-09-23 15:23:11,725 [pool-1-thread-6] WARN  - $11 is not handled for null for checking implication
2018-09-23 15:23:11,725 [pool-1-thread-6] WARN  - $11 is not handled for null for checking implication
[INFO] Tests run: 19, Failures: 0, Errors: 0, Skipped: 0, Time elapsed: 0.104 s - in org.apache.calcite.test.RexImplicationCheckerTest
[INFO] Running org.apache.calcite.util.ChunkListTest
[INFO] Tests run: 5, Failures: 0, Errors: 0, Skipped: 0, Time elapsed: 5.131 s - in org.apache.calcite.util.ChunkListTest
[INFO] Running org.apache.calcite.tools.PlannerTest
[WARNING] Tests run: 39, Failures: 0, Errors: 0, Skipped: 1, Time elapsed: 5.584 s - in org.apache.calcite.tools.PlannerTest
[INFO] Running org.apache.calcite.test.LinqFrontJdbcBackTest
[INFO] Tests run: 1, Failures: 0, Errors: 0, Skipped: 0, Time elapsed: 0.03 s - in org.apache.calcite.test.LinqFrontJdbcBackTest
[INFO] Running org.apache.calcite.test.JdbcAdapterTest
[INFO] Tests run: 34, Failures: 0, Errors: 0, Skipped: 0, Time elapsed: 2.768 s - in org.apache.calcite.test.JdbcAdapterTest
[INFO] Running org.apache.calcite.test.JdbcFrontJdbcBackLinqMiddleTest
[WARNING] Tests run: 14, Failures: 0, Errors: 0, Skipped: 4, Time elapsed: 0.538 s - in org.apache.calcite.test.JdbcFrontJdbcBackLinqMiddleTest
[INFO] Running org.apache.calcite.test.fuzzer.RexProgramFuzzyTest
2018-09-23 15:24:11,873 [pool-1-thread-3] INFO  - Using seed 44 for rex fuzzing
2018-09-23 15:24:11,887 [pool-1-thread-3] INFO  - Rex fuzzing results: number of cases tested=18, failed cases=0, duplicate failures=0, fuzz rate=1285 per second
2018-09-23 15:24:12,028 [pool-1-thread-2] INFO  - Rex fuzzing results: number of cases tested=43, failed cases=1, duplicate failures=0, fuzz rate=292 per second
2018-09-23 15:24:12,032 [pool-1-thread-2] INFO  - Randomized test identified a potential defect. Feel free to fix that issue
java.lang.AssertionError: IS NOT TRUE(true)
isNotTrue(trueLiteral) optimizes to FALSE, isAlwaysTrue MUST not be true unknownAsFalse 
	at org.junit.Assert.fail(Assert.java:88)
	at org.apache.calcite.test.fuzzer.RexProgramFuzzyTest.checkTrueFalse(RexProgramFuzzyTest.java:195)
	at org.apache.calcite.test.fuzzer.RexProgramFuzzyTest.checkTrueFalse(RexProgramFuzzyTest.java:163)
	at org.apache.calcite.test.fuzzer.RexProgramFuzzyTest.generateRexAndCheckTrueFalse(RexProgramFuzzyTest.java:382)
	Suppressed: org.apache.calcite.test.fuzzer.RexProgramFuzzyTest$1: seed -2025127223730059340
[WARNING] Tests run: 4, Failures: 0, Errors: 0, Skipped: 2, Time elapsed: 0.162 s - in org.apache.calcite.test.fuzzer.RexProgramFuzzyTest
[INFO] Running org.apache.calcite.test.CalciteSqlOperatorTest
[WARNING] Tests run: 227, Failures: 0, Errors: 0, Skipped: 1, Time elapsed: 20.545 s - in org.apache.calcite.test.CalciteSqlOperatorTest
[INFO] Running org.apache.calcite.profile.ProfilerTest
[WARNING] Tests run: 10, Failures: 0, Errors: 0, Skipped: 2, Time elapsed: 0.566 s - in org.apache.calcite.profile.ProfilerTest
[INFO] Running org.apache.calcite.test.MaterializationTest
[WARNING] Tests run: 130, Failures: 0, Errors: 0, Skipped: 17, Time elapsed: 75.15 s - in org.apache.calcite.test.MaterializationTest
[INFO] Running org.apache.calcite.test.ReflectiveSchemaTest
[WARNING] Tests run: 31, Failures: 0, Errors: 0, Skipped: 5, Time elapsed: 12.136 s - in org.apache.calcite.test.ReflectiveSchemaTest
2018-09-23 15:25:13,971 [pool-1-thread-8] INFO  - Logging initialized @162381ms
2018-09-23 15:25:14,044 [pool-1-thread-8] INFO  - jetty-9.2.19.v20160908
2018-09-23 15:25:14,156 [pool-1-thread-8] INFO  - Started ServerConnector@74b40407{HTTP/1.1}{0.0.0.0:37161}
2018-09-23 15:25:14,157 [pool-1-thread-8] INFO  - Started @162566ms
2018-09-23 15:25:14,157 [pool-1-thread-8] INFO  - Service listening on port 37161.
[INFO] Running org.apache.calcite.test.JdbcTest
[WARNING] Tests run: 279, Failures: 0, Errors: 0, Skipped: 18, Time elapsed: 36.446 s - in org.apache.calcite.test.JdbcTest
2018-09-23 15:25:19,894 [pool-1-thread-8] INFO  - Service terminating.
[INFO] Running org.apache.calcite.jdbc.CalciteRemoteDriverTest
[INFO] Tests run: 28, Failures: 0, Errors: 0, Skipped: 0, Time elapsed: 1.06 s - in org.apache.calcite.jdbc.CalciteRemoteDriverTest
2018-09-23 15:25:19,909 [pool-1-thread-8] INFO  - Stopped ServerConnector@74b40407{HTTP/1.1}{0.0.0.0:0}
[INFO] Running org.apache.calcite.test.StreamTest
[WARNING] Tests run: 9, Failures: 0, Errors: 0, Skipped: 2, Time elapsed: 0.355 s - in org.apache.calcite.test.StreamTest
[INFO] Running org.apache.calcite.test.TableInRootSchemaTest
[INFO] Tests run: 1, Failures: 0, Errors: 0, Skipped: 0, Time elapsed: 0.023 s - in org.apache.calcite.test.TableInRootSchemaTest
[INFO] Running org.apache.calcite.test.RelMdColumnOriginsTest
[INFO] Tests run: 1, Failures: 0, Errors: 0, Skipped: 0, Time elapsed: 0.039 s - in org.apache.calcite.test.RelMdColumnOriginsTest
[INFO] Running org.apache.calcite.test.MultiJdbcSchemaJoinTest
[INFO] Tests run: 6, Failures: 0, Errors: 0, Skipped: 0, Time elapsed: 0.714 s - in org.apache.calcite.test.MultiJdbcSchemaJoinTest
[INFO] Running org.apache.calcite.test.CollectionTypeTest
[INFO] Tests run: 12, Failures: 0, Errors: 0, Skipped: 0, Time elapsed: 0.184 s - in org.apache.calcite.test.CollectionTypeTest
[INFO] Running org.apache.calcite.test.SqlLineTest
[INFO] Tests run: 1, Failures: 0, Errors: 0, Skipped: 0, Time elapsed: 0.077 s - in org.apache.calcite.test.SqlLineTest
[INFO] Running org.apache.calcite.test.SqlToRelConverterExtendedTest
[WARNING] Tests run: 342, Failures: 0, Errors: 0, Skipped: 4, Time elapsed: 11.575 s - in org.apache.calcite.test.SqlToRelConverterExtendedTest
[INFO] Running org.apache.calcite.sql.parser.parserextensiontesting.ExtensionSqlParserTest
[WARNING] Tests run: 319, Failures: 0, Errors: 0, Skipped: 6, Time elapsed: 0.589 s - in org.apache.calcite.sql.parser.parserextensiontesting.ExtensionSqlParserTest
[INFO] Running org.apache.calcite.test.CoreQuidemTest
[ERROR] Tests run: 16, Failures: 0, Errors: 1, Skipped: 0, Time elapsed: 31.597 s <<< FAILURE! - in org.apache.calcite.test.CoreQuidemTest
[ERROR] test[15: quidem(sql/misc.iq)](org.apache.calcite.test.CoreQuidemTest)  Time elapsed: 7.529 s  <<< ERROR!
java.lang.reflect.InvocationTargetException
	at org.apache.calcite.test.CoreQuidemTest.testSqlMisc(CoreQuidemTest.java:67)

[INFO] Running org.apache.calcite.util.PartiallyOrderedSetTest
[WARNING] Tests run: 15, Failures: 0, Errors: 0, Skipped: 2, Time elapsed: 1.177 s - in org.apache.calcite.util.PartiallyOrderedSetTest
[INFO] Running org.apache.calcite.plan.volcano.VolcanoPlannerTest
[ERROR] Tests run: 10, Failures: 1, Errors: 0, Skipped: 3, Time elapsed: 0.347 s <<< FAILURE! - in org.apache.calcite.plan.volcano.VolcanoPlannerTest
[ERROR] testOomProjectMergeRule(org.apache.calcite.plan.volcano.VolcanoPlannerTest)  Time elapsed: 0.276 s  <<< FAILURE!
java.lang.AssertionError: Too many rules fired. Output relation is rel#289:EnumerableValues.ENUMERABLE.[[0]](type=RecordType(CHAR(1) f),tuples=[{ '1' }]), expected id to be less than 100
	at org.apache.calcite.plan.volcano.VolcanoPlannerTest.testOomProjectMergeRule(VolcanoPlannerTest.java:521)

[INFO] Running org.apache.calcite.test.SqlAdvisorJdbcTest
[INFO] Tests run: 8, Failures: 0, Errors: 0, Skipped: 0, Time elapsed: 0.281 s - in org.apache.calcite.test.SqlAdvisorJdbcTest
[INFO] Running org.apache.calcite.sql.parser.SqlUnParserTest
[WARNING] Tests run: 315, Failures: 0, Errors: 0, Skipped: 6, Time elapsed: 0.312 s - in org.apache.calcite.sql.parser.SqlUnParserTest
[INFO] Running org.apache.calcite.test.RelMetadataTest
[WARNING] Tests run: 140, Failures: 0, Errors: 0, Skipped: 7, Time elapsed: 4.793 s - in org.apache.calcite.test.RelMetadataTest
[INFO] Running org.apache.calcite.test.LatticeTest
2018-09-23 15:24:14,957 [pool-1-thread-4] WARN  - PoolableConnectionFactory not linked to pool. Calling setPool() to fix the configuration.
[WARNING] Tests run: 38, Failures: 0, Errors: 0, Skipped: 2, Time elapsed: 100.262 s - in org.apache.calcite.test.LatticeTest
[INFO] 
[INFO] Results:
[INFO] 
[ERROR] Failures: 
[ERROR]   VolcanoPlannerTest.testOomProjectMergeRule:521 Too many rules fired. Output relation is rel#289:EnumerableValues.ENUMERABLE.[[0]](type=RecordType(CHAR(1) f),tuples=[{ '1' }]), expected id to be less than 100
[ERROR] Errors: 
[ERROR]   CoreQuidemTest>QuidemTest.test:195 » InvocationTarget
[INFO] 
[ERROR] Tests run: 4557, Failures: 1, Errors: 1, Skipped: 118
[INFO] 
[INFO] ------------------------------------------------------------------------
[INFO] Reactor Summary:
[INFO] 
[INFO] Calcite ............................................ SUCCESS [  1.222 s]
[INFO] Calcite Linq4j ..................................... SUCCESS [  4.342 s]
[INFO] Calcite Core ....................................... FAILURE [03:24 min]
[INFO] Calcite Babel ...................................... SKIPPED
[INFO] Calcite Cassandra .................................. SKIPPED
[INFO] Calcite Druid ...................................... SKIPPED
[INFO] Calcite Elasticsearch .............................. SKIPPED
[INFO] Calcite Examples ................................... SKIPPED
[INFO] Calcite Example CSV ................................ SKIPPED
[INFO] Calcite Example Function ........................... SKIPPED
[INFO] Calcite File ....................................... SKIPPED
[INFO] Calcite Geode ...................................... SKIPPED
[INFO] Calcite MongoDB .................................... SKIPPED
[INFO] Calcite Pig ........................................ SKIPPED
[INFO] Calcite Piglet ..................................... SKIPPED
[INFO] Calcite Plus ....................................... SKIPPED
[INFO] Calcite Server ..................................... SKIPPED
[INFO] Calcite Spark ...................................... SKIPPED
[INFO] Calcite Splunk ..................................... SKIPPED
[INFO] Calcite Ubenchmark ................................. SKIPPED
[INFO] ------------------------------------------------------------------------
[INFO] BUILD FAILURE
[INFO] ------------------------------------------------------------------------
[INFO] Total time: 03:30 min
[INFO] Finished at: 2018-09-23T15:25:53+02:00
[INFO] Final Memory: 36M/642M
[INFO] ------------------------------------------------------------------------
[ERROR] Failed to execute goal org.apache.maven.plugins:maven-surefire-plugin:2.22.0:test (default-test) on project calcite-core: There are test failures.
[ERROR] 
[ERROR] Please refer to /root/workspace/apache/calcite/432128278/core/target/surefire-reports for the individual test results.
[ERROR] Please refer to dump files (if any exist) [date]-jvmRun[N].dump, [date].dumpstream and [date]-jvmRun[N].dumpstream.
[ERROR] -> [Help 1]
[ERROR] 
[ERROR] To see the full stack trace of the errors, re-run Maven with the -e switch.
[ERROR] Re-run Maven using the -X switch to enable full debug logging.
[ERROR] 
[ERROR] For more information about the errors and possible solutions, please read the following articles:
[ERROR] [Help 1] http://cwiki.apache.org/confluence/display/MAVEN/MojoFailureException
[ERROR] 
[ERROR] After correcting the problems, you can resume the build with the command
[ERROR]   mvn <goals> -rf :calcite-core
