[INFO] Scanning for projects...
[INFO] Inspecting build with total of 4 modules...
[INFO] Installing Nexus Staging features:
[INFO]   ... total of 4 executions of maven-deploy-plugin replaced with nexus-staging-maven-plugin
[INFO] ------------------------------------------------------------------------
[INFO] Reactor Build Order:
[INFO] 
[INFO] findbugs-slf4j
[INFO] findbugs-slf4j bug pattern
[INFO] findbugs-slf4j test case
[INFO] findbugs-slf4j sonar plugin
[INFO]                                                                         
[INFO] ------------------------------------------------------------------------
[INFO] Building findbugs-slf4j 1.4.2-SNAPSHOT
[INFO] ------------------------------------------------------------------------
[INFO]                                                                         
[INFO] ------------------------------------------------------------------------
[INFO] Building findbugs-slf4j bug pattern 1.4.2-SNAPSHOT
[INFO] ------------------------------------------------------------------------
[INFO] 
[INFO] --- maven-resources-plugin:3.1.0:resources (default-resources) @ bug-pattern ---
[INFO] Using 'UTF-8' encoding to copy filtered resources.
[INFO] Copying 4 resources
[INFO] 
[INFO] --- maven-compiler-plugin:3.8.0:compile (default-compile) @ bug-pattern ---
[INFO] Nothing to compile - all classes are up to date
[INFO] 
[INFO] --- build-helper-maven-plugin:3.0.0:add-test-source (add-test-source) @ bug-pattern ---
[INFO] Test Source directory: /root/workspace/KengoTODA/findbugs-slf4j/439399862/bug-pattern/src/case/java added.
[INFO] 
[INFO] --- maven-resources-plugin:3.1.0:testResources (default-testResources) @ bug-pattern ---
[INFO] Using 'UTF-8' encoding to copy filtered resources.
[INFO] skip non existing resourceDirectory /root/workspace/KengoTODA/findbugs-slf4j/439399862/bug-pattern/src/test/resources
[INFO] 
[INFO] --- maven-compiler-plugin:3.8.0:testCompile (default-testCompile) @ bug-pattern ---
[INFO] Nothing to compile - all classes are up to date
[INFO] 
[INFO] --- maven-surefire-plugin:2.22.0:test (default-test) @ bug-pattern ---
[INFO] Downloading: https://repo.maven.apache.org/maven2/org/apache/maven/surefire/surefire-junit-platform/2.22.0/surefire-junit-platform-2.22.0.pom
[INFO] Downloaded: https://repo.maven.apache.org/maven2/org/apache/maven/surefire/surefire-junit-platform/2.22.0/surefire-junit-platform-2.22.0.pom (7 KB at 17.2 KB/sec)
[INFO] Downloading: https://repo.maven.apache.org/maven2/org/apache/maven/surefire/surefire-providers/2.22.0/surefire-providers-2.22.0.pom
[INFO] Downloaded: https://repo.maven.apache.org/maven2/org/apache/maven/surefire/surefire-providers/2.22.0/surefire-providers-2.22.0.pom (3 KB at 69.4 KB/sec)
[INFO] Downloading: https://repo.maven.apache.org/maven2/org/junit/platform/junit-platform-launcher/1.2.0/junit-platform-launcher-1.2.0.pom
[INFO] Downloaded: https://repo.maven.apache.org/maven2/org/junit/platform/junit-platform-launcher/1.2.0/junit-platform-launcher-1.2.0.pom (3 KB at 60.1 KB/sec)
[INFO] Downloading: https://repo.maven.apache.org/maven2/org/junit/platform/junit-platform-engine/1.2.0/junit-platform-engine-1.2.0.pom
[INFO] Downloaded: https://repo.maven.apache.org/maven2/org/junit/platform/junit-platform-engine/1.2.0/junit-platform-engine-1.2.0.pom (3 KB at 66.8 KB/sec)
[INFO] Downloading: https://repo.maven.apache.org/maven2/org/junit/platform/junit-platform-commons/1.2.0/junit-platform-commons-1.2.0.pom
[INFO] Downloaded: https://repo.maven.apache.org/maven2/org/junit/platform/junit-platform-commons/1.2.0/junit-platform-commons-1.2.0.pom (2 KB at 56.4 KB/sec)
[INFO] Downloading: https://repo.maven.apache.org/maven2/org/opentest4j/opentest4j/1.1.0/opentest4j-1.1.0.pom
[INFO] Downloaded: https://repo.maven.apache.org/maven2/org/opentest4j/opentest4j/1.1.0/opentest4j-1.1.0.pom (2 KB at 48.3 KB/sec)
[INFO] Downloading: https://repo.maven.apache.org/maven2/org/opentest4j/opentest4j/1.1.0/opentest4j-1.1.0.jar
[INFO] Downloading: https://repo.maven.apache.org/maven2/org/junit/platform/junit-platform-engine/1.2.0/junit-platform-engine-1.2.0.jar
[INFO] Downloading: https://repo.maven.apache.org/maven2/org/junit/platform/junit-platform-launcher/1.2.0/junit-platform-launcher-1.2.0.jar
[INFO] Downloading: https://repo.maven.apache.org/maven2/org/junit/platform/junit-platform-commons/1.2.0/junit-platform-commons-1.2.0.jar
[INFO] Downloading: https://repo.maven.apache.org/maven2/org/apache/maven/surefire/surefire-junit-platform/2.22.0/surefire-junit-platform-2.22.0.jar
[INFO] Downloaded: https://repo.maven.apache.org/maven2/org/junit/platform/junit-platform-commons/1.2.0/junit-platform-commons-1.2.0.jar (77 KB at 1124.4 KB/sec)
[INFO] Downloaded: https://repo.maven.apache.org/maven2/org/opentest4j/opentest4j/1.1.0/opentest4j-1.1.0.jar (7 KB at 91.2 KB/sec)
[INFO] Downloaded: https://repo.maven.apache.org/maven2/org/apache/maven/surefire/surefire-junit-platform/2.22.0/surefire-junit-platform-2.22.0.jar (65 KB at 618.8 KB/sec)
[INFO] Downloaded: https://repo.maven.apache.org/maven2/org/junit/platform/junit-platform-launcher/1.2.0/junit-platform-launcher-1.2.0.jar (79 KB at 692.8 KB/sec)
[INFO] Downloaded: https://repo.maven.apache.org/maven2/org/junit/platform/junit-platform-engine/1.2.0/junit-platform-engine-1.2.0.jar (88 KB at 777.3 KB/sec)
[INFO] 
[INFO] -------------------------------------------------------
[INFO]  T E S T S
[INFO] -------------------------------------------------------
[INFO] Running jp.skypencil.findbugs.slf4j.parameter.AbstractDetectorForParameterArrayTest
[ERROR] Tests run: 1, Failures: 0, Errors: 1, Skipped: 0, Time elapsed: 1.177 s <<< FAILURE! - in jp.skypencil.findbugs.slf4j.parameter.AbstractDetectorForParameterArrayTest
[ERROR] testIndexOf  Time elapsed: 1.172 s  <<< ERROR!
java.lang.NoClassDefFoundError: org/junit/ComparisonFailure
	at jp.skypencil.findbugs.slf4j.parameter.AbstractDetectorForParameterArrayTest.testIndexOf(AbstractDetectorForParameterArrayTest.java:12)
Caused by: java.lang.ClassNotFoundException: org.junit.ComparisonFailure
	at jp.skypencil.findbugs.slf4j.parameter.AbstractDetectorForParameterArrayTest.testIndexOf(AbstractDetectorForParameterArrayTest.java:12)

[INFO] Running jp.skypencil.findbugs.slf4j.WrongPlaceholderDetectorTest
[ERROR] Tests run: 2, Failures: 0, Errors: 2, Skipped: 0, Time elapsed: 0.797 s <<< FAILURE! - in jp.skypencil.findbugs.slf4j.WrongPlaceholderDetectorTest
[ERROR] testCountPlaceholders  Time elapsed: 0.011 s  <<< ERROR!
java.lang.NoClassDefFoundError: Could not initialize class com.google.common.truth.Truth
	at jp.skypencil.findbugs.slf4j.WrongPlaceholderDetectorTest.testCountPlaceholders(WrongPlaceholderDetectorTest.java:16)

[ERROR] testCountParameterWithoutArray  Time elapsed: 0.785 s  <<< ERROR!
java.lang.NoClassDefFoundError: Could not initialize class com.google.common.truth.Truth
	at jp.skypencil.findbugs.slf4j.WrongPlaceholderDetectorTest.testCountParameterWithoutArray(WrongPlaceholderDetectorTest.java:32)

[INFO] Running jp.skypencil.findbugs.slf4j.JavaTypeTest
[ERROR] Tests run: 1, Failures: 0, Errors: 1, Skipped: 0, Time elapsed: 0 s <<< FAILURE! - in jp.skypencil.findbugs.slf4j.JavaTypeTest
[ERROR] testIssue17  Time elapsed: 0 s  <<< ERROR!
java.lang.NoClassDefFoundError: Could not initialize class com.google.common.truth.Truth
	at jp.skypencil.findbugs.slf4j.JavaTypeTest.testIssue17(JavaTypeTest.java:15)

[INFO] Running jp.skypencil.findbugs.slf4j.CodepointIteratorTest
[ERROR] Tests run: 2, Failures: 0, Errors: 2, Skipped: 0, Time elapsed: 0.002 s <<< FAILURE! - in jp.skypencil.findbugs.slf4j.CodepointIteratorTest
[ERROR] testAbc  Time elapsed: 0.001 s  <<< ERROR!
java.lang.NoClassDefFoundError: Could not initialize class com.google.common.truth.Truth
	at jp.skypencil.findbugs.slf4j.CodepointIteratorTest.testAbc(CodepointIteratorTest.java:11)

[ERROR] testSurrogatePair  Time elapsed: 0 s  <<< ERROR!
java.lang.NoClassDefFoundError: Could not initialize class com.google.common.truth.Truth
	at jp.skypencil.findbugs.slf4j.CodepointIteratorTest.testSurrogatePair(CodepointIteratorTest.java:21)

[INFO] Running jp.skypencil.findbugs.slf4j.GettingClassFromArrayTest
pkg.GettingClassFromArray.<init> : ()V
  0 aload_0         []::[< Lpkg/GettingClassFromArray;, IP, r0 >]
  1 invokespecial   [< Lpkg/GettingClassFromArray;, IP, r0 >]::[< Lpkg/GettingClassFromArray;, IP, r0 >]
  4 return          []::[< Lpkg/GettingClassFromArray;, IP, r0 >]

pkg.GettingClassFromArray.method : ()V
  0 iconst_0        []::[< Lpkg/GettingClassFromArray;, IP, r0 >]
  1 anewarray       [< I, 0 >]::[< Lpkg/GettingClassFromArray;, IP, r0 >]
  4 invokevirtual   [< [Ljava/lang/String;, new, 0 >]::[< Lpkg/GettingClassFromArray;, IP, r0 >]
  7 pop             [< Ljava/lang/Class;, return value from java.lang.Object.getClass()Ljava/lang/Class; >]::[< Lpkg/GettingClassFromArray;, IP, r0 >]
  8 return          []::[< Lpkg/GettingClassFromArray;, IP, r0 >]

Analyzing pkg.GettingClassFromArray.<init>()

*******************************************************

Method invocation:    1: invokespecial[183](3) 1
	Invoking: java.lang.Object.<init>()
	Prototype method: class=java.lang.Object, method=public void <init>()
	Target method set: [java.lang.Object.<init>()]
Analyzing pkg.GettingClassFromArray.method()

*******************************************************

Method invocation:    4: invokevirtual[182](3) 3
	Invoking: java.lang.Object.getClass()
	Prototype method: class=java.lang.Object, method=public final native Class getClass() [Signature: ()Ljava/lang/Class<*>;]
	Target method set: [java.lang.Object.getClass()]
[ERROR] Tests run: 1, Failures: 0, Errors: 1, Skipped: 0, Time elapsed: 1.751 s <<< FAILURE! - in jp.skypencil.findbugs.slf4j.GettingClassFromArrayTest
[ERROR] test{SpotBugsRunner}  Time elapsed: 1.751 s  <<< ERROR!
java.lang.NoClassDefFoundError: Could not initialize class com.google.common.truth.Truth
	at jp.skypencil.findbugs.slf4j.GettingClassFromArrayTest.test(GettingClassFromArrayTest.java:17)

[INFO] Running jp.skypencil.findbugs.slf4j.IllegalPassedClassDetectorTest
[ERROR] Tests run: 1, Failures: 1, Errors: 0, Skipped: 0, Time elapsed: 0.006 s <<< FAILURE! - in jp.skypencil.findbugs.slf4j.IllegalPassedClassDetectorTest
[ERROR] testFindClass  Time elapsed: 0.005 s  <<< FAILURE!
org.opentest4j.AssertionFailedError: Unexpected exception type thrown ==> expected: <org.apache.bcel.classfile.ClassFormatException> but was: <java.lang.NullPointerException>
	at jp.skypencil.findbugs.slf4j.IllegalPassedClassDetectorTest.testFindClass(IllegalPassedClassDetectorTest.java:12)
Caused by: java.lang.NullPointerException
	at jp.skypencil.findbugs.slf4j.IllegalPassedClassDetectorTest.lambda$testFindClass$0(IllegalPassedClassDetectorTest.java:13)
	at jp.skypencil.findbugs.slf4j.IllegalPassedClassDetectorTest.testFindClass(IllegalPassedClassDetectorTest.java:12)

[INFO] 
[INFO] Results:
[INFO] 
[ERROR] Failures: 
[ERROR]   IllegalPassedClassDetectorTest.testFindClass:12 Unexpected exception type thrown ==> expected: <org.apache.bcel.classfile.ClassFormatException> but was: <java.lang.NullPointerException>
[ERROR] Errors: 
[ERROR]   CodepointIteratorTest.testAbc:11 NoClassDefFound Could not initialize class co...
[ERROR]   CodepointIteratorTest.testSurrogatePair:21 NoClassDefFound Could not initializ...
[ERROR]   GettingClassFromArrayTest.test:17 NoClassDefFound Could not initialize class c...
[ERROR]   JavaTypeTest.testIssue17:15 NoClassDefFound Could not initialize class com.goo...
[ERROR]   WrongPlaceholderDetectorTest.testCountParameterWithoutArray:32 NoClassDefFound
[ERROR]   WrongPlaceholderDetectorTest.testCountPlaceholders:16 NoClassDefFound Could no...
[ERROR]   AbstractDetectorForParameterArrayTest.testIndexOf:12 » NoClassDefFound org/jun...
[INFO] 
[ERROR] Tests run: 8, Failures: 1, Errors: 7, Skipped: 0
[INFO] 
[INFO] ------------------------------------------------------------------------
[INFO] Reactor Summary:
[INFO] 
[INFO] findbugs-slf4j ..................................... SUCCESS [  0.065 s]
[INFO] findbugs-slf4j bug pattern ......................... FAILURE [  7.011 s]
[INFO] findbugs-slf4j test case ........................... SKIPPED
[INFO] findbugs-slf4j sonar plugin ........................ SKIPPED
[INFO] ------------------------------------------------------------------------
[INFO] BUILD FAILURE
[INFO] ------------------------------------------------------------------------
[INFO] Total time: 8.335 s
[INFO] Finished at: 2018-10-10T01:50:38+02:00
[INFO] Final Memory: 25M/384M
[INFO] ------------------------------------------------------------------------
[ERROR] Failed to execute goal org.apache.maven.plugins:maven-surefire-plugin:2.22.0:test (default-test) on project bug-pattern: There are test failures.
[ERROR] 
[ERROR] Please refer to /root/workspace/KengoTODA/findbugs-slf4j/439399862/bug-pattern/target/surefire-reports for the individual test results.
[ERROR] Please refer to dump files (if any exist) [date]-jvmRun[N].dump, [date].dumpstream and [date]-jvmRun[N].dumpstream.
[ERROR] -> [Help 1]
[ERROR] 
[ERROR] To see the full stack trace of the errors, re-run Maven with the -e switch.
[ERROR] Re-run Maven using the -X switch to enable full debug logging.
[ERROR] 
[ERROR] For more information about the errors and possible solutions, please read the following articles:
[ERROR] [Help 1] http://cwiki.apache.org/confluence/display/MAVEN/MojoFailureException
[ERROR] 
[ERROR] After correcting the problems, you can resume the build with the command
[ERROR]   mvn <goals> -rf :bug-pattern
