[INFO] Scanning for projects...
[INFO] ------------------------------------------------------------------------
[INFO] Reactor Build Order:
[INFO] 
[INFO] Apache Commons RNG
[INFO] Apache Commons RNG Client API
[INFO] Apache Commons RNG Core
[INFO] Apache Commons RNG Simple
[INFO] Apache Commons RNG Sampling
[INFO]                                                                         
[INFO] ------------------------------------------------------------------------
[INFO] Building Apache Commons RNG 1.2-SNAPSHOT
[INFO] ------------------------------------------------------------------------
[INFO] 
[INFO] --- maven-enforcer-plugin:3.0.0-M2:enforce (enforce-maven-version) @ commons-rng-parent ---
[INFO] Skipping Rule Enforcement.
[INFO] 
[INFO] --- maven-enforcer-plugin:3.0.0-M2:enforce (enforce-maven-3) @ commons-rng-parent ---
[INFO] Skipping Rule Enforcement.
[INFO] 
[INFO] --- maven-checkstyle-plugin:3.0.0:check (validate) @ commons-rng-parent ---
[INFO] 
[INFO] --- build-helper-maven-plugin:3.0.0:parse-version (parse-version) @ commons-rng-parent ---
[INFO] 
[INFO] --- maven-antrun-plugin:1.7:run (javadoc.resources) @ commons-rng-parent ---
[INFO] Executing tasks

main:
[INFO] Executed tasks
[INFO] 
[INFO] --- maven-remote-resources-plugin:1.5:process (process-resource-bundles) @ commons-rng-parent ---
[INFO] 
[INFO] --- maven-jgit-buildnumber-plugin:1.2.10:extract-buildnumber (default) @ commons-rng-parent ---
[INFO] Git info extracted, revision: '58afa68', branch: '', tag: '', commitsCount: '558', commitDate: '2018-10-03', buildnumber: 'UNNAMED.558.58afa68'
[INFO] 
[INFO] --- buildnumber-maven-plugin:1.4:create (default) @ commons-rng-parent ---
[INFO] Executing: /bin/sh -c cd '/root/workspace/apache/commons-rng/436572836' && 'git' 'rev-parse' '--verify' 'HEAD'
[INFO] Working directory: /root/workspace/apache/commons-rng/436572836
[INFO] Storing buildNumber: 58afa68ebef161fa938c06ceed6bc324e8367e4a at timestamp: 2018-10-03 13:01:05+0200
[WARNING] Cannot get the branch information from the git repository: 
Detecting the current branch failed: fatal: ref HEAD is not a symbolic ref

[INFO] Executing: /bin/sh -c cd '/root/workspace/apache/commons-rng/436572836' && 'git' 'rev-parse' '--verify' 'HEAD'
[INFO] Working directory: /root/workspace/apache/commons-rng/436572836
[INFO] Storing buildScmBranch: UNKNOWN
[INFO] 
[INFO] --- maven-bundle-plugin:3.5.0:manifest (bundle-manifest) @ commons-rng-parent ---
[WARNING] Ignoring project type pom - supportedProjectTypes = [jar, bundle]
[INFO] 
[INFO] --- animal-sniffer-maven-plugin:1.16:check (checkAPIcompatibility) @ commons-rng-parent ---
[INFO] Checking unresolved references to org.codehaus.mojo.signature:java16:1.0
[INFO] 
[INFO] --- jacoco-maven-plugin:0.8.0:prepare-agent (prepare-agent) @ commons-rng-parent ---
[INFO] argLine set to -javaagent:/root/./workspace/apache/commons-rng/436572836/.m2/org/jacoco/org.jacoco.agent/0.8.0/org.jacoco.agent-0.8.0-runtime.jar=destfile=/root/workspace/apache/commons-rng/436572836/target/jacoco.exec
[INFO]                                                                         
[INFO] ------------------------------------------------------------------------
[INFO] Building Apache Commons RNG Client API 1.2-SNAPSHOT
[INFO] ------------------------------------------------------------------------
[INFO] 
[INFO] --- maven-enforcer-plugin:3.0.0-M2:enforce (enforce-maven-version) @ commons-rng-client-api ---
[INFO] Skipping Rule Enforcement.
[INFO] 
[INFO] --- maven-enforcer-plugin:3.0.0-M2:enforce (enforce-maven-3) @ commons-rng-client-api ---
[INFO] Skipping Rule Enforcement.
[INFO] 
[INFO] --- maven-checkstyle-plugin:3.0.0:check (validate) @ commons-rng-client-api ---
[INFO] 
[INFO] --- build-helper-maven-plugin:3.0.0:parse-version (parse-version) @ commons-rng-client-api ---
[INFO] 
[INFO] --- maven-antrun-plugin:1.7:run (javadoc.resources) @ commons-rng-client-api ---
[INFO] Executing tasks

main:
[INFO] Executed tasks
[INFO] 
[INFO] --- maven-remote-resources-plugin:1.5:process (process-resource-bundles) @ commons-rng-client-api ---
[INFO] 
[INFO] --- buildnumber-maven-plugin:1.4:create (default) @ commons-rng-client-api ---
[INFO] Executing: /bin/sh -c cd '/root/workspace/apache/commons-rng/436572836/commons-rng-client-api' && 'git' 'rev-parse' '--verify' 'HEAD'
[INFO] Working directory: /root/workspace/apache/commons-rng/436572836/commons-rng-client-api
[INFO] Storing buildNumber: 58afa68ebef161fa938c06ceed6bc324e8367e4a at timestamp: 2018-10-03 13:01:06+0200
[WARNING] Cannot get the branch information from the git repository: 
Detecting the current branch failed: fatal: ref HEAD is not a symbolic ref

[INFO] Executing: /bin/sh -c cd '/root/workspace/apache/commons-rng/436572836/commons-rng-client-api' && 'git' 'rev-parse' '--verify' 'HEAD'
[INFO] Working directory: /root/workspace/apache/commons-rng/436572836/commons-rng-client-api
[INFO] Storing buildScmBranch: UNKNOWN
[INFO] 
[INFO] --- maven-resources-plugin:3.0.2:resources (default-resources) @ commons-rng-client-api ---
[INFO] Using 'UTF-8' encoding to copy filtered resources.
[INFO] skip non existing resourceDirectory /root/workspace/apache/commons-rng/436572836/commons-rng-client-api/src/main/resources
[INFO] Copying 2 resources to META-INF
[INFO] 
[INFO] --- maven-compiler-plugin:3.7.0:compile (default-compile) @ commons-rng-client-api ---
[INFO] Changes detected - recompiling the module!
[INFO] Compiling 4 source files to /root/workspace/apache/commons-rng/436572836/commons-rng-client-api/target/classes
[INFO] 
[INFO] --- maven-bundle-plugin:3.5.0:manifest (bundle-manifest) @ commons-rng-client-api ---
[INFO] 
[INFO] --- animal-sniffer-maven-plugin:1.16:check (checkAPIcompatibility) @ commons-rng-client-api ---
[INFO] Checking unresolved references to org.codehaus.mojo.signature:java16:1.0
[INFO] 
[INFO] --- maven-resources-plugin:3.0.2:testResources (default-testResources) @ commons-rng-client-api ---
[INFO] Using 'UTF-8' encoding to copy filtered resources.
[INFO] skip non existing resourceDirectory /root/workspace/apache/commons-rng/436572836/commons-rng-client-api/src/test/resources
[INFO] Copying 2 resources to META-INF
[INFO] 
[INFO] --- maven-compiler-plugin:3.7.0:testCompile (default-testCompile) @ commons-rng-client-api ---
[INFO] No sources to compile
[INFO] 
[INFO] --- jacoco-maven-plugin:0.8.0:prepare-agent (prepare-agent) @ commons-rng-client-api ---
[INFO] argLine set to -javaagent:/root/./workspace/apache/commons-rng/436572836/.m2/org/jacoco/org.jacoco.agent/0.8.0/org.jacoco.agent-0.8.0-runtime.jar=destfile=/root/workspace/apache/commons-rng/436572836/commons-rng-client-api/target/jacoco.exec
[INFO] 
[INFO] --- maven-surefire-plugin:2.22.0:test (default-test) @ commons-rng-client-api ---
[INFO]                                                                         
[INFO] ------------------------------------------------------------------------
[INFO] Building Apache Commons RNG Core 1.2-SNAPSHOT
[INFO] ------------------------------------------------------------------------
[INFO] 
[INFO] --- maven-enforcer-plugin:3.0.0-M2:enforce (enforce-maven-version) @ commons-rng-core ---
[INFO] Skipping Rule Enforcement.
[INFO] 
[INFO] --- maven-enforcer-plugin:3.0.0-M2:enforce (enforce-maven-3) @ commons-rng-core ---
[INFO] Skipping Rule Enforcement.
[INFO] 
[INFO] --- maven-checkstyle-plugin:3.0.0:check (validate) @ commons-rng-core ---
[INFO] 
[INFO] --- build-helper-maven-plugin:3.0.0:parse-version (parse-version) @ commons-rng-core ---
[INFO] 
[INFO] --- maven-antrun-plugin:1.7:run (javadoc.resources) @ commons-rng-core ---
[INFO] Executing tasks

main:
[INFO] Executed tasks
[INFO] 
[INFO] --- maven-remote-resources-plugin:1.5:process (process-resource-bundles) @ commons-rng-core ---
[INFO] 
[INFO] --- buildnumber-maven-plugin:1.4:create (default) @ commons-rng-core ---
[INFO] Executing: /bin/sh -c cd '/root/workspace/apache/commons-rng/436572836/commons-rng-core' && 'git' 'rev-parse' '--verify' 'HEAD'
[INFO] Working directory: /root/workspace/apache/commons-rng/436572836/commons-rng-core
[INFO] Storing buildNumber: 58afa68ebef161fa938c06ceed6bc324e8367e4a at timestamp: 2018-10-03 13:01:08+0200
[WARNING] Cannot get the branch information from the git repository: 
Detecting the current branch failed: fatal: ref HEAD is not a symbolic ref

[INFO] Executing: /bin/sh -c cd '/root/workspace/apache/commons-rng/436572836/commons-rng-core' && 'git' 'rev-parse' '--verify' 'HEAD'
[INFO] Working directory: /root/workspace/apache/commons-rng/436572836/commons-rng-core
[INFO] Storing buildScmBranch: UNKNOWN
[INFO] 
[INFO] --- maven-resources-plugin:3.0.2:resources (default-resources) @ commons-rng-core ---
[INFO] Using 'UTF-8' encoding to copy filtered resources.
[INFO] skip non existing resourceDirectory /root/workspace/apache/commons-rng/436572836/commons-rng-core/src/main/resources
[INFO] Copying 2 resources to META-INF
[INFO] 
[INFO] --- maven-compiler-plugin:3.7.0:compile (default-compile) @ commons-rng-core ---
[INFO] Changes detected - recompiling the module!
[INFO] Compiling 27 source files to /root/workspace/apache/commons-rng/436572836/commons-rng-core/target/classes
[INFO] 
[INFO] --- maven-bundle-plugin:3.5.0:manifest (bundle-manifest) @ commons-rng-core ---
[INFO] 
[INFO] --- animal-sniffer-maven-plugin:1.16:check (checkAPIcompatibility) @ commons-rng-core ---
[INFO] Checking unresolved references to org.codehaus.mojo.signature:java16:1.0
[INFO] 
[INFO] --- maven-resources-plugin:3.0.2:testResources (default-testResources) @ commons-rng-core ---
[INFO] Using 'UTF-8' encoding to copy filtered resources.
[INFO] skip non existing resourceDirectory /root/workspace/apache/commons-rng/436572836/commons-rng-core/src/test/resources
[INFO] Copying 2 resources to META-INF
[INFO] 
[INFO] --- maven-compiler-plugin:3.7.0:testCompile (default-testCompile) @ commons-rng-core ---
[INFO] Nothing to compile - all classes are up to date
[INFO] 
[INFO] --- jacoco-maven-plugin:0.8.0:prepare-agent (prepare-agent) @ commons-rng-core ---
[INFO] argLine set to -javaagent:/root/./workspace/apache/commons-rng/436572836/.m2/org/jacoco/org.jacoco.agent/0.8.0/org.jacoco.agent-0.8.0-runtime.jar=destfile=/root/workspace/apache/commons-rng/436572836/commons-rng-core/target/jacoco.exec
[INFO] 
[INFO] --- maven-surefire-plugin:2.22.0:test (default-test) @ commons-rng-core ---
[INFO] Downloading: https://repo.maven.apache.org/maven2/org/apache/maven/surefire/surefire-junit4/2.22.0/surefire-junit4-2.22.0.pom
[INFO] Downloaded: https://repo.maven.apache.org/maven2/org/apache/maven/surefire/surefire-junit4/2.22.0/surefire-junit4-2.22.0.pom (4 KB at 6.4 KB/sec)
[INFO] Downloading: https://repo.maven.apache.org/maven2/org/apache/maven/surefire/surefire-providers/2.22.0/surefire-providers-2.22.0.pom
[INFO] Downloaded: https://repo.maven.apache.org/maven2/org/apache/maven/surefire/surefire-providers/2.22.0/surefire-providers-2.22.0.pom (3 KB at 60.7 KB/sec)
[INFO] Downloading: https://repo.maven.apache.org/maven2/org/apache/maven/surefire/surefire-junit4/2.22.0/surefire-junit4-2.22.0.jar
[INFO] Downloaded: https://repo.maven.apache.org/maven2/org/apache/maven/surefire/surefire-junit4/2.22.0/surefire-junit4-2.22.0.jar (83 KB at 809.4 KB/sec)
[INFO] 
[INFO] -------------------------------------------------------
[INFO]  T E S T S
[INFO] -------------------------------------------------------
[INFO] Running org.apache.commons.rng.core.source32.KISSRandomTest
[INFO] Tests run: 1, Failures: 0, Errors: 0, Skipped: 0, Time elapsed: 0.14 s - in org.apache.commons.rng.core.source32.KISSRandomTest
[INFO] Running org.apache.commons.rng.core.source32.Well19937cTest
[INFO] Tests run: 1, Failures: 0, Errors: 0, Skipped: 0, Time elapsed: 0 s - in org.apache.commons.rng.core.source32.Well19937cTest
[INFO] Running org.apache.commons.rng.core.source32.Well1024aTest
[INFO] Tests run: 1, Failures: 0, Errors: 0, Skipped: 0, Time elapsed: 0.001 s - in org.apache.commons.rng.core.source32.Well1024aTest
[INFO] Running org.apache.commons.rng.core.source32.IntProviderTest
[INFO] Tests run: 1, Failures: 0, Errors: 0, Skipped: 0, Time elapsed: 0 s - in org.apache.commons.rng.core.source32.IntProviderTest
[INFO] Running org.apache.commons.rng.core.source32.MultiplyWithCarry256Test
[INFO] Tests run: 1, Failures: 0, Errors: 0, Skipped: 0, Time elapsed: 0.001 s - in org.apache.commons.rng.core.source32.MultiplyWithCarry256Test
[INFO] Running org.apache.commons.rng.core.source32.Well512aTest
[INFO] Tests run: 1, Failures: 0, Errors: 0, Skipped: 0, Time elapsed: 0 s - in org.apache.commons.rng.core.source32.Well512aTest
[INFO] Running org.apache.commons.rng.core.source32.Well44497bTest
[INFO] Tests run: 1, Failures: 0, Errors: 0, Skipped: 0, Time elapsed: 0.004 s - in org.apache.commons.rng.core.source32.Well44497bTest
[INFO] Running org.apache.commons.rng.core.source32.JDKRandomTest
[INFO] Tests run: 1, Failures: 0, Errors: 0, Skipped: 0, Time elapsed: 0.001 s - in org.apache.commons.rng.core.source32.JDKRandomTest
[INFO] Running org.apache.commons.rng.core.source32.ISAACRandomTest
[INFO] Tests run: 2, Failures: 0, Errors: 0, Skipped: 0, Time elapsed: 0 s - in org.apache.commons.rng.core.source32.ISAACRandomTest
[INFO] Running org.apache.commons.rng.core.source32.Well44497aTest
[INFO] Tests run: 1, Failures: 0, Errors: 0, Skipped: 0, Time elapsed: 0 s - in org.apache.commons.rng.core.source32.Well44497aTest
[INFO] Running org.apache.commons.rng.core.source32.Well19937aTest
[INFO] Tests run: 1, Failures: 0, Errors: 0, Skipped: 0, Time elapsed: 0.002 s - in org.apache.commons.rng.core.source32.Well19937aTest
[INFO] Running org.apache.commons.rng.core.source32.MersenneTwisterTest
[INFO] Tests run: 1, Failures: 0, Errors: 0, Skipped: 0, Time elapsed: 0.007 s - in org.apache.commons.rng.core.source32.MersenneTwisterTest
[INFO] Running org.apache.commons.rng.core.source64.LongProviderTest
[INFO] Tests run: 2, Failures: 0, Errors: 0, Skipped: 0, Time elapsed: 0.011 s - in org.apache.commons.rng.core.source64.LongProviderTest
[INFO] Running org.apache.commons.rng.core.source64.MersenneTwister64Test
[INFO] Tests run: 1, Failures: 0, Errors: 0, Skipped: 0, Time elapsed: 0.01 s - in org.apache.commons.rng.core.source64.MersenneTwister64Test
[INFO] Running org.apache.commons.rng.core.source64.SplitMix64Test
[INFO] Tests run: 1, Failures: 0, Errors: 0, Skipped: 0, Time elapsed: 0.001 s - in org.apache.commons.rng.core.source64.SplitMix64Test
[INFO] Running org.apache.commons.rng.core.source64.XorShift1024StarTest
[INFO] Tests run: 1, Failures: 0, Errors: 0, Skipped: 0, Time elapsed: 0 s - in org.apache.commons.rng.core.source64.XorShift1024StarTest
[INFO] Running org.apache.commons.rng.core.source64.TwoCmresTest
[INFO] Tests run: 3, Failures: 0, Errors: 0, Skipped: 0, Time elapsed: 0.273 s - in org.apache.commons.rng.core.source64.TwoCmresTest
[INFO] Running org.apache.commons.rng.core.Providers64ParametricTest
[INFO] Tests run: 5, Failures: 0, Errors: 0, Skipped: 0, Time elapsed: 0.04 s - in org.apache.commons.rng.core.Providers64ParametricTest
[INFO] Running org.apache.commons.rng.core.BaseProviderTest
[INFO] Tests run: 4, Failures: 0, Errors: 0, Skipped: 0, Time elapsed: 0.007 s - in org.apache.commons.rng.core.BaseProviderTest
[INFO] Running org.apache.commons.rng.core.util.NumberFactoryTest
[INFO] Tests run: 10, Failures: 0, Errors: 0, Skipped: 0, Time elapsed: 0.01 s - in org.apache.commons.rng.core.util.NumberFactoryTest
[INFO] Running org.apache.commons.rng.core.RandomProviderDefaultStateTest
[INFO] Tests run: 1, Failures: 0, Errors: 0, Skipped: 0, Time elapsed: 0.002 s - in org.apache.commons.rng.core.RandomProviderDefaultStateTest
[INFO] Running org.apache.commons.rng.core.ProvidersCommonParametricTest
[ERROR] Tests run: 320, Failures: 4, Errors: 0, Skipped: 1, Time elapsed: 13.369 s <<< FAILURE! - in org.apache.commons.rng.core.ProvidersCommonParametricTest
[ERROR] testUniformNextLongInRange[1: data=org.apache.commons.rng.core.source32.MersenneTwister](org.apache.commons.rng.core.ProvidersCommonParametricTest)  Time elapsed: 0.28 s  <<< FAILURE!
java.lang.AssertionError: org.apache.commons.rng.core.source32.MersenneTwister: Too many failures for n = 4611686018427387902 (13 out of 500 tests failed)
	at org.apache.commons.rng.core.ProvidersCommonParametricTest.checkNextInRange(ProvidersCommonParametricTest.java:555)
	at org.apache.commons.rng.core.ProvidersCommonParametricTest.checkNextLongInRange(ProvidersCommonParametricTest.java:441)
	at org.apache.commons.rng.core.ProvidersCommonParametricTest.testUniformNextLongInRange(ProvidersCommonParametricTest.java:180)

[ERROR] testUniformNextIntegerInRange[3: data=org.apache.commons.rng.core.source32.Well1024a](org.apache.commons.rng.core.ProvidersCommonParametricTest)  Time elapsed: 0.152 s  <<< FAILURE!
java.lang.AssertionError: org.apache.commons.rng.core.source32.Well1024a: Too many failures for n = 32 (11 out of 500 tests failed)
	at org.apache.commons.rng.core.ProvidersCommonParametricTest.checkNextInRange(ProvidersCommonParametricTest.java:555)
	at org.apache.commons.rng.core.ProvidersCommonParametricTest.checkNextIntegerInRange(ProvidersCommonParametricTest.java:423)
	at org.apache.commons.rng.core.ProvidersCommonParametricTest.checkNextIntegerInRange(ProvidersCommonParametricTest.java:403)
	at org.apache.commons.rng.core.ProvidersCommonParametricTest.testUniformNextIntegerInRange(ProvidersCommonParametricTest.java:163)

[ERROR] testUniformNextLongInRange[9: data=org.apache.commons.rng.core.source32.MultiplyWithCarry256](org.apache.commons.rng.core.ProvidersCommonParametricTest)  Time elapsed: 0.158 s  <<< FAILURE!
java.lang.AssertionError: org.apache.commons.rng.core.source32.MultiplyWithCarry256: Too many failures for n = 31 (13 out of 500 tests failed)
	at org.apache.commons.rng.core.ProvidersCommonParametricTest.checkNextInRange(ProvidersCommonParametricTest.java:555)
	at org.apache.commons.rng.core.ProvidersCommonParametricTest.checkNextLongInRange(ProvidersCommonParametricTest.java:441)
	at org.apache.commons.rng.core.ProvidersCommonParametricTest.testUniformNextLongInRange(ProvidersCommonParametricTest.java:175)

[ERROR] testStateSettable[11: data=org.apache.commons.rng.core.source64.SplitMix64](org.apache.commons.rng.core.ProvidersCommonParametricTest)  Time elapsed: 0.013 s  <<< FAILURE!
java.lang.AssertionError
	at org.apache.commons.rng.core.ProvidersCommonParametricTest.testStateSettable(ProvidersCommonParametricTest.java:252)

[INFO] Running org.apache.commons.rng.core.Providers32ParametricTest
[INFO] Tests run: 11, Failures: 0, Errors: 0, Skipped: 0, Time elapsed: 0.01 s - in org.apache.commons.rng.core.Providers32ParametricTest
[INFO] 
[INFO] Results:
[INFO] 
[ERROR] Failures: 
[ERROR]   ProvidersCommonParametricTest.testStateSettable:252
[ERROR]   ProvidersCommonParametricTest.testUniformNextIntegerInRange:163->checkNextIntegerInRange:403->checkNextIntegerInRange:423->checkNextInRange:555 org.apache.commons.rng.core.source32.Well1024a: Too many failures for n = 32 (11 out of 500 tests failed)
[ERROR]   ProvidersCommonParametricTest.testUniformNextLongInRange:180->checkNextLongInRange:441->checkNextInRange:555 org.apache.commons.rng.core.source32.MersenneTwister: Too many failures for n = 4611686018427387902 (13 out of 500 tests failed)
[ERROR]   ProvidersCommonParametricTest.testUniformNextLongInRange:175->checkNextLongInRange:441->checkNextInRange:555 org.apache.commons.rng.core.source32.MultiplyWithCarry256: Too many failures for n = 31 (13 out of 500 tests failed)
[INFO] 
[ERROR] Tests run: 372, Failures: 4, Errors: 0, Skipped: 1
[INFO] 
[INFO] ------------------------------------------------------------------------
[INFO] Reactor Summary:
[INFO] 
[INFO] Apache Commons RNG ................................. SUCCESS [  4.083 s]
[INFO] Apache Commons RNG Client API ...................... SUCCESS [  2.080 s]
[INFO] Apache Commons RNG Core ............................ FAILURE [ 18.414 s]
[INFO] Apache Commons RNG Simple .......................... SKIPPED
[INFO] Apache Commons RNG Sampling ........................ SKIPPED
[INFO] ------------------------------------------------------------------------
[INFO] BUILD FAILURE
[INFO] ------------------------------------------------------------------------
[INFO] Total time: 24.996 s
[INFO] Finished at: 2018-10-03T13:01:26+02:00
[INFO] Final Memory: 39M/554M
[INFO] ------------------------------------------------------------------------
[ERROR] Failed to execute goal org.apache.maven.plugins:maven-surefire-plugin:2.22.0:test (default-test) on project commons-rng-core: There are test failures.
[ERROR] 
[ERROR] Please refer to /root/workspace/apache/commons-rng/436572836/commons-rng-core/target/surefire-reports for the individual test results.
[ERROR] Please refer to dump files (if any exist) [date]-jvmRun[N].dump, [date].dumpstream and [date]-jvmRun[N].dumpstream.
[ERROR] -> [Help 1]
[ERROR] 
[ERROR] To see the full stack trace of the errors, re-run Maven with the -e switch.
[ERROR] Re-run Maven using the -X switch to enable full debug logging.
[ERROR] 
[ERROR] For more information about the errors and possible solutions, please read the following articles:
[ERROR] [Help 1] http://cwiki.apache.org/confluence/display/MAVEN/MojoFailureException
[ERROR] 
[ERROR] After correcting the problems, you can resume the build with the command
[ERROR]   mvn <goals> -rf :commons-rng-core
