[INFO] Scanning for projects...
[INFO]                                                                         
[INFO] ------------------------------------------------------------------------
[INFO] Building oar-dist-service 1.0.0-SNAPSHOT
[INFO] ------------------------------------------------------------------------
[INFO] 
[INFO] --- jacoco-maven-plugin:0.7.6.201602180812:prepare-agent (jacoco-initialize-ut) @ oar-dist-service ---
[INFO] surefireArgLine set to -javaagent:/root/./workspace/RayPlante/oar-dist-service/429848837/.m2/org/jacoco/org.jacoco.agent/0.7.6.201602180812/org.jacoco.agent-0.7.6.201602180812-runtime.jar=destfile=/root/workspace/RayPlante/oar-dist-service/429848837/target/coverage-reports/jacoco-ut.exec,append=true
[INFO] 
[INFO] --- maven-resources-plugin:3.0.1:resources (default-resources) @ oar-dist-service ---
[INFO] Using 'UTF-8' encoding to copy filtered resources.
[INFO] Copying 0 resource
[INFO] Copying 3 resources
[INFO] 
[INFO] --- maven-compiler-plugin:3.7.0:compile (default-compile) @ oar-dist-service ---
[INFO] Changes detected - recompiling the module!
[INFO] Compiling 47 source files to /root/workspace/RayPlante/oar-dist-service/429848837/target/classes
[INFO] /root/workspace/RayPlante/oar-dist-service/429848837/src/main/java/gov/nist/oar/ds/ApplicationConfig.java: Some input files use or override a deprecated API.
[INFO] /root/workspace/RayPlante/oar-dist-service/429848837/src/main/java/gov/nist/oar/ds/ApplicationConfig.java: Recompile with -Xlint:deprecation for details.
[INFO] 
[INFO] --- maven-resources-plugin:3.0.1:testResources (default-testResources) @ oar-dist-service ---
[INFO] Using 'UTF-8' encoding to copy filtered resources.
[INFO] Copying 2 resources
[INFO] 
[INFO] --- maven-compiler-plugin:3.7.0:testCompile (default-testCompile) @ oar-dist-service ---
[INFO] Changes detected - recompiling the module!
[INFO] Compiling 18 source files to /root/workspace/RayPlante/oar-dist-service/429848837/target/test-classes
[INFO] /root/workspace/RayPlante/oar-dist-service/429848837/src/test/java/gov/nist/oar/distrib/StreamHandleTest.java: /root/workspace/RayPlante/oar-dist-service/429848837/src/test/java/gov/nist/oar/distrib/StreamHandleTest.java uses or overrides a deprecated API.
[INFO] /root/workspace/RayPlante/oar-dist-service/429848837/src/test/java/gov/nist/oar/distrib/StreamHandleTest.java: Recompile with -Xlint:deprecation for details.
[INFO] 
[INFO] --- maven-surefire-plugin:2.21.0:test (default-test) @ oar-dist-service ---
[INFO] Downloading: https://repo.maven.apache.org/maven2/org/apache/maven/surefire/surefire-junit4/2.21.0/surefire-junit4-2.21.0.pom
[INFO] Downloaded: https://repo.maven.apache.org/maven2/org/apache/maven/surefire/surefire-junit4/2.21.0/surefire-junit4-2.21.0.pom (4 KB at 8.0 KB/sec)
[INFO] Downloading: https://repo.maven.apache.org/maven2/org/apache/maven/surefire/surefire-providers/2.21.0/surefire-providers-2.21.0.pom
[INFO] Downloaded: https://repo.maven.apache.org/maven2/org/apache/maven/surefire/surefire-providers/2.21.0/surefire-providers-2.21.0.pom (3 KB at 70.1 KB/sec)
[INFO] Downloading: https://repo.maven.apache.org/maven2/org/apache/maven/surefire/surefire-junit4/2.21.0/surefire-junit4-2.21.0.jar
[INFO] Downloaded: https://repo.maven.apache.org/maven2/org/apache/maven/surefire/surefire-junit4/2.21.0/surefire-junit4-2.21.0.jar (83 KB at 1059.7 KB/sec)
[INFO] 
[INFO] -------------------------------------------------------
[INFO]  T E S T S
[INFO] -------------------------------------------------------
[INFO] Running gov.nist.oar.ds.unit.BagUtilsTest
[INFO] Tests run: 7, Failures: 0, Errors: 0, Skipped: 0, Time elapsed: 0.11 s - in gov.nist.oar.ds.unit.BagUtilsTest
[INFO] Running gov.nist.oar.distrib.service.FromBagFileDownloadServiceTest
04:05:15,507 |-INFO in ch.qos.logback.classic.LoggerContext[default] - Could NOT find resource [logback-test.xml]
04:05:15,508 |-INFO in ch.qos.logback.classic.LoggerContext[default] - Could NOT find resource [logback.groovy]
04:05:15,508 |-INFO in ch.qos.logback.classic.LoggerContext[default] - Found resource [logback.xml] at [file:/root/workspace/RayPlante/oar-dist-service/429848837/target/classes/logback.xml]
04:05:15,666 |-INFO in ch.qos.logback.classic.joran.action.ConfigurationAction - debug attribute not set
04:05:15,667 |-INFO in ch.qos.logback.core.joran.action.AppenderAction - About to instantiate appender of type [ch.qos.logback.core.ConsoleAppender]
04:05:15,689 |-INFO in ch.qos.logback.core.joran.action.AppenderAction - Naming appender as [STDOUT]
04:05:15,705 |-INFO in ch.qos.logback.core.joran.action.NestedComplexPropertyIA - Assuming default type [ch.qos.logback.classic.encoder.PatternLayoutEncoder] for [encoder] property
04:05:15,791 |-INFO in ch.qos.logback.core.joran.action.AppenderAction - About to instantiate appender of type [ch.qos.logback.core.rolling.RollingFileAppender]
04:05:15,800 |-INFO in ch.qos.logback.core.joran.action.AppenderAction - Naming appender as [SAVE-TO-FILE]
04:05:15,819 |-INFO in ch.qos.logback.core.rolling.FixedWindowRollingPolicy@21fdfefc - No compression will be used
04:05:15,819 |-WARN in ch.qos.logback.core.rolling.FixedWindowRollingPolicy@21fdfefc - Large window sizes are not allowed.
04:05:15,819 |-WARN in ch.qos.logback.core.rolling.FixedWindowRollingPolicy@21fdfefc - MaxIndex reduced to 22
04:05:15,828 |-INFO in ch.qos.logback.core.rolling.RollingFileAppender[SAVE-TO-FILE] - Active log file name: LOG_PATH_IS_UNDEFINED/distservice.log
04:05:15,828 |-INFO in ch.qos.logback.core.rolling.RollingFileAppender[SAVE-TO-FILE] - File property is set to [LOG_PATH_IS_UNDEFINED/distservice.log]
04:05:15,832 |-INFO in ch.qos.logback.classic.joran.action.LoggerAction - Setting level of logger [org.springframework] to INFO
04:05:15,832 |-INFO in ch.qos.logback.classic.joran.action.LoggerAction - Setting additivity of logger [org.springframework] to false
04:05:15,832 |-INFO in ch.qos.logback.core.joran.action.AppenderRefAction - Attaching appender named [STDOUT] to Logger[org.springframework]
04:05:15,833 |-INFO in ch.qos.logback.core.joran.action.AppenderRefAction - Attaching appender named [SAVE-TO-FILE] to Logger[org.springframework]
04:05:15,833 |-INFO in ch.qos.logback.classic.joran.action.LoggerAction - Setting level of logger [gov.nist.oar.ds] to DEBUG
04:05:15,834 |-INFO in ch.qos.logback.classic.joran.action.LoggerAction - Setting additivity of logger [gov.nist.oar.ds] to false
04:05:15,834 |-INFO in ch.qos.logback.core.joran.action.AppenderRefAction - Attaching appender named [STDOUT] to Logger[gov.nist.oar.ds]
04:05:15,834 |-INFO in ch.qos.logback.core.joran.action.AppenderRefAction - Attaching appender named [SAVE-TO-FILE] to Logger[gov.nist.oar.ds]
04:05:15,834 |-INFO in ch.qos.logback.classic.joran.action.RootLoggerAction - Setting level of ROOT logger to INFO
04:05:15,834 |-INFO in ch.qos.logback.core.joran.action.AppenderRefAction - Attaching appender named [STDOUT] to Logger[ROOT]
04:05:15,834 |-INFO in ch.qos.logback.core.joran.action.AppenderRefAction - Attaching appender named [SAVE-TO-FILE] to Logger[ROOT]
04:05:15,834 |-INFO in ch.qos.logback.classic.joran.action.ConfigurationAction - End of configuration.
04:05:15,835 |-INFO in ch.qos.logback.classic.joran.JoranConfigurator@3daa82be - Registering current configuration as safe fallback point

2018-09-18 04:05:15 [main] INFO  gov.nist.oar.distrib.storage.FilesystemLongTermStorage:<init>:69 - Creating FilesystemLongTermStorage rooted at /root/workspace/RayPlante/oar-dist-service/429848837/_unittest6912090223313224946
2018-09-18 04:05:15 [main] INFO  gov.nist.oar.distrib.storage.FilesystemLongTermStorage:<init>:69 - Creating FilesystemLongTermStorage rooted at /root/workspace/RayPlante/oar-dist-service/429848837/_unittest6912090223313224946
2018-09-18 04:05:15 [main] INFO  gov.nist.oar.distrib.storage.FilesystemLongTermStorage:<init>:69 - Creating FilesystemLongTermStorage rooted at /root/workspace/RayPlante/oar-dist-service/429848837/_unittest6912090223313224946
2018-09-18 04:05:15 [main] INFO  gov.nist.oar.distrib.service.PreservationBagService:getBag:162 - Get StreamHandle for bagfile:mds1491.mbag0_2-0.zip
2018-09-18 04:05:15 [main] WARN  gov.nist.oar.distrib.storage.FilesystemLongTermStorage:getChecksum:104 - No cached checksum available for mds1491.mbag0_2-0.zip
2018-09-18 04:05:15 [main] INFO  gov.nist.oar.distrib.service.PreservationBagService:getBag:162 - Get StreamHandle for bagfile:mds1491.mbag0_2-0.zip
2018-09-18 04:05:15 [main] WARN  gov.nist.oar.distrib.storage.FilesystemLongTermStorage:getChecksum:104 - No cached checksum available for mds1491.mbag0_2-0.zip
2018-09-18 04:05:15 [main] INFO  gov.nist.oar.distrib.service.PreservationBagService:getBag:162 - Get StreamHandle for bagfile:mds1491.1_1_0.mbag0_4-1.zip
2018-09-18 04:05:15 [main] WARN  gov.nist.oar.distrib.storage.FilesystemLongTermStorage:getChecksum:104 - No cached checksum available for mds1491.1_1_0.mbag0_4-1.zip
2018-09-18 04:05:15 [main] INFO  gov.nist.oar.distrib.service.PreservationBagService:getBag:162 - Get StreamHandle for bagfile:mds1491.1_1_0.mbag0_4-1.zip
2018-09-18 04:05:15 [main] WARN  gov.nist.oar.distrib.storage.FilesystemLongTermStorage:getChecksum:104 - No cached checksum available for mds1491.1_1_0.mbag0_4-1.zip
2018-09-18 04:05:15 [main] INFO  gov.nist.oar.distrib.service.PreservationBagService:getBag:162 - Get StreamHandle for bagfile:mds1491.1_1_0.mbag0_4-1.zip
2018-09-18 04:05:15 [main] WARN  gov.nist.oar.distrib.storage.FilesystemLongTermStorage:getChecksum:104 - No cached checksum available for mds1491.1_1_0.mbag0_4-1.zip
2018-09-18 04:05:15 [main] INFO  gov.nist.oar.distrib.service.PreservationBagService:getBag:162 - Get StreamHandle for bagfile:mds1491.1_1_0.mbag0_4-1.zip
2018-09-18 04:05:15 [main] WARN  gov.nist.oar.distrib.storage.FilesystemLongTermStorage:getChecksum:104 - No cached checksum available for mds1491.1_1_0.mbag0_4-1.zip
2018-09-18 04:05:15 [main] INFO  gov.nist.oar.distrib.storage.FilesystemLongTermStorage:<init>:69 - Creating FilesystemLongTermStorage rooted at /root/workspace/RayPlante/oar-dist-service/429848837/_unittest6912090223313224946
2018-09-18 04:05:15 [main] INFO  gov.nist.oar.distrib.storage.FilesystemLongTermStorage:<init>:69 - Creating FilesystemLongTermStorage rooted at /root/workspace/RayPlante/oar-dist-service/429848837/_unittest6912090223313224946
2018-09-18 04:05:15 [main] INFO  gov.nist.oar.distrib.service.PreservationBagService:getBag:162 - Get StreamHandle for bagfile:mds1491.mbag0_2-0.zip
2018-09-18 04:05:15 [main] WARN  gov.nist.oar.distrib.storage.FilesystemLongTermStorage:getChecksum:104 - No cached checksum available for mds1491.mbag0_2-0.zip
2018-09-18 04:05:15 [main] INFO  gov.nist.oar.distrib.storage.FilesystemLongTermStorage:<init>:69 - Creating FilesystemLongTermStorage rooted at /root/workspace/RayPlante/oar-dist-service/429848837/_unittest6912090223313224946
2018-09-18 04:05:15 [main] INFO  gov.nist.oar.distrib.storage.FilesystemLongTermStorage:<init>:69 - Creating FilesystemLongTermStorage rooted at /root/workspace/RayPlante/oar-dist-service/429848837/_unittest6912090223313224946
2018-09-18 04:05:15 [main] INFO  gov.nist.oar.distrib.service.PreservationBagService:getBag:162 - Get StreamHandle for bagfile:mds1491.mbag0_2-0.zip
2018-09-18 04:05:15 [main] WARN  gov.nist.oar.distrib.storage.FilesystemLongTermStorage:getChecksum:104 - No cached checksum available for mds1491.mbag0_2-0.zip
2018-09-18 04:05:15 [main] INFO  gov.nist.oar.distrib.service.PreservationBagService:getBag:162 - Get StreamHandle for bagfile:mds1491.1_1_0.mbag0_4-1.zip
2018-09-18 04:05:15 [main] WARN  gov.nist.oar.distrib.storage.FilesystemLongTermStorage:getChecksum:104 - No cached checksum available for mds1491.1_1_0.mbag0_4-1.zip
2018-09-18 04:05:15 [main] INFO  gov.nist.oar.distrib.storage.FilesystemLongTermStorage:<init>:69 - Creating FilesystemLongTermStorage rooted at /root/workspace/RayPlante/oar-dist-service/429848837/_unittest6912090223313224946
2018-09-18 04:05:15 [main] INFO  gov.nist.oar.distrib.storage.FilesystemLongTermStorage:<init>:69 - Creating FilesystemLongTermStorage rooted at /root/workspace/RayPlante/oar-dist-service/429848837/_unittest6912090223313224946
2018-09-18 04:05:15 [main] INFO  gov.nist.oar.distrib.service.PreservationBagService:getBag:162 - Get StreamHandle for bagfile:mds1491.mbag0_2-0.zip
2018-09-18 04:05:15 [main] WARN  gov.nist.oar.distrib.storage.FilesystemLongTermStorage:getChecksum:104 - No cached checksum available for mds1491.mbag0_2-0.zip
2018-09-18 04:05:15 [main] INFO  gov.nist.oar.distrib.service.PreservationBagService:getBag:162 - Get StreamHandle for bagfile:mds1491.mbag0_2-0.zip
2018-09-18 04:05:15 [main] WARN  gov.nist.oar.distrib.storage.FilesystemLongTermStorage:getChecksum:104 - No cached checksum available for mds1491.mbag0_2-0.zip
[INFO] Tests run: 9, Failures: 0, Errors: 0, Skipped: 0, Time elapsed: 0.549 s - in gov.nist.oar.distrib.service.FromBagFileDownloadServiceTest
[INFO] Running gov.nist.oar.distrib.service.DefaultPreservationBagServiceTest
2018-09-18 04:05:16 [main] INFO  gov.nist.oar.distrib.storage.FilesystemLongTermStorage:<init>:69 - Creating FilesystemLongTermStorage rooted at /root/workspace/RayPlante/oar-dist-service/429848837/_unittest2257300599285745176
2018-09-18 04:05:16 [main] INFO  gov.nist.oar.distrib.storage.FilesystemLongTermStorage:<init>:69 - Creating FilesystemLongTermStorage rooted at /root/workspace/RayPlante/oar-dist-service/429848837/_unittest2257300599285745176
2018-09-18 04:05:16 [main] INFO  gov.nist.oar.distrib.storage.FilesystemLongTermStorage:<init>:69 - Creating FilesystemLongTermStorage rooted at /root/workspace/RayPlante/oar-dist-service/429848837/_unittest2257300599285745176
2018-09-18 04:05:16 [main] INFO  gov.nist.oar.distrib.service.PreservationBagService:getInfo:180 - Get StreamHandle info for bagfile:mds013u4g.1_0_0.mbag0_4-2.7z
2018-09-18 04:05:16 [main] INFO  gov.nist.oar.distrib.service.PreservationBagService:getInfo:180 - Get StreamHandle info for bagfile:6376FC675D0E1D77E0531A5706812BC21886.mbag0_3-18.zip
2018-09-18 04:05:16 [main] INFO  gov.nist.oar.distrib.storage.FilesystemLongTermStorage:<init>:69 - Creating FilesystemLongTermStorage rooted at /root/workspace/RayPlante/oar-dist-service/429848837/_unittest2257300599285745176
2018-09-18 04:05:16 [main] INFO  gov.nist.oar.distrib.storage.FilesystemLongTermStorage:<init>:69 - Creating FilesystemLongTermStorage rooted at /root/workspace/RayPlante/oar-dist-service/429848837/_unittest2257300599285745176
2018-09-18 04:05:16 [main] INFO  gov.nist.oar.distrib.storage.FilesystemLongTermStorage:<init>:69 - Creating FilesystemLongTermStorage rooted at /root/workspace/RayPlante/oar-dist-service/429848837/_unittest2257300599285745176
2018-09-18 04:05:16 [main] INFO  gov.nist.oar.distrib.storage.FilesystemLongTermStorage:<init>:69 - Creating FilesystemLongTermStorage rooted at /root/workspace/RayPlante/oar-dist-service/429848837/_unittest2257300599285745176
2018-09-18 04:05:16 [main] INFO  gov.nist.oar.distrib.service.PreservationBagService:getBag:162 - Get StreamHandle for bagfile:mds013u4g.1_0_0.mbag0_4-2.7z
2018-09-18 04:05:16 [main] INFO  gov.nist.oar.distrib.service.PreservationBagService:getBag:162 - Get StreamHandle for bagfile:6376FC675D0E1D77E0531A5706812BC21886.mbag0_3-18.zip
2018-09-18 04:05:16 [main] INFO  gov.nist.oar.distrib.storage.FilesystemLongTermStorage:<init>:69 - Creating FilesystemLongTermStorage rooted at /root/workspace/RayPlante/oar-dist-service/429848837/_unittest2257300599285745176
[INFO] Tests run: 8, Failures: 0, Errors: 0, Skipped: 0, Time elapsed: 0.046 s - in gov.nist.oar.distrib.service.DefaultPreservationBagServiceTest
[INFO] Running gov.nist.oar.distrib.storage.AWSS3LongTermStorageTest
[ERROR] Tests run: 1, Failures: 0, Errors: 1, Skipped: 0, Time elapsed: 2.15 s <<< FAILURE! - in gov.nist.oar.distrib.storage.AWSS3LongTermStorageTest
[ERROR] gov.nist.oar.distrib.storage.AWSS3LongTermStorageTest  Time elapsed: 2.15 s  <<< ERROR!
java.lang.RuntimeException: 
java.lang.IllegalStateException: Failed to run command 'bash -c cd "/tmp/localstack_install_dir"; make install', return code 127.
STDOUT: 
STDERR: bash: make: command not found

	at org.apache.maven.surefire.junit4.JUnit4Provider.execute(JUnit4Provider.java:365)
	at org.apache.maven.surefire.junit4.JUnit4Provider.executeWithRerun(JUnit4Provider.java:273)
	at org.apache.maven.surefire.junit4.JUnit4Provider.executeTestSet(JUnit4Provider.java:238)
	at org.apache.maven.surefire.junit4.JUnit4Provider.invoke(JUnit4Provider.java:159)
Caused by: java.lang.IllegalStateException: 
Failed to run command 'bash -c cd "/tmp/localstack_install_dir"; make install', return code 127.
STDOUT: 
STDERR: bash: make: command not found

	at org.apache.maven.surefire.junit4.JUnit4Provider.execute(JUnit4Provider.java:365)
	at org.apache.maven.surefire.junit4.JUnit4Provider.executeWithRerun(JUnit4Provider.java:273)
	at org.apache.maven.surefire.junit4.JUnit4Provider.executeTestSet(JUnit4Provider.java:238)
	at org.apache.maven.surefire.junit4.JUnit4Provider.invoke(JUnit4Provider.java:159)

[INFO] Running gov.nist.oar.distrib.storage.FilesystemLongTermStorageTest
2018-09-18 04:05:18 [main] INFO  gov.nist.oar.distrib.storage.FilesystemLongTermStorage:<init>:69 - Creating FilesystemLongTermStorage rooted at /root/workspace/RayPlante/oar-dist-service/429848837/_unittest8739633973174144413
2018-09-18 04:05:18 [main] INFO  gov.nist.oar.distrib.storage.FilesystemLongTermStorage:<init>:69 - Creating FilesystemLongTermStorage rooted at /root/workspace/RayPlante/oar-dist-service/429848837/_unittest2292068689518287623
2018-09-18 04:05:18 [main] INFO  gov.nist.oar.distrib.storage.FilesystemLongTermStorage:<init>:69 - Creating FilesystemLongTermStorage rooted at /root/workspace/RayPlante/oar-dist-service/429848837/_unittest4708418409054390152
2018-09-18 04:05:18 [main] INFO  gov.nist.oar.distrib.storage.FilesystemLongTermStorage:<init>:69 - Creating FilesystemLongTermStorage rooted at /root/workspace/RayPlante/oar-dist-service/429848837/_unittest6718050735860705960
2018-09-18 04:05:18 [main] INFO  gov.nist.oar.distrib.storage.FilesystemLongTermStorage:<init>:69 - Creating FilesystemLongTermStorage rooted at /root/workspace/RayPlante/oar-dist-service/429848837/_unittest6376165058991469980
2018-09-18 04:05:18 [main] INFO  gov.nist.oar.distrib.storage.FilesystemLongTermStorage:<init>:69 - Creating FilesystemLongTermStorage rooted at /root/workspace/RayPlante/oar-dist-service/429848837/_unittest1291542802958205398
[INFO] Tests run: 6, Failures: 0, Errors: 0, Skipped: 0, Time elapsed: 0.056 s - in gov.nist.oar.distrib.storage.FilesystemLongTermStorageTest
[INFO] Running gov.nist.oar.distrib.BagDescriptionTest
[INFO] Tests run: 6, Failures: 0, Errors: 0, Skipped: 0, Time elapsed: 0.489 s - in gov.nist.oar.distrib.BagDescriptionTest
[INFO] Running gov.nist.oar.distrib.DistributionExceptionTest
[INFO] Tests run: 2, Failures: 0, Errors: 0, Skipped: 0, Time elapsed: 0.001 s - in gov.nist.oar.distrib.DistributionExceptionTest
[INFO] Running gov.nist.oar.distrib.FileDescriptionTest
[INFO] Tests run: 5, Failures: 0, Errors: 0, Skipped: 0, Time elapsed: 0 s - in gov.nist.oar.distrib.FileDescriptionTest
[INFO] Running gov.nist.oar.distrib.ChecksumTest
[INFO] Tests run: 2, Failures: 0, Errors: 0, Skipped: 0, Time elapsed: 0 s - in gov.nist.oar.distrib.ChecksumTest
[INFO] Running gov.nist.oar.distrib.StreamHandleTest
[INFO] Tests run: 5, Failures: 0, Errors: 0, Skipped: 0, Time elapsed: 0 s - in gov.nist.oar.distrib.StreamHandleTest
[INFO] Running gov.nist.oar.bags.preservation.BagUtilsTest
[INFO] Tests run: 10, Failures: 0, Errors: 0, Skipped: 0, Time elapsed: 0.001 s - in gov.nist.oar.bags.preservation.BagUtilsTest
[INFO] Running gov.nist.oar.bags.preservation.ZipBagUtilsTest
[INFO] Tests run: 5, Failures: 0, Errors: 0, Skipped: 0, Time elapsed: 0.001 s - in gov.nist.oar.bags.preservation.ZipBagUtilsTest
[INFO] Running gov.nist.oar.bags.preservation.HeadBagUtilsTest
[INFO] Tests run: 3, Failures: 0, Errors: 0, Skipped: 0, Time elapsed: 0 s - in gov.nist.oar.bags.preservation.HeadBagUtilsTest
[INFO] 
[INFO] Results:
[INFO] 
[ERROR] Errors: 
[ERROR]   JUnit4Provider.invoke:159->executeTestSet:238->executeWithRerun:273->execute:365 » Runtime
[INFO] 
[ERROR] Tests run: 69, Failures: 0, Errors: 1, Skipped: 0
[INFO] 
[INFO] ------------------------------------------------------------------------
[INFO] BUILD FAILURE
[INFO] ------------------------------------------------------------------------
[INFO] Total time: 10.630 s
[INFO] Finished at: 2018-09-18T04:05:19+02:00
[INFO] Final Memory: 52M/497M
[INFO] ------------------------------------------------------------------------
[ERROR] Failed to execute goal org.apache.maven.plugins:maven-surefire-plugin:2.21.0:test (default-test) on project oar-dist-service: There are test failures.
[ERROR] 
[ERROR] Please refer to /root/workspace/RayPlante/oar-dist-service/429848837/target/surefire-reports for the individual test results.
[ERROR] Please refer to dump files (if any exist) [date]-jvmRun[N].dump, [date].dumpstream and [date]-jvmRun[N].dumpstream.
[ERROR] -> [Help 1]
[ERROR] 
[ERROR] To see the full stack trace of the errors, re-run Maven with the -e switch.
[ERROR] Re-run Maven using the -X switch to enable full debug logging.
[ERROR] 
[ERROR] For more information about the errors and possible solutions, please read the following articles:
[ERROR] [Help 1] http://cwiki.apache.org/confluence/display/MAVEN/MojoFailureException
