[INFO] Scanning for projects...
[INFO] Inspecting build with total of 1 modules...
[INFO] Installing Nexus Staging features:
[INFO]   ... total of 1 executions of maven-deploy-plugin replaced with nexus-staging-maven-plugin
[INFO]                                                                         
[INFO] ------------------------------------------------------------------------
[INFO] Building FastClasspathScanner 4.0.0-beta-6-SNAPSHOT
[INFO] ------------------------------------------------------------------------
[INFO] 
[INFO] --- maven-resources-plugin:2.6:resources (default-resources) @ fast-classpath-scanner ---
[INFO] Using 'UTF-8' encoding to copy filtered resources.
[INFO] Copying 1 resource
[INFO] 
[INFO] --- maven-compiler-plugin:3.7.0:compile (default-compile) @ fast-classpath-scanner ---
[INFO] Nothing to compile - all classes are up to date
[INFO] 
[INFO] --- maven-bundle-plugin:3.5.1:manifest (bundle-manifest) @ fast-classpath-scanner ---
[INFO] 
[INFO] --- maven-resources-plugin:2.6:testResources (default-testResources) @ fast-classpath-scanner ---
[INFO] Using 'UTF-8' encoding to copy filtered resources.
[INFO] Copying 19 resources
[INFO] 
[INFO] --- maven-compiler-plugin:3.7.0:testCompile (default-testCompile) @ fast-classpath-scanner ---
[INFO] Nothing to compile - all classes are up to date
[INFO] 
[INFO] --- maven-surefire-plugin:2.21.0:test (default-test) @ fast-classpath-scanner ---
[INFO] Downloading: https://repo.maven.apache.org/maven2/org/apache/maven/surefire/surefire-junit4/2.21.0/surefire-junit4-2.21.0.pom
[INFO] Downloaded: https://repo.maven.apache.org/maven2/org/apache/maven/surefire/surefire-junit4/2.21.0/surefire-junit4-2.21.0.pom (4 KB at 8.2 KB/sec)
[INFO] Downloading: https://repo.maven.apache.org/maven2/org/apache/maven/surefire/surefire-providers/2.21.0/surefire-providers-2.21.0.pom
[INFO] Downloaded: https://repo.maven.apache.org/maven2/org/apache/maven/surefire/surefire-providers/2.21.0/surefire-providers-2.21.0.pom (3 KB at 106.7 KB/sec)
[INFO] Downloading: https://repo.maven.apache.org/maven2/org/apache/maven/surefire/surefire-junit4/2.21.0/surefire-junit4-2.21.0.jar
[INFO] Downloaded: https://repo.maven.apache.org/maven2/org/apache/maven/surefire/surefire-junit4/2.21.0/surefire-junit4-2.21.0.jar (83 KB at 1401.0 KB/sec)
[INFO] 
[INFO] -------------------------------------------------------
[INFO]  T E S T S
[INFO] -------------------------------------------------------
[INFO] Running io.github.lukehutch.fastclasspathscanner.issues.issue146.Issue146Test
[INFO] Tests run: 1, Failures: 0, Errors: 0, Skipped: 0, Time elapsed: 0.278 s - in io.github.lukehutch.fastclasspathscanner.issues.issue146.Issue146Test
[INFO] Running io.github.lukehutch.fastclasspathscanner.issues.issue107.Issue107Test
[INFO] Tests run: 1, Failures: 0, Errors: 0, Skipped: 0, Time elapsed: 0.041 s - in io.github.lukehutch.fastclasspathscanner.issues.issue107.Issue107Test
[INFO] Running io.github.lukehutch.fastclasspathscanner.issues.issue101.Issue101Test
[INFO] Tests run: 3, Failures: 0, Errors: 0, Skipped: 0, Time elapsed: 0.175 s - in io.github.lukehutch.fastclasspathscanner.issues.issue101.Issue101Test
[INFO] Running io.github.lukehutch.fastclasspathscanner.issues.issue167.Issue167Test
[INFO] Tests run: 2, Failures: 0, Errors: 0, Skipped: 0, Time elapsed: 0.1 s - in io.github.lukehutch.fastclasspathscanner.issues.issue167.Issue167Test
[INFO] Running io.github.lukehutch.fastclasspathscanner.issues.issue38.Issue38Test
[INFO] Tests run: 1, Failures: 0, Errors: 0, Skipped: 0, Time elapsed: 0.065 s - in io.github.lukehutch.fastclasspathscanner.issues.issue38.Issue38Test
[INFO] Running io.github.lukehutch.fastclasspathscanner.issues.issue78.Issue78Test
[INFO] Tests run: 1, Failures: 0, Errors: 0, Skipped: 0, Time elapsed: 0.077 s - in io.github.lukehutch.fastclasspathscanner.issues.issue78.Issue78Test
[INFO] Running io.github.lukehutch.fastclasspathscanner.issues.issue83.Issue83Test
[INFO] Tests run: 2, Failures: 0, Errors: 0, Skipped: 0, Time elapsed: 0.027 s - in io.github.lukehutch.fastclasspathscanner.issues.issue83.Issue83Test
[INFO] Running io.github.lukehutch.fastclasspathscanner.issues.IssuesTest
[ERROR] Tests run: 7, Failures: 2, Errors: 0, Skipped: 0, Time elapsed: 0.475 s <<< FAILURE! - in io.github.lukehutch.fastclasspathscanner.issues.IssuesTest
[ERROR] issue70EnableExternalClasses(io.github.lukehutch.fastclasspathscanner.issues.IssuesTest)  Time elapsed: 0.144 s  <<< FAILURE!
java.lang.AssertionError: 

Expecting:
  <["io.github.lukehutch.fastclasspathscanner.test.whitelisted.Impl1",
    "java.lang.Object"]>
to contain only:
  <["io.github.lukehutch.fastclasspathscanner.test.whitelisted.Impl1"]>
but the following elements were unexpected:
  <["java.lang.Object"]>

	at io.github.lukehutch.fastclasspathscanner.issues.IssuesTest.issue70EnableExternalClasses(IssuesTest.java:32)

[ERROR] extendsExternal(io.github.lukehutch.fastclasspathscanner.issues.IssuesTest)  Time elapsed: 0.06 s  <<< FAILURE!
java.lang.AssertionError: 

Expecting empty but was:<["io.github.lukehutch.fastclasspathscanner.test.external.ExternalSuperclass"]>
	at io.github.lukehutch.fastclasspathscanner.issues.IssuesTest.extendsExternal(IssuesTest.java:39)

[INFO] Running io.github.lukehutch.fastclasspathscanner.issues.issue148.Issue148Test
[INFO] Tests run: 1, Failures: 0, Errors: 0, Skipped: 0, Time elapsed: 0.036 s - in io.github.lukehutch.fastclasspathscanner.issues.issue148.Issue148Test
[INFO] Running io.github.lukehutch.fastclasspathscanner.issues.issue140.Issue140Test
[INFO] Tests run: 1, Failures: 0, Errors: 0, Skipped: 0, Time elapsed: 0.049 s - in io.github.lukehutch.fastclasspathscanner.issues.issue140.Issue140Test
[INFO] Running io.github.lukehutch.fastclasspathscanner.issues.issue171.Issue171Test
[INFO] Tests run: 1, Failures: 0, Errors: 0, Skipped: 0, Time elapsed: 0.168 s - in io.github.lukehutch.fastclasspathscanner.issues.issue171.Issue171Test
[INFO] Running io.github.lukehutch.fastclasspathscanner.issues.issue141.Issue141Test
[INFO] Tests run: 1, Failures: 0, Errors: 0, Skipped: 0, Time elapsed: 0.498 s - in io.github.lukehutch.fastclasspathscanner.issues.issue141.Issue141Test
[INFO] Running io.github.lukehutch.fastclasspathscanner.issues.issue193.Issue193Test
[INFO] Tests run: 1, Failures: 0, Errors: 0, Skipped: 0, Time elapsed: 0.431 s - in io.github.lukehutch.fastclasspathscanner.issues.issue193.Issue193Test
[INFO] Running io.github.lukehutch.fastclasspathscanner.issues.issue216.Issue216Test
[INFO] Tests run: 1, Failures: 0, Errors: 0, Skipped: 0, Time elapsed: 0.043 s - in io.github.lukehutch.fastclasspathscanner.issues.issue216.Issue216Test
[INFO] Running io.github.lukehutch.fastclasspathscanner.issues.issue175.Issue175Test
[INFO] Tests run: 9, Failures: 0, Errors: 0, Skipped: 0, Time elapsed: 0.155 s - in io.github.lukehutch.fastclasspathscanner.issues.issue175.Issue175Test
[INFO] Running io.github.lukehutch.fastclasspathscanner.issues.issue37.Issue37Test
[INFO] Tests run: 1, Failures: 0, Errors: 0, Skipped: 0, Time elapsed: 0.05 s - in io.github.lukehutch.fastclasspathscanner.issues.issue37.Issue37Test
[INFO] Running io.github.lukehutch.fastclasspathscanner.issues.issue153.Issue153Test
[ERROR] Tests run: 1, Failures: 0, Errors: 1, Skipped: 0, Time elapsed: 0.043 s <<< FAILURE! - in io.github.lukehutch.fastclasspathscanner.issues.issue153.Issue153Test
[ERROR] classAnnotationParameters(io.github.lukehutch.fastclasspathscanner.issues.issue153.Issue153Test)  Time elapsed: 0.043 s  <<< ERROR!
java.lang.NullPointerException
	at io.github.lukehutch.fastclasspathscanner.issues.issue153.Issue153Test.classAnnotationParameters(Issue153Test.java:129)

[INFO] Running io.github.lukehutch.fastclasspathscanner.issues.issue151.Issue151Test
[INFO] Tests run: 1, Failures: 0, Errors: 0, Skipped: 0, Time elapsed: 0.044 s - in io.github.lukehutch.fastclasspathscanner.issues.issue151.Issue151Test
[INFO] Running io.github.lukehutch.fastclasspathscanner.issues.issue209.Issue209Test
[INFO] Tests run: 2, Failures: 0, Errors: 0, Skipped: 0, Time elapsed: 0.083 s - in io.github.lukehutch.fastclasspathscanner.issues.issue209.Issue209Test
[INFO] Running io.github.lukehutch.fastclasspathscanner.issues.issue74.Issue74Test
[INFO] Tests run: 1, Failures: 0, Errors: 0, Skipped: 0, Time elapsed: 0.061 s - in io.github.lukehutch.fastclasspathscanner.issues.issue74.Issue74Test
[INFO] Running io.github.lukehutch.fastclasspathscanner.issues.issue46.Issue46Test
[INFO] Tests run: 1, Failures: 0, Errors: 0, Skipped: 0, Time elapsed: 0.017 s - in io.github.lukehutch.fastclasspathscanner.issues.issue46.Issue46Test
[INFO] Running io.github.lukehutch.fastclasspathscanner.issues.issue80.Issue80Test
[INFO] Tests run: 1, Failures: 0, Errors: 0, Skipped: 0, Time elapsed: 1.536 s - in io.github.lukehutch.fastclasspathscanner.issues.issue80.Issue80Test
[INFO] Running io.github.lukehutch.fastclasspathscanner.issues.issue100.Issue100Test
[INFO] Tests run: 1, Failures: 0, Errors: 0, Skipped: 0, Time elapsed: 0.063 s - in io.github.lukehutch.fastclasspathscanner.issues.issue100.Issue100Test
[INFO] Running io.github.lukehutch.fastclasspathscanner.issues.TestGetUniqueClasspathElements
[INFO] Tests run: 1, Failures: 0, Errors: 0, Skipped: 0, Time elapsed: 0.04 s - in io.github.lukehutch.fastclasspathscanner.issues.TestGetUniqueClasspathElements
[INFO] Running io.github.lukehutch.fastclasspathscanner.issues.issue99.Issue99Test
[INFO] Tests run: 1, Failures: 0, Errors: 0, Skipped: 0, Time elapsed: 0.034 s - in io.github.lukehutch.fastclasspathscanner.issues.issue99.Issue99Test
[INFO] Running io.github.lukehutch.fastclasspathscanner.issues.issue152.Issue152Test
[INFO] Tests run: 1, Failures: 0, Errors: 0, Skipped: 0, Time elapsed: 0.049 s - in io.github.lukehutch.fastclasspathscanner.issues.issue152.Issue152Test
[INFO] Running io.github.lukehutch.fastclasspathscanner.issues.issue128.Issue128Test
[INFO] Tests run: 1, Failures: 0, Errors: 0, Skipped: 0, Time elapsed: 0.957 s - in io.github.lukehutch.fastclasspathscanner.issues.issue128.Issue128Test
[INFO] Running io.github.lukehutch.fastclasspathscanner.issues.issue166.Issue166Test
[INFO] Tests run: 3, Failures: 0, Errors: 0, Skipped: 0, Time elapsed: 0.028 s - in io.github.lukehutch.fastclasspathscanner.issues.issue166.Issue166Test
[INFO] Running io.github.lukehutch.fastclasspathscanner.test.internal.InternalExternalTest
[INFO] Tests run: 4, Failures: 0, Errors: 0, Skipped: 0, Time elapsed: 0.123 s - in io.github.lukehutch.fastclasspathscanner.test.internal.InternalExternalTest
[INFO] Running io.github.lukehutch.fastclasspathscanner.test.fieldinfo.FieldInfoTest
[INFO] Tests run: 3, Failures: 0, Errors: 0, Skipped: 0, Time elapsed: 0.085 s - in io.github.lukehutch.fastclasspathscanner.test.fieldinfo.FieldInfoTest
[INFO] Running io.github.lukehutch.fastclasspathscanner.test.ClassInfoTest
[INFO] Tests run: 7, Failures: 0, Errors: 0, Skipped: 0, Time elapsed: 0.248 s - in io.github.lukehutch.fastclasspathscanner.test.ClassInfoTest
[INFO] Running io.github.lukehutch.fastclasspathscanner.test.FastClasspathScannerTest
[ERROR] Tests run: 20, Failures: 5, Errors: 0, Skipped: 0, Time elapsed: 1.47 s <<< FAILURE! - in io.github.lukehutch.fastclasspathscanner.test.FastClasspathScannerTest
[ERROR] testNonWhitelistedAnnotationNotReturnedWithStrictWhitelist(io.github.lukehutch.fastclasspathscanner.test.FastClasspathScannerTest)  Time elapsed: 0.025 s  <<< FAILURE!
java.lang.AssertionError: 

Expecting empty but was:<["io.github.lukehutch.fastclasspathscanner.test.blacklisted.BlacklistedAnnotation"]>
	at io.github.lukehutch.fastclasspathscanner.test.FastClasspathScannerTest.testNonWhitelistedAnnotationNotReturnedWithStrictWhitelist(FastClasspathScannerTest.java:236)

[ERROR] testWhitelistedWithoutExceptionWithStrictWhitelist(io.github.lukehutch.fastclasspathscanner.test.FastClasspathScannerTest)  Time elapsed: 0.028 s  <<< FAILURE!
java.lang.AssertionError: 

Expecting empty but was:<["io.github.lukehutch.fastclasspathscanner.test.blacklisted.BlacklistedSuperclass"]>
	at io.github.lukehutch.fastclasspathscanner.test.FastClasspathScannerTest.testWhitelistedWithoutExceptionWithStrictWhitelist(FastClasspathScannerTest.java:183)

[ERROR] testVisibleIfNotBlacklisted(io.github.lukehutch.fastclasspathscanner.test.FastClasspathScannerTest)  Time elapsed: 0.033 s  <<< FAILURE!
java.lang.AssertionError: 

Expecting:
  <["io.github.lukehutch.fastclasspathscanner.test.blacklisted.BlacklistedSuperclass",
    "java.lang.Object"]>
to contain exactly (and in same order):
  <["io.github.lukehutch.fastclasspathscanner.test.blacklisted.BlacklistedSuperclass"]>
but some elements were not expected:
  <["java.lang.Object"]>

	at io.github.lukehutch.fastclasspathscanner.test.FastClasspathScannerTest.testVisibleIfNotBlacklisted(FastClasspathScannerTest.java:268)

[ERROR] testBlacklistedPackageOverridesWhitelistedClassWithWhitelistedOverrideReturned(io.github.lukehutch.fastclasspathscanner.test.FastClasspathScannerTest)  Time elapsed: 0.031 s  <<< FAILURE!
java.lang.AssertionError: 

Expecting empty but was:<["io.github.lukehutch.fastclasspathscanner.test.blacklisted.BlacklistedAnnotation"]>
	at io.github.lukehutch.fastclasspathscanner.test.FastClasspathScannerTest.testBlacklistedPackageOverridesWhitelistedClassWithWhitelistedOverrideReturned(FastClasspathScannerTest.java:221)

[ERROR] testBlacklistedPlaceholderNotReturned(io.github.lukehutch.fastclasspathscanner.test.FastClasspathScannerTest)  Time elapsed: 0.032 s  <<< FAILURE!
java.lang.AssertionError: 

Expecting empty but was:<["io.github.lukehutch.fastclasspathscanner.test.blacklisted.BlacklistedSuperclass"]>
	at io.github.lukehutch.fastclasspathscanner.test.FastClasspathScannerTest.testBlacklistedPlaceholderNotReturned(FastClasspathScannerTest.java:209)

[INFO] Running io.github.lukehutch.fastclasspathscanner.test.methodannotation2.TestMethodMetaAnnotation
[INFO] Tests run: 3, Failures: 0, Errors: 0, Skipped: 0, Time elapsed: 0.072 s - in io.github.lukehutch.fastclasspathscanner.test.methodannotation2.TestMethodMetaAnnotation
[INFO] Running io.github.lukehutch.fastclasspathscanner.test.fieldannotation.FieldAndMethodAnnotationTest
[INFO] Tests run: 3, Failures: 0, Errors: 0, Skipped: 0, Time elapsed: 0.072 s - in io.github.lukehutch.fastclasspathscanner.test.fieldannotation.FieldAndMethodAnnotationTest
[INFO] Running io.github.lukehutch.fastclasspathscanner.test.methodannotation.MethodAnnotationTest
[INFO] Tests run: 2, Failures: 0, Errors: 0, Skipped: 0, Time elapsed: 0.048 s - in io.github.lukehutch.fastclasspathscanner.test.methodannotation.MethodAnnotationTest
[INFO] Running io.github.lukehutch.fastclasspathscanner.test.classrefannotation.AnnotationClassRefTest
[INFO] Tests run: 1, Failures: 0, Errors: 0, Skipped: 0, Time elapsed: 0.024 s - in io.github.lukehutch.fastclasspathscanner.test.classrefannotation.AnnotationClassRefTest
[INFO] Running io.github.lukehutch.fastclasspathscanner.test.methodinfo.MethodInfoTest
[INFO] Tests run: 4, Failures: 0, Errors: 0, Skipped: 0, Time elapsed: 0.099 s - in io.github.lukehutch.fastclasspathscanner.test.methodinfo.MethodInfoTest
[INFO] Running io.github.lukehutch.fastclasspathscanner.json.JSONSerializationTest
[INFO] Tests run: 2, Failures: 0, Errors: 0, Skipped: 0, Time elapsed: 0.091 s - in io.github.lukehutch.fastclasspathscanner.json.JSONSerializationTest
[INFO] Running com.xyz.MetaAnnotationTest
[ERROR] Tests run: 8, Failures: 2, Errors: 0, Skipped: 0, Time elapsed: 0.2 s <<< FAILURE! - in com.xyz.MetaAnnotationTest
[ERROR] namesOfMetaAnnotations(com.xyz.MetaAnnotationTest)  Time elapsed: 0.001 s  <<< FAILURE!
java.lang.AssertionError: 

Expecting:
  <["com.xyz.meta.F",
    "com.xyz.meta.J",
    "java.lang.annotation.Retention",
    "java.lang.annotation.Target"]>
to contain only:
  <["com.xyz.meta.J", "com.xyz.meta.F"]>
but the following elements were unexpected:
  <["java.lang.annotation.Retention", "java.lang.annotation.Target"]>

	at com.xyz.MetaAnnotationTest.namesOfMetaAnnotations(MetaAnnotationTest.java:88)

[ERROR] acrossCycle(com.xyz.MetaAnnotationTest)  Time elapsed: 0.001 s  <<< FAILURE!
java.lang.AssertionError: 

Expecting:
  <["com.xyz.meta.I",
    "com.xyz.meta.K",
    "java.lang.annotation.Retention",
    "java.lang.annotation.Target"]>
to contain only:
  <["com.xyz.meta.I", "com.xyz.meta.K"]>
but the following elements were unexpected:
  <["java.lang.annotation.Retention", "java.lang.annotation.Target"]>

	at com.xyz.MetaAnnotationTest.acrossCycle(MetaAnnotationTest.java:69)

[INFO] Running DefaultPackageTest
[INFO] Tests run: 2, Failures: 0, Errors: 0, Skipped: 0, Time elapsed: 0.053 s - in DefaultPackageTest
[INFO] Running DisableRecursiveScanningTest
[INFO] Tests run: 2, Failures: 0, Errors: 0, Skipped: 0, Time elapsed: 0.046 s - in DisableRecursiveScanningTest
[INFO] 
[INFO] Results:
[INFO] 
[ERROR] Failures: 
[ERROR]   MetaAnnotationTest.acrossCycle:69 
Expecting:
  <["com.xyz.meta.I",
    "com.xyz.meta.K",
    "java.lang.annotation.Retention",
    "java.lang.annotation.Target"]>
to contain only:
  <["com.xyz.meta.I", "com.xyz.meta.K"]>
but the following elements were unexpected:
  <["java.lang.annotation.Retention", "java.lang.annotation.Target"]>

[ERROR]   MetaAnnotationTest.namesOfMetaAnnotations:88 
Expecting:
  <["com.xyz.meta.F",
    "com.xyz.meta.J",
    "java.lang.annotation.Retention",
    "java.lang.annotation.Target"]>
to contain only:
  <["com.xyz.meta.J", "com.xyz.meta.F"]>
but the following elements were unexpected:
  <["java.lang.annotation.Retention", "java.lang.annotation.Target"]>

[ERROR]   IssuesTest.extendsExternal:39 
Expecting empty but was:<["io.github.lukehutch.fastclasspathscanner.test.external.ExternalSuperclass"]>
[ERROR]   IssuesTest.issue70EnableExternalClasses:32 
Expecting:
  <["io.github.lukehutch.fastclasspathscanner.test.whitelisted.Impl1",
    "java.lang.Object"]>
to contain only:
  <["io.github.lukehutch.fastclasspathscanner.test.whitelisted.Impl1"]>
but the following elements were unexpected:
  <["java.lang.Object"]>

[ERROR]   FastClasspathScannerTest.testBlacklistedPackageOverridesWhitelistedClassWithWhitelistedOverrideReturned:221 
Expecting empty but was:<["io.github.lukehutch.fastclasspathscanner.test.blacklisted.BlacklistedAnnotation"]>
[ERROR]   FastClasspathScannerTest.testBlacklistedPlaceholderNotReturned:209 
Expecting empty but was:<["io.github.lukehutch.fastclasspathscanner.test.blacklisted.BlacklistedSuperclass"]>
[ERROR]   FastClasspathScannerTest.testNonWhitelistedAnnotationNotReturnedWithStrictWhitelist:236 
Expecting empty but was:<["io.github.lukehutch.fastclasspathscanner.test.blacklisted.BlacklistedAnnotation"]>
[ERROR]   FastClasspathScannerTest.testVisibleIfNotBlacklisted:268 
Expecting:
  <["io.github.lukehutch.fastclasspathscanner.test.blacklisted.BlacklistedSuperclass",
    "java.lang.Object"]>
to contain exactly (and in same order):
  <["io.github.lukehutch.fastclasspathscanner.test.blacklisted.BlacklistedSuperclass"]>
but some elements were not expected:
  <["java.lang.Object"]>

[ERROR]   FastClasspathScannerTest.testWhitelistedWithoutExceptionWithStrictWhitelist:183 
Expecting empty but was:<["io.github.lukehutch.fastclasspathscanner.test.blacklisted.BlacklistedSuperclass"]>
[ERROR] Errors: 
[ERROR]   Issue153Test.classAnnotationParameters:129 » NullPointer
[INFO] 
[ERROR] Tests run: 110, Failures: 9, Errors: 1, Skipped: 0
[INFO] 
[INFO] ------------------------------------------------------------------------
[INFO] BUILD FAILURE
[INFO] ------------------------------------------------------------------------
[INFO] Total time: 13.394 s
[INFO] Finished at: 2018-07-27T01:11:53+02:00
[INFO] Final Memory: 26M/377M
[INFO] ------------------------------------------------------------------------
[ERROR] Failed to execute goal org.apache.maven.plugins:maven-surefire-plugin:2.21.0:test (default-test) on project fast-classpath-scanner: There are test failures.
[ERROR] 
[ERROR] Please refer to /root/workspace/lukehutch/fast-classpath-scanner/408731924/target/surefire-reports for the individual test results.
[ERROR] Please refer to dump files (if any exist) [date]-jvmRun[N].dump, [date].dumpstream and [date]-jvmRun[N].dumpstream.
[ERROR] -> [Help 1]
[ERROR] 
[ERROR] To see the full stack trace of the errors, re-run Maven with the -e switch.
[ERROR] Re-run Maven using the -X switch to enable full debug logging.
[ERROR] 
[ERROR] For more information about the errors and possible solutions, please read the following articles:
[ERROR] [Help 1] http://cwiki.apache.org/confluence/display/MAVEN/MojoFailureException
