[INFO] Scanning for projects...
[INFO]                                                                         
[INFO] ------------------------------------------------------------------------
[INFO] Building rps-axon 1.0.0-SNAPSHOT
[INFO] ------------------------------------------------------------------------
[INFO] 
[INFO] --- maven-resources-plugin:3.0.2:resources (default-resources) @ rps-axon ---
[INFO] Using 'UTF-8' encoding to copy filtered resources.
[INFO] Copying 2 resources
[INFO] 
[INFO] --- maven-compiler-plugin:3.7.0:compile (default-compile) @ rps-axon ---
[INFO] Nothing to compile - all classes are up to date
[INFO] 
[INFO] --- maven-resources-plugin:3.0.2:testResources (default-testResources) @ rps-axon ---
[INFO] Using 'UTF-8' encoding to copy filtered resources.
[INFO] skip non existing resourceDirectory /root/workspace/johanhaleby/rps-axon-elm/437750727/src/test/resources
[INFO] 
[INFO] --- maven-compiler-plugin:3.7.0:testCompile (default-testCompile) @ rps-axon ---
[INFO] Nothing to compile - all classes are up to date
[INFO] 
[INFO] --- maven-surefire-plugin:2.22.0:test (default-test) @ rps-axon ---
[INFO] Downloading: https://repo.maven.apache.org/maven2/org/apache/maven/surefire/surefire-junit-platform/2.22.0/surefire-junit-platform-2.22.0.pom
[INFO] Downloaded: https://repo.maven.apache.org/maven2/org/apache/maven/surefire/surefire-junit-platform/2.22.0/surefire-junit-platform-2.22.0.pom (7 KB at 12.8 KB/sec)
[INFO] Downloading: https://repo.maven.apache.org/maven2/org/apache/maven/surefire/surefire-providers/2.22.0/surefire-providers-2.22.0.pom
[INFO] Downloaded: https://repo.maven.apache.org/maven2/org/apache/maven/surefire/surefire-providers/2.22.0/surefire-providers-2.22.0.pom (3 KB at 67.5 KB/sec)
[INFO] Downloading: https://repo.maven.apache.org/maven2/org/junit/platform/junit-platform-launcher/1.2.0/junit-platform-launcher-1.2.0.pom
[INFO] Downloaded: https://repo.maven.apache.org/maven2/org/junit/platform/junit-platform-launcher/1.2.0/junit-platform-launcher-1.2.0.pom (3 KB at 50.3 KB/sec)
[INFO] Downloading: https://repo.maven.apache.org/maven2/org/junit/platform/junit-platform-engine/1.2.0/junit-platform-engine-1.2.0.pom
[INFO] Downloaded: https://repo.maven.apache.org/maven2/org/junit/platform/junit-platform-engine/1.2.0/junit-platform-engine-1.2.0.pom (3 KB at 68.7 KB/sec)
[INFO] Downloading: https://repo.maven.apache.org/maven2/org/junit/platform/junit-platform-commons/1.2.0/junit-platform-commons-1.2.0.pom
[INFO] Downloaded: https://repo.maven.apache.org/maven2/org/junit/platform/junit-platform-commons/1.2.0/junit-platform-commons-1.2.0.pom (2 KB at 53.4 KB/sec)
[INFO] Downloading: https://repo.maven.apache.org/maven2/org/opentest4j/opentest4j/1.1.0/opentest4j-1.1.0.pom
[INFO] Downloaded: https://repo.maven.apache.org/maven2/org/opentest4j/opentest4j/1.1.0/opentest4j-1.1.0.pom (2 KB at 49.8 KB/sec)
[INFO] Downloading: https://repo.maven.apache.org/maven2/org/junit/platform/junit-platform-commons/1.2.0/junit-platform-commons-1.2.0.jar
[INFO] Downloading: https://repo.maven.apache.org/maven2/org/junit/platform/junit-platform-engine/1.2.0/junit-platform-engine-1.2.0.jar
[INFO] Downloading: https://repo.maven.apache.org/maven2/org/junit/platform/junit-platform-launcher/1.2.0/junit-platform-launcher-1.2.0.jar
[INFO] Downloading: https://repo.maven.apache.org/maven2/org/opentest4j/opentest4j/1.1.0/opentest4j-1.1.0.jar
[INFO] Downloading: https://repo.maven.apache.org/maven2/org/apache/maven/surefire/surefire-junit-platform/2.22.0/surefire-junit-platform-2.22.0.jar
[INFO] Downloaded: https://repo.maven.apache.org/maven2/org/opentest4j/opentest4j/1.1.0/opentest4j-1.1.0.jar (7 KB at 81.2 KB/sec)
[INFO] Downloaded: https://repo.maven.apache.org/maven2/org/junit/platform/junit-platform-commons/1.2.0/junit-platform-commons-1.2.0.jar (77 KB at 910.2 KB/sec)
[INFO] Downloaded: https://repo.maven.apache.org/maven2/org/junit/platform/junit-platform-engine/1.2.0/junit-platform-engine-1.2.0.jar (88 KB at 645.8 KB/sec)
[INFO] Downloaded: https://repo.maven.apache.org/maven2/org/apache/maven/surefire/surefire-junit-platform/2.22.0/surefire-junit-platform-2.22.0.jar (65 KB at 473.2 KB/sec)
[INFO] Downloaded: https://repo.maven.apache.org/maven2/org/junit/platform/junit-platform-launcher/1.2.0/junit-platform-launcher-1.2.0.jar (79 KB at 551.3 KB/sec)
[INFO] 
[INFO] -------------------------------------------------------
[INFO]  T E S T S
[INFO] -------------------------------------------------------
[INFO] Running se.haleby.rps.port.http.GameHttpApiTest
2018-10-05 20:07:41.095 [main] INFO  se.haleby.rps.GameServer - Starting GameServer with args: GameServer.CmdArgs(staticDirectories=[/static, /compiled-static], directoriesLoadLocation=CLASSPATH, port=8080, rounds=3, help=false)
2018-10-05 20:07:41.189 [main] INFO  org.eclipse.jetty.util.log - Logging initialized @1428ms to org.eclipse.jetty.util.log.Slf4jLog
2018-10-05 20:07:41.372 [main] INFO  io.javalin.Javalin - Starting Javalin ...
2018-10-05 20:07:41.420 [main] INFO  io.javalin.Javalin - Static file handler added with path=/static and location=CLASSPATH. Absolute path: 'file:///root/workspace/johanhaleby/rps-axon-elm/437750727/target/classes/static/'.
2018-10-05 20:07:41.423 [main] ERROR io.javalin.Javalin - Failed to start Javalin
java.lang.RuntimeException: Static resource directory with path: '/compiled-static' does not exist. Depending on your setup, empty folders might not get copied to classpath.
	at io.javalin.staticfiles.JettyResourceHandler.getResourcePath(JettyResourceHandler.kt:48)
	at io.javalin.staticfiles.JettyResourceHandler.<init>(JettyResourceHandler.kt:31)
	at io.javalin.Javalin.start(Javalin.java:122)
	at io.javalin.Javalin.start(Javalin.java:103)
	at se.haleby.rps.port.http.GameApi.start(GameApi.java:66)
	at se.haleby.rps.GameServer.start(GameServer.java:55)
	at se.haleby.rps.port.http.GameHttpApiTest.startServer(GameHttpApiTest.java:310)
	at sun.reflect.NativeMethodAccessorImpl.invoke0(Native Method)
	at sun.reflect.NativeMethodAccessorImpl.invoke(NativeMethodAccessorImpl.java:62)
	at sun.reflect.DelegatingMethodAccessorImpl.invoke(DelegatingMethodAccessorImpl.java:43)
	at java.lang.reflect.Method.invoke(Method.java:498)
	at org.junit.platform.commons.util.ReflectionUtils.invokeMethod(ReflectionUtils.java:515)
	at org.junit.jupiter.engine.execution.ExecutableInvoker.invoke(ExecutableInvoker.java:115)
	at org.junit.jupiter.engine.descriptor.ClassTestDescriptor.invokeMethodInExtensionContext(ClassTestDescriptor.java:436)
	at org.junit.jupiter.engine.descriptor.ClassTestDescriptor.lambda$synthesizeBeforeEachMethodAdapter$14(ClassTestDescriptor.java:424)
	at org.junit.jupiter.engine.descriptor.TestMethodTestDescriptor.lambda$invokeBeforeEachMethods$2(TestMethodTestDescriptor.java:136)
	at org.junit.platform.engine.support.hierarchical.ThrowableCollector.execute(ThrowableCollector.java:72)
	at org.junit.jupiter.engine.descriptor.TestMethodTestDescriptor.invokeBeforeMethodsOrCallbacksUntilExceptionOccurs(TestMethodTestDescriptor.java:156)
	at org.junit.jupiter.engine.descriptor.TestMethodTestDescriptor.invokeBeforeEachMethods(TestMethodTestDescriptor.java:135)
	at org.junit.jupiter.engine.descriptor.TestMethodTestDescriptor.execute(TestMethodTestDescriptor.java:110)
	at org.junit.jupiter.engine.descriptor.TestMethodTestDescriptor.execute(TestMethodTestDescriptor.java:59)
	at org.junit.platform.engine.support.hierarchical.NodeTestTask.lambda$executeRecursively$5(NodeTestTask.java:105)
	at org.junit.platform.engine.support.hierarchical.ThrowableCollector.execute(ThrowableCollector.java:72)
	at org.junit.platform.engine.support.hierarchical.NodeTestTask.executeRecursively(NodeTestTask.java:95)
	at org.junit.platform.engine.support.hierarchical.NodeTestTask.execute(NodeTestTask.java:71)
	at java.util.ArrayList.forEach(ArrayList.java:1249)
	at org.junit.platform.engine.support.hierarchical.SameThreadHierarchicalTestExecutorService.invokeAll(SameThreadHierarchicalTestExecutorService.java:38)
	at org.junit.platform.engine.support.hierarchical.NodeTestTask.lambda$executeRecursively$5(NodeTestTask.java:110)
	at org.junit.platform.engine.support.hierarchical.ThrowableCollector.execute(ThrowableCollector.java:72)
	at org.junit.platform.engine.support.hierarchical.NodeTestTask.executeRecursively(NodeTestTask.java:95)
	at org.junit.platform.engine.support.hierarchical.NodeTestTask.execute(NodeTestTask.java:71)
	at java.util.ArrayList.forEach(ArrayList.java:1249)
	at org.junit.platform.engine.support.hierarchical.SameThreadHierarchicalTestExecutorService.invokeAll(SameThreadHierarchicalTestExecutorService.java:38)
	at org.junit.platform.engine.support.hierarchical.NodeTestTask.lambda$executeRecursively$5(NodeTestTask.java:110)
	at org.junit.platform.engine.support.hierarchical.ThrowableCollector.execute(ThrowableCollector.java:72)
	at org.junit.platform.engine.support.hierarchical.NodeTestTask.executeRecursively(NodeTestTask.java:95)
	at org.junit.platform.engine.support.hierarchical.NodeTestTask.execute(NodeTestTask.java:71)
	at java.util.ArrayList.forEach(ArrayList.java:1249)
	at org.junit.platform.engine.support.hierarchical.SameThreadHierarchicalTestExecutorService.invokeAll(SameThreadHierarchicalTestExecutorService.java:38)
	at org.junit.platform.engine.support.hierarchical.NodeTestTask.lambda$executeRecursively$5(NodeTestTask.java:110)
	at org.junit.platform.engine.support.hierarchical.ThrowableCollector.execute(ThrowableCollector.java:72)
	at org.junit.platform.engine.support.hierarchical.NodeTestTask.executeRecursively(NodeTestTask.java:95)
	at org.junit.platform.engine.support.hierarchical.NodeTestTask.execute(NodeTestTask.java:71)
	at org.junit.platform.engine.support.hierarchical.SameThreadHierarchicalTestExecutorService.submit(SameThreadHierarchicalTestExecutorService.java:32)
	at org.junit.platform.engine.support.hierarchical.HierarchicalTestExecutor.execute(HierarchicalTestExecutor.java:57)
	at org.junit.platform.engine.support.hierarchical.HierarchicalTestEngine.execute(HierarchicalTestEngine.java:51)
	at org.junit.platform.launcher.core.DefaultLauncher.execute(DefaultLauncher.java:170)
	at org.junit.platform.launcher.core.DefaultLauncher.execute(DefaultLauncher.java:154)
	at org.junit.platform.launcher.core.DefaultLauncher.execute(DefaultLauncher.java:90)
	at org.apache.maven.surefire.junitplatform.JUnitPlatformProvider.invokeAllTests(JUnitPlatformProvider.java:142)
	at org.apache.maven.surefire.junitplatform.JUnitPlatformProvider.invoke(JUnitPlatformProvider.java:117)
	at org.apache.maven.surefire.booter.ForkedBooter.invokeProviderInSameClassLoader(ForkedBooter.java:383)
	at org.apache.maven.surefire.booter.ForkedBooter.runSuitesInProcess(ForkedBooter.java:344)
	at org.apache.maven.surefire.booter.ForkedBooter.execute(ForkedBooter.java:125)
	at org.apache.maven.surefire.booter.ForkedBooter.main(ForkedBooter.java:417)
2018-10-05 20:07:42.405 [main] INFO  io.javalin.Javalin - Stopping Javalin ...
2018-10-05 20:07:42.405 [main] INFO  io.javalin.Javalin - Javalin has stopped
2018-10-05 20:07:42.416 [main] INFO  se.haleby.rps.GameServer - Starting GameServer with args: GameServer.CmdArgs(staticDirectories=[/static, /compiled-static], directoriesLoadLocation=CLASSPATH, port=8080, rounds=3, help=false)
2018-10-05 20:07:42.424 [main] INFO  io.javalin.Javalin - Starting Javalin ...
2018-10-05 20:07:42.426 [main] INFO  io.javalin.Javalin - Static file handler added with path=/static and location=CLASSPATH. Absolute path: 'file:///root/workspace/johanhaleby/rps-axon-elm/437750727/target/classes/static/'.
2018-10-05 20:07:42.428 [main] ERROR io.javalin.Javalin - Failed to start Javalin
java.lang.RuntimeException: Static resource directory with path: '/compiled-static' does not exist. Depending on your setup, empty folders might not get copied to classpath.
	at io.javalin.staticfiles.JettyResourceHandler.getResourcePath(JettyResourceHandler.kt:48)
	at io.javalin.staticfiles.JettyResourceHandler.<init>(JettyResourceHandler.kt:31)
	at io.javalin.Javalin.start(Javalin.java:122)
	at io.javalin.Javalin.start(Javalin.java:103)
	at se.haleby.rps.port.http.GameApi.start(GameApi.java:66)
	at se.haleby.rps.GameServer.start(GameServer.java:55)
	at se.haleby.rps.port.http.GameHttpApiTest.startServer(GameHttpApiTest.java:310)
	at sun.reflect.NativeMethodAccessorImpl.invoke0(Native Method)
	at sun.reflect.NativeMethodAccessorImpl.invoke(NativeMethodAccessorImpl.java:62)
	at sun.reflect.DelegatingMethodAccessorImpl.invoke(DelegatingMethodAccessorImpl.java:43)
	at java.lang.reflect.Method.invoke(Method.java:498)
	at org.junit.platform.commons.util.ReflectionUtils.invokeMethod(ReflectionUtils.java:515)
	at org.junit.jupiter.engine.execution.ExecutableInvoker.invoke(ExecutableInvoker.java:115)
	at org.junit.jupiter.engine.descriptor.ClassTestDescriptor.invokeMethodInExtensionContext(ClassTestDescriptor.java:436)
	at org.junit.jupiter.engine.descriptor.ClassTestDescriptor.lambda$synthesizeBeforeEachMethodAdapter$14(ClassTestDescriptor.java:424)
	at org.junit.jupiter.engine.descriptor.TestMethodTestDescriptor.lambda$invokeBeforeEachMethods$2(TestMethodTestDescriptor.java:136)
	at org.junit.platform.engine.support.hierarchical.ThrowableCollector.execute(ThrowableCollector.java:72)
	at org.junit.jupiter.engine.descriptor.TestMethodTestDescriptor.invokeBeforeMethodsOrCallbacksUntilExceptionOccurs(TestMethodTestDescriptor.java:156)
	at org.junit.jupiter.engine.descriptor.TestMethodTestDescriptor.invokeBeforeEachMethods(TestMethodTestDescriptor.java:135)
	at org.junit.jupiter.engine.descriptor.TestMethodTestDescriptor.execute(TestMethodTestDescriptor.java:110)
	at org.junit.jupiter.engine.descriptor.TestMethodTestDescriptor.execute(TestMethodTestDescriptor.java:59)
	at org.junit.platform.engine.support.hierarchical.NodeTestTask.lambda$executeRecursively$5(NodeTestTask.java:105)
	at org.junit.platform.engine.support.hierarchical.ThrowableCollector.execute(ThrowableCollector.java:72)
	at org.junit.platform.engine.support.hierarchical.NodeTestTask.executeRecursively(NodeTestTask.java:95)
	at org.junit.platform.engine.support.hierarchical.NodeTestTask.execute(NodeTestTask.java:71)
	at java.util.ArrayList.forEach(ArrayList.java:1249)
	at org.junit.platform.engine.support.hierarchical.SameThreadHierarchicalTestExecutorService.invokeAll(SameThreadHierarchicalTestExecutorService.java:38)
	at org.junit.platform.engine.support.hierarchical.NodeTestTask.lambda$executeRecursively$5(NodeTestTask.java:110)
	at org.junit.platform.engine.support.hierarchical.ThrowableCollector.execute(ThrowableCollector.java:72)
	at org.junit.platform.engine.support.hierarchical.NodeTestTask.executeRecursively(NodeTestTask.java:95)
	at org.junit.platform.engine.support.hierarchical.NodeTestTask.execute(NodeTestTask.java:71)
	at java.util.ArrayList.forEach(ArrayList.java:1249)
	at org.junit.platform.engine.support.hierarchical.SameThreadHierarchicalTestExecutorService.invokeAll(SameThreadHierarchicalTestExecutorService.java:38)
	at org.junit.platform.engine.support.hierarchical.NodeTestTask.lambda$executeRecursively$5(NodeTestTask.java:110)
	at org.junit.platform.engine.support.hierarchical.ThrowableCollector.execute(ThrowableCollector.java:72)
	at org.junit.platform.engine.support.hierarchical.NodeTestTask.executeRecursively(NodeTestTask.java:95)
	at org.junit.platform.engine.support.hierarchical.NodeTestTask.execute(NodeTestTask.java:71)
	at java.util.ArrayList.forEach(ArrayList.java:1249)
	at org.junit.platform.engine.support.hierarchical.SameThreadHierarchicalTestExecutorService.invokeAll(SameThreadHierarchicalTestExecutorService.java:38)
	at org.junit.platform.engine.support.hierarchical.NodeTestTask.lambda$executeRecursively$5(NodeTestTask.java:110)
	at org.junit.platform.engine.support.hierarchical.ThrowableCollector.execute(ThrowableCollector.java:72)
	at org.junit.platform.engine.support.hierarchical.NodeTestTask.executeRecursively(NodeTestTask.java:95)
	at org.junit.platform.engine.support.hierarchical.NodeTestTask.execute(NodeTestTask.java:71)
	at org.junit.platform.engine.support.hierarchical.SameThreadHierarchicalTestExecutorService.submit(SameThreadHierarchicalTestExecutorService.java:32)
	at org.junit.platform.engine.support.hierarchical.HierarchicalTestExecutor.execute(HierarchicalTestExecutor.java:57)
	at org.junit.platform.engine.support.hierarchical.HierarchicalTestEngine.execute(HierarchicalTestEngine.java:51)
	at org.junit.platform.launcher.core.DefaultLauncher.execute(DefaultLauncher.java:170)
	at org.junit.platform.launcher.core.DefaultLauncher.execute(DefaultLauncher.java:154)
	at org.junit.platform.launcher.core.DefaultLauncher.execute(DefaultLauncher.java:90)
	at org.apache.maven.surefire.junitplatform.JUnitPlatformProvider.invokeAllTests(JUnitPlatformProvider.java:142)
	at org.apache.maven.surefire.junitplatform.JUnitPlatformProvider.invoke(JUnitPlatformProvider.java:117)
	at org.apache.maven.surefire.booter.ForkedBooter.invokeProviderInSameClassLoader(ForkedBooter.java:383)
	at org.apache.maven.surefire.booter.ForkedBooter.runSuitesInProcess(ForkedBooter.java:344)
	at org.apache.maven.surefire.booter.ForkedBooter.execute(ForkedBooter.java:125)
	at org.apache.maven.surefire.booter.ForkedBooter.main(ForkedBooter.java:417)
2018-10-05 20:07:42.472 [main] INFO  io.javalin.Javalin - Stopping Javalin ...
2018-10-05 20:07:42.472 [main] INFO  io.javalin.Javalin - Javalin has stopped
2018-10-05 20:07:42.478 [main] INFO  se.haleby.rps.GameServer - Starting GameServer with args: GameServer.CmdArgs(staticDirectories=[/static, /compiled-static], directoriesLoadLocation=CLASSPATH, port=8080, rounds=3, help=false)
2018-10-05 20:07:42.487 [main] INFO  io.javalin.Javalin - Starting Javalin ...
2018-10-05 20:07:42.488 [main] INFO  io.javalin.Javalin - Static file handler added with path=/static and location=CLASSPATH. Absolute path: 'file:///root/workspace/johanhaleby/rps-axon-elm/437750727/target/classes/static/'.
2018-10-05 20:07:42.489 [main] ERROR io.javalin.Javalin - Failed to start Javalin
java.lang.RuntimeException: Static resource directory with path: '/compiled-static' does not exist. Depending on your setup, empty folders might not get copied to classpath.
	at io.javalin.staticfiles.JettyResourceHandler.getResourcePath(JettyResourceHandler.kt:48)
	at io.javalin.staticfiles.JettyResourceHandler.<init>(JettyResourceHandler.kt:31)
	at io.javalin.Javalin.start(Javalin.java:122)
	at io.javalin.Javalin.start(Javalin.java:103)
	at se.haleby.rps.port.http.GameApi.start(GameApi.java:66)
	at se.haleby.rps.GameServer.start(GameServer.java:55)
	at se.haleby.rps.port.http.GameHttpApiTest.startServer(GameHttpApiTest.java:310)
	at sun.reflect.NativeMethodAccessorImpl.invoke0(Native Method)
	at sun.reflect.NativeMethodAccessorImpl.invoke(NativeMethodAccessorImpl.java:62)
	at sun.reflect.DelegatingMethodAccessorImpl.invoke(DelegatingMethodAccessorImpl.java:43)
	at java.lang.reflect.Method.invoke(Method.java:498)
	at org.junit.platform.commons.util.ReflectionUtils.invokeMethod(ReflectionUtils.java:515)
	at org.junit.jupiter.engine.execution.ExecutableInvoker.invoke(ExecutableInvoker.java:115)
	at org.junit.jupiter.engine.descriptor.ClassTestDescriptor.invokeMethodInExtensionContext(ClassTestDescriptor.java:436)
	at org.junit.jupiter.engine.descriptor.ClassTestDescriptor.lambda$synthesizeBeforeEachMethodAdapter$14(ClassTestDescriptor.java:424)
	at org.junit.jupiter.engine.descriptor.TestMethodTestDescriptor.lambda$invokeBeforeEachMethods$2(TestMethodTestDescriptor.java:136)
	at org.junit.platform.engine.support.hierarchical.ThrowableCollector.execute(ThrowableCollector.java:72)
	at org.junit.jupiter.engine.descriptor.TestMethodTestDescriptor.invokeBeforeMethodsOrCallbacksUntilExceptionOccurs(TestMethodTestDescriptor.java:156)
	at org.junit.jupiter.engine.descriptor.TestMethodTestDescriptor.invokeBeforeEachMethods(TestMethodTestDescriptor.java:135)
	at org.junit.jupiter.engine.descriptor.TestMethodTestDescriptor.execute(TestMethodTestDescriptor.java:110)
	at org.junit.jupiter.engine.descriptor.TestMethodTestDescriptor.execute(TestMethodTestDescriptor.java:59)
	at org.junit.platform.engine.support.hierarchical.NodeTestTask.lambda$executeRecursively$5(NodeTestTask.java:105)
	at org.junit.platform.engine.support.hierarchical.ThrowableCollector.execute(ThrowableCollector.java:72)
	at org.junit.platform.engine.support.hierarchical.NodeTestTask.executeRecursively(NodeTestTask.java:95)
	at org.junit.platform.engine.support.hierarchical.NodeTestTask.execute(NodeTestTask.java:71)
	at java.util.ArrayList.forEach(ArrayList.java:1249)
	at org.junit.platform.engine.support.hierarchical.SameThreadHierarchicalTestExecutorService.invokeAll(SameThreadHierarchicalTestExecutorService.java:38)
	at org.junit.platform.engine.support.hierarchical.NodeTestTask.lambda$executeRecursively$5(NodeTestTask.java:110)
	at org.junit.platform.engine.support.hierarchical.ThrowableCollector.execute(ThrowableCollector.java:72)
	at org.junit.platform.engine.support.hierarchical.NodeTestTask.executeRecursively(NodeTestTask.java:95)
	at org.junit.platform.engine.support.hierarchical.NodeTestTask.execute(NodeTestTask.java:71)
	at java.util.ArrayList.forEach(ArrayList.java:1249)
	at org.junit.platform.engine.support.hierarchical.SameThreadHierarchicalTestExecutorService.invokeAll(SameThreadHierarchicalTestExecutorService.java:38)
	at org.junit.platform.engine.support.hierarchical.NodeTestTask.lambda$executeRecursively$5(NodeTestTask.java:110)
	at org.junit.platform.engine.support.hierarchical.ThrowableCollector.execute(ThrowableCollector.java:72)
	at org.junit.platform.engine.support.hierarchical.NodeTestTask.executeRecursively(NodeTestTask.java:95)
	at org.junit.platform.engine.support.hierarchical.NodeTestTask.execute(NodeTestTask.java:71)
	at java.util.ArrayList.forEach(ArrayList.java:1249)
	at org.junit.platform.engine.support.hierarchical.SameThreadHierarchicalTestExecutorService.invokeAll(SameThreadHierarchicalTestExecutorService.java:38)
	at org.junit.platform.engine.support.hierarchical.NodeTestTask.lambda$executeRecursively$5(NodeTestTask.java:110)
	at org.junit.platform.engine.support.hierarchical.ThrowableCollector.execute(ThrowableCollector.java:72)
	at org.junit.platform.engine.support.hierarchical.NodeTestTask.executeRecursively(NodeTestTask.java:95)
	at org.junit.platform.engine.support.hierarchical.NodeTestTask.execute(NodeTestTask.java:71)
	at org.junit.platform.engine.support.hierarchical.SameThreadHierarchicalTestExecutorService.submit(SameThreadHierarchicalTestExecutorService.java:32)
	at org.junit.platform.engine.support.hierarchical.HierarchicalTestExecutor.execute(HierarchicalTestExecutor.java:57)
	at org.junit.platform.engine.support.hierarchical.HierarchicalTestEngine.execute(HierarchicalTestEngine.java:51)
	at org.junit.platform.launcher.core.DefaultLauncher.execute(DefaultLauncher.java:170)
	at org.junit.platform.launcher.core.DefaultLauncher.execute(DefaultLauncher.java:154)
	at org.junit.platform.launcher.core.DefaultLauncher.execute(DefaultLauncher.java:90)
	at org.apache.maven.surefire.junitplatform.JUnitPlatformProvider.invokeAllTests(JUnitPlatformProvider.java:142)
	at org.apache.maven.surefire.junitplatform.JUnitPlatformProvider.invoke(JUnitPlatformProvider.java:117)
	at org.apache.maven.surefire.booter.ForkedBooter.invokeProviderInSameClassLoader(ForkedBooter.java:383)
	at org.apache.maven.surefire.booter.ForkedBooter.runSuitesInProcess(ForkedBooter.java:344)
	at org.apache.maven.surefire.booter.ForkedBooter.execute(ForkedBooter.java:125)
	at org.apache.maven.surefire.booter.ForkedBooter.main(ForkedBooter.java:417)
2018-10-05 20:07:42.511 [main] INFO  io.javalin.Javalin - Stopping Javalin ...
2018-10-05 20:07:42.511 [main] INFO  io.javalin.Javalin - Javalin has stopped
2018-10-05 20:07:42.513 [main] INFO  se.haleby.rps.GameServer - Starting GameServer with args: GameServer.CmdArgs(staticDirectories=[/static, /compiled-static], directoriesLoadLocation=CLASSPATH, port=8080, rounds=3, help=false)
2018-10-05 20:07:42.518 [main] INFO  io.javalin.Javalin - Starting Javalin ...
2018-10-05 20:07:42.519 [main] INFO  io.javalin.Javalin - Static file handler added with path=/static and location=CLASSPATH. Absolute path: 'file:///root/workspace/johanhaleby/rps-axon-elm/437750727/target/classes/static/'.
2018-10-05 20:07:42.520 [main] ERROR io.javalin.Javalin - Failed to start Javalin
java.lang.RuntimeException: Static resource directory with path: '/compiled-static' does not exist. Depending on your setup, empty folders might not get copied to classpath.
	at io.javalin.staticfiles.JettyResourceHandler.getResourcePath(JettyResourceHandler.kt:48)
	at io.javalin.staticfiles.JettyResourceHandler.<init>(JettyResourceHandler.kt:31)
	at io.javalin.Javalin.start(Javalin.java:122)
	at io.javalin.Javalin.start(Javalin.java:103)
	at se.haleby.rps.port.http.GameApi.start(GameApi.java:66)
	at se.haleby.rps.GameServer.start(GameServer.java:55)
	at se.haleby.rps.port.http.GameHttpApiTest.startServer(GameHttpApiTest.java:310)
	at sun.reflect.NativeMethodAccessorImpl.invoke0(Native Method)
	at sun.reflect.NativeMethodAccessorImpl.invoke(NativeMethodAccessorImpl.java:62)
	at sun.reflect.DelegatingMethodAccessorImpl.invoke(DelegatingMethodAccessorImpl.java:43)
	at java.lang.reflect.Method.invoke(Method.java:498)
	at org.junit.platform.commons.util.ReflectionUtils.invokeMethod(ReflectionUtils.java:515)
	at org.junit.jupiter.engine.execution.ExecutableInvoker.invoke(ExecutableInvoker.java:115)
	at org.junit.jupiter.engine.descriptor.ClassTestDescriptor.invokeMethodInExtensionContext(ClassTestDescriptor.java:436)
	at org.junit.jupiter.engine.descriptor.ClassTestDescriptor.lambda$synthesizeBeforeEachMethodAdapter$14(ClassTestDescriptor.java:424)
	at org.junit.jupiter.engine.descriptor.TestMethodTestDescriptor.lambda$invokeBeforeEachMethods$2(TestMethodTestDescriptor.java:136)
	at org.junit.platform.engine.support.hierarchical.ThrowableCollector.execute(ThrowableCollector.java:72)
	at org.junit.jupiter.engine.descriptor.TestMethodTestDescriptor.invokeBeforeMethodsOrCallbacksUntilExceptionOccurs(TestMethodTestDescriptor.java:156)
	at org.junit.jupiter.engine.descriptor.TestMethodTestDescriptor.invokeBeforeEachMethods(TestMethodTestDescriptor.java:135)
	at org.junit.jupiter.engine.descriptor.TestMethodTestDescriptor.execute(TestMethodTestDescriptor.java:110)
	at org.junit.jupiter.engine.descriptor.TestMethodTestDescriptor.execute(TestMethodTestDescriptor.java:59)
	at org.junit.platform.engine.support.hierarchical.NodeTestTask.lambda$executeRecursively$5(NodeTestTask.java:105)
	at org.junit.platform.engine.support.hierarchical.ThrowableCollector.execute(ThrowableCollector.java:72)
	at org.junit.platform.engine.support.hierarchical.NodeTestTask.executeRecursively(NodeTestTask.java:95)
	at org.junit.platform.engine.support.hierarchical.NodeTestTask.execute(NodeTestTask.java:71)
	at java.util.ArrayList.forEach(ArrayList.java:1249)
	at org.junit.platform.engine.support.hierarchical.SameThreadHierarchicalTestExecutorService.invokeAll(SameThreadHierarchicalTestExecutorService.java:38)
	at org.junit.platform.engine.support.hierarchical.NodeTestTask.lambda$executeRecursively$5(NodeTestTask.java:110)
	at org.junit.platform.engine.support.hierarchical.ThrowableCollector.execute(ThrowableCollector.java:72)
	at org.junit.platform.engine.support.hierarchical.NodeTestTask.executeRecursively(NodeTestTask.java:95)
	at org.junit.platform.engine.support.hierarchical.NodeTestTask.execute(NodeTestTask.java:71)
	at java.util.ArrayList.forEach(ArrayList.java:1249)
	at org.junit.platform.engine.support.hierarchical.SameThreadHierarchicalTestExecutorService.invokeAll(SameThreadHierarchicalTestExecutorService.java:38)
	at org.junit.platform.engine.support.hierarchical.NodeTestTask.lambda$executeRecursively$5(NodeTestTask.java:110)
	at org.junit.platform.engine.support.hierarchical.ThrowableCollector.execute(ThrowableCollector.java:72)
	at org.junit.platform.engine.support.hierarchical.NodeTestTask.executeRecursively(NodeTestTask.java:95)
	at org.junit.platform.engine.support.hierarchical.NodeTestTask.execute(NodeTestTask.java:71)
	at java.util.ArrayList.forEach(ArrayList.java:1249)
	at org.junit.platform.engine.support.hierarchical.SameThreadHierarchicalTestExecutorService.invokeAll(SameThreadHierarchicalTestExecutorService.java:38)
	at org.junit.platform.engine.support.hierarchical.NodeTestTask.lambda$executeRecursively$5(NodeTestTask.java:110)
	at org.junit.platform.engine.support.hierarchical.ThrowableCollector.execute(ThrowableCollector.java:72)
	at org.junit.platform.engine.support.hierarchical.NodeTestTask.executeRecursively(NodeTestTask.java:95)
	at org.junit.platform.engine.support.hierarchical.NodeTestTask.execute(NodeTestTask.java:71)
	at org.junit.platform.engine.support.hierarchical.SameThreadHierarchicalTestExecutorService.submit(SameThreadHierarchicalTestExecutorService.java:32)
	at org.junit.platform.engine.support.hierarchical.HierarchicalTestExecutor.execute(HierarchicalTestExecutor.java:57)
	at org.junit.platform.engine.support.hierarchical.HierarchicalTestEngine.execute(HierarchicalTestEngine.java:51)
	at org.junit.platform.launcher.core.DefaultLauncher.execute(DefaultLauncher.java:170)
	at org.junit.platform.launcher.core.DefaultLauncher.execute(DefaultLauncher.java:154)
	at org.junit.platform.launcher.core.DefaultLauncher.execute(DefaultLauncher.java:90)
	at org.apache.maven.surefire.junitplatform.JUnitPlatformProvider.invokeAllTests(JUnitPlatformProvider.java:142)
	at org.apache.maven.surefire.junitplatform.JUnitPlatformProvider.invoke(JUnitPlatformProvider.java:117)
	at org.apache.maven.surefire.booter.ForkedBooter.invokeProviderInSameClassLoader(ForkedBooter.java:383)
	at org.apache.maven.surefire.booter.ForkedBooter.runSuitesInProcess(ForkedBooter.java:344)
	at org.apache.maven.surefire.booter.ForkedBooter.execute(ForkedBooter.java:125)
	at org.apache.maven.surefire.booter.ForkedBooter.main(ForkedBooter.java:417)
2018-10-05 20:07:42.540 [main] INFO  io.javalin.Javalin - Stopping Javalin ...
2018-10-05 20:07:42.540 [main] INFO  io.javalin.Javalin - Javalin has stopped
2018-10-05 20:07:42.542 [main] INFO  se.haleby.rps.GameServer - Starting GameServer with args: GameServer.CmdArgs(staticDirectories=[/static, /compiled-static], directoriesLoadLocation=CLASSPATH, port=8080, rounds=3, help=false)
2018-10-05 20:07:42.549 [main] INFO  io.javalin.Javalin - Starting Javalin ...
2018-10-05 20:07:42.551 [main] INFO  io.javalin.Javalin - Static file handler added with path=/static and location=CLASSPATH. Absolute path: 'file:///root/workspace/johanhaleby/rps-axon-elm/437750727/target/classes/static/'.
2018-10-05 20:07:42.552 [main] ERROR io.javalin.Javalin - Failed to start Javalin
java.lang.RuntimeException: Static resource directory with path: '/compiled-static' does not exist. Depending on your setup, empty folders might not get copied to classpath.
	at io.javalin.staticfiles.JettyResourceHandler.getResourcePath(JettyResourceHandler.kt:48)
	at io.javalin.staticfiles.JettyResourceHandler.<init>(JettyResourceHandler.kt:31)
	at io.javalin.Javalin.start(Javalin.java:122)
	at io.javalin.Javalin.start(Javalin.java:103)
	at se.haleby.rps.port.http.GameApi.start(GameApi.java:66)
	at se.haleby.rps.GameServer.start(GameServer.java:55)
	at se.haleby.rps.port.http.GameHttpApiTest.startServer(GameHttpApiTest.java:310)
	at sun.reflect.NativeMethodAccessorImpl.invoke0(Native Method)
	at sun.reflect.NativeMethodAccessorImpl.invoke(NativeMethodAccessorImpl.java:62)
	at sun.reflect.DelegatingMethodAccessorImpl.invoke(DelegatingMethodAccessorImpl.java:43)
	at java.lang.reflect.Method.invoke(Method.java:498)
	at org.junit.platform.commons.util.ReflectionUtils.invokeMethod(ReflectionUtils.java:515)
	at org.junit.jupiter.engine.execution.ExecutableInvoker.invoke(ExecutableInvoker.java:115)
	at org.junit.jupiter.engine.descriptor.ClassTestDescriptor.invokeMethodInExtensionContext(ClassTestDescriptor.java:436)
	at org.junit.jupiter.engine.descriptor.ClassTestDescriptor.lambda$synthesizeBeforeEachMethodAdapter$14(ClassTestDescriptor.java:424)
	at org.junit.jupiter.engine.descriptor.TestMethodTestDescriptor.lambda$invokeBeforeEachMethods$2(TestMethodTestDescriptor.java:136)
	at org.junit.platform.engine.support.hierarchical.ThrowableCollector.execute(ThrowableCollector.java:72)
	at org.junit.jupiter.engine.descriptor.TestMethodTestDescriptor.invokeBeforeMethodsOrCallbacksUntilExceptionOccurs(TestMethodTestDescriptor.java:156)
	at org.junit.jupiter.engine.descriptor.TestMethodTestDescriptor.invokeBeforeEachMethods(TestMethodTestDescriptor.java:135)
	at org.junit.jupiter.engine.descriptor.TestMethodTestDescriptor.execute(TestMethodTestDescriptor.java:110)
	at org.junit.jupiter.engine.descriptor.TestMethodTestDescriptor.execute(TestMethodTestDescriptor.java:59)
	at org.junit.platform.engine.support.hierarchical.NodeTestTask.lambda$executeRecursively$5(NodeTestTask.java:105)
	at org.junit.platform.engine.support.hierarchical.ThrowableCollector.execute(ThrowableCollector.java:72)
	at org.junit.platform.engine.support.hierarchical.NodeTestTask.executeRecursively(NodeTestTask.java:95)
	at org.junit.platform.engine.support.hierarchical.NodeTestTask.execute(NodeTestTask.java:71)
	at java.util.ArrayList.forEach(ArrayList.java:1249)
	at org.junit.platform.engine.support.hierarchical.SameThreadHierarchicalTestExecutorService.invokeAll(SameThreadHierarchicalTestExecutorService.java:38)
	at org.junit.platform.engine.support.hierarchical.NodeTestTask.lambda$executeRecursively$5(NodeTestTask.java:110)
	at org.junit.platform.engine.support.hierarchical.ThrowableCollector.execute(ThrowableCollector.java:72)
	at org.junit.platform.engine.support.hierarchical.NodeTestTask.executeRecursively(NodeTestTask.java:95)
	at org.junit.platform.engine.support.hierarchical.NodeTestTask.execute(NodeTestTask.java:71)
	at java.util.ArrayList.forEach(ArrayList.java:1249)
	at org.junit.platform.engine.support.hierarchical.SameThreadHierarchicalTestExecutorService.invokeAll(SameThreadHierarchicalTestExecutorService.java:38)
	at org.junit.platform.engine.support.hierarchical.NodeTestTask.lambda$executeRecursively$5(NodeTestTask.java:110)
	at org.junit.platform.engine.support.hierarchical.ThrowableCollector.execute(ThrowableCollector.java:72)
	at org.junit.platform.engine.support.hierarchical.NodeTestTask.executeRecursively(NodeTestTask.java:95)
	at org.junit.platform.engine.support.hierarchical.NodeTestTask.execute(NodeTestTask.java:71)
	at java.util.ArrayList.forEach(ArrayList.java:1249)
	at org.junit.platform.engine.support.hierarchical.SameThreadHierarchicalTestExecutorService.invokeAll(SameThreadHierarchicalTestExecutorService.java:38)
	at org.junit.platform.engine.support.hierarchical.NodeTestTask.lambda$executeRecursively$5(NodeTestTask.java:110)
	at org.junit.platform.engine.support.hierarchical.ThrowableCollector.execute(ThrowableCollector.java:72)
	at org.junit.platform.engine.support.hierarchical.NodeTestTask.executeRecursively(NodeTestTask.java:95)
	at org.junit.platform.engine.support.hierarchical.NodeTestTask.execute(NodeTestTask.java:71)
	at org.junit.platform.engine.support.hierarchical.SameThreadHierarchicalTestExecutorService.submit(SameThreadHierarchicalTestExecutorService.java:32)
	at org.junit.platform.engine.support.hierarchical.HierarchicalTestExecutor.execute(HierarchicalTestExecutor.java:57)
	at org.junit.platform.engine.support.hierarchical.HierarchicalTestEngine.execute(HierarchicalTestEngine.java:51)
	at org.junit.platform.launcher.core.DefaultLauncher.execute(DefaultLauncher.java:170)
	at org.junit.platform.launcher.core.DefaultLauncher.execute(DefaultLauncher.java:154)
	at org.junit.platform.launcher.core.DefaultLauncher.execute(DefaultLauncher.java:90)
	at org.apache.maven.surefire.junitplatform.JUnitPlatformProvider.invokeAllTests(JUnitPlatformProvider.java:142)
	at org.apache.maven.surefire.junitplatform.JUnitPlatformProvider.invoke(JUnitPlatformProvider.java:117)
	at org.apache.maven.surefire.booter.ForkedBooter.invokeProviderInSameClassLoader(ForkedBooter.java:383)
	at org.apache.maven.surefire.booter.ForkedBooter.runSuitesInProcess(ForkedBooter.java:344)
	at org.apache.maven.surefire.booter.ForkedBooter.execute(ForkedBooter.java:125)
	at org.apache.maven.surefire.booter.ForkedBooter.main(ForkedBooter.java:417)
2018-10-05 20:07:42.574 [main] INFO  io.javalin.Javalin - Stopping Javalin ...
2018-10-05 20:07:42.574 [main] INFO  io.javalin.Javalin - Javalin has stopped
2018-10-05 20:07:42.576 [main] INFO  se.haleby.rps.GameServer - Starting GameServer with args: GameServer.CmdArgs(staticDirectories=[/static, /compiled-static], directoriesLoadLocation=CLASSPATH, port=8080, rounds=3, help=false)
2018-10-05 20:07:42.584 [main] INFO  io.javalin.Javalin - Starting Javalin ...
2018-10-05 20:07:42.586 [main] INFO  io.javalin.Javalin - Static file handler added with path=/static and location=CLASSPATH. Absolute path: 'file:///root/workspace/johanhaleby/rps-axon-elm/437750727/target/classes/static/'.
2018-10-05 20:07:42.586 [main] ERROR io.javalin.Javalin - Failed to start Javalin
java.lang.RuntimeException: Static resource directory with path: '/compiled-static' does not exist. Depending on your setup, empty folders might not get copied to classpath.
	at io.javalin.staticfiles.JettyResourceHandler.getResourcePath(JettyResourceHandler.kt:48)
	at io.javalin.staticfiles.JettyResourceHandler.<init>(JettyResourceHandler.kt:31)
	at io.javalin.Javalin.start(Javalin.java:122)
	at io.javalin.Javalin.start(Javalin.java:103)
	at se.haleby.rps.port.http.GameApi.start(GameApi.java:66)
	at se.haleby.rps.GameServer.start(GameServer.java:55)
	at se.haleby.rps.port.http.GameHttpApiTest.startServer(GameHttpApiTest.java:310)
	at sun.reflect.NativeMethodAccessorImpl.invoke0(Native Method)
	at sun.reflect.NativeMethodAccessorImpl.invoke(NativeMethodAccessorImpl.java:62)
	at sun.reflect.DelegatingMethodAccessorImpl.invoke(DelegatingMethodAccessorImpl.java:43)
	at java.lang.reflect.Method.invoke(Method.java:498)
	at org.junit.platform.commons.util.ReflectionUtils.invokeMethod(ReflectionUtils.java:515)
	at org.junit.jupiter.engine.execution.ExecutableInvoker.invoke(ExecutableInvoker.java:115)
	at org.junit.jupiter.engine.descriptor.ClassTestDescriptor.invokeMethodInExtensionContext(ClassTestDescriptor.java:436)
	at org.junit.jupiter.engine.descriptor.ClassTestDescriptor.lambda$synthesizeBeforeEachMethodAdapter$14(ClassTestDescriptor.java:424)
	at org.junit.jupiter.engine.descriptor.TestMethodTestDescriptor.lambda$invokeBeforeEachMethods$2(TestMethodTestDescriptor.java:136)
	at org.junit.platform.engine.support.hierarchical.ThrowableCollector.execute(ThrowableCollector.java:72)
	at org.junit.jupiter.engine.descriptor.TestMethodTestDescriptor.invokeBeforeMethodsOrCallbacksUntilExceptionOccurs(TestMethodTestDescriptor.java:156)
	at org.junit.jupiter.engine.descriptor.TestMethodTestDescriptor.invokeBeforeEachMethods(TestMethodTestDescriptor.java:135)
	at org.junit.jupiter.engine.descriptor.TestMethodTestDescriptor.execute(TestMethodTestDescriptor.java:110)
	at org.junit.jupiter.engine.descriptor.TestMethodTestDescriptor.execute(TestMethodTestDescriptor.java:59)
	at org.junit.platform.engine.support.hierarchical.NodeTestTask.lambda$executeRecursively$5(NodeTestTask.java:105)
	at org.junit.platform.engine.support.hierarchical.ThrowableCollector.execute(ThrowableCollector.java:72)
	at org.junit.platform.engine.support.hierarchical.NodeTestTask.executeRecursively(NodeTestTask.java:95)
	at org.junit.platform.engine.support.hierarchical.NodeTestTask.execute(NodeTestTask.java:71)
	at java.util.ArrayList.forEach(ArrayList.java:1249)
	at org.junit.platform.engine.support.hierarchical.SameThreadHierarchicalTestExecutorService.invokeAll(SameThreadHierarchicalTestExecutorService.java:38)
	at org.junit.platform.engine.support.hierarchical.NodeTestTask.lambda$executeRecursively$5(NodeTestTask.java:110)
	at org.junit.platform.engine.support.hierarchical.ThrowableCollector.execute(ThrowableCollector.java:72)
	at org.junit.platform.engine.support.hierarchical.NodeTestTask.executeRecursively(NodeTestTask.java:95)
	at org.junit.platform.engine.support.hierarchical.NodeTestTask.execute(NodeTestTask.java:71)
	at java.util.ArrayList.forEach(ArrayList.java:1249)
	at org.junit.platform.engine.support.hierarchical.SameThreadHierarchicalTestExecutorService.invokeAll(SameThreadHierarchicalTestExecutorService.java:38)
	at org.junit.platform.engine.support.hierarchical.NodeTestTask.lambda$executeRecursively$5(NodeTestTask.java:110)
	at org.junit.platform.engine.support.hierarchical.ThrowableCollector.execute(ThrowableCollector.java:72)
	at org.junit.platform.engine.support.hierarchical.NodeTestTask.executeRecursively(NodeTestTask.java:95)
	at org.junit.platform.engine.support.hierarchical.NodeTestTask.execute(NodeTestTask.java:71)
	at java.util.ArrayList.forEach(ArrayList.java:1249)
	at org.junit.platform.engine.support.hierarchical.SameThreadHierarchicalTestExecutorService.invokeAll(SameThreadHierarchicalTestExecutorService.java:38)
	at org.junit.platform.engine.support.hierarchical.NodeTestTask.lambda$executeRecursively$5(NodeTestTask.java:110)
	at org.junit.platform.engine.support.hierarchical.ThrowableCollector.execute(ThrowableCollector.java:72)
	at org.junit.platform.engine.support.hierarchical.NodeTestTask.executeRecursively(NodeTestTask.java:95)
	at org.junit.platform.engine.support.hierarchical.NodeTestTask.execute(NodeTestTask.java:71)
	at org.junit.platform.engine.support.hierarchical.SameThreadHierarchicalTestExecutorService.submit(SameThreadHierarchicalTestExecutorService.java:32)
	at org.junit.platform.engine.support.hierarchical.HierarchicalTestExecutor.execute(HierarchicalTestExecutor.java:57)
	at org.junit.platform.engine.support.hierarchical.HierarchicalTestEngine.execute(HierarchicalTestEngine.java:51)
	at org.junit.platform.launcher.core.DefaultLauncher.execute(DefaultLauncher.java:170)
	at org.junit.platform.launcher.core.DefaultLauncher.execute(DefaultLauncher.java:154)
	at org.junit.platform.launcher.core.DefaultLauncher.execute(DefaultLauncher.java:90)
	at org.apache.maven.surefire.junitplatform.JUnitPlatformProvider.invokeAllTests(JUnitPlatformProvider.java:142)
	at org.apache.maven.surefire.junitplatform.JUnitPlatformProvider.invoke(JUnitPlatformProvider.java:117)
	at org.apache.maven.surefire.booter.ForkedBooter.invokeProviderInSameClassLoader(ForkedBooter.java:383)
	at org.apache.maven.surefire.booter.ForkedBooter.runSuitesInProcess(ForkedBooter.java:344)
	at org.apache.maven.surefire.booter.ForkedBooter.execute(ForkedBooter.java:125)
	at org.apache.maven.surefire.booter.ForkedBooter.main(ForkedBooter.java:417)
2018-10-05 20:07:42.609 [main] INFO  io.javalin.Javalin - Stopping Javalin ...
2018-10-05 20:07:42.610 [main] INFO  io.javalin.Javalin - Javalin has stopped
2018-10-05 20:07:42.612 [main] INFO  se.haleby.rps.GameServer - Starting GameServer with args: GameServer.CmdArgs(staticDirectories=[/static, /compiled-static], directoriesLoadLocation=CLASSPATH, port=8080, rounds=3, help=false)
2018-10-05 20:07:42.620 [main] INFO  io.javalin.Javalin - Starting Javalin ...
2018-10-05 20:07:42.621 [main] INFO  io.javalin.Javalin - Static file handler added with path=/static and location=CLASSPATH. Absolute path: 'file:///root/workspace/johanhaleby/rps-axon-elm/437750727/target/classes/static/'.
2018-10-05 20:07:42.622 [main] ERROR io.javalin.Javalin - Failed to start Javalin
java.lang.RuntimeException: Static resource directory with path: '/compiled-static' does not exist. Depending on your setup, empty folders might not get copied to classpath.
	at io.javalin.staticfiles.JettyResourceHandler.getResourcePath(JettyResourceHandler.kt:48)
	at io.javalin.staticfiles.JettyResourceHandler.<init>(JettyResourceHandler.kt:31)
	at io.javalin.Javalin.start(Javalin.java:122)
	at io.javalin.Javalin.start(Javalin.java:103)
	at se.haleby.rps.port.http.GameApi.start(GameApi.java:66)
	at se.haleby.rps.GameServer.start(GameServer.java:55)
	at se.haleby.rps.port.http.GameHttpApiTest.startServer(GameHttpApiTest.java:310)
	at sun.reflect.NativeMethodAccessorImpl.invoke0(Native Method)
	at sun.reflect.NativeMethodAccessorImpl.invoke(NativeMethodAccessorImpl.java:62)
	at sun.reflect.DelegatingMethodAccessorImpl.invoke(DelegatingMethodAccessorImpl.java:43)
	at java.lang.reflect.Method.invoke(Method.java:498)
	at org.junit.platform.commons.util.ReflectionUtils.invokeMethod(ReflectionUtils.java:515)
	at org.junit.jupiter.engine.execution.ExecutableInvoker.invoke(ExecutableInvoker.java:115)
	at org.junit.jupiter.engine.descriptor.ClassTestDescriptor.invokeMethodInExtensionContext(ClassTestDescriptor.java:436)
	at org.junit.jupiter.engine.descriptor.ClassTestDescriptor.lambda$synthesizeBeforeEachMethodAdapter$14(ClassTestDescriptor.java:424)
	at org.junit.jupiter.engine.descriptor.TestMethodTestDescriptor.lambda$invokeBeforeEachMethods$2(TestMethodTestDescriptor.java:136)
	at org.junit.platform.engine.support.hierarchical.ThrowableCollector.execute(ThrowableCollector.java:72)
	at org.junit.jupiter.engine.descriptor.TestMethodTestDescriptor.invokeBeforeMethodsOrCallbacksUntilExceptionOccurs(TestMethodTestDescriptor.java:156)
	at org.junit.jupiter.engine.descriptor.TestMethodTestDescriptor.invokeBeforeEachMethods(TestMethodTestDescriptor.java:135)
	at org.junit.jupiter.engine.descriptor.TestMethodTestDescriptor.execute(TestMethodTestDescriptor.java:110)
	at org.junit.jupiter.engine.descriptor.TestMethodTestDescriptor.execute(TestMethodTestDescriptor.java:59)
	at org.junit.platform.engine.support.hierarchical.NodeTestTask.lambda$executeRecursively$5(NodeTestTask.java:105)
	at org.junit.platform.engine.support.hierarchical.ThrowableCollector.execute(ThrowableCollector.java:72)
	at org.junit.platform.engine.support.hierarchical.NodeTestTask.executeRecursively(NodeTestTask.java:95)
	at org.junit.platform.engine.support.hierarchical.NodeTestTask.execute(NodeTestTask.java:71)
	at java.util.ArrayList.forEach(ArrayList.java:1249)
	at org.junit.platform.engine.support.hierarchical.SameThreadHierarchicalTestExecutorService.invokeAll(SameThreadHierarchicalTestExecutorService.java:38)
	at org.junit.platform.engine.support.hierarchical.NodeTestTask.lambda$executeRecursively$5(NodeTestTask.java:110)
	at org.junit.platform.engine.support.hierarchical.ThrowableCollector.execute(ThrowableCollector.java:72)
	at org.junit.platform.engine.support.hierarchical.NodeTestTask.executeRecursively(NodeTestTask.java:95)
	at org.junit.platform.engine.support.hierarchical.NodeTestTask.execute(NodeTestTask.java:71)
	at java.util.ArrayList.forEach(ArrayList.java:1249)
	at org.junit.platform.engine.support.hierarchical.SameThreadHierarchicalTestExecutorService.invokeAll(SameThreadHierarchicalTestExecutorService.java:38)
	at org.junit.platform.engine.support.hierarchical.NodeTestTask.lambda$executeRecursively$5(NodeTestTask.java:110)
	at org.junit.platform.engine.support.hierarchical.ThrowableCollector.execute(ThrowableCollector.java:72)
	at org.junit.platform.engine.support.hierarchical.NodeTestTask.executeRecursively(NodeTestTask.java:95)
	at org.junit.platform.engine.support.hierarchical.NodeTestTask.execute(NodeTestTask.java:71)
	at java.util.ArrayList.forEach(ArrayList.java:1249)
	at org.junit.platform.engine.support.hierarchical.SameThreadHierarchicalTestExecutorService.invokeAll(SameThreadHierarchicalTestExecutorService.java:38)
	at org.junit.platform.engine.support.hierarchical.NodeTestTask.lambda$executeRecursively$5(NodeTestTask.java:110)
	at org.junit.platform.engine.support.hierarchical.ThrowableCollector.execute(ThrowableCollector.java:72)
	at org.junit.platform.engine.support.hierarchical.NodeTestTask.executeRecursively(NodeTestTask.java:95)
	at org.junit.platform.engine.support.hierarchical.NodeTestTask.execute(NodeTestTask.java:71)
	at org.junit.platform.engine.support.hierarchical.SameThreadHierarchicalTestExecutorService.submit(SameThreadHierarchicalTestExecutorService.java:32)
	at org.junit.platform.engine.support.hierarchical.HierarchicalTestExecutor.execute(HierarchicalTestExecutor.java:57)
	at org.junit.platform.engine.support.hierarchical.HierarchicalTestEngine.execute(HierarchicalTestEngine.java:51)
	at org.junit.platform.launcher.core.DefaultLauncher.execute(DefaultLauncher.java:170)
	at org.junit.platform.launcher.core.DefaultLauncher.execute(DefaultLauncher.java:154)
	at org.junit.platform.launcher.core.DefaultLauncher.execute(DefaultLauncher.java:90)
	at org.apache.maven.surefire.junitplatform.JUnitPlatformProvider.invokeAllTests(JUnitPlatformProvider.java:142)
	at org.apache.maven.surefire.junitplatform.JUnitPlatformProvider.invoke(JUnitPlatformProvider.java:117)
	at org.apache.maven.surefire.booter.ForkedBooter.invokeProviderInSameClassLoader(ForkedBooter.java:383)
	at org.apache.maven.surefire.booter.ForkedBooter.runSuitesInProcess(ForkedBooter.java:344)
	at org.apache.maven.surefire.booter.ForkedBooter.execute(ForkedBooter.java:125)
	at org.apache.maven.surefire.booter.ForkedBooter.main(ForkedBooter.java:417)
2018-10-05 20:07:42.642 [main] INFO  io.javalin.Javalin - Stopping Javalin ...
2018-10-05 20:07:42.642 [main] INFO  io.javalin.Javalin - Javalin has stopped
2018-10-05 20:07:42.646 [main] INFO  se.haleby.rps.GameServer - Starting GameServer with args: GameServer.CmdArgs(staticDirectories=[/static, /compiled-static], directoriesLoadLocation=CLASSPATH, port=8080, rounds=3, help=false)
2018-10-05 20:07:42.653 [main] INFO  io.javalin.Javalin - Starting Javalin ...
2018-10-05 20:07:42.655 [main] INFO  io.javalin.Javalin - Static file handler added with path=/static and location=CLASSPATH. Absolute path: 'file:///root/workspace/johanhaleby/rps-axon-elm/437750727/target/classes/static/'.
2018-10-05 20:07:42.656 [main] ERROR io.javalin.Javalin - Failed to start Javalin
java.lang.RuntimeException: Static resource directory with path: '/compiled-static' does not exist. Depending on your setup, empty folders might not get copied to classpath.
	at io.javalin.staticfiles.JettyResourceHandler.getResourcePath(JettyResourceHandler.kt:48)
	at io.javalin.staticfiles.JettyResourceHandler.<init>(JettyResourceHandler.kt:31)
	at io.javalin.Javalin.start(Javalin.java:122)
	at io.javalin.Javalin.start(Javalin.java:103)
	at se.haleby.rps.port.http.GameApi.start(GameApi.java:66)
	at se.haleby.rps.GameServer.start(GameServer.java:55)
	at se.haleby.rps.port.http.GameHttpApiTest.startServer(GameHttpApiTest.java:310)
	at sun.reflect.NativeMethodAccessorImpl.invoke0(Native Method)
	at sun.reflect.NativeMethodAccessorImpl.invoke(NativeMethodAccessorImpl.java:62)
	at sun.reflect.DelegatingMethodAccessorImpl.invoke(DelegatingMethodAccessorImpl.java:43)
	at java.lang.reflect.Method.invoke(Method.java:498)
	at org.junit.platform.commons.util.ReflectionUtils.invokeMethod(ReflectionUtils.java:515)
	at org.junit.jupiter.engine.execution.ExecutableInvoker.invoke(ExecutableInvoker.java:115)
	at org.junit.jupiter.engine.descriptor.ClassTestDescriptor.invokeMethodInExtensionContext(ClassTestDescriptor.java:436)
	at org.junit.jupiter.engine.descriptor.ClassTestDescriptor.lambda$synthesizeBeforeEachMethodAdapter$14(ClassTestDescriptor.java:424)
	at org.junit.jupiter.engine.descriptor.TestMethodTestDescriptor.lambda$invokeBeforeEachMethods$2(TestMethodTestDescriptor.java:136)
	at org.junit.platform.engine.support.hierarchical.ThrowableCollector.execute(ThrowableCollector.java:72)
	at org.junit.jupiter.engine.descriptor.TestMethodTestDescriptor.invokeBeforeMethodsOrCallbacksUntilExceptionOccurs(TestMethodTestDescriptor.java:156)
	at org.junit.jupiter.engine.descriptor.TestMethodTestDescriptor.invokeBeforeEachMethods(TestMethodTestDescriptor.java:135)
	at org.junit.jupiter.engine.descriptor.TestMethodTestDescriptor.execute(TestMethodTestDescriptor.java:110)
	at org.junit.jupiter.engine.descriptor.TestMethodTestDescriptor.execute(TestMethodTestDescriptor.java:59)
	at org.junit.platform.engine.support.hierarchical.NodeTestTask.lambda$executeRecursively$5(NodeTestTask.java:105)
	at org.junit.platform.engine.support.hierarchical.ThrowableCollector.execute(ThrowableCollector.java:72)
	at org.junit.platform.engine.support.hierarchical.NodeTestTask.executeRecursively(NodeTestTask.java:95)
	at org.junit.platform.engine.support.hierarchical.NodeTestTask.execute(NodeTestTask.java:71)
	at java.util.ArrayList.forEach(ArrayList.java:1249)
	at org.junit.platform.engine.support.hierarchical.SameThreadHierarchicalTestExecutorService.invokeAll(SameThreadHierarchicalTestExecutorService.java:38)
	at org.junit.platform.engine.support.hierarchical.NodeTestTask.lambda$executeRecursively$5(NodeTestTask.java:110)
	at org.junit.platform.engine.support.hierarchical.ThrowableCollector.execute(ThrowableCollector.java:72)
	at org.junit.platform.engine.support.hierarchical.NodeTestTask.executeRecursively(NodeTestTask.java:95)
	at org.junit.platform.engine.support.hierarchical.NodeTestTask.execute(NodeTestTask.java:71)
	at java.util.ArrayList.forEach(ArrayList.java:1249)
	at org.junit.platform.engine.support.hierarchical.SameThreadHierarchicalTestExecutorService.invokeAll(SameThreadHierarchicalTestExecutorService.java:38)
	at org.junit.platform.engine.support.hierarchical.NodeTestTask.lambda$executeRecursively$5(NodeTestTask.java:110)
	at org.junit.platform.engine.support.hierarchical.ThrowableCollector.execute(ThrowableCollector.java:72)
	at org.junit.platform.engine.support.hierarchical.NodeTestTask.executeRecursively(NodeTestTask.java:95)
	at org.junit.platform.engine.support.hierarchical.NodeTestTask.execute(NodeTestTask.java:71)
	at java.util.ArrayList.forEach(ArrayList.java:1249)
	at org.junit.platform.engine.support.hierarchical.SameThreadHierarchicalTestExecutorService.invokeAll(SameThreadHierarchicalTestExecutorService.java:38)
	at org.junit.platform.engine.support.hierarchical.NodeTestTask.lambda$executeRecursively$5(NodeTestTask.java:110)
	at org.junit.platform.engine.support.hierarchical.ThrowableCollector.execute(ThrowableCollector.java:72)
	at org.junit.platform.engine.support.hierarchical.NodeTestTask.executeRecursively(NodeTestTask.java:95)
	at org.junit.platform.engine.support.hierarchical.NodeTestTask.execute(NodeTestTask.java:71)
	at org.junit.platform.engine.support.hierarchical.SameThreadHierarchicalTestExecutorService.submit(SameThreadHierarchicalTestExecutorService.java:32)
	at org.junit.platform.engine.support.hierarchical.HierarchicalTestExecutor.execute(HierarchicalTestExecutor.java:57)
	at org.junit.platform.engine.support.hierarchical.HierarchicalTestEngine.execute(HierarchicalTestEngine.java:51)
	at org.junit.platform.launcher.core.DefaultLauncher.execute(DefaultLauncher.java:170)
	at org.junit.platform.launcher.core.DefaultLauncher.execute(DefaultLauncher.java:154)
	at org.junit.platform.launcher.core.DefaultLauncher.execute(DefaultLauncher.java:90)
	at org.apache.maven.surefire.junitplatform.JUnitPlatformProvider.invokeAllTests(JUnitPlatformProvider.java:142)
	at org.apache.maven.surefire.junitplatform.JUnitPlatformProvider.invoke(JUnitPlatformProvider.java:117)
	at org.apache.maven.surefire.booter.ForkedBooter.invokeProviderInSameClassLoader(ForkedBooter.java:383)
	at org.apache.maven.surefire.booter.ForkedBooter.runSuitesInProcess(ForkedBooter.java:344)
	at org.apache.maven.surefire.booter.ForkedBooter.execute(ForkedBooter.java:125)
	at org.apache.maven.surefire.booter.ForkedBooter.main(ForkedBooter.java:417)
2018-10-05 20:07:42.681 [main] INFO  io.javalin.Javalin - Stopping Javalin ...
2018-10-05 20:07:42.681 [main] INFO  io.javalin.Javalin - Javalin has stopped
2018-10-05 20:07:42.683 [main] INFO  se.haleby.rps.GameServer - Starting GameServer with args: GameServer.CmdArgs(staticDirectories=[/static, /compiled-static], directoriesLoadLocation=CLASSPATH, port=8080, rounds=3, help=false)
2018-10-05 20:07:42.690 [main] INFO  io.javalin.Javalin - Starting Javalin ...
2018-10-05 20:07:42.692 [main] INFO  io.javalin.Javalin - Static file handler added with path=/static and location=CLASSPATH. Absolute path: 'file:///root/workspace/johanhaleby/rps-axon-elm/437750727/target/classes/static/'.
2018-10-05 20:07:42.693 [main] ERROR io.javalin.Javalin - Failed to start Javalin
java.lang.RuntimeException: Static resource directory with path: '/compiled-static' does not exist. Depending on your setup, empty folders might not get copied to classpath.
	at io.javalin.staticfiles.JettyResourceHandler.getResourcePath(JettyResourceHandler.kt:48)
	at io.javalin.staticfiles.JettyResourceHandler.<init>(JettyResourceHandler.kt:31)
	at io.javalin.Javalin.start(Javalin.java:122)
	at io.javalin.Javalin.start(Javalin.java:103)
	at se.haleby.rps.port.http.GameApi.start(GameApi.java:66)
	at se.haleby.rps.GameServer.start(GameServer.java:55)
	at se.haleby.rps.port.http.GameHttpApiTest.startServer(GameHttpApiTest.java:310)
	at sun.reflect.NativeMethodAccessorImpl.invoke0(Native Method)
	at sun.reflect.NativeMethodAccessorImpl.invoke(NativeMethodAccessorImpl.java:62)
	at sun.reflect.DelegatingMethodAccessorImpl.invoke(DelegatingMethodAccessorImpl.java:43)
	at java.lang.reflect.Method.invoke(Method.java:498)
	at org.junit.platform.commons.util.ReflectionUtils.invokeMethod(ReflectionUtils.java:515)
	at org.junit.jupiter.engine.execution.ExecutableInvoker.invoke(ExecutableInvoker.java:115)
	at org.junit.jupiter.engine.descriptor.ClassTestDescriptor.invokeMethodInExtensionContext(ClassTestDescriptor.java:436)
	at org.junit.jupiter.engine.descriptor.ClassTestDescriptor.lambda$synthesizeBeforeEachMethodAdapter$14(ClassTestDescriptor.java:424)
	at org.junit.jupiter.engine.descriptor.TestMethodTestDescriptor.lambda$invokeBeforeEachMethods$2(TestMethodTestDescriptor.java:136)
	at org.junit.platform.engine.support.hierarchical.ThrowableCollector.execute(ThrowableCollector.java:72)
	at org.junit.jupiter.engine.descriptor.TestMethodTestDescriptor.invokeBeforeMethodsOrCallbacksUntilExceptionOccurs(TestMethodTestDescriptor.java:156)
	at org.junit.jupiter.engine.descriptor.TestMethodTestDescriptor.invokeBeforeEachMethods(TestMethodTestDescriptor.java:135)
	at org.junit.jupiter.engine.descriptor.TestMethodTestDescriptor.execute(TestMethodTestDescriptor.java:110)
	at org.junit.jupiter.engine.descriptor.TestMethodTestDescriptor.execute(TestMethodTestDescriptor.java:59)
	at org.junit.platform.engine.support.hierarchical.NodeTestTask.lambda$executeRecursively$5(NodeTestTask.java:105)
	at org.junit.platform.engine.support.hierarchical.ThrowableCollector.execute(ThrowableCollector.java:72)
	at org.junit.platform.engine.support.hierarchical.NodeTestTask.executeRecursively(NodeTestTask.java:95)
	at org.junit.platform.engine.support.hierarchical.NodeTestTask.execute(NodeTestTask.java:71)
	at java.util.ArrayList.forEach(ArrayList.java:1249)
	at org.junit.platform.engine.support.hierarchical.SameThreadHierarchicalTestExecutorService.invokeAll(SameThreadHierarchicalTestExecutorService.java:38)
	at org.junit.platform.engine.support.hierarchical.NodeTestTask.lambda$executeRecursively$5(NodeTestTask.java:110)
	at org.junit.platform.engine.support.hierarchical.ThrowableCollector.execute(ThrowableCollector.java:72)
	at org.junit.platform.engine.support.hierarchical.NodeTestTask.executeRecursively(NodeTestTask.java:95)
	at org.junit.platform.engine.support.hierarchical.NodeTestTask.execute(NodeTestTask.java:71)
	at java.util.ArrayList.forEach(ArrayList.java:1249)
	at org.junit.platform.engine.support.hierarchical.SameThreadHierarchicalTestExecutorService.invokeAll(SameThreadHierarchicalTestExecutorService.java:38)
	at org.junit.platform.engine.support.hierarchical.NodeTestTask.lambda$executeRecursively$5(NodeTestTask.java:110)
	at org.junit.platform.engine.support.hierarchical.ThrowableCollector.execute(ThrowableCollector.java:72)
	at org.junit.platform.engine.support.hierarchical.NodeTestTask.executeRecursively(NodeTestTask.java:95)
	at org.junit.platform.engine.support.hierarchical.NodeTestTask.execute(NodeTestTask.java:71)
	at java.util.ArrayList.forEach(ArrayList.java:1249)
	at org.junit.platform.engine.support.hierarchical.SameThreadHierarchicalTestExecutorService.invokeAll(SameThreadHierarchicalTestExecutorService.java:38)
	at org.junit.platform.engine.support.hierarchical.NodeTestTask.lambda$executeRecursively$5(NodeTestTask.java:110)
	at org.junit.platform.engine.support.hierarchical.ThrowableCollector.execute(ThrowableCollector.java:72)
	at org.junit.platform.engine.support.hierarchical.NodeTestTask.executeRecursively(NodeTestTask.java:95)
	at org.junit.platform.engine.support.hierarchical.NodeTestTask.execute(NodeTestTask.java:71)
	at org.junit.platform.engine.support.hierarchical.SameThreadHierarchicalTestExecutorService.submit(SameThreadHierarchicalTestExecutorService.java:32)
	at org.junit.platform.engine.support.hierarchical.HierarchicalTestExecutor.execute(HierarchicalTestExecutor.java:57)
	at org.junit.platform.engine.support.hierarchical.HierarchicalTestEngine.execute(HierarchicalTestEngine.java:51)
	at org.junit.platform.launcher.core.DefaultLauncher.execute(DefaultLauncher.java:170)
	at org.junit.platform.launcher.core.DefaultLauncher.execute(DefaultLauncher.java:154)
	at org.junit.platform.launcher.core.DefaultLauncher.execute(DefaultLauncher.java:90)
	at org.apache.maven.surefire.junitplatform.JUnitPlatformProvider.invokeAllTests(JUnitPlatformProvider.java:142)
	at org.apache.maven.surefire.junitplatform.JUnitPlatformProvider.invoke(JUnitPlatformProvider.java:117)
	at org.apache.maven.surefire.booter.ForkedBooter.invokeProviderInSameClassLoader(ForkedBooter.java:383)
	at org.apache.maven.surefire.booter.ForkedBooter.runSuitesInProcess(ForkedBooter.java:344)
	at org.apache.maven.surefire.booter.ForkedBooter.execute(ForkedBooter.java:125)
	at org.apache.maven.surefire.booter.ForkedBooter.main(ForkedBooter.java:417)
2018-10-05 20:07:42.710 [main] INFO  io.javalin.Javalin - Stopping Javalin ...
2018-10-05 20:07:42.710 [main] INFO  io.javalin.Javalin - Javalin has stopped
2018-10-05 20:07:42.712 [main] INFO  se.haleby.rps.GameServer - Starting GameServer with args: GameServer.CmdArgs(staticDirectories=[/static, /compiled-static], directoriesLoadLocation=CLASSPATH, port=8080, rounds=3, help=false)
2018-10-05 20:07:42.718 [main] INFO  io.javalin.Javalin - Starting Javalin ...
2018-10-05 20:07:42.719 [main] INFO  io.javalin.Javalin - Static file handler added with path=/static and location=CLASSPATH. Absolute path: 'file:///root/workspace/johanhaleby/rps-axon-elm/437750727/target/classes/static/'.
2018-10-05 20:07:42.719 [main] ERROR io.javalin.Javalin - Failed to start Javalin
java.lang.RuntimeException: Static resource directory with path: '/compiled-static' does not exist. Depending on your setup, empty folders might not get copied to classpath.
	at io.javalin.staticfiles.JettyResourceHandler.getResourcePath(JettyResourceHandler.kt:48)
	at io.javalin.staticfiles.JettyResourceHandler.<init>(JettyResourceHandler.kt:31)
	at io.javalin.Javalin.start(Javalin.java:122)
	at io.javalin.Javalin.start(Javalin.java:103)
	at se.haleby.rps.port.http.GameApi.start(GameApi.java:66)
	at se.haleby.rps.GameServer.start(GameServer.java:55)
	at se.haleby.rps.port.http.GameHttpApiTest.startServer(GameHttpApiTest.java:310)
	at sun.reflect.NativeMethodAccessorImpl.invoke0(Native Method)
	at sun.reflect.NativeMethodAccessorImpl.invoke(NativeMethodAccessorImpl.java:62)
	at sun.reflect.DelegatingMethodAccessorImpl.invoke(DelegatingMethodAccessorImpl.java:43)
	at java.lang.reflect.Method.invoke(Method.java:498)
	at org.junit.platform.commons.util.ReflectionUtils.invokeMethod(ReflectionUtils.java:515)
	at org.junit.jupiter.engine.execution.ExecutableInvoker.invoke(ExecutableInvoker.java:115)
	at org.junit.jupiter.engine.descriptor.ClassTestDescriptor.invokeMethodInExtensionContext(ClassTestDescriptor.java:436)
	at org.junit.jupiter.engine.descriptor.ClassTestDescriptor.lambda$synthesizeBeforeEachMethodAdapter$14(ClassTestDescriptor.java:424)
	at org.junit.jupiter.engine.descriptor.TestMethodTestDescriptor.lambda$invokeBeforeEachMethods$2(TestMethodTestDescriptor.java:136)
	at org.junit.platform.engine.support.hierarchical.ThrowableCollector.execute(ThrowableCollector.java:72)
	at org.junit.jupiter.engine.descriptor.TestMethodTestDescriptor.invokeBeforeMethodsOrCallbacksUntilExceptionOccurs(TestMethodTestDescriptor.java:156)
	at org.junit.jupiter.engine.descriptor.TestMethodTestDescriptor.invokeBeforeEachMethods(TestMethodTestDescriptor.java:135)
	at org.junit.jupiter.engine.descriptor.TestMethodTestDescriptor.execute(TestMethodTestDescriptor.java:110)
	at org.junit.jupiter.engine.descriptor.TestMethodTestDescriptor.execute(TestMethodTestDescriptor.java:59)
	at org.junit.platform.engine.support.hierarchical.NodeTestTask.lambda$executeRecursively$5(NodeTestTask.java:105)
	at org.junit.platform.engine.support.hierarchical.ThrowableCollector.execute(ThrowableCollector.java:72)
	at org.junit.platform.engine.support.hierarchical.NodeTestTask.executeRecursively(NodeTestTask.java:95)
	at org.junit.platform.engine.support.hierarchical.NodeTestTask.execute(NodeTestTask.java:71)
	at java.util.ArrayList.forEach(ArrayList.java:1249)
	at org.junit.platform.engine.support.hierarchical.SameThreadHierarchicalTestExecutorService.invokeAll(SameThreadHierarchicalTestExecutorService.java:38)
	at org.junit.platform.engine.support.hierarchical.NodeTestTask.lambda$executeRecursively$5(NodeTestTask.java:110)
	at org.junit.platform.engine.support.hierarchical.ThrowableCollector.execute(ThrowableCollector.java:72)
	at org.junit.platform.engine.support.hierarchical.NodeTestTask.executeRecursively(NodeTestTask.java:95)
	at org.junit.platform.engine.support.hierarchical.NodeTestTask.execute(NodeTestTask.java:71)
	at java.util.ArrayList.forEach(ArrayList.java:1249)
	at org.junit.platform.engine.support.hierarchical.SameThreadHierarchicalTestExecutorService.invokeAll(SameThreadHierarchicalTestExecutorService.java:38)
	at org.junit.platform.engine.support.hierarchical.NodeTestTask.lambda$executeRecursively$5(NodeTestTask.java:110)
	at org.junit.platform.engine.support.hierarchical.ThrowableCollector.execute(ThrowableCollector.java:72)
	at org.junit.platform.engine.support.hierarchical.NodeTestTask.executeRecursively(NodeTestTask.java:95)
	at org.junit.platform.engine.support.hierarchical.NodeTestTask.execute(NodeTestTask.java:71)
	at java.util.ArrayList.forEach(ArrayList.java:1249)
	at org.junit.platform.engine.support.hierarchical.SameThreadHierarchicalTestExecutorService.invokeAll(SameThreadHierarchicalTestExecutorService.java:38)
	at org.junit.platform.engine.support.hierarchical.NodeTestTask.lambda$executeRecursively$5(NodeTestTask.java:110)
	at org.junit.platform.engine.support.hierarchical.ThrowableCollector.execute(ThrowableCollector.java:72)
	at org.junit.platform.engine.support.hierarchical.NodeTestTask.executeRecursively(NodeTestTask.java:95)
	at org.junit.platform.engine.support.hierarchical.NodeTestTask.execute(NodeTestTask.java:71)
	at org.junit.platform.engine.support.hierarchical.SameThreadHierarchicalTestExecutorService.submit(SameThreadHierarchicalTestExecutorService.java:32)
	at org.junit.platform.engine.support.hierarchical.HierarchicalTestExecutor.execute(HierarchicalTestExecutor.java:57)
	at org.junit.platform.engine.support.hierarchical.HierarchicalTestEngine.execute(HierarchicalTestEngine.java:51)
	at org.junit.platform.launcher.core.DefaultLauncher.execute(DefaultLauncher.java:170)
	at org.junit.platform.launcher.core.DefaultLauncher.execute(DefaultLauncher.java:154)
	at org.junit.platform.launcher.core.DefaultLauncher.execute(DefaultLauncher.java:90)
	at org.apache.maven.surefire.junitplatform.JUnitPlatformProvider.invokeAllTests(JUnitPlatformProvider.java:142)
	at org.apache.maven.surefire.junitplatform.JUnitPlatformProvider.invoke(JUnitPlatformProvider.java:117)
	at org.apache.maven.surefire.booter.ForkedBooter.invokeProviderInSameClassLoader(ForkedBooter.java:383)
	at org.apache.maven.surefire.booter.ForkedBooter.runSuitesInProcess(ForkedBooter.java:344)
	at org.apache.maven.surefire.booter.ForkedBooter.execute(ForkedBooter.java:125)
	at org.apache.maven.surefire.booter.ForkedBooter.main(ForkedBooter.java:417)
2018-10-05 20:07:42.732 [main] INFO  io.javalin.Javalin - Stopping Javalin ...
2018-10-05 20:07:42.732 [main] INFO  io.javalin.Javalin - Javalin has stopped
[ERROR] Tests run: 10, Failures: 0, Errors: 10, Skipped: 0, Time elapsed: 2.3 s <<< FAILURE! - in se.haleby.rps.port.http.GameHttpApiTest
[ERROR] game_is_retrievable_when_started  Time elapsed: 1.484 s  <<< ERROR!
java.net.ConnectException: Connection refused (Connection refused)
	at se.haleby.rps.port.http.GameHttpApiTest$GetGame.game_is_retrievable_when_started(GameHttpApiTest.java:278)

[ERROR] game_is_retrievable_when_ended  Time elapsed: 0.057 s  <<< ERROR!
java.net.ConnectException: Connection refused (Connection refused)
	at se.haleby.rps.port.http.GameHttpApiTest$GetGame.game_is_retrievable_when_ended(GameHttpApiTest.java:255)

[ERROR] when_multiple_state_query_parameters_then_matching_games_are_returned  Time elapsed: 0.034 s  <<< ERROR!
java.net.ConnectException: Connection refused (Connection refused)
	at se.haleby.rps.port.http.GameHttpApiTest$A.when_multiple_state_query_parameters_then_matching_games_are_returned(GameHttpApiTest.java:218)

[ERROR] when_query_parameter_state_is_joinable_then_only_joinable_games_are_returned  Time elapsed: 0.028 s  <<< ERROR!
java.net.ConnectException: Connection refused (Connection refused)
	at se.haleby.rps.port.http.GameHttpApiTest$A.when_query_parameter_state_is_joinable_then_only_joinable_games_are_returned(GameHttpApiTest.java:186)

[ERROR] when_no_query_parameters_are_specified_then_both_started_and_ended_games_are_returned  Time elapsed: 0.033 s  <<< ERROR!
java.net.ConnectException: Connection refused (Connection refused)
	at se.haleby.rps.port.http.GameHttpApiTest$A.when_no_query_parameters_are_specified_then_both_started_and_ended_games_are_returned(GameHttpApiTest.java:85)

[ERROR] when_query_parameter_state_is_ended_then_only_ended_games_are_returned  Time elapsed: 0.035 s  <<< ERROR!
java.net.ConnectException: Connection refused (Connection refused)
	at se.haleby.rps.port.http.GameHttpApiTest$A.when_query_parameter_state_is_ended_then_only_ended_games_are_returned(GameHttpApiTest.java:154)

[ERROR] when_query_parameter_state_is_started_then_only_started_games_are_returned  Time elapsed: 0.031 s  <<< ERROR!
java.net.ConnectException: Connection refused (Connection refused)
	at se.haleby.rps.port.http.GameHttpApiTest$A.when_query_parameter_state_is_started_then_only_started_games_are_returned(GameHttpApiTest.java:122)

[ERROR] example_of_full_game  Time elapsed: 0.036 s  <<< ERROR!
java.net.ConnectException: Connection refused (Connection refused)
	at se.haleby.rps.port.http.GameHttpApiTest$PlayableGame.example_of_full_game(GameHttpApiTest.java:64)

[ERROR] when_put_to_api_games  Time elapsed: 0.028 s  <<< ERROR!
java.net.ConnectException: Connection refused (Connection refused)
	at se.haleby.rps.port.http.GameHttpApiTest$PlayableGame.when_put_to_api_games(GameHttpApiTest.java:50)

[ERROR] when_put_to_api_games  Time elapsed: 0.021 s  <<< ERROR!
java.net.ConnectException: Connection refused (Connection refused)
	at se.haleby.rps.port.http.GameHttpApiTest$NoGame.when_put_to_api_games(GameHttpApiTest.java:32)

[INFO] Running se.haleby.rps.domain.GameTest
[INFO] Tests run: 8, Failures: 0, Errors: 0, Skipped: 0, Time elapsed: 0.157 s - in se.haleby.rps.domain.GameTest
[INFO] 
[INFO] Results:
[INFO] 
[ERROR] Errors: 
[ERROR]   GameHttpApiTest$A.when_multiple_state_query_parameters_then_matching_games_are_returned:218  Connect
[ERROR]   GameHttpApiTest$A.when_no_query_parameters_are_specified_then_both_started_and_ended_games_are_returned:85  Connect
[ERROR]   GameHttpApiTest$A.when_query_parameter_state_is_ended_then_only_ended_games_are_returned:154  Connect
[ERROR]   GameHttpApiTest$A.when_query_parameter_state_is_joinable_then_only_joinable_games_are_returned:186  Connect
[ERROR]   GameHttpApiTest$A.when_query_parameter_state_is_started_then_only_started_games_are_returned:122  Connect
[ERROR]   GameHttpApiTest$GetGame.game_is_retrievable_when_ended:255  Connect Connectio...
[ERROR]   GameHttpApiTest$GetGame.game_is_retrievable_when_started:278  Connect Connect...
[ERROR]   GameHttpApiTest$NoGame.when_put_to_api_games:32  Connect Connection refused (...
[ERROR]   GameHttpApiTest$PlayableGame.example_of_full_game:64  Connect Connection refu...
[ERROR]   GameHttpApiTest$PlayableGame.when_put_to_api_games:50  Connect Connection ref...
[INFO] 
[ERROR] Tests run: 18, Failures: 0, Errors: 10, Skipped: 0
[INFO] 
[INFO] ------------------------------------------------------------------------
[INFO] BUILD FAILURE
[INFO] ------------------------------------------------------------------------
[INFO] Total time: 6.588 s
[INFO] Finished at: 2018-10-05T20:07:43+02:00
[INFO] Final Memory: 15M/248M
[INFO] ------------------------------------------------------------------------
[ERROR] Failed to execute goal org.apache.maven.plugins:maven-surefire-plugin:2.22.0:test (default-test) on project rps-axon: There are test failures.
[ERROR] 
[ERROR] Please refer to /root/workspace/johanhaleby/rps-axon-elm/437750727/target/surefire-reports for the individual test results.
[ERROR] Please refer to dump files (if any exist) [date]-jvmRun[N].dump, [date].dumpstream and [date]-jvmRun[N].dumpstream.
[ERROR] -> [Help 1]
[ERROR] 
[ERROR] To see the full stack trace of the errors, re-run Maven with the -e switch.
[ERROR] Re-run Maven using the -X switch to enable full debug logging.
[ERROR] 
[ERROR] For more information about the errors and possible solutions, please read the following articles:
[ERROR] [Help 1] http://cwiki.apache.org/confluence/display/MAVEN/MojoFailureException
